SET NAMES utf8mb4;
SET FOREIGN_KEY_CHECKS = 0;

-- ----------------------------
-- Table structure for channels
-- ----------------------------
DROP TABLE IF EXISTS `channels`;
CREATE TABLE `channels` (
  `id` int(255) NOT NULL AUTO_INCREMENT,
  `inactive` int(2) DEFAULT NULL,
  `c_id` text,
  `c_name` text,
  `c_desc` longtext,
  `c_thburl` text,
  `realname` text,
  `link_youtube` text,
  `link_web` text,
  `link_podcast` text,
  `id_twitch` text,
  `id_instagram` text,
  `catids` text,
  `c_publishdate` text,
  `date_c_update` text,
  `date_v_update` text,
  `subs_2015` int(255) DEFAULT NULL,
  `subs_2016` int(255) DEFAULT NULL,
  `subs_2017` int(255) DEFAULT NULL,
  `subs_2018` int(255) DEFAULT NULL,
  `subs_2019` int(255) DEFAULT NULL,
  `subs_2020` int(255) DEFAULT NULL,
  `subs_2021` int(255) DEFAULT NULL,
  `views_2015` int(255) DEFAULT NULL,
  `views_2016` int(255) DEFAULT NULL,
  `views_2017` int(255) DEFAULT NULL,
  `views_2018` int(255) DEFAULT NULL,
  `views_2019` int(255) DEFAULT NULL,
  `views_2020` int(255) DEFAULT NULL,
  `views_2021` int(255) DEFAULT NULL,
  `videos_2020` int(255) DEFAULT NULL,
  `videos_2021` int(255) DEFAULT NULL,
  `video_last_title` text,
  `video_last_id` text,
  `video_last_html` longtext,
  `video_last_views` int(255) DEFAULT NULL,
  `video_last_date` text,
  `video_last_datesort` text,
  `lang` text,
  PRIMARY KEY (`id`)
) ENGINE=InnoDB AUTO_INCREMENT=734 DEFAULT CHARSET=utf8mb4;

-- ----------------------------
-- Records of channels
-- ----------------------------
BEGIN;
INSERT INTO `channels` VALUES (1, 0, 'UCgw0vnoy6z_4wWrYc9eFEHw', 'Martin Bommeli', 'Yooo, auf meinem Kanal findest du viele verschiedene Videos zu verschiedenen Themen die mich interessieren. Da gibt es z.B. die #ParkView Videos in denen ich Skateparks, Bikeparks, Pumptracks, Trampolinhallen und Kletterhallen zeige. In anderen Videos zeige ich Rollerblading/Inlineskating Events oder aber auch Reviews/Tests von Inline Skates.<br /><br />Guck am besten in die entsprechenden Playlists 😜<br /><br />Zudäm git\'s vill Livestreams uf SCHWIZERDÜTSCH zu verschiedenä Themä!<br />Went d\'Livestreams nöd verpasse möchtsch, dusch am beste min Kanal abonniere und aktiviersch d\'Glogge mit de Notifications ✌️<br />Die meiste Livestreams bliebed online, luegsch am gschiedsche au i de Playlists.<br /><br />Vill spass', 'https://yt3.ggpht.com/a/AATXAJxdCCWLVaTTtx7MED85mysw6pLyBRKt5q1LUsFCSw=s88-c-k-c0xffffffff-no-rj-mo', '', 'https://www.youtube.com/MBommeli', 'https://www.mbrand.info', '', 'mbommeli', 'mbommeli', '-5-7-11-15-16-18-22-', '04.06.2007', '201017-11', '201017-11', 83, 637, 1487, 1894, 3300, 4560, NULL, 70127, 124878, 270839, 477809, 919893, 1526672, NULL, 560, NULL, 'Jump Factory Basel / Schweiz (Trampolinhalle | 360° Tour #ParkView 291)', 'IELGmAccreA', '<td class=\"yt-lastvideo\" data-sort=\"201016185845\" data-utime=\"201017-11\"><a href=\"https://youtu.be/IELGmAccreA\" title=\"Jump Factory Basel / Schweiz (Trampolinhalle | 360° Tour #ParkView 291)\" target=\"_blank\">Fr. 16.10.20</a><div class=\"info\"><div class=\"close\"></div><div class=\"circle\" style=\"background-image:url(https://i2.ytimg.com/vi/IELGmAccreA/hqdefault.jpg)\"></div><p>Jump Factory Basel / Schweiz (Trampolinhalle | 360° Tour #ParkView 291)<br><br>Views: 73 &nbsp; Ø/Video: 2726<br>Veröffentlicht am: Fr. 16.10.20 um 18:58 Uhr</p><div class=\"abobar\"><a href=\"https://youtu.be/IELGmAccreA\" target=\"_blank\" class=\"red\">zum Video</a></div></div></td>', 73, '2020-10-16T16:58:45+00:00', '201016185845', 'ch');
INSERT INTO `channels` VALUES (2, 0, 'UCo-ZV4wLm249m9jRs4F9HbA', 'LittleCity', 'Hallo zusammen! Wir sind Valeria und Adi aus der Schweiz und das ist unser Schweizer YouTuber Kanal. Wir machen Videos auf Schweizerdeutsch.<br /><br />Wir lieben zwei Dinge ganz besonders: Reisen & gutes Essen! Seit 2012 nehmen wir euch mit dem Blog LittleCITY.ch  (Valeria), YouTube (Adi) und über Social Media auf unsere Abenteuer mit, teilen unsere besten Tipps mit euch und hoffen, euch zu inspirieren! Alle unsere Videos sind auf Mundart, denn wir fühlen uns am wöhlsten, wenn wir so reden können, wie uns der Schnabel gewachsen ist! :-)<br /><br />Danke für Deinen Besuch in unserer kleinen Welt und viel Spass beim Stöbern.<br /><br />Was wir täglich so erleben könnt ihr auf Instagram @AdisLittleCITY & @ValeriasLittleCITY oder Snapchat @AdisLittleCITY & @LittleCITYch sehen!<br /><br />Schön, dass du da bist. Viel Spass beim Schauen! <br /><br />Und wenn ihr Videovorschläge habt, schreibt uns gern einen Kommentar.<br /><br />Alle unsere Videos werden auch auf unserer Facebook Seite veröffentlicht.<br /><br />Unser Shop: littlecity.ch/shop', 'https://yt3.ggpht.com/a/AATXAJw9BWeBqNORgfYFqZCNiPV7o4GqiqT-qp3UJezZtg=s88-c-k-c0xffffffff-no-rj-mo', 'Valeria Mella & Adrian Rüedi', 'https://www.youtube.com/LittleCITYch', 'https://littlecity.ch', '', '', 'adislittlecity', '-1-20-', '30.07.2014', '201017-11', '201017-11', 922, 2166, 2735, 3185, 3460, 3720, NULL, 123600, 354407, 527340, 669081, 801915, 889680, NULL, 134, NULL, 'DEUTSCHLAND ROADTRIP zu 13 ganz besonderen Schlösser & Burgen! | LittleCITY.ch', 'IlWbI7yrUbc', '<td class=\"yt-lastvideo\" data-sort=\"200922190008\" data-utime=\"201017-11\"><a href=\"https://youtu.be/IlWbI7yrUbc\" title=\"DEUTSCHLAND ROADTRIP zu 13 ganz besonderen Schlösser & Burgen! | LittleCITY.ch\" target=\"_blank\">Di. 22.09.20</a><div class=\"info\"><div class=\"close\"></div><div class=\"circle\" style=\"background-image:url(https://i2.ytimg.com/vi/IlWbI7yrUbc/hqdefault.jpg)\"></div><p>DEUTSCHLAND ROADTRIP zu 13 ganz besonderen Schlösser & Burgen! | LittleCITY.ch<br><br>Views: 1709 &nbsp; Ø/Video: 6639<br>Veröffentlicht am: Di. 22.09.20 um 19:00 Uhr</p><div class=\"abobar\"><a href=\"https://youtu.be/IlWbI7yrUbc\" target=\"_blank\" class=\"red\">zum Video</a></div></div></td>', 1709, '2020-09-22T17:00:08+00:00', '200922190008', 'ch');
INSERT INTO `channels` VALUES (3, 0, 'UCXG4LxOG_7z2j6NqwcMXoww', 'Miri Weber', 'DIY - FOOD - TRAVEL -INSPIRATION<br /><br />Hallo & herzlich Willkommen auf meinem youtube Kanal ❤ <br /><br />Ich bin Miri Weber, Creative Content Creator, Schweizer Bloggerin, Foto- und Videografin. <br />Auf meinem Channel erwartet dich viel Kreatives mit grossen und kleinen #DIY.<br />#Inspiration für dein saisonales #Chalkboard Lettering<br />#Rezept Videos, <br />viel Bewegung auf dem #Skateboard oder #Snowboard in der Natur. <br />Lass dich inspirieren. <br /> <br />Miri Weber', 'https://yt3.ggpht.com/a/AATXAJyJIp9X9PYUImOsNw8kX8LfVsYqAyLqAFFR-Xm9Ow=s88-c-k-c0xffffffff-no-rj-mo', 'Mirjam Weber', 'https://www.youtube.com/zaubersterne', 'https://www.miriweber.ch', '', '', 'miriweber.ch', '-3-14-', '10.03.2016', '201017-11', '201017-11', 0, 0, 0, 225, 326, 456, NULL, 0, 0, 0, 87014, 126722, 178105, NULL, 46, NULL, 'HINTER JEDEM BILD STECKT EINE STORY - MIRIWEBER.CH', 'W6f0lQXZxBI', '<td class=\"yt-lastvideo\" data-sort=\"200702163931\" data-utime=\"201017-11\"><a href=\"https://youtu.be/W6f0lQXZxBI\" title=\"HINTER JEDEM BILD STECKT EINE STORY - MIRIWEBER.CH\" target=\"_blank\">Do. 02.07.20</a><div class=\"info\"><div class=\"close\"></div><div class=\"circle\" style=\"background-image:url(https://i4.ytimg.com/vi/W6f0lQXZxBI/hqdefault.jpg)\"></div><p>HINTER JEDEM BILD STECKT EINE STORY - MIRIWEBER.CH<br><br>Views: 40 &nbsp; Ø/Video: 3872<br>Veröffentlicht am: Do. 02.07.20 um 16:39 Uhr</p><div class=\"abobar\"><a href=\"https://youtu.be/W6f0lQXZxBI\" target=\"_blank\" class=\"red\">zum Video</a></div></div></td>', 40, '2020-07-02T14:39:31+00:00', '200702163931', 'ch');
INSERT INTO `channels` VALUES (4, 0, 'UC5jlXWBWEynirzUIB_5XKCw', 'Top Of Tops', 'Welcome to the official YouTube channel of TOP OF TOPS. <br /><br />World is full of beautiful places and travelers usually end up going to commonly known or better advertised destinations but often, the lesser known, though equally beautiful and charming places are missed out. <br />Thus we would like to bring to you videos and useful tips about these hidden gems. <br /><br />TOP OF TOPS showcases beautiful and interesting places which are truly hidden gems and better known only to the locals. We bring to you high quality cinematic videos along with useful travel tips. <br /><br />We extensively use drone photography techniques together with high end ground cameras to bring in a whole new perspective. <br />One can see breathtaking footage of landscapes, from a bird\'s eye view which are never seen before.', 'https://yt3.ggpht.com/a/AATXAJzQaNqG0Xgi0ujabf0Bk39kXzVpEXcGSFtF9SJK0A=s88-c-k-c0xffffffff-no-rj-mo', '', 'https://www.youtube.com/TopOfTops', '', '', '', '', '-1-', '21.06.2016', '201017-11', '201017-11', 0, 0, 0, 493, 1590, 1890, NULL, 0, 0, 0, 122581, 391628, 480453, NULL, 24, NULL, 'Dubronik | Lokrum Island | GoT & Star Wars Filming Locations | King\'s Landing', 'k6JjqekBwLs', '<td class=\"yt-lastvideo\" data-sort=\"200105224108\" data-utime=\"201017-11\"><a href=\"https://youtu.be/k6JjqekBwLs\" title=\"Dubronik | Lokrum Island | GoT & Star Wars Filming Locations | King\'s Landing\" target=\"_blank\">So. 05.01.20</a><div class=\"info\"><div class=\"close\"></div><div class=\"circle\" style=\"background-image:url(https://i4.ytimg.com/vi/k6JjqekBwLs/hqdefault.jpg)\"></div><p>Dubronik | Lokrum Island | GoT & Star Wars Filming Locations | King\'s Landing<br><br>Views: 212 &nbsp; Ø/Video: 20019<br>Veröffentlicht am: So. 05.01.20 um 22:41 Uhr</p><div class=\"abobar\"><a href=\"https://youtu.be/k6JjqekBwLs\" target=\"_blank\" class=\"red\">zum Video</a></div></div></td>', 212, '2020-01-05T21:41:08+00:00', '200105224108', 'ch');
INSERT INTO `channels` VALUES (5, 0, 'UCxC2KyLOV_g-00QBO-0bWww', 'Martina Kopp', 'Hallo zämme ig heisse Martina.<br />Ig möchd euch gern mit dür mini abetür nä. Ig machä uf dem kanau ab sofort videos wonig here ga. Äs werde aber widerhin videos vom wandere cho. Faus dir da use dä kanau gfaut de la bitte es gratis Abo da. Merci fürz verbiluege. Es werde numä berndütschi videos gemacht uf mim kanau.<br />Insta:_Martina _kopp_', 'https://yt3.ggpht.com/a/AATXAJySknIQee1Ldvuu-1rO3Qek_sybqMAo2wAAXKf9=s88-c-k-c0xffffffff-no-rj-mo', '', '', '', '', '', '_martina_kopp_', '-6-14-25-', '20.08.2019', '201017-11', '201017-11', 0, 0, 33, 132, 15, 35, NULL, 0, 0, 1258, 7295, 629, 1347, NULL, 72, NULL, 'Ch rocks Steine. Selber gemalt und gefundene', 'wK49Q4AwnJA', '<td class=\"yt-lastvideo\" data-sort=\"200909181121\" data-utime=\"201017-11\"><a href=\"https://youtu.be/wK49Q4AwnJA\" title=\"Ch rocks Steine. Selber gemalt und gefundene\" target=\"_blank\">Mi. 09.09.20</a><div class=\"info\"><div class=\"close\"></div><div class=\"circle\" style=\"background-image:url(https://i4.ytimg.com/vi/wK49Q4AwnJA/hqdefault.jpg)\"></div><p>Ch rocks Steine. Selber gemalt und gefundene<br><br>Views: 12 &nbsp; Ø/Video: 19<br>Veröffentlicht am: Mi. 09.09.20 um 18:11 Uhr</p><div class=\"abobar\"><a href=\"https://youtu.be/wK49Q4AwnJA\" target=\"_blank\" class=\"red\">zum Video</a></div></div></td>', 12, '2020-09-09T16:11:21+00:00', '200909181121', 'ch');
INSERT INTO `channels` VALUES (6, 0, 'UC8ALges_b4zvuhYVpoHvygA', 'Adrian Stern', 'Songs about Love and Life, with lots of Guitars, sung in Swiss German!', 'https://yt3.ggpht.com/a/AATXAJzT2cV1DaDLPfui7OFooy_OrJI4ajooaBAwjA=s88-c-k-c0xffffffff-no-rj-mo', '', '', '', '', '', 'adriansternmusic', '-8-', '23.07.2006', '201017-11', '201017-11', 0, 0, 275, 286, 373, 1900, NULL, 0, 0, 128034, 140281, 160510, 140860, NULL, 26, NULL, 'Meer schaffed das - Adrian Stern (Official Videoclip)', 'MJU4516rPtw', '<td class=\"yt-lastvideo\" data-sort=\"200710110221\" data-utime=\"201017-11\"><a href=\"https://youtu.be/MJU4516rPtw\" title=\"Meer schaffed das - Adrian Stern (Official Videoclip)\" target=\"_blank\">Fr. 10.07.20</a><div class=\"info\"><div class=\"close\"></div><div class=\"circle\" style=\"background-image:url(https://i2.ytimg.com/vi/MJU4516rPtw/hqdefault.jpg)\"></div><p>Meer schaffed das - Adrian Stern (Official Videoclip)<br><br>Views: 2152 &nbsp; Ø/Video: 5418<br>Veröffentlicht am: Fr. 10.07.20 um 11:02 Uhr</p><div class=\"abobar\"><a href=\"https://youtu.be/MJU4516rPtw\" target=\"_blank\" class=\"red\">zum Video</a></div></div></td>', 2152, '2020-07-10T09:02:21+00:00', '200710110221', 'ch');
INSERT INTO `channels` VALUES (7, 0, 'UCOWv-1UVZYIa5IupVMsRjtA', 'Kantonspolizei Bern', 'Offizieller YouTube-Markenkanal der Kantonspolizei Bern.<br /><br />Hier finden Sie Videos zu diversen Themen rund um die Kantonspolizei Bern. Im Notfall 117!', 'https://yt3.ggpht.com/a/AATXAJwCxXY74JLoNIRZNRsXfTyUwKBCs7rpXBDy3cF8=s88-c-k-c0xffffffff-no-rj-mo', '', 'https://www.youtube.com/PoliceBern', 'https://www.police.be.ch', '', '', '', '-7-25-', '08.05.2014', '201017-11', '201017-11', 0, 0, 0, 0, 0, 0, NULL, 0, 0, 0, 0, 252093, 259348, NULL, 41, NULL, 'Zusammen sicher in der Schweiz (Tamil)', 'jbORbNTawh4', '<td class=\"yt-lastvideo\" data-sort=\"201006151009\" data-utime=\"201017-11\"><a href=\"https://youtu.be/jbORbNTawh4\" title=\"Zusammen sicher in der Schweiz (Tamil)\" target=\"_blank\">Di. 06.10.20</a><div class=\"info\"><div class=\"close\"></div><div class=\"circle\" style=\"background-image:url(https://i3.ytimg.com/vi/jbORbNTawh4/hqdefault.jpg)\"></div><p>Zusammen sicher in der Schweiz (Tamil)<br><br>Views: 66 &nbsp; Ø/Video: 6326<br>Veröffentlicht am: Di. 06.10.20 um 15:10 Uhr</p><div class=\"abobar\"><a href=\"https://youtu.be/jbORbNTawh4\" target=\"_blank\" class=\"red\">zum Video</a></div></div></td>', 66, '2020-10-06T13:10:09+00:00', '201006151009', 'ch');
INSERT INTO `channels` VALUES (8, 0, 'UCLRI9G_WHYcSE8UtmWX6Omw', 'Mikethe Bike', 'Tesla Model 3 im täglichen Gebrauch in der Schweiz', 'https://yt3.ggpht.com/a/AATXAJw0Ik5cwV5_aVN3RGCph25HWGeP36TRnK9a2A=s88-c-k-c0xffffffff-no-rj-mo', '', '', '', '', '', '', '-7-', '26.01.2015', '201017-11', '201017-11', 0, 0, 0, 0, 0, 63, NULL, 0, 0, 0, 0, 0, 69087, NULL, 10, NULL, 'Safety in an Accident with my Tesla Model 3', 'aTIWk1j0YRA', '<td class=\"yt-lastvideo\" data-sort=\"201004095948\" data-utime=\"201017-11\"><a href=\"https://youtu.be/aTIWk1j0YRA\" title=\"Safety in an Accident with my Tesla Model 3\" target=\"_blank\">So. 04.10.20</a><div class=\"info\"><div class=\"close\"></div><div class=\"circle\" style=\"background-image:url(https://i2.ytimg.com/vi/aTIWk1j0YRA/hqdefault.jpg)\"></div><p>Safety in an Accident with my Tesla Model 3<br><br>Views: 29626 &nbsp; Ø/Video: 6909<br>Veröffentlicht am: So. 04.10.20 um 09:59 Uhr</p><div class=\"abobar\"><a href=\"https://youtu.be/aTIWk1j0YRA\" target=\"_blank\" class=\"red\">zum Video</a></div></div></td>', 29626, '2020-10-04T07:59:48+00:00', '201004095948', 'ch');
INSERT INTO `channels` VALUES (9, 0, 'UCIIPY878fZMCF72waEd3OGg', 'Ademessi TV', 'Ademessi, tschüss, tschau.....', 'https://yt3.ggpht.com/a/AATXAJzPi9o-yFZk1t5rG0gsuxsYKkjEweQYFfaoX5gR=s88-c-k-c0xffffffff-no-rj-mo', '', '', '', '', '', 'ademessitv', '-6-', '04.04.2020', '201017-11', '201017-11', 0, 0, 0, 0, 0, 2960, NULL, 0, 0, 0, 0, 0, 80770, NULL, 19, NULL, 'Ademessi ade Comedy Awards | Teil 2', 'JgqknHorxmk', '<td class=\"yt-lastvideo\" data-sort=\"201006180006\" data-utime=\"201017-11\"><a href=\"https://youtu.be/JgqknHorxmk\" title=\"Ademessi ade Comedy Awards | Teil 2\" target=\"_blank\">Di. 06.10.20</a><div class=\"info\"><div class=\"close\"></div><div class=\"circle\" style=\"background-image:url(https://i3.ytimg.com/vi/JgqknHorxmk/hqdefault.jpg)\"></div><p>Ademessi ade Comedy Awards | Teil 2<br><br>Views: 3508 &nbsp; Ø/Video: 4251<br>Veröffentlicht am: Di. 06.10.20 um 18:00 Uhr</p><div class=\"abobar\"><a href=\"https://youtu.be/JgqknHorxmk\" target=\"_blank\" class=\"red\">zum Video</a></div></div></td>', 3508, '2020-10-06T16:00:06+00:00', '201006180006', 'ch');
INSERT INTO `channels` VALUES (10, 1, 'UCLKCNlX44-4JLLOSBHUO0mw', 'TheWorkingClassHD', 'Offical TWCHD Youtube Kanal<br /><br />Von Vlogs bis Challenges hin zu Gaming Content!<br /><br />Hier findet ihr alles rund um das Streamer Duo: The Workingclass HD', 'https://yt3.ggpht.com/a/AATXAJxuEzfkY1nyqDzkQyPJqWYKnk7S8C2IKPaXmPyP=s88-c-k-c0xffffffff-no-rj-mo', '', '', '', '', 'theworkingclasshd', 'theworkingclasshd', '-4-11-', '09.12.2017', '201016-20', '201017-11', 0, 0, 0, 0, 66, 63, NULL, 0, 0, 0, 0, 1888, 2035, NULL, 9, NULL, 'TWCHD Meets Beekwest | Tour-Vlog | Schweizerdeutsch | Hip-Hop | Folge 1', 'DQU3-SzpVfo', '<td class=\"yt-lastvideo\" data-sort=\"190818150008\" data-utime=\"201017-11\"><a href=\"https://youtu.be/DQU3-SzpVfo\" title=\"TWCHD Meets Beekwest | Tour-Vlog | Schweizerdeutsch | Hip-Hop | Folge 1\" target=\"_blank\">So. 18.08.19</a><div class=\"info\"><div class=\"close\"></div><div class=\"circle\" style=\"background-image:url(https://i1.ytimg.com/vi/DQU3-SzpVfo/hqdefault.jpg)\"></div><p>TWCHD Meets Beekwest | Tour-Vlog | Schweizerdeutsch | Hip-Hop | Folge 1<br><br>Views: 276 &nbsp; Ø/Video: 226<br>Veröffentlicht am: So. 18.08.19 um 15:00 Uhr</p><div class=\"abobar\"><a href=\"https://youtu.be/DQU3-SzpVfo\" target=\"_blank\" class=\"red\">zum Video</a></div></div></td>', 276, '2019-08-18T13:00:08+00:00', '190818150008', 'ch');
INSERT INTO `channels` VALUES (11, 0, 'UCjkefV-6mroOwvBp0LOqTWw', 'HiH Records', 'Heaven in Hell Records Youtube Channel', 'https://yt3.ggpht.com/a/AATXAJyTmwLsqdSw3GuQ5yO-hD-ekcHPcgoeShA1pdy7=s88-c-k-c0xffffffff-no-rj-mo', '', 'https://www.youtube.com/HeavenInHellRecords', 'https://hih-rec.ch', '', '', 'hih_records', '-8-', '17.12.2012', '201017-11', '201017-11', 0, 0, 121, 0, 0, 0, NULL, 0, 0, 32754, 47722, 82597, 102202, NULL, 74, NULL, 'Gabe (HiH) - raveheart (prod. AuraAudio)', 'EEIitaqUQdc', '<td class=\"yt-lastvideo\" data-sort=\"200911114844\" data-utime=\"201017-11\"><a href=\"https://youtu.be/EEIitaqUQdc\" title=\"Gabe (HiH) - raveheart (prod. AuraAudio)\" target=\"_blank\">Fr. 11.09.20</a><div class=\"info\"><div class=\"close\"></div><div class=\"circle\" style=\"background-image:url(https://i2.ytimg.com/vi/EEIitaqUQdc/hqdefault.jpg)\"></div><p>Gabe (HiH) - raveheart (prod. AuraAudio)<br><br>Views: 165 &nbsp; Ø/Video: 1381<br>Veröffentlicht am: Fr. 11.09.20 um 11:48 Uhr</p><div class=\"abobar\"><a href=\"https://youtu.be/EEIitaqUQdc\" target=\"_blank\" class=\"red\">zum Video</a></div></div></td>', 165, '2020-09-11T09:48:44+00:00', '200911114844', 'ch');
INSERT INTO `channels` VALUES (12, 0, 'UC_mNor8OoBw1GQ9fg1Vxk9Q', 'Carmen, Salome & Rahel', 'Willkomme uf eusem Kanal!<br />Wenn du schomal da bisch, blib doch :)<br /><br />Mir sind eifach 3 random Schwöstere wo eifach gern düend unterhalte.<br /><br />Carmen, Salome & Rahel', 'https://yt3.ggpht.com/a/AATXAJzsUSZ7Vm5dSPrtSE4nsrI43gIxeevLwMDgzrak=s88-c-k-c0xffffffff-no-rj-mo', '', '', '', '', '', '', '-6-', '03.01.2019', '201017-11', '201017-11', 0, 0, 0, 0, 0, 2050, NULL, 0, 0, 0, 0, 0, 19834, NULL, 4, NULL, 'Carmen s‘1 mal am Autofahre🤭🚘', 'DtzHbNw0ytc', '<td class=\"yt-lastvideo\" data-sort=\"200826164539\" data-utime=\"201017-11\"><a href=\"https://youtu.be/DtzHbNw0ytc\" title=\"Carmen s‘1 mal am Autofahre🤭🚘\" target=\"_blank\">Mi. 26.08.20</a><div class=\"info\"><div class=\"close\"></div><div class=\"circle\" style=\"background-image:url(https://i1.ytimg.com/vi/DtzHbNw0ytc/hqdefault.jpg)\"></div><p>Carmen s‘1 mal am Autofahre🤭🚘<br><br>Views: 2647 &nbsp; Ø/Video: 4959<br>Veröffentlicht am: Mi. 26.08.20 um 16:45 Uhr</p><div class=\"abobar\"><a href=\"https://youtu.be/DtzHbNw0ytc\" target=\"_blank\" class=\"red\">zum Video</a></div></div></td>', 2647, '2020-08-26T14:45:39+00:00', '200826164539', 'ch');
INSERT INTO `channels` VALUES (13, 0, 'UCcLncBsuXIatROQ9tVOn-dg', 'Viertelmusik Records', 'DER OFFIZIELLE YOUTUBE KANAL VON VIERTELMUSIK RECORDS', 'https://yt3.ggpht.com/a/AATXAJxZW5J6iBNoUzWh6wnSM9arWbjZC60a6gGCd0MxzA=s88-c-k-c0xffffffff-no-rj-mo', '', '', '', '', '', 'viertelmusik', '-8-20-', '03.01.2019', '201017-11', '201017-11', 0, 0, 0, 0, 0, 2510, NULL, 0, 0, 0, 0, 0, 500788, NULL, 15, NULL, 'Sic4rio - Kopfnickersound (Official Video)', 'joR79Q_Nu4U', '<td class=\"yt-lastvideo\" data-sort=\"200924200010\" data-utime=\"201017-11\"><a href=\"https://youtu.be/joR79Q_Nu4U\" title=\"Sic4rio - Kopfnickersound (Official Video)\" target=\"_blank\">Do. 24.09.20</a><div class=\"info\"><div class=\"close\"></div><div class=\"circle\" style=\"background-image:url(https://i3.ytimg.com/vi/joR79Q_Nu4U/hqdefault.jpg)\"></div><p>Sic4rio - Kopfnickersound (Official Video)<br><br>Views: 42485 &nbsp; Ø/Video: 33386<br>Veröffentlicht am: Do. 24.09.20 um 20:00 Uhr</p><div class=\"abobar\"><a href=\"https://youtu.be/joR79Q_Nu4U\" target=\"_blank\" class=\"red\">zum Video</a></div></div></td>', 42485, '2020-09-24T18:00:10+00:00', '200924200010', 'ch');
INSERT INTO `channels` VALUES (14, 0, 'UC4pIVzYlzkfPMSLsRPA0IDg', 'louiccih', '💗-zlich Willkomme uf mim Youtube-Kanal! ☀️<br />Min Traum isch’s Moderatorin zwerde, siit ich chli bin, ich will min Traum nid ufgeh & die Videos wo ich mach, das isch das wo mich glücklich macht und ich hoffe euch genauso!🥰<br /><br />Ihr findet mich au do:<br /><br />Instagram:  louiccih<br /><br />Danke für jedi Unterstützig & viel Spass uf mim Kanal🤗', 'https://yt3.ggpht.com/a/AATXAJwbU9tGfWAATK2Fb-b1wm4psWSvO5jTx73Ia1akWg=s88-c-k-c0xffffffff-no-rj-mo', '', '', '', '', '', 'louiccih', '-6-14-', '11.12.2016', '201017-11', '201017-11', 0, 0, 0, 90, 182, 205, NULL, 0, 0, 0, 1149, 9689, 12239, NULL, 9, NULL, 'Ich beantworte EUCHI FRAGE', 'ZsXby9x-b0A', '<td class=\"yt-lastvideo\" data-sort=\"200425113238\" data-utime=\"201017-11\"><a href=\"https://youtu.be/ZsXby9x-b0A\" title=\"Ich beantworte EUCHI FRAGE\" target=\"_blank\">Sa. 25.04.20</a><div class=\"info\"><div class=\"close\"></div><div class=\"circle\" style=\"background-image:url(https://i3.ytimg.com/vi/ZsXby9x-b0A/hqdefault.jpg)\"></div><p>Ich beantworte EUCHI FRAGE<br><br>Views: 573 &nbsp; Ø/Video: 1360<br>Veröffentlicht am: Sa. 25.04.20 um 11:32 Uhr</p><div class=\"abobar\"><a href=\"https://youtu.be/ZsXby9x-b0A\" target=\"_blank\" class=\"red\">zum Video</a></div></div></td>', 573, '2020-04-25T09:32:38+00:00', '200425113238', 'ch');
INSERT INTO `channels` VALUES (15, 0, 'UCOADuuOO2C6bGpHaPymOAGg', 'Halunke', 'Halunke - Mundart - Bern', 'https://yt3.ggpht.com/a/AATXAJzJ8lHl1dCLklHGLAxtP0NS2czLG0Wd5fMp6dhyxA=s88-c-k-c0xffffffff-no-rj-mo', '', 'https://www.youtube.com/Halunktube', 'https://www.halunkeonline.ch', '', '', 'halunke_band', '-8-25-', '10.01.2010', '201017-11', '201017-11', 0, 0, 0, 517, 575, 624, NULL, 0, 0, 0, 544648, 561881, 615041, NULL, 39, NULL, 'HALUNKE «HWAO» (offizieller Lyric Clip)', 'zIzO3kxE3NU', '<td class=\"yt-lastvideo\" data-sort=\"200220190008\" data-utime=\"201017-11\"><a href=\"https://youtu.be/zIzO3kxE3NU\" title=\"HALUNKE «HWAO» (offizieller Lyric Clip)\" target=\"_blank\">Do. 20.02.20</a><div class=\"info\"><div class=\"close\"></div><div class=\"circle\" style=\"background-image:url(https://i3.ytimg.com/vi/zIzO3kxE3NU/hqdefault.jpg)\"></div><p>HALUNKE «HWAO» (offizieller Lyric Clip)<br><br>Views: 1924 &nbsp; Ø/Video: 15770<br>Veröffentlicht am: Do. 20.02.20 um 19:00 Uhr</p><div class=\"abobar\"><a href=\"https://youtu.be/zIzO3kxE3NU\" target=\"_blank\" class=\"red\">zum Video</a></div></div></td>', 1924, '2020-02-20T18:00:08+00:00', '200220190008', 'ch');
INSERT INTO `channels` VALUES (16, 0, 'UCTKjNfAGViRoOCgQ-J7leDg', 'Stahlseil', 'Stahlseil.ch befasst sich mit allem was durch Seile bewegt wird. Bergbahnen, Skilifte, Seilbahnen, Sessellifte, Grosse Gondeln, Kleine Gondeln usw.', 'https://yt3.ggpht.com/a/AATXAJx-AKIaaXL9WdZwpRVUwXzGusuFlawMPFVwojLykA=s88-c-k-c0xffffffff-no-rj-mo', 'Michael Meier', 'https://www.youtube.com/stahlseil', 'http://www.stahlseil.ch', '', '', '', '-7-21-', '28.09.2008', '201017-11', '201017-11', 0, 0, 778, 1162, 1820, 2740, NULL, 0, 0, 1322098, 1659738, 2027446, 2684811, NULL, 537, NULL, 'Bahnlinie Bergen auf Rügen-Putbus-Lauterbach Mole, Rügen', 'f8k0mjMu2nw', '<td class=\"yt-lastvideo\" data-sort=\"200919151458\" data-utime=\"201017-11\"><a href=\"https://youtu.be/f8k0mjMu2nw\" title=\"Bahnlinie Bergen auf Rügen-Putbus-Lauterbach Mole, Rügen\" target=\"_blank\">Sa. 19.09.20</a><div class=\"info\"><div class=\"close\"></div><div class=\"circle\" style=\"background-image:url(https://i3.ytimg.com/vi/f8k0mjMu2nw/hqdefault.jpg)\"></div><p>Bahnlinie Bergen auf Rügen-Putbus-Lauterbach Mole, Rügen<br><br>Views: 138 &nbsp; Ø/Video: 5000<br>Veröffentlicht am: Sa. 19.09.20 um 15:14 Uhr</p><div class=\"abobar\"><a href=\"https://youtu.be/f8k0mjMu2nw\" target=\"_blank\" class=\"red\">zum Video</a></div></div></td>', 138, '2020-09-19T13:14:58+00:00', '200919151458', 'ch');
INSERT INTO `channels` VALUES (17, 0, 'UC0Q2HB_PxFurzQM6ck38U2A', 'Kitchwitch', 'Bei Kitchwitch wird mit Leidenschaft gekocht, gebacken und grilliert. Wir mögen Lebensmittel und verarbeiten diese zu schmackhaften Gerichten. Wir kochen Rezepte, die wir noch nie probiert haben, die wir lieben oder Einsendungen von unserer Community. Sei auch du dabei, wenn das nächste Video publiziert wird und abonniere unseren Kanal. Wir freuen uns, dich dabei zu haben!<br /><br /><br />Wir verwenden Musik von Epidemic Sound und Nocopyrightsounds.<br />Unser 2015 Intro: Micro Boogie von 8 Bit Weapon: 8bitweapon.com', 'https://yt3.ggpht.com/a/AATXAJxi_HiwCyGQKXK44E4dWGAFCCUIggFR4d-383ulfA=s88-c-k-c0xffffffff-no-rj-mo', 'Denise & Stefan Lehmann', 'https://www.youtube.com/kitchwitch', 'https://www.kitchwitch.ch', '', '', 'kitchwitch_', '-2-14-18-25-', '30.05.2015', '201017-11', '201017-11', 0, 105, 347, 671, 801, 926, NULL, 0, 23582, 54499, 81243, 127662, 159834, NULL, 202, NULL, 'DOUBLE DIP!! 🍭  | WEIRDFOOD 005', '2Em1yICd4c8', '<td class=\"yt-lastvideo\" data-sort=\"200813192349\" data-utime=\"201017-11\"><a href=\"https://youtu.be/2Em1yICd4c8\" title=\"DOUBLE DIP!! 🍭  | WEIRDFOOD 005\" target=\"_blank\">Do. 13.08.20</a><div class=\"info\"><div class=\"close\"></div><div class=\"circle\" style=\"background-image:url(https://i3.ytimg.com/vi/2Em1yICd4c8/hqdefault.jpg)\"></div><p>DOUBLE DIP!! 🍭  | WEIRDFOOD 005<br><br>Views: 230 &nbsp; Ø/Video: 791<br>Veröffentlicht am: Do. 13.08.20 um 19:23 Uhr</p><div class=\"abobar\"><a href=\"https://youtu.be/2Em1yICd4c8\" target=\"_blank\" class=\"red\">zum Video</a></div></div></td>', 230, '2020-08-13T17:23:49+00:00', '200813192349', 'ch');
INSERT INTO `channels` VALUES (18, 0, 'UCRLujtgjquGHoDTd_dl0y8g', 'Gipfelbike', 'gipfelbike.ch - Mountainbike Guiding in the swiss alps.<br /><br />Geführte Mountainbike Touren schweizweit und im benachbarten Ausland. Insbesondere im Val Müstair, Wallis, Sihltal und Grossraum Zürich.', 'https://yt3.ggpht.com/a/AATXAJyQb9IAD3wVOmCZAIv908m9ATtreUkJTLl7qftL=s88-c-k-c0xffffffff-no-rj-mo', 'Stefan Oberer', '', 'https://gipfelbike.ch', '', '', '', '-5-20-', '14.05.2016', '201017-11', '201017-11', 0, 0, 0, 0, 0, 8, NULL, 0, 0, 0, 0, 0, 521, NULL, 11, NULL, 'Crossfoot Challenge', 'CiPUzGt2Wyo', '<td class=\"yt-lastvideo\" data-sort=\"200419220230\" data-utime=\"201017-11\"><a href=\"https://youtu.be/CiPUzGt2Wyo\" title=\"Crossfoot Challenge\" target=\"_blank\">So. 19.04.20</a><div class=\"info\"><div class=\"close\"></div><div class=\"circle\" style=\"background-image:url(https://i4.ytimg.com/vi/CiPUzGt2Wyo/hqdefault.jpg)\"></div><p>Crossfoot Challenge<br><br>Views: 9 &nbsp; Ø/Video: 47<br>Veröffentlicht am: So. 19.04.20 um 22:02 Uhr</p><div class=\"abobar\"><a href=\"https://youtu.be/CiPUzGt2Wyo\" target=\"_blank\" class=\"red\">zum Video</a></div></div></td>', 9, '2020-04-19T20:02:30+00:00', '200419220230', 'ch');
INSERT INTO `channels` VALUES (19, 0, 'UCpYM98Cz5ptezaK7nV4Akpg', 'Swissmeme TV', 'De einzig originale Youtube-Account vo Swissmeme !', 'https://yt3.ggpht.com/a/AATXAJypZXNODdLMkuHpFOJLbkdp_YBCGGt32hpq91K1=s88-c-k-c0xffffffff-no-rj-mo', 'Zeki Bulgurcu', 'https://www.youtube.com/swissmeme', '', '', '', 'zekisworld', '-6-21-', '24.12.2013', '201017-11', '201017-11', 0, 82518, 89480, 93706, 95400, 107000, NULL, 0, 23192890, 25637054, 28672583, 30031252, 36876699, NULL, 297, NULL, 'SWISSMEME: PROBLEM MIT DE HYMNE', 'FUQSMRrFr00', '<td class=\"yt-lastvideo\" data-sort=\"201016173406\" data-utime=\"201017-11\"><a href=\"https://youtu.be/FUQSMRrFr00\" title=\"SWISSMEME: PROBLEM MIT DE HYMNE\" target=\"_blank\">Fr. 16.10.20</a><div class=\"info\"><div class=\"close\"></div><div class=\"circle\" style=\"background-image:url(https://i3.ytimg.com/vi/FUQSMRrFr00/hqdefault.jpg)\"></div><p>SWISSMEME: PROBLEM MIT DE HYMNE<br><br>Views: 5532 &nbsp; Ø/Video: 124164<br>Veröffentlicht am: Fr. 16.10.20 um 17:34 Uhr</p><div class=\"abobar\"><a href=\"https://youtu.be/FUQSMRrFr00\" target=\"_blank\" class=\"red\">zum Video</a></div></div></td>', 5532, '2020-10-16T15:34:06+00:00', '201016173406', 'ch');
INSERT INTO `channels` VALUES (20, 0, 'UC_Ihi5UHVkB5p2ZKQ1Fec8g', 'SSOC let\'s plays', 'Wir der SSOC Clan sind eine Truppe Schweizer Fun gamer die einfach nur spass am Spiel haben. <br /><br />Folgende Titel werden bei uns so gespielt <br /><br />Arma 3 mit div Mods<br />Battlefield 4<br />Batlefield 1 (Ab 18.10.2016)<br />Und viele mehr auf die ich oder der Clan gerade bock haben.<br /><br /><br />Wir sind Schweizer und werden auch in unseren Videos  Schweizerdeutsch sprechen. Wir wünschen euch viel spass beim zuschauen', 'https://yt3.ggpht.com/a/AATXAJxPr72vJpKcf7m4MwXZ6A-r4G938dNRTy6nmMAZ=s88-c-k-c0xffffffff-no-rj-mo', '', '', 'https://www.facebook.com/SSOClps', '', '', '', '-4-', '23.01.2016', '201017-11', '201017-11', 0, 14, 16, 21, 21, 21, NULL, 0, 1245, 2174, 2511, 2501, 2963, NULL, 205, NULL, '(CH) Cod Blacckops Coldware Beta', 'YBIFDBHDVsI', '<td class=\"yt-lastvideo\" data-sort=\"201013003455\" data-utime=\"201017-11\"><a href=\"https://youtu.be/YBIFDBHDVsI\" title=\"(CH) Cod Blacckops Coldware Beta\" target=\"_blank\">Di. 13.10.20</a><div class=\"info\"><div class=\"close\"></div><div class=\"circle\" style=\"background-image:url(https://i2.ytimg.com/vi/YBIFDBHDVsI/hqdefault.jpg)\"></div><p>(CH) Cod Blacckops Coldware Beta<br><br>Views: 11 &nbsp; Ø/Video: 14<br>Veröffentlicht am: Di. 13.10.20 um 00:34 Uhr</p><div class=\"abobar\"><a href=\"https://youtu.be/YBIFDBHDVsI\" target=\"_blank\" class=\"red\">zum Video</a></div></div></td>', 11, '2020-10-12T22:34:55+00:00', '201013003455', 'ch');
INSERT INTO `channels` VALUES (21, 0, 'UCLRoyCrW4ByT0UP2RcLyBgw', 'Uf dä Punkt.', 'Wir sprechen Klartext und freuen uns, auch deine Meinung zu hören. Ohne grosses Blabla.', 'https://yt3.ggpht.com/a/AATXAJx-1kFETbiEjAuAiBi2x7_wl52WuRzfFnyFxNCL=s88-c-k-c0xffffffff-no-rj-mo', '', 'https://www.youtube.com/ufdapunkt', '', '', '', 'uf.dae.punkt', '-10-', '10.01.2019', '201017-11', '201017-11', 0, 0, 0, 0, 1650, 2090, NULL, 0, 0, 0, 0, 210925, 310132, NULL, 90, NULL, 'Kommt jetzt der zweite Lockdown?', 'm_HJkx6rvFg', '<td class=\"yt-lastvideo\" data-sort=\"201015120010\" data-utime=\"201017-11\"><a href=\"https://youtu.be/m_HJkx6rvFg\" title=\"Kommt jetzt der zweite Lockdown?\" target=\"_blank\">Do. 15.10.20</a><div class=\"info\"><div class=\"close\"></div><div class=\"circle\" style=\"background-image:url(https://i2.ytimg.com/vi/m_HJkx6rvFg/hqdefault.jpg)\"></div><p>Kommt jetzt der zweite Lockdown?<br><br>Views: 308 &nbsp; Ø/Video: 3446<br>Veröffentlicht am: Do. 15.10.20 um 12:00 Uhr</p><div class=\"abobar\"><a href=\"https://youtu.be/m_HJkx6rvFg\" target=\"_blank\" class=\"red\">zum Video</a></div></div></td>', 308, '2020-10-15T10:00:10+00:00', '201015120010', 'ch');
INSERT INTO `channels` VALUES (22, 0, 'UCl82STTPSdqGs4AOx8ZKY4A', 'Playvetia', 'Playvetia isch ä Community für Schwyzer Gaming Content Creators. Mer hend en Discord wo sich Schwyzer Streamer und Youtuber chönd ustusche, neui Kontakt knüpfe und sich gegesitig helfe. Usserdem promoted mir Schwyzer Creators uf üsne Social Media Kanäl und mached regelmässigi Highlight Montage uf YouTube.', 'https://yt3.ggpht.com/a/AATXAJxyajy2hJY69bsZddpzLtTt4MMMA5VSdgxneYNc=s88-c-k-c0xffffffff-no-rj-mo', '', 'https://www.youtube.com/playvetia', '', '', 'playvetia', '', '-4-11-', '12.01.2017', '201017-11', '201017-11', 0, 0, 409, 446, 479, 481, NULL, 0, 0, 8547, 12411, 15185, 16781, NULL, 66, NULL, 'Ohh Jerry, ich bi koh!! - Highlight Januar 2019', 'sc6L_R3urno', '<td class=\"yt-lastvideo\" data-sort=\"200214164501\" data-utime=\"201017-11\"><a href=\"https://youtu.be/sc6L_R3urno\" title=\"Ohh Jerry, ich bi koh!! - Highlight Januar 2019\" target=\"_blank\">Fr. 14.02.20</a><div class=\"info\"><div class=\"close\"></div><div class=\"circle\" style=\"background-image:url(https://i4.ytimg.com/vi/sc6L_R3urno/hqdefault.jpg)\"></div><p>Ohh Jerry, ich bi koh!! - Highlight Januar 2019<br><br>Views: 189 &nbsp; Ø/Video: 254<br>Veröffentlicht am: Fr. 14.02.20 um 16:45 Uhr</p><div class=\"abobar\"><a href=\"https://youtu.be/sc6L_R3urno\" target=\"_blank\" class=\"red\">zum Video</a></div></div></td>', 189, '2020-02-14T15:45:01+00:00', '200214164501', 'ch');
INSERT INTO `channels` VALUES (23, 0, 'UCCPWLVUCAiMYHl6T1bIXjig', 'Besserheigo Records', 'KONTAKT: besserheigo@gmail.com<br /><br /><br />BESSERHEIGO RECORDS ®️', 'https://yt3.ggpht.com/a/AATXAJwXCQi3A_oUqoE27eeoVEK2xhLUKtymTAUMreNHLQ=s88-c-k-c0xffffffff-no-rj-mo', '', '', '', '', '', 'besserheigorecords', '-8-', '05.11.2019', '201017-11', '201017-11', 0, 0, 0, 0, 174, 537, NULL, 0, 0, 0, 0, 6557, 47197, NULL, 6, NULL, 'VEJNO - ELM STREET PROD. BY MAEGLIBEATZ', 'Az1sI8lNAKg', '<td class=\"yt-lastvideo\" data-sort=\"200613000005\" data-utime=\"201017-11\"><a href=\"https://youtu.be/Az1sI8lNAKg\" title=\"VEJNO - ELM STREET PROD. BY MAEGLIBEATZ\" target=\"_blank\">Sa. 13.06.20</a><div class=\"info\"><div class=\"close\"></div><div class=\"circle\" style=\"background-image:url(https://i2.ytimg.com/vi/Az1sI8lNAKg/hqdefault.jpg)\"></div><p>VEJNO - ELM STREET PROD. BY MAEGLIBEATZ<br><br>Views: 1145 &nbsp; Ø/Video: 7866<br>Veröffentlicht am: Sa. 13.06.20 um 00:00 Uhr</p><div class=\"abobar\"><a href=\"https://youtu.be/Az1sI8lNAKg\" target=\"_blank\" class=\"red\">zum Video</a></div></div></td>', 1145, '2020-06-12T22:00:05+00:00', '200613000005', 'ch');
INSERT INTO `channels` VALUES (24, 0, 'UCOss7V5TISfPeQBZOnXcDLw', 'Palm', 'Palm - junger Newcomer aus dem Bernbiet. Nach einigen Jahren Stille erscheint am 31.07.2020 endlich das lang angekündigte Album \"Grauzone\".', 'https://yt3.ggpht.com/a/AATXAJx4EK3mdFsyOHZZE_cKlEWdIjIa4HVT5Yox7BC6=s88-c-k-c0xffffffff-no-rj-mo', '', '', '', '', '', '', '-8-25-', '22.05.2011', '201017-11', '201017-11', 0, 0, 219, 222, 219, 252, NULL, 0, 0, 56587, 58962, 60572, 40570, NULL, 26, NULL, 'Palm - Ig Gäge d\'Wäut (Audio)', 'MFD89ZXwa2Y', '<td class=\"yt-lastvideo\" data-sort=\"200831183003\" data-utime=\"201017-11\"><a href=\"https://youtu.be/MFD89ZXwa2Y\" title=\"Palm - Ig Gäge d\'Wäut (Audio)\" target=\"_blank\">Mo. 31.08.20</a><div class=\"info\"><div class=\"close\"></div><div class=\"circle\" style=\"background-image:url(https://i2.ytimg.com/vi/MFD89ZXwa2Y/hqdefault.jpg)\"></div><p>Palm - Ig Gäge d\'Wäut (Audio)<br><br>Views: 40 &nbsp; Ø/Video: 1560<br>Veröffentlicht am: Mo. 31.08.20 um 18:30 Uhr</p><div class=\"abobar\"><a href=\"https://youtu.be/MFD89ZXwa2Y\" target=\"_blank\" class=\"red\">zum Video</a></div></div></td>', 40, '2020-08-31T16:30:03+00:00', '200831183003', 'ch');
INSERT INTO `channels` VALUES (25, 0, 'UCFwaiySl9fDq1sZ2v5xaykg', 'KimBo', 'Welcome! I\'m KimBo, a Swiss rapper. I rap in two languages: Italian and Swiss German.', 'https://yt3.ggpht.com/a/AATXAJyYa91MAU0Ki76RlV2B5sdFURI7kq5EmFqGVQNE7h0=s88-c-k-c0xffffffff-no-rj-mo', '', '', 'http://kimbomusic.ch', '', '', 'kimborap', '-8-14-', '03.02.2011', '201017-11', '201017-11', 0, 0, 0, 0, 0, 331, NULL, 0, 0, 0, 0, 0, 71647, NULL, 16, NULL, 'Scho No Geil - KimBo', 'MetkY4gbhaQ', '<td class=\"yt-lastvideo\" data-sort=\"200817234119\" data-utime=\"201017-11\"><a href=\"https://youtu.be/MetkY4gbhaQ\" title=\"Scho No Geil - KimBo\" target=\"_blank\">Mo. 17.08.20</a><div class=\"info\"><div class=\"close\"></div><div class=\"circle\" style=\"background-image:url(https://i2.ytimg.com/vi/MetkY4gbhaQ/hqdefault.jpg)\"></div><p>Scho No Geil - KimBo<br><br>Views: 863 &nbsp; Ø/Video: 4478<br>Veröffentlicht am: Mo. 17.08.20 um 23:41 Uhr</p><div class=\"abobar\"><a href=\"https://youtu.be/MetkY4gbhaQ\" target=\"_blank\" class=\"red\">zum Video</a></div></div></td>', 863, '2020-08-17T21:41:19+00:00', '200817234119', 'ch');
INSERT INTO `channels` VALUES (26, 0, 'UCNuCQrKaET5OLzKO_64kOjg', 'Physical Shock', 'Offizieller YouTube Kanal von PHYSICAL SHOCK | physicalshock.com<br /><br />XEN | EAZ | LIBA', 'https://yt3.ggpht.com/a/AATXAJxg5NAHnyXpLMfVqKYztRjf_HUwBy4c0H8QbHQu=s88-c-k-c0xffffffff-no-rj-mo', '', 'https://www.youtube.com/physicalshock', 'https://www.physicalshock.com', '', '', 'physicalshock', '-8-20-', '25.02.2010', '201017-11', '201017-11', 4303, 6625, 12862, 19080, 21700, 24700, NULL, 1066795, 1875955, 3424371, 7779337, 11421271, 16255717, NULL, 24, NULL, 'Reza X Trippy Adi - Zona (prod. by ROB)', '30pjmCq1ATc', '<td class=\"yt-lastvideo\" data-sort=\"200918000015\" data-utime=\"201017-11\"><a href=\"https://youtu.be/30pjmCq1ATc\" title=\"Reza X Trippy Adi - Zona (prod. by ROB)\" target=\"_blank\">Fr. 18.09.20</a><div class=\"info\"><div class=\"close\"></div><div class=\"circle\" style=\"background-image:url(https://i4.ytimg.com/vi/30pjmCq1ATc/hqdefault.jpg)\"></div><p>Reza X Trippy Adi - Zona (prod. by ROB)<br><br>Views: 7842 &nbsp; Ø/Video: 677322<br>Veröffentlicht am: Fr. 18.09.20 um 00:00 Uhr</p><div class=\"abobar\"><a href=\"https://youtu.be/30pjmCq1ATc\" target=\"_blank\" class=\"red\">zum Video</a></div></div></td>', 7842, '2020-09-17T22:00:15+00:00', '200918000015', 'ch');
INSERT INTO `channels` VALUES (27, 0, 'UChOr2ANjTXhRoxH83ZQay3g', 'davey6000', '', 'https://yt3.ggpht.com/a/AATXAJzpl3ecvUuMshLAoBNvBcRYVzx5byW37D4nmTJh=s88-c-k-c0xffffffff-no-rj-mo', '', '', '', '', '', 'davey6000', '-8-', '08.01.2019', '201017-11', '201017-11', 0, 0, 0, 0, 335, 684, NULL, 0, 0, 0, 0, 46064, 206379, NULL, 8, NULL, 'davey6000 - odyssee (Official Video)', 'xQS4OUmLeWQ', '<td class=\"yt-lastvideo\" data-sort=\"201009113006\" data-utime=\"201017-11\"><a href=\"https://youtu.be/xQS4OUmLeWQ\" title=\"davey6000 - odyssee (Official Video)\" target=\"_blank\">Fr. 09.10.20</a><div class=\"info\"><div class=\"close\"></div><div class=\"circle\" style=\"background-image:url(https://i1.ytimg.com/vi/xQS4OUmLeWQ/hqdefault.jpg)\"></div><p>davey6000 - odyssee (Official Video)<br><br>Views: 6575 &nbsp; Ø/Video: 25797<br>Veröffentlicht am: Fr. 09.10.20 um 11:30 Uhr</p><div class=\"abobar\"><a href=\"https://youtu.be/xQS4OUmLeWQ\" target=\"_blank\" class=\"red\">zum Video</a></div></div></td>', 6575, '2020-10-09T09:30:06+00:00', '201009113006', 'ch');
INSERT INTO `channels` VALUES (28, 0, 'UCPvw4R46FquW2BICbvcjSrg', 'Denner', 'Denner ist der führende Schweizer Lebensmittel-Discounter mit über 800 Standorten in der ganzen Schweiz mit einem ausgewogenem Sortiment und vielen attraktiven, wöchentlichen Aktionen.', 'https://yt3.ggpht.com/a/AATXAJzqWS9UOIG873KHamEKwm8b2gLZRgG8kQ5-CyjX=s88-c-k-c0xffffffff-no-rj-mo', '', '', 'https://www.denner.ch', '', '', '', '-13-', '23.02.2012', '201017-11', '201017-11', 0, 0, 0, 0, 0, 0, NULL, 0, 0, 0, 0, 1893240, 3460587, NULL, 137, NULL, 'Süsskartoffel-Gnocchi für CHF 13.- im Video-Tutorial', 'F7lAtGX3-dE', '<td class=\"yt-lastvideo\" data-sort=\"201006000002\" data-utime=\"201017-11\"><a href=\"https://youtu.be/F7lAtGX3-dE\" title=\"Süsskartoffel-Gnocchi für CHF 13.- im Video-Tutorial\" target=\"_blank\">Di. 06.10.20</a><div class=\"info\"><div class=\"close\"></div><div class=\"circle\" style=\"background-image:url(https://i3.ytimg.com/vi/F7lAtGX3-dE/hqdefault.jpg)\"></div><p>Süsskartoffel-Gnocchi für CHF 13.- im Video-Tutorial<br><br>Views: 63 &nbsp; Ø/Video: 25260<br>Veröffentlicht am: Di. 06.10.20 um 00:00 Uhr</p><div class=\"abobar\"><a href=\"https://youtu.be/F7lAtGX3-dE\" target=\"_blank\" class=\"red\">zum Video</a></div></div></td>', 63, '2020-10-05T22:00:02+00:00', '201006000002', 'ch');
INSERT INTO `channels` VALUES (29, 0, 'UCX892bYIvEh69obJk_PSicQ', 'Tüli Unzo', '', 'https://yt3.ggpht.com/a/AATXAJyXWTSKuwzCBhP8xXoT1oovWhKrcri0ePfrsLPE=s88-c-k-c0xffffffff-no-rj-mo', '', '', '', '', '', 'tueli_unzo', '-8-', '12.11.2012', '201017-11', '201017-11', 0, 0, 0, 0, 0, 305, NULL, 0, 0, 0, 0, 0, 59045, NULL, 17, NULL, 'Tüli - Verliebt', 'OTfg3YG8t9s', '<td class=\"yt-lastvideo\" data-sort=\"200502100012\" data-utime=\"201017-11\"><a href=\"https://youtu.be/OTfg3YG8t9s\" title=\"Tüli - Verliebt\" target=\"_blank\">Sa. 02.05.20</a><div class=\"info\"><div class=\"close\"></div><div class=\"circle\" style=\"background-image:url(https://i4.ytimg.com/vi/OTfg3YG8t9s/hqdefault.jpg)\"></div><p>Tüli - Verliebt<br><br>Views: 6985 &nbsp; Ø/Video: 3473<br>Veröffentlicht am: Sa. 02.05.20 um 10:00 Uhr</p><div class=\"abobar\"><a href=\"https://youtu.be/OTfg3YG8t9s\" target=\"_blank\" class=\"red\">zum Video</a></div></div></td>', 6985, '2020-05-02T08:00:12+00:00', '200502100012', 'ch');
INSERT INTO `channels` VALUES (30, 0, 'UCXY_jfrKvPwXsA2Iz1BWYuA', 'Zona 167 Produzioni', 'produzioni<br /><br />recording<br /><br />artist support<br /><br />167Flash', 'https://yt3.ggpht.com/a/AATXAJxUQUbbcqUtwBN2Kv44Qh-BHhUmQyrkz-H1bu5y=s88-c-k-c0xffffffff-no-rj-mo', 'Renato Trianni', 'https://www.youtube.com/zona167produzioni', 'https://www.zona167.com', '', '', '', '-6-8-', '24.10.2006', '201017-11', '201017-11', 0, 0, 151, 218, 251, 292, NULL, 0, 0, 58744, 76063, 88295, 96377, NULL, 256, NULL, 'Pat MC & Sigy Säck \"Mic Check\"', 'OUnNuMxxiXI', '<td class=\"yt-lastvideo\" data-sort=\"200514181054\" data-utime=\"201017-11\"><a href=\"https://youtu.be/OUnNuMxxiXI\" title=\"Pat MC & Sigy Säck \"Mic Check\"\" target=\"_blank\">Do. 14.05.20</a><div class=\"info\"><div class=\"close\"></div><div class=\"circle\" style=\"background-image:url(https://i4.ytimg.com/vi/OUnNuMxxiXI/hqdefault.jpg)\"></div><p>Pat MC & Sigy Säck \"Mic Check\"<br><br>Views: 114 &nbsp; Ø/Video: 376<br>Veröffentlicht am: Do. 14.05.20 um 18:10 Uhr</p><div class=\"abobar\"><a href=\"https://youtu.be/OUnNuMxxiXI\" target=\"_blank\" class=\"red\">zum Video</a></div></div></td>', 114, '2020-05-14T16:10:54+00:00', '200514181054', 'ch');
INSERT INTO `channels` VALUES (31, 0, 'UCvUW-FXbkGgSJdoqRtjNhZQ', 'Dudldei Gurke', 'Hi ich heisse Damaris und bin 23 Jahre alt.<br />Ich komme aus der Schweiz und lade VLOG\'s auf meinem Kanal hoch aber auch anderes, ich möchte mich nicht festlegen. :D<br />Wenn ihr an meinem Leben Teil haben möchtet, dürft ihr mich gern Abonnieren oder mir auf Instagram folgen.<br />Ich freue mich über jeden Einzelnen von euch..<br /><br />Instagram: instagram.com/dudldeigurke2/<br />Twitter: twitter.com/DudldeiGurke2', 'https://yt3.ggpht.com/a/AATXAJyl711kauXYvcWmcPQuKy3vxXcsXhWlh8EClxMxGg=s88-c-k-c0xffffffff-no-rj-mo', 'Damaris', '', '', '', '', 'dudldeigurke2', '-2-14-', '15.07.2014', '201017-11', '201017-11', 0, 0, 0, 151, 163, 175, NULL, 0, 0, 0, 20299, 25271, 27763, NULL, 125, NULL, 'Ich bin Schwanger! und so sind d\'reaktione gsi..', 'VNRhnv3wrSk', '<td class=\"yt-lastvideo\" data-sort=\"200828153000\" data-utime=\"201017-11\"><a href=\"https://youtu.be/VNRhnv3wrSk\" title=\"Ich bin Schwanger! und so sind d\'reaktione gsi..\" target=\"_blank\">Fr. 28.08.20</a><div class=\"info\"><div class=\"close\"></div><div class=\"circle\" style=\"background-image:url(https://i3.ytimg.com/vi/VNRhnv3wrSk/hqdefault.jpg)\"></div><p>Ich bin Schwanger! und so sind d\'reaktione gsi..<br><br>Views: 529 &nbsp; Ø/Video: 222<br>Veröffentlicht am: Fr. 28.08.20 um 15:30 Uhr</p><div class=\"abobar\"><a href=\"https://youtu.be/VNRhnv3wrSk\" target=\"_blank\" class=\"red\">zum Video</a></div></div></td>', 529, '2020-08-28T13:30:00+00:00', '200828153000', 'ch');
INSERT INTO `channels` VALUES (32, 1, 'UCE36cJGnIWOCK8OIiygXH0w', 'Say Hello', 'Herzlich willkommen bei say hello!<br />Wir designen und entwickeln massgeschneiderte Webseiten und Webapplikationen, die den virtuellen Dialog zwischen Firma und Nutzer auf das nächste Level bringen.', 'https://yt3.ggpht.com/a/AATXAJwzJTd9jlXmmdfRH70tIUwYcPzAv-oBcQT75z0n=s88-c-k-c0xffffffff-no-rj-mo', 'Nico Martin', '', 'https://sayhello.ch', '', '', '', '-7-18-', '05.12.2018', '201016-20', '201017-11', 0, 0, 0, 0, 19, 19, NULL, 0, 0, 0, 0, 618, 1100, NULL, 10, NULL, 'YBTeam Hackantons // YBHackathon 2019', 'ZLMaHnOEEQ8', '<td class=\"yt-lastvideo\" data-sort=\"191129092426\" data-utime=\"201017-11\"><a href=\"https://youtu.be/ZLMaHnOEEQ8\" title=\"YBTeam Hackantons // YBHackathon 2019\" target=\"_blank\">Fr. 29.11.19</a><div class=\"info\"><div class=\"close\"></div><div class=\"circle\" style=\"background-image:url(https://i3.ytimg.com/vi/ZLMaHnOEEQ8/hqdefault.jpg)\"></div><p>YBTeam Hackantons // YBHackathon 2019<br><br>Views: 62 &nbsp; Ø/Video: 110<br>Veröffentlicht am: Fr. 29.11.19 um 09:24 Uhr</p><div class=\"abobar\"><a href=\"https://youtu.be/ZLMaHnOEEQ8\" target=\"_blank\" class=\"red\">zum Video</a></div></div></td>', 62, '2019-11-29T08:24:26+00:00', '191129092426', 'ch');
INSERT INTO `channels` VALUES (33, 1, 'UCzPjs7IBa27ZkPbejtqLyhA', 'Landro', '', 'https://yt3.ggpht.com/a/AATXAJz8Kd81iFwMOkwE9e_omlHwfMMTENPX1dB--8nRuw=s88-c-k-c0xffffffff-no-rj-mo', '', 'https://www.youtube.com/landroofficial', '', '', '', 'lucalandro', '-8-', '21.03.2011', '201016-20', '201017-11', 0, 0, 535, 778, 860, 922, NULL, 0, 0, 199720, 298687, 354635, 364979, NULL, 6, NULL, 'Landro - Zoned Out', 'jQenBkGnySc', '<td class=\"yt-lastvideo\" data-sort=\"190612175744\" data-utime=\"201017-11\"><a href=\"https://youtu.be/jQenBkGnySc\" title=\"Landro - Zoned Out\" target=\"_blank\">Mi. 12.06.19</a><div class=\"info\"><div class=\"close\"></div><div class=\"circle\" style=\"background-image:url(https://i3.ytimg.com/vi/jQenBkGnySc/hqdefault.jpg)\"></div><p>Landro - Zoned Out<br><br>Views: 2617 &nbsp; Ø/Video: 60830<br>Veröffentlicht am: Mi. 12.06.19 um 17:57 Uhr</p><div class=\"abobar\"><a href=\"https://youtu.be/jQenBkGnySc\" target=\"_blank\" class=\"red\">zum Video</a></div></div></td>', 2617, '2019-06-12T15:57:44+00:00', '190612175744', 'ch');
INSERT INTO `channels` VALUES (34, 0, 'UC4iwYBmLyF3wBe6TtFRtR7A', 'Ursus & Nadeschkin', 'Der offizielle YouTube-Kanal von Ursus & Nadeschkin!', 'https://yt3.ggpht.com/a/AATXAJxMzTxo0xEcoCBTvbD0TE1Lt6SNdRX6KAdvVNp3=s88-c-k-c0xffffffff-no-rj-mo', 'Nadja Sieger & Urs Wehrli', 'https://www.youtube.com/ursusnadeschkin', 'https://www.ursusnadeschkin.ch', '', '', 'ursusnadeschkin', '-6-', '12.09.2010', '201017-11', '201017-11', 2623, 3079, 3391, 4017, 4370, 4650, NULL, 2039800, 2483119, 2818234, 3265463, 3548699, 3824906, NULL, 90, NULL, 'U&N DVD-Trailer 2020', 'Wbv5awIcOfw', '<td class=\"yt-lastvideo\" data-sort=\"200419124202\" data-utime=\"201017-11\"><a href=\"https://youtu.be/Wbv5awIcOfw\" title=\"U&N DVD-Trailer 2020\" target=\"_blank\">So. 19.04.20</a><div class=\"info\"><div class=\"close\"></div><div class=\"circle\" style=\"background-image:url(https://i4.ytimg.com/vi/Wbv5awIcOfw/hqdefault.jpg)\"></div><p>U&N DVD-Trailer 2020<br><br>Views: 594 &nbsp; Ø/Video: 42499<br>Veröffentlicht am: So. 19.04.20 um 12:42 Uhr</p><div class=\"abobar\"><a href=\"https://youtu.be/Wbv5awIcOfw\" target=\"_blank\" class=\"red\">zum Video</a></div></div></td>', 594, '2020-04-19T10:42:02+00:00', '200419124202', 'ch');
INSERT INTO `channels` VALUES (35, 0, 'UCKeycG2jjRS3HNmqhF9LOkg', '3+', 'Das junge Schweizer Fernsehen<br /><br /><br /><br />Alle Folgen auch unter 3plus.tv<br /><br /><br /><br /><br /><br /><br /><br />Schweizer Eigenproduktionen, Filme in Erstausstrahlung, Serien-Hits<br /><br /><br /><br /><br /><br /><br /><br /><br /><br /><br /><br /><br /><br /><br /><br /><br /><br /><br /><br /><br /><br /><br /><br /><br /><br /><br /><br /><br /><br />3Plus TV Network AG', 'https://yt3.ggpht.com/a/AATXAJzekWpFVaNJ8D0yob81-pbpLt5bCGVSRhjwMr4K5Q=s88-c-k-c0xffffffff-no-rj-mo', '', 'https://www.youtube.com/3PlusTV', 'http://www.3plus.tv', '', '', '3plus', '-9-', '24.07.2008', '201017-11', '201017-11', 784, 1530, 12067, 19682, 41100, 58800, NULL, 1676715, 3748618, 20437304, 31659345, 58512397, 84405670, NULL, 2319, NULL, 'Trailer Folge 10: Res legt Ruth flach! I Bauer, ledig, sucht... Staffel 16', 'jkDerGTGyS8', '<td class=\"yt-lastvideo\" data-sort=\"201016120031\" data-utime=\"201017-11\"><a href=\"https://youtu.be/jkDerGTGyS8\" title=\"Trailer Folge 10: Res legt Ruth flach! I Bauer, ledig, sucht... Staffel 16\" target=\"_blank\">Fr. 16.10.20</a><div class=\"info\"><div class=\"close\"></div><div class=\"circle\" style=\"background-image:url(https://i3.ytimg.com/vi/jkDerGTGyS8/hqdefault.jpg)\"></div><p>Trailer Folge 10: Res legt Ruth flach! I Bauer, ledig, sucht... Staffel 16<br><br>Views: 1389 &nbsp; Ø/Video: 36397<br>Veröffentlicht am: Fr. 16.10.20 um 12:00 Uhr</p><div class=\"abobar\"><a href=\"https://youtu.be/jkDerGTGyS8\" target=\"_blank\" class=\"red\">zum Video</a></div></div></td>', 1389, '2020-10-16T10:00:31+00:00', '201016120031', 'ch');
INSERT INTO `channels` VALUES (36, 0, 'UChp33TLVomDNqo8vSIVW2WQ', 'Blanko Bounce', '🇨🇭HIP HOP🇨🇭<br />         RAP', 'https://yt3.ggpht.com/a/AATXAJz5v1fh-CEGUSagmPE9qadcgRucjjUu6neZVeI5FA=s88-c-k-c0xffffffff-no-rj-mo', '', '', '', '', '', '', '-8-', '22.03.2018', '201017-11', '201017-11', 0, 0, 0, 1478, 4900, 6700, NULL, 0, 0, 0, 171409, 912551, 1626502, NULL, 28, NULL, 'BABKO - CHROME (prod.by CHEKAA)', 'zdoMiSJ9bDU', '<td class=\"yt-lastvideo\" data-sort=\"200921225944\" data-utime=\"201017-11\"><a href=\"https://youtu.be/zdoMiSJ9bDU\" title=\"BABKO - CHROME (prod.by CHEKAA)\" target=\"_blank\">Mo. 21.09.20</a><div class=\"info\"><div class=\"close\"></div><div class=\"circle\" style=\"background-image:url(https://i3.ytimg.com/vi/zdoMiSJ9bDU/hqdefault.jpg)\"></div><p>BABKO - CHROME (prod.by CHEKAA)<br><br>Views: 4543 &nbsp; Ø/Video: 58089<br>Veröffentlicht am: Mo. 21.09.20 um 22:59 Uhr</p><div class=\"abobar\"><a href=\"https://youtu.be/zdoMiSJ9bDU\" target=\"_blank\" class=\"red\">zum Video</a></div></div></td>', 4543, '2020-09-21T20:59:44+00:00', '200921225944', 'ch');
INSERT INTO `channels` VALUES (37, 0, 'UCCKOtijnH8AmP4nU6xCNLyQ', 'Jimmy Mace', 'Welcome to Macejuania<br /><br />Hier auf meinem tollen Youtube Kanal<br /><br />________________________________<br /><br />Ich lade gelegentlich CH Deutsche oder Deutsche Videos hoch. <br /><br /><br />Oftmals sind diese cinematisch oder lustig gestaltet.<br />________________________________<br /><br /><br />Kamera Setup:<br /><br />Main Camera: Sony A6500<br />Lens 1: Sony 16-50 3.5 - 5.6<br />Lens 2: Sony 35mm 1.8<br /><br />Second Camera: Canon EOS M3<br />Lens 11: Canon ef-M 18 - 55 3.5 - 5.6<br /><br />Vlogging Camera: Canon Legria Mini<br /><br />Compact Camera: Canon IXUS 220 HS<br /><br />________________________________<br /><br />PC Setup<br /><br />Notebook: Asus Rog GL552 <br />2. Bildschirm: Philips Brilliance 225B<br />Headset: Turtle Beach Ear Force X12<br />Maus+ Mauspad: Dragon War g9 Thor <br />Audio Interface: Presonus iTwo <br />Mikrofon: Presonus M7 <br /><br />Schnittprogramm:  Davinci Resolve 15<br />Color Grading: Davinci Resolve 15<br /><br />________________________________<br /><br /><br />Viel Spass auf meinem Kanal', 'https://yt3.ggpht.com/a/AATXAJz1dAbSNobXYfy6xbITx1bF_r3yhbM3_SuOTyQ3Wg=s88-c-k-c0xffffffff-no-rj-mo', '', 'https://www.youtube.com/jimmymace', '', '', '', 'macejutv', '-6-', '21.01.2018', '201017-11', '201017-11', 0, 0, 0, 183, 190, 193, NULL, 0, 0, 0, 6265, 6126, 5925, NULL, 54, NULL, 'ChainestOW Highlights 9.8.20 | #bestof #twitch #highlights', 'xXWYY601SZ0', '<td class=\"yt-lastvideo\" data-sort=\"200830155431\" data-utime=\"201017-11\"><a href=\"https://youtu.be/xXWYY601SZ0\" title=\"ChainestOW Highlights 9.8.20 | #bestof #twitch #highlights\" target=\"_blank\">So. 30.08.20</a><div class=\"info\"><div class=\"close\"></div><div class=\"circle\" style=\"background-image:url(https://i1.ytimg.com/vi/xXWYY601SZ0/hqdefault.jpg)\"></div><p>ChainestOW Highlights 9.8.20 | #bestof #twitch #highlights<br><br>Views: 45 &nbsp; Ø/Video: 110<br>Veröffentlicht am: So. 30.08.20 um 15:54 Uhr</p><div class=\"abobar\"><a href=\"https://youtu.be/xXWYY601SZ0\" target=\"_blank\" class=\"red\">zum Video</a></div></div></td>', 45, '2020-08-30T13:54:31+00:00', '200830155431', 'ch');
INSERT INTO `channels` VALUES (38, 0, 'UC-BU5HYjsi7RFZmHwEo4iJw', 'Michi Stuntrider', 'Freestyle Stuntrider from Zurich, Switzerland.<br />check my Instagram and Facebook for more', 'https://yt3.ggpht.com/a/AATXAJzpYiKeUlma1z7fRL2KjpNw_HCcjTal-rtQ2qAX=s88-c-k-c0xffffffff-no-rj-mo', '', '', 'https://hardluck.ch', '', '', 'michi_stuntrider', '-5-', '06.11.2019', '201017-11', '201017-11', 0, 0, 0, 0, 0, 47, NULL, 0, 0, 0, 0, 0, 665, NULL, 4, NULL, 'Stuntriding is not a crime', 'WMw_vnbvCUQ', '<td class=\"yt-lastvideo\" data-sort=\"200429155529\" data-utime=\"201017-11\"><a href=\"https://youtu.be/WMw_vnbvCUQ\" title=\"Stuntriding is not a crime\" target=\"_blank\">Mi. 29.04.20</a><div class=\"info\"><div class=\"close\"></div><div class=\"circle\" style=\"background-image:url(https://i4.ytimg.com/vi/WMw_vnbvCUQ/hqdefault.jpg)\"></div><p>Stuntriding is not a crime<br><br>Views: 77 &nbsp; Ø/Video: 166<br>Veröffentlicht am: Mi. 29.04.20 um 15:55 Uhr</p><div class=\"abobar\"><a href=\"https://youtu.be/WMw_vnbvCUQ\" target=\"_blank\" class=\"red\">zum Video</a></div></div></td>', 77, '2020-04-29T13:55:29+00:00', '200429155529', 'ch');
INSERT INTO `channels` VALUES (39, 0, 'UCw7lZryLz7kYylaXxehT7cg', 'Beekwest', '', 'https://yt3.ggpht.com/a/AATXAJwBgvnCa-VNRTVGukWLod6wgUv1UU18UE65o6hc=s88-c-k-c0xffffffff-no-rj-mo', '', '', '', '', '', 'Beekwest', '-8-', '13.09.2015', '201017-11', '201017-11', 0, 0, 0, 0, 0, 132, NULL, 0, 0, 0, 0, 0, 17182, NULL, 18, NULL, 'Rawid - Skyline (Prod. by Uesemusique) | Official Music Video', 'nU_ItXdENhI', '<td class=\"yt-lastvideo\" data-sort=\"200810180025\" data-utime=\"201017-11\"><a href=\"https://youtu.be/nU_ItXdENhI\" title=\"Rawid - Skyline (Prod. by Uesemusique) | Official Music Video\" target=\"_blank\">Mo. 10.08.20</a><div class=\"info\"><div class=\"close\"></div><div class=\"circle\" style=\"background-image:url(https://i3.ytimg.com/vi/nU_ItXdENhI/hqdefault.jpg)\"></div><p>Rawid - Skyline (Prod. by Uesemusique) | Official Music Video<br><br>Views: 575 &nbsp; Ø/Video: 955<br>Veröffentlicht am: Mo. 10.08.20 um 18:00 Uhr</p><div class=\"abobar\"><a href=\"https://youtu.be/nU_ItXdENhI\" target=\"_blank\" class=\"red\">zum Video</a></div></div></td>', 575, '2020-08-10T16:00:25+00:00', '200810180025', 'ch');
INSERT INTO `channels` VALUES (40, 0, 'UCULwtpJKIY7X3Mw-9Lb8Ong', 'Rety Del Rey', '', 'https://yt3.ggpht.com/a/AATXAJwjZ0GbpD-wYHnvPfJ3L6P1OLD7Hpnw4oE0CZ3t=s88-c-k-c0xffffffff-no-rj-mo', '', '', '', '', '', 'retydelrey', '-8-', '03.03.2008', '201017-11', '201017-11', 0, 0, 0, 0, 0, 26, NULL, 0, 0, 0, 0, 0, 4089, NULL, 11, NULL, 'Rety del Rey - Privateigetum (Full Mixtape 2020)', 'cUuKsUPKiA8', '<td class=\"yt-lastvideo\" data-sort=\"200707070005\" data-utime=\"201017-11\"><a href=\"https://youtu.be/cUuKsUPKiA8\" title=\"Rety del Rey - Privateigetum (Full Mixtape 2020)\" target=\"_blank\">Di. 07.07.20</a><div class=\"info\"><div class=\"close\"></div><div class=\"circle\" style=\"background-image:url(https://i4.ytimg.com/vi/cUuKsUPKiA8/hqdefault.jpg)\"></div><p>Rety del Rey - Privateigetum (Full Mixtape 2020)<br><br>Views: 345 &nbsp; Ø/Video: 372<br>Veröffentlicht am: Di. 07.07.20 um 07:00 Uhr</p><div class=\"abobar\"><a href=\"https://youtu.be/cUuKsUPKiA8\" target=\"_blank\" class=\"red\">zum Video</a></div></div></td>', 345, '2020-07-07T05:00:05+00:00', '200707070005', 'ch');
INSERT INTO `channels` VALUES (41, 0, 'UCecQ8ONRCAtTCu8nrg1mZHA', 'Newcolorline Visagistenschule', '', 'https://yt3.ggpht.com/a/AATXAJw4RkRHKTyb5ore1jnz4pPxJbwGZRHfqfipa-ia=s88-c-k-c0xffffffff-no-rj-mo', '', '', 'https://www.newcolorline.ch', '', '', 'newcolorline', '-13-18-22-', '17.04.2013', '201017-11', '201017-11', 0, 0, 0, 0, 0, 5, NULL, 0, 0, 0, 0, 0, 737, NULL, 8, NULL, 'Tages-Make-up in der Zeit von Corona ;-)', 'DGk7gGhqMCw', '<td class=\"yt-lastvideo\" data-sort=\"200325161715\" data-utime=\"201017-11\"><a href=\"https://youtu.be/DGk7gGhqMCw\" title=\"Tages-Make-up in der Zeit von Corona ;-)\" target=\"_blank\">Mi. 25.03.20</a><div class=\"info\"><div class=\"close\"></div><div class=\"circle\" style=\"background-image:url(https://i1.ytimg.com/vi/DGk7gGhqMCw/hqdefault.jpg)\"></div><p>Tages-Make-up in der Zeit von Corona ;-)<br><br>Views: 130 &nbsp; Ø/Video: 92<br>Veröffentlicht am: Mi. 25.03.20 um 16:17 Uhr</p><div class=\"abobar\"><a href=\"https://youtu.be/DGk7gGhqMCw\" target=\"_blank\" class=\"red\">zum Video</a></div></div></td>', 130, '2020-03-25T15:17:15+00:00', '200325161715', 'ch');
INSERT INTO `channels` VALUES (42, 1, 'UCinxAWhCEJT3-SRSll55mmw', 'Troubas Kater', 'Troubas Kater ist eine 8-köpfige Mundart-Urban-Troubadour Band aus Bern.', 'https://yt3.ggpht.com/a/AATXAJwz-12jPh4ykMVbP8frgSCne5YS9dHF17lWEEFw=s88-c-k-c0xffffffff-no-rj-mo', 'Markus Sollberger, Matthias Urech, Alexander Balajew, Jürg Lerch, Kaspar Eggimann, Mark Oberholzer, Simon Hirsiger, Lukas Wyss', 'https://www.youtube.com/troubaskater', 'https://www.troubaskater.ch', '', '', '', '-8-25-', '28.12.2006', '201016-20', '201017-11', 0, 0, 861, 1137, 1280, 1420, NULL, 0, 0, 705335, 907557, 1031753, 1147149, NULL, 19, NULL, 'Troubas Kater - Härz:Bluet:Louf', 'rzEkupGp4js', '<td class=\"yt-lastvideo\" data-sort=\"191212090010\" data-utime=\"201017-11\"><a href=\"https://youtu.be/rzEkupGp4js\" title=\"Troubas Kater - Härz:Bluet:Louf\" target=\"_blank\">Do. 12.12.19</a><div class=\"info\"><div class=\"close\"></div><div class=\"circle\" style=\"background-image:url(https://i3.ytimg.com/vi/rzEkupGp4js/hqdefault.jpg)\"></div><p>Troubas Kater - Härz:Bluet:Louf<br><br>Views: 10207 &nbsp; Ø/Video: 60376<br>Veröffentlicht am: Do. 12.12.19 um 09:00 Uhr</p><div class=\"abobar\"><a href=\"https://youtu.be/rzEkupGp4js\" target=\"_blank\" class=\"red\">zum Video</a></div></div></td>', 10207, '2019-12-12T08:00:10+00:00', '191212090010', 'ch');
INSERT INTO `channels` VALUES (43, 0, 'UCbD3YQhCnTglQRx9PE-ZctQ', 'Tuwan', 'Nach ihrem Überraschungserfolg mit der Single „Pancakes“ setzen TUWAN noch einen drauf: „Pracht“ heisst die neue Single der beiden Newcomer aus Bern, die zugleich den Frühling und ein fulminantes Debutalbum ankündigt.<br />Es war im letzten Sommer, als die zwei Jungs von TUWAN der Schweiz den Funk zurück brachten: „Pancakes“ hiess die Single, mit der die beiden bislang unbekannten Berner in diversen Radiostationen landeten. Erfrischend neu und doch irgendwie Old-School wirkte der Song und zog damit die Hörer in seinen Bann.<br />Auch auf ihrer neuen Single „Pracht“ mischen TUWAN gekonnt verschiedene Einflüsse: Soulige Stimmen, ein Touch von Latin und Elektroswing über einen HipHop-Beat, dazu viel Horns und am Schluss ein Battle zwischen Trompete und Posaune - so etwas gab es schon lange nicht mehr im Radio. Und es macht definitiv Appetit auf mehr: „Pracht“ ist die Vorabsingle zum Debutalbum von TUWAN, welches im Herbst 2019 erscheinen wird. Man darf gespannt sein!', 'https://yt3.ggpht.com/a/AATXAJxCFqe16tygLLnMn7Wuq1L2EezWz8PbRC0cy0Ch-A=s88-c-k-c0xffffffff-no-rj-mo', '', 'https://www.youtube.com/tuwan', '', '', '', 'tuwanmusic', '-8-25-', '21.08.2016', '201017-11', '201017-11', 0, 0, 0, 0, 543, 675, NULL, 0, 0, 0, 0, 63297, 103414, NULL, 6, NULL, 'TUWAN - Mehrzahl vo Heimat (Musikvideo)', 'z7wYVn6OV-Q', '<td class=\"yt-lastvideo\" data-sort=\"200717180012\" data-utime=\"201017-11\"><a href=\"https://youtu.be/z7wYVn6OV-Q\" title=\"TUWAN - Mehrzahl vo Heimat (Musikvideo)\" target=\"_blank\">Fr. 17.07.20</a><div class=\"info\"><div class=\"close\"></div><div class=\"circle\" style=\"background-image:url(https://i3.ytimg.com/vi/z7wYVn6OV-Q/hqdefault.jpg)\"></div><p>TUWAN - Mehrzahl vo Heimat (Musikvideo)<br><br>Views: 39004 &nbsp; Ø/Video: 17236<br>Veröffentlicht am: Fr. 17.07.20 um 18:00 Uhr</p><div class=\"abobar\"><a href=\"https://youtu.be/z7wYVn6OV-Q\" target=\"_blank\" class=\"red\">zum Video</a></div></div></td>', 39004, '2020-07-17T16:00:12+00:00', '200717180012', 'ch');
INSERT INTO `channels` VALUES (44, 0, 'UCD10UORUOGk9lLp-l1RWTqQ', 'Silvan Kuster', 'Hey Ho Herzlich Willkomen auf meinem Kanal!!<br /><br />Uf dem Kanal erwarte dich:<br />       <br />    Jede Sunntig am 10ii es neues Video (oder vilicht au absolut need)<br />        Vlogs<br />        Challenges<br />        Comedy<br />        Musik<br /><br />Also eigentlich eifach das uf was ich Bock han.<br /><br />Danke dass ich dich uf mim Kanal derf begrüesse und wenn scho debii bisch:<br />    Abonnieren<br />    Glocke Aktivieren<br />    Liken<br /><br /><br />!!ACHTUNG!!<br />De Kanal beinhaltet viel Sarkasmus und die getätigte Ussage selled need immer zu 100% ernst gnoh werde!!<br /><br /><br />© Silvan Kuster', 'https://yt3.ggpht.com/a/AATXAJwk1Ms-cDh9WZW3ZV0XqpZeMS9vQ_7_KlMlEavb=s88-c-k-c0xffffffff-no-rj-mo', '', 'https://www.youtube.com/silvankuster', '', '', '', 'silvan__hd', '-4-6-23-', '28.11.2015', '201017-11', '201017-11', 0, 0, 0, 64, 154, 223, NULL, 0, 0, 0, 60, 2243, 5289, NULL, 38, NULL, 'Hemmer nu Wasserfäll | Silvan Kuster | Vlog#23 | CH-Deutsch', 'EKp3EzbMFsM', '<td class=\"yt-lastvideo\" data-sort=\"201011100004\" data-utime=\"201017-11\"><a href=\"https://youtu.be/EKp3EzbMFsM\" title=\"Hemmer nu Wasserfäll | Silvan Kuster | Vlog#23 | CH-Deutsch\" target=\"_blank\">So. 11.10.20</a><div class=\"info\"><div class=\"close\"></div><div class=\"circle\" style=\"background-image:url(https://i2.ytimg.com/vi/EKp3EzbMFsM/hqdefault.jpg)\"></div><p>Hemmer nu Wasserfäll | Silvan Kuster | Vlog#23 | CH-Deutsch<br><br>Views: 33 &nbsp; Ø/Video: 139<br>Veröffentlicht am: So. 11.10.20 um 10:00 Uhr</p><div class=\"abobar\"><a href=\"https://youtu.be/EKp3EzbMFsM\" target=\"_blank\" class=\"red\">zum Video</a></div></div></td>', 33, '2020-10-11T08:00:04+00:00', '201011100004', 'ch');
INSERT INTO `channels` VALUES (45, 1, 'UCNGu4K3ZFaaDRI2tVWBAo9Q', 'ICEPRODUCTION', 'Destinatione finde und Events Filme sich üsi passion', 'https://yt3.ggpht.com/a/AATXAJyXE4o4jW9Jl3IpgOFGyBrB_a0TDI7jzVi_xlRztw=s88-c-k-c0xffffffff-no-rj-mo', '', '', '', '', '', 'iceproduction', '-3-', '11.04.2014', '201016-20', '201017-11', 0, 0, 0, 0, 155, 148, NULL, 0, 0, 0, 0, 5616, 5772, NULL, 9, NULL, 'Neus Video', 'MsRIxUetul0', '<td class=\"yt-lastvideo\" data-sort=\"190721210341\" data-utime=\"201017-11\"><a href=\"https://youtu.be/MsRIxUetul0\" title=\"Neus Video\" target=\"_blank\">So. 21.07.19</a><div class=\"info\"><div class=\"close\"></div><div class=\"circle\" style=\"background-image:url(https://i2.ytimg.com/vi/MsRIxUetul0/hqdefault.jpg)\"></div><p>Neus Video<br><br>Views: 225 &nbsp; Ø/Video: 641<br>Veröffentlicht am: So. 21.07.19 um 21:03 Uhr</p><div class=\"abobar\"><a href=\"https://youtu.be/MsRIxUetul0\" target=\"_blank\" class=\"red\">zum Video</a></div></div></td>', 225, '2019-07-21T19:03:41+00:00', '190721210341', 'ch');
INSERT INTO `channels` VALUES (46, 0, 'UCZh09i2x6EQrTZUQxUZHZSg', 'Milena Patagônia', 'Pop sounds with a trap twist in Swiss German language. Just Milena Patagônia and one item of gear.<br /><br />facebook.com/milenapatagonia/<br />soundcloud.com/milenapatagonia<br />instagram.com/lamilenalamilena/', 'https://yt3.ggpht.com/a/AATXAJy6QOD8KK-scb4xpoEgDgTwBY2TQTsAXjFDptLeFw=s88-c-k-c0xffffffff-no-rj-mo', '', '', '', '', '', 'lamilenalamilena', '-8-14-', '23.04.2016', '201017-11', '201017-11', 0, 0, 0, 0, 68, 85, NULL, 0, 0, 0, 0, 15292, 17591, NULL, 15, NULL, 'Ohni di (Darksome Remix)', 'mQTLhhw5aM0', '<td class=\"yt-lastvideo\" data-sort=\"200821060008\" data-utime=\"201017-11\"><a href=\"https://youtu.be/mQTLhhw5aM0\" title=\"Ohni di (Darksome Remix)\" target=\"_blank\">Fr. 21.08.20</a><div class=\"info\"><div class=\"close\"></div><div class=\"circle\" style=\"background-image:url(https://i2.ytimg.com/vi/mQTLhhw5aM0/hqdefault.jpg)\"></div><p>Ohni di (Darksome Remix)<br><br>Views: 134 &nbsp; Ø/Video: 1173<br>Veröffentlicht am: Fr. 21.08.20 um 06:00 Uhr</p><div class=\"abobar\"><a href=\"https://youtu.be/mQTLhhw5aM0\" target=\"_blank\" class=\"red\">zum Video</a></div></div></td>', 134, '2020-08-21T04:00:08+00:00', '200821060008', 'ch');
INSERT INTO `channels` VALUES (47, 0, 'UCk82ch8IkEf_PYf1qwbpgUg', 'Lärsu', 'ÄLLI u Tschou dir geile Böck🐐<br /><br />Uf mim Kanal findet dir eh Mischig zwüsche Comedy, Vlogs und berndütsche Usdrück.<br />Mini Videos werde wüchentlech (Sunntig,18:00 Uhr) zum ahluege präsentiert.<br /><br />Für das du mi ooh chli besser kennet:<br />Ih bi dr Lärsu, knackigi 19i und wohne in Burgdorf, Bern. <br />PS: Bi eh überdurchschnittlech schneuer Berner.<br /><br />Weh ooh möchtisch Teil vo dem Kanal und somit ooh eh Teil vor \"Chüeunnity\" z´si, darfsch du sehr gern uf \"Abonnieren\" klicke.<br />Usserdem darfsch mir ooh sehr gern mine Social Media Accounts folge, um zukünfig mitzuentscheide was genau für Videos chömme.<br /><br />Snapchat:       doener_king7<br />Instagram:      fritierti_eier<br />                         fritierte_lärsu<br /><br /><br />Viu Spass bem Stimuliere💦<br />Lars Brunner<br />Fritierte_Lärsu', 'https://yt3.ggpht.com/a/AATXAJxcIDpJNg6zMmoBIX82iael0dBYtA8JPsqHaDxNdw=s88-c-k-c0xffffffff-no-rj-mo', 'Lars Brunner', 'https://www.youtube.com/larsu', '', '', '', 'fritierte_larsu', '-6-25-', '29.05.2014', '201017-11', '201017-11', 0, 0, 0, 261, 913, 1190, NULL, 0, 0, 0, 4405, 23450, 35314, NULL, 46, NULL, 'WARUM chömme ke VIDEOS MEH?!😳 - Fritierte_Lärsu🔥', 'hqDZ35qsDuc', '<td class=\"yt-lastvideo\" data-sort=\"200913190007\" data-utime=\"201017-11\"><a href=\"https://youtu.be/hqDZ35qsDuc\" title=\"WARUM chömme ke VIDEOS MEH?!😳 - Fritierte_Lärsu🔥\" target=\"_blank\">So. 13.09.20</a><div class=\"info\"><div class=\"close\"></div><div class=\"circle\" style=\"background-image:url(https://i1.ytimg.com/vi/hqDZ35qsDuc/hqdefault.jpg)\"></div><p>WARUM chömme ke VIDEOS MEH?!😳 - Fritierte_Lärsu🔥<br><br>Views: 388 &nbsp; Ø/Video: 768<br>Veröffentlicht am: So. 13.09.20 um 19:00 Uhr</p><div class=\"abobar\"><a href=\"https://youtu.be/hqDZ35qsDuc\" target=\"_blank\" class=\"red\">zum Video</a></div></div></td>', 388, '2020-09-13T17:00:07+00:00', '200913190007', 'ch');
INSERT INTO `channels` VALUES (48, 0, 'UC4CAORGWUEm2v0m5WXma4Vw', 'Okann', 'lnk.site//tipico-2<br /><br />instagram.com/okann85/', 'https://yt3.ggpht.com/a/AATXAJyT9E5vYLOydEMRYg1-P7YA1xyp5sYxCeZHd867ow=s88-c-k-c0xffffffff-no-rj-mo', '', '', '', '', '', 'okann85', '-8-', '12.10.2015', '201017-11', '201017-11', 0, 0, 333, 375, 386, 455, NULL, 0, 0, 91744, 103664, 93756, 129145, NULL, 12, NULL, 'Deyo - Donner prod. by MEAN2K', 'grxoeBfcYHk', '<td class=\"yt-lastvideo\" data-sort=\"200612000013\" data-utime=\"201017-11\"><a href=\"https://youtu.be/grxoeBfcYHk\" title=\"Deyo - Donner prod. by MEAN2K\" target=\"_blank\">Fr. 12.06.20</a><div class=\"info\"><div class=\"close\"></div><div class=\"circle\" style=\"background-image:url(https://i4.ytimg.com/vi/grxoeBfcYHk/hqdefault.jpg)\"></div><p>Deyo - Donner prod. by MEAN2K<br><br>Views: 1243 &nbsp; Ø/Video: 10762<br>Veröffentlicht am: Fr. 12.06.20 um 00:00 Uhr</p><div class=\"abobar\"><a href=\"https://youtu.be/grxoeBfcYHk\" target=\"_blank\" class=\"red\">zum Video</a></div></div></td>', 1243, '2020-06-11T22:00:13+00:00', '200612000013', 'ch');
INSERT INTO `channels` VALUES (49, 1, 'UCi_u6bUJY_dcK7tybOXvyZw', 'WISDOM das Musikmagazin', 'WISDOM - Musik | Stars | Fashion<br />Jeden Sonntagabend, 18:25 Uhr auf SWISS1<br /><br />Online kannst du WISDOM auch via wilmaa.com, zattoo.com, teleboy.ch, swiss1.tv und auf unserem YouTube-Kanal schauen!<br /><br />Kontakt zur Redaktion:<br />wisdom@swiss1.tv | swiss1.tv/wisdom<br /><br />PR & Medienanfragen Pät Schreiber: <br />Contcept Communication, Barbara Ryter<br />barbara.ryter@contcept.ch | 043 501 33 00', 'https://yt3.ggpht.com/a/AATXAJz5s5amOc18X_r1dqAIR4UVITJcCPnIpseQOBls=s88-c-k-c0xffffffff-no-rj-mo', 'Pät Schreiber', 'https://www.youtube.com/WisdomDasMusikmagazin', 'https://www.swiss1.tv/wisdom', '', '', 'wisdom_swiss1', '-6-8-9-', '01.02.2018', '201016-20', '201017-11', 0, 0, 0, 2008, 3000, 2930, NULL, 0, 0, 0, 206796, 436196, 475185, NULL, 71, NULL, 'Tipps zum Silvester-Outfit | WISDOM | Dr. Fashion', 'EMus4U4EfyE', '<td class=\"yt-lastvideo\" data-sort=\"191230131730\" data-utime=\"201017-11\"><a href=\"https://youtu.be/EMus4U4EfyE\" title=\"Tipps zum Silvester-Outfit | WISDOM | Dr. Fashion\" target=\"_blank\">Mo. 30.12.19</a><div class=\"info\"><div class=\"close\"></div><div class=\"circle\" style=\"background-image:url(https://i2.ytimg.com/vi/EMus4U4EfyE/hqdefault.jpg)\"></div><p>Tipps zum Silvester-Outfit | WISDOM | Dr. Fashion<br><br>Views: 1073 &nbsp; Ø/Video: 6693<br>Veröffentlicht am: Mo. 30.12.19 um 13:17 Uhr</p><div class=\"abobar\"><a href=\"https://youtu.be/EMus4U4EfyE\" target=\"_blank\" class=\"red\">zum Video</a></div></div></td>', 1073, '2019-12-30T12:17:30+00:00', '191230131730', 'ch');
INSERT INTO `channels` VALUES (50, 0, 'UCqNL83581wbf9pv_wHV0Zaw', 'SRF Digital', 'Liebst du Games und Geek-Kultur mindestens so sehr wie wir? Dann bist du hier richtig! Guido, Martina und Jürg unterhalten dich:<br />► jeden Montag, 20 Uhr: «Let\'s Play» im Livestream<br />► jeden Mittwoch, 13 Uhr: Talkshow «Geek-Sofa» im Livestream <br />----------------------------------------------------------------------------------------<br />Plaudere jederzeit mit uns auf Discord:<br />► discordapp.com/invite/012xplhQmvIErYJrN<br />----------------------------------------------------------------------------------------<br />Geek-Sofa Podcast:<br />► srf.ch/feed/podcast/hd/558068d8-8dfb-4319-bfb9-e6eb7401444e.xml<br />Digital Podcast:<br />► srf.ch/feed/podcast/hd/400741a5-0289-474b-807c-01679a6986c0.xml<br />---------------------------------------------', 'https://yt3.ggpht.com/a/AATXAJyiBZhAoPTRNVB22ut6isZ7E66AWDU0AQgYmh9c=s88-c-k-c0xffffffff-no-rj-mo', '', 'https://www.youtube.com/srfdigital', 'https://www.srf.ch/radio-srf-3/digital', '', '', 'srfdigital', '-9-15-', '31.05.2011', '201017-11', '201017-11', 1350, 1971, 2634, 3416, 4040, 5340, NULL, 619777, 834731, 1100957, 1433373, 1737321, 2212434, NULL, 817, NULL, 'Star Wars: Squadrons – Let\'s Play mit Guido', 'Rb7gTVtmon0', '<td class=\"yt-lastvideo\" data-sort=\"201016113108\" data-utime=\"201017-11\"><a href=\"https://youtu.be/Rb7gTVtmon0\" title=\"Star Wars: Squadrons – Let\'s Play mit Guido\" target=\"_blank\">Fr. 16.10.20</a><div class=\"info\"><div class=\"close\"></div><div class=\"circle\" style=\"background-image:url(https://i3.ytimg.com/vi/Rb7gTVtmon0/hqdefault.jpg)\"></div><p>Star Wars: Squadrons – Let\'s Play mit Guido<br><br>Views: 0 &nbsp; Ø/Video: 2708<br>Veröffentlicht am: Fr. 16.10.20 um 11:31 Uhr</p><div class=\"abobar\"><a href=\"https://youtu.be/Rb7gTVtmon0\" target=\"_blank\" class=\"red\">zum Video</a></div></div></td>', 0, '2020-10-16T09:31:08+00:00', '201016113108', 'ch');
INSERT INTO `channels` VALUES (51, 0, 'UCXpi8SQCydn71E2S6qwwbRw', 'Absurdistdrama', 'Schön das uf mim youtube Kanal bisch. 🦋<br /><br />Ich lade uf mim Kanal schwizerdütschi & dütschi Videos ufe. Ich ha kei festgleite Content, mache eifach das wo mer spass macht. 🌸<br /><br />Falls Video wünsch hesch, chasch mer gern schriebe. 📩<br /><br />Instagram: absurdistdrama<br />TikTok: absurdistdrama<br />snapchat: absurdistdrama', 'https://yt3.ggpht.com/a/AATXAJz2CdQNpBeHfLW9zxuepD_NX-qSWxvxNbFSksw2=s88-c-k-c0xffffffff-no-rj-mo', '', '', '', '', '', 'absurdistdrama', '-2-14-28-', '20.04.2019', '201017-11', '201017-11', 0, 0, 0, 0, 0, 25, NULL, 0, 0, 0, 0, 0, 864, NULL, 5, NULL, 'Spring dress outfit inspo / by absurdistdrama 🌸', 'EK2y8AcbyDQ', '<td class=\"yt-lastvideo\" data-sort=\"200403113139\" data-utime=\"201017-11\"><a href=\"https://youtu.be/EK2y8AcbyDQ\" title=\"Spring dress outfit inspo / by absurdistdrama 🌸\" target=\"_blank\">Fr. 03.04.20</a><div class=\"info\"><div class=\"close\"></div><div class=\"circle\" style=\"background-image:url(https://i2.ytimg.com/vi/EK2y8AcbyDQ/hqdefault.jpg)\"></div><p>Spring dress outfit inspo / by absurdistdrama 🌸<br><br>Views: 199 &nbsp; Ø/Video: 173<br>Veröffentlicht am: Fr. 03.04.20 um 11:31 Uhr</p><div class=\"abobar\"><a href=\"https://youtu.be/EK2y8AcbyDQ\" target=\"_blank\" class=\"red\">zum Video</a></div></div></td>', 199, '2020-04-03T09:31:39+00:00', '200403113139', 'ch');
INSERT INTO `channels` VALUES (52, 1, 'UCYxnbeaEQCIgTPEkrvddrDQ', 'CH-Traveladdict', 'Hey willkommen auf meinem Kanal!<br />Mein Name ist Gianna aber man nennt mich auch der Sparfuchs^^<br />Ich lebe in der teuren Schweiz, arbeite vollzeit und liebe es trotzdem die Welt zu bereisen. <br />Denn: Keine Karriere der Welt ist so vielseitig, dass sie die Erfahrungen und Lehren des Reisens ersetzen könnte. :-)<br />Ihr wollt die Welt so sehen wie sie ist und nicht wie sie die Medien oder der Reisekatalog darstellen? Dann seid ihr bei mir genau richtig!', 'https://yt3.ggpht.com/a/AATXAJym13qeLPjCuoBHXs4jhF2k-zefB-GHsfTfD9HgOQ=s88-c-k-c0xffffffff-no-rj-mo', 'Gianna Rutz', '', 'http://www.ch-traveladdict.com', '', '', 'traveladdict_ch', '-1-14-', '21.08.2015', '201016-20', '201017-11', 0, 0, 0, 144, 254, 321, NULL, 0, 0, 0, 49977, 122575, 174511, NULL, 52, NULL, 'EXUMA BAHAMAS 4K - I\'m in Paradise!', '8YLORqIhyF0', '<td class=\"yt-lastvideo\" data-sort=\"190901154159\" data-utime=\"201017-11\"><a href=\"https://youtu.be/8YLORqIhyF0\" title=\"EXUMA BAHAMAS 4K - I\'m in Paradise!\" target=\"_blank\">So. 01.09.19</a><div class=\"info\"><div class=\"close\"></div><div class=\"circle\" style=\"background-image:url(https://i1.ytimg.com/vi/8YLORqIhyF0/hqdefault.jpg)\"></div><p>EXUMA BAHAMAS 4K - I\'m in Paradise!<br><br>Views: 23496 &nbsp; Ø/Video: 3356<br>Veröffentlicht am: So. 01.09.19 um 15:41 Uhr</p><div class=\"abobar\"><a href=\"https://youtu.be/8YLORqIhyF0\" target=\"_blank\" class=\"red\">zum Video</a></div></div></td>', 23496, '2019-09-01T13:41:59+00:00', '190901154159', 'ch');
INSERT INTO `channels` VALUES (53, 0, 'UCQyJ7r9orLatdj06lzOvjFw', 'Smileypeacefun', 'SMILEYPEACEFUN aka Joel<br />-Crazy Projects With Passion-<br />Swiss Youtuber <br /><br />-------------------------------------------------------------------------------------<br /><br />Imprint: <br />Joel aka. Smileypeacefun<br />Switzerland<br />My post office box: <br />Please send me a personal/direct message on one of my social media pages or a business email and I will send you the post office box address. Also, let me know roughly when the mail will arrive. Otherwise, I won\'t get it.<br /><br />Email: smileypeacefun.joel@gmail.com (only business inquiries)', 'https://yt3.ggpht.com/a/AATXAJyttygGqIkn4Ld8al1QsW8LDwwwqsQWtnZGx0YeGA=s88-c-k-c0xffffffff-no-rj-mo', 'Joel', 'https://www.youtube.com/Smileypeacefun', '', '', '', 'smiley.peace.fun', '-6-', '11.12.2009', '201017-11', '201017-11', 0, 997, 1117, 1250, 1310, 1400, NULL, 0, 100828, 140943, 217095, 247821, 275205, NULL, 161, NULL, 'Ranking EVERY MILEY CYRUS Song', 'cyQCR4amDOQ', '<td class=\"yt-lastvideo\" data-sort=\"200916103708\" data-utime=\"201017-11\"><a href=\"https://youtu.be/cyQCR4amDOQ\" title=\"Ranking EVERY MILEY CYRUS Song\" target=\"_blank\">Mi. 16.09.20</a><div class=\"info\"><div class=\"close\"></div><div class=\"circle\" style=\"background-image:url(https://i4.ytimg.com/vi/cyQCR4amDOQ/hqdefault.jpg)\"></div><p>Ranking EVERY MILEY CYRUS Song<br><br>Views: 153 &nbsp; Ø/Video: 1709<br>Veröffentlicht am: Mi. 16.09.20 um 10:37 Uhr</p><div class=\"abobar\"><a href=\"https://youtu.be/cyQCR4amDOQ\" target=\"_blank\" class=\"red\">zum Video</a></div></div></td>', 153, '2020-09-16T08:37:08+00:00', '200916103708', 'ch');
INSERT INTO `channels` VALUES (54, 0, 'UC1zlNcX7ssGmMfuWCUnC3xg', 'Distrust', 'Fr jede wos füut!!!', 'https://yt3.ggpht.com/a/AATXAJwbls2peAHKGOOVCGE3Tr5YZqUNupgbpjEQGGAn3Q=s88-c-k-c0xffffffff-no-rj-mo', '', '', '', '', '', '', '-8-', '15.08.2014', '201017-11', '201017-11', 0, 0, 0, 660, 810, 866, NULL, 0, 0, 0, 43347, 29168, 36199, NULL, 7, NULL, 'Distrust - Bye', 'yTPplCD-_NM', '<td class=\"yt-lastvideo\" data-sort=\"200228000016\" data-utime=\"201017-11\"><a href=\"https://youtu.be/yTPplCD-_NM\" title=\"Distrust - Bye\" target=\"_blank\">Fr. 28.02.20</a><div class=\"info\"><div class=\"close\"></div><div class=\"circle\" style=\"background-image:url(https://i2.ytimg.com/vi/yTPplCD-_NM/hqdefault.jpg)\"></div><p>Distrust - Bye<br><br>Views: 1043 &nbsp; Ø/Video: 5171<br>Veröffentlicht am: Fr. 28.02.20 um 00:00 Uhr</p><div class=\"abobar\"><a href=\"https://youtu.be/yTPplCD-_NM\" target=\"_blank\" class=\"red\">zum Video</a></div></div></td>', 1043, '2020-02-27T23:00:16+00:00', '200228000016', 'ch');
INSERT INTO `channels` VALUES (55, 0, 'UCng3w4h7F1lLnWQTQxxGgKA', 'Elia', 'Aues wo ir Schwizz abgheit: Gesellschaft, News, Politik, Aktuelle Themen usw.<br /><br />Ig bi dr Elia, umé im Kanton Bern und thematisiere uf dem Kanal aues, wo mi und d Schwizz aktuell grad beschäftige. Lah gern dini Meinig ih de Kommentare da, um mit mir mit diskutiere!<br /><br />- - - - - -<br /><br />► Elia uf Social Media<br />- Instagram: @mister_elia<br />- Twitch: EyElia<br />- Twitter: @mister_elia<br /><br />► Livestreams<br />Jede Sunntig Abe am 19:30 bini LIVE uf Twitch: EyElia.<br /><br />Livestream Reactions & Highlights chöme ufem Zweitkanal uf YouTube online.<br />- Zweitkanal: EyElia<br /><br />► Podcast<br />Dr Privatchat Podcast zeme mitem Maelo Romani isch verfüegbar uf Spotify, Apple Podcasts usw.<br /><br />- - - - - -<br /><br />Merci bisch umé! <br />Elia', 'https://yt3.ggpht.com/a/AATXAJxEBGDZCnM48cN61IetSugo04iPladU7CivXtLR=s88-c-k-c0xffffffff-no-rj-mo', 'Elia Rohrbach', 'https://www.youtube.com/misterelia', '', 'https://open.spotify.com/show/1xIBDLWYV7C7fmkrx1krF8', 'eyelia', 'mister_elia', '-6-11-12-25-', '28.12.2011', '201017-11', '201017-11', 2554, 3076, 4015, 5174, 5910, 7350, NULL, 92583, 123089, 163987, 192283, 221606, 98132, NULL, 14, NULL, 'SwissCovid-App: Ke Lösig füre Ueli 📱🤔', 'a9w_Jwi1fqs', '<td class=\"yt-lastvideo\" data-sort=\"200915171357\" data-utime=\"201017-11\"><a href=\"https://youtu.be/a9w_Jwi1fqs\" title=\"SwissCovid-App: Ke Lösig füre Ueli 📱🤔\" target=\"_blank\">Di. 15.09.20</a><div class=\"info\"><div class=\"close\"></div><div class=\"circle\" style=\"background-image:url(https://i2.ytimg.com/vi/a9w_Jwi1fqs/hqdefault.jpg)\"></div><p>SwissCovid-App: Ke Lösig füre Ueli 📱🤔<br><br>Views: 2372 &nbsp; Ø/Video: 7009<br>Veröffentlicht am: Di. 15.09.20 um 17:13 Uhr</p><div class=\"abobar\"><a href=\"https://youtu.be/a9w_Jwi1fqs\" target=\"_blank\" class=\"red\">zum Video</a></div></div></td>', 2372, '2020-09-15T15:13:57+00:00', '200915171357', 'ch');
INSERT INTO `channels` VALUES (56, 0, 'UCMLgtW0G0wJoi9Wzl9HHyRg', 'Carina Manco', 'Ricette, consigli di cucina e molto altro in quattro lingue.<br />Rezepte, Tipps für die Küche, und vieles mehr in vier Sprachen.<br />Recepten, kooktips en nog veel meer in vier talen.', 'https://yt3.ggpht.com/a/AATXAJw51xDcNnbbj_MWgfd3GHCbyNw1JHo36HoeR918=s88-c-k-c0xffffffff-no-rj-mo', '', 'https://www.youtube.com/carinamancomusitoru', '', '', '', '', '-2-14-', '01.11.2017', '201017-11', '201017-11', 0, 0, 0, 0, 667, 1550, NULL, 0, 0, 0, 0, 104987, 243636, NULL, 235, NULL, 'NL-060 Bedankt voor 1000 abonnees (helemaal gratis)', 'VGhGGX0F19s', '<td class=\"yt-lastvideo\" data-sort=\"200812202051\" data-utime=\"201017-11\"><a href=\"https://youtu.be/VGhGGX0F19s\" title=\"NL-060 Bedankt voor 1000 abonnees (helemaal gratis)\" target=\"_blank\">Mi. 12.08.20</a><div class=\"info\"><div class=\"close\"></div><div class=\"circle\" style=\"background-image:url(https://i3.ytimg.com/vi/VGhGGX0F19s/hqdefault.jpg)\"></div><p>NL-060 Bedankt voor 1000 abonnees (helemaal gratis)<br><br>Views: 58 &nbsp; Ø/Video: 1037<br>Veröffentlicht am: Mi. 12.08.20 um 20:20 Uhr</p><div class=\"abobar\"><a href=\"https://youtu.be/VGhGGX0F19s\" target=\"_blank\" class=\"red\">zum Video</a></div></div></td>', 58, '2020-08-12T18:20:51+00:00', '200812202051', 'ch');
INSERT INTO `channels` VALUES (57, 0, 'UCseMRliCjLdWPXjGt5qgOIQ', 'Mafflin', 'Dies ist ein Kanal in dem alles gemacht wird. Sowohl Gaming, Reviews Reactions, Vlogs Songs, und so weiter. Es kommen Wöchentliche Videos und ich hoffe er gefällt euch. Bitte hinterlasst mir doch auch mal ein Abo. Es würde mich freuen.', 'https://yt3.ggpht.com/a/AATXAJwxVvLLJHb5PQFKVB00WhgyVv7gow2qAdQXAlKX=s88-c-k-c0xffffffff-no-rj-mo', '', '', '', '', '', '', '-4-6-15-', '16.12.2018', '201017-11', '201017-11', 0, 0, 0, 0, 92, 122, NULL, 0, 0, 0, 0, 16806, 26059, NULL, 21, NULL, 'Mavic Pro 2|Cinematic Footage', '7Ct3s-ToZ8M', '<td class=\"yt-lastvideo\" data-sort=\"200604162702\" data-utime=\"201017-11\"><a href=\"https://youtu.be/7Ct3s-ToZ8M\" title=\"Mavic Pro 2|Cinematic Footage\" target=\"_blank\">Do. 04.06.20</a><div class=\"info\"><div class=\"close\"></div><div class=\"circle\" style=\"background-image:url(https://i4.ytimg.com/vi/7Ct3s-ToZ8M/hqdefault.jpg)\"></div><p>Mavic Pro 2|Cinematic Footage<br><br>Views: 46 &nbsp; Ø/Video: 1241<br>Veröffentlicht am: Do. 04.06.20 um 16:27 Uhr</p><div class=\"abobar\"><a href=\"https://youtu.be/7Ct3s-ToZ8M\" target=\"_blank\" class=\"red\">zum Video</a></div></div></td>', 46, '2020-06-04T14:27:02+00:00', '200604162702', 'ch');
INSERT INTO `channels` VALUES (58, 0, 'UC0df7E41rpg697KLv7erpOw', 'MediaMarkt Schweiz', 'Willkommen auf dem offiziellen Kanal von Media Markt Schweiz!<br />Hier findet Ihr Unboxings & Testberichte zu den neusten Produkten, Interviews mit Mitarbeitenden oder Kunden, Previews zu neuen Märkten, exklusive Game-Tests und Berichte zu Events<br /><br />Habt Ihr Videowünsche? Lasst es uns wissen! Wir freuen uns auch über jeden Kommentar, Daumen hoch und jedes Abo!<br /><br />Wir wünschen Euch gute Unterhaltung in THE WORLD OF FUN POWERED BY MEDIA MARKT.<br /><br />Media Markt E-Commerce AG (CHE-147.614.144)<br />Allmendstrasse 23<br />CH-8953 Dietikon<br />Telefon für Kunden: 0848 544 455 <br />Telefon für übrige Anfragen: 044 749 36 36<br />E-Mail: kundendienst@mediamarkt.ch<br /><br />Ansprechpartnerin Medien:<br />Séverine de Rougemont / Unternehmenskommunikation <br />Media Markt E-Commerce AG<br />Tel.: +41 44 749 39 76<br />E-Mail: presse@mediamarkt.ch', 'https://yt3.ggpht.com/a/AATXAJwpOtulPNRo6pbM7PRpF6eCnYunhGelnepLd3aHNQ=s88-c-k-c0xffffffff-no-rj-mo', '', 'https://www.youtube.com/MediaMarktch', 'https://www.mediamarkt.ch', '', '', 'mediamarkt_ch', '-13-', '25.11.2010', '201017-11', '201017-11', 1420, 2672, 5548, 8184, 8710, 8800, NULL, 1120460, 1386537, 1579590, 2239416, 2612082, 2825501, NULL, 726, NULL, 'Golden Brand Weekend | MediaMarkt Schweiz', 'ezjiW7r0QQo', '<td class=\"yt-lastvideo\" data-sort=\"200316091722\" data-utime=\"201017-11\"><a href=\"https://youtu.be/ezjiW7r0QQo\" title=\"Golden Brand Weekend | MediaMarkt Schweiz\" target=\"_blank\">Mo. 16.03.20</a><div class=\"info\"><div class=\"close\"></div><div class=\"circle\" style=\"background-image:url(https://i2.ytimg.com/vi/ezjiW7r0QQo/hqdefault.jpg)\"></div><p>Golden Brand Weekend | MediaMarkt Schweiz<br><br>Views: 614 &nbsp; Ø/Video: 3892<br>Veröffentlicht am: Mo. 16.03.20 um 09:17 Uhr</p><div class=\"abobar\"><a href=\"https://youtu.be/ezjiW7r0QQo\" target=\"_blank\" class=\"red\">zum Video</a></div></div></td>', 614, '2020-03-16T08:17:22+00:00', '200316091722', 'ch');
INSERT INTO `channels` VALUES (59, 0, 'UCquWDHql1G1JNVX2PmYRFJQ', 'SamuelFlueckiger', '', 'https://yt3.ggpht.com/a/AATXAJwbyKaX9POZ4qJOb8VN8WaPPHbcPeSILJV2I8LE_w=s88-c-k-c0xffffffff-no-rj-mo', 'Samuel Flückiger', 'https://www.youtube.com/samuelflueckiger', '', '', '', '', '-3-8-', '16.12.2006', '201017-11', '201017-11', 0, 0, 491, 533, 558, 588, NULL, 0, 0, 1623055, 1691673, 1744473, 1783876, NULL, 30, NULL, 'FENSTERLOS (WINDOWLESS) -  Official Trailer', 'kcNiYBtyhAs', '<td class=\"yt-lastvideo\" data-sort=\"200308140621\" data-utime=\"201017-11\"><a href=\"https://youtu.be/kcNiYBtyhAs\" title=\"FENSTERLOS (WINDOWLESS) -  Official Trailer\" target=\"_blank\">So. 08.03.20</a><div class=\"info\"><div class=\"close\"></div><div class=\"circle\" style=\"background-image:url(https://i4.ytimg.com/vi/kcNiYBtyhAs/hqdefault.jpg)\"></div><p>FENSTERLOS (WINDOWLESS) -  Official Trailer<br><br>Views: 53 &nbsp; Ø/Video: 59463<br>Veröffentlicht am: So. 08.03.20 um 14:06 Uhr</p><div class=\"abobar\"><a href=\"https://youtu.be/kcNiYBtyhAs\" target=\"_blank\" class=\"red\">zum Video</a></div></div></td>', 53, '2020-03-08T13:06:21+00:00', '200308140621', 'ch');
INSERT INTO `channels` VALUES (60, 0, 'UC0ia0Bh33OgZ8p4emfeGG6g', 'SRF Comedy', 'Comedy von SRF / Hier findest du das beste aus dem Comedy Universum von SRF: Wir haben die Klassiker von gestern und morgen. Das Beste aus dem TV, Radio und Web findest du hier regelmässig erweitert. <br /><br />Netiquette:  srf.ch/social-netiquette', 'https://yt3.ggpht.com/a/AATXAJyCUxW6hzMt-SFw2x08aeRxOS4sqzf3zCYN_vANZg=s88-c-k-c0xffffffff-no-rj-mo', '', 'https://www.youtube.com/srfcomedy', '', '', '', '', '-6-9-', '11.10.2012', '201017-11', '201017-11', 3495, 7291, 16111, 22506, 32100, 43700, NULL, 3440465, 6931252, 23313055, 30315389, 25069169, 38574784, NULL, 2135, NULL, 'Michelle Kalt: Genital Tattoo als Warnhinweis | Comedy Talent Show Warm Up | SRF Comedy', 'Nff7O1KDwUo', '<td class=\"yt-lastvideo\" data-sort=\"201015190004\" data-utime=\"201017-11\"><a href=\"https://youtu.be/Nff7O1KDwUo\" title=\"Michelle Kalt: Genital Tattoo als Warnhinweis | Comedy Talent Show Warm Up | SRF Comedy\" target=\"_blank\">Do. 15.10.20</a><div class=\"info\"><div class=\"close\"></div><div class=\"circle\" style=\"background-image:url(https://i3.ytimg.com/vi/Nff7O1KDwUo/hqdefault.jpg)\"></div><p>Michelle Kalt: Genital Tattoo als Warnhinweis | Comedy Talent Show Warm Up | SRF Comedy<br><br>Views: 1432 &nbsp; Ø/Video: 18068<br>Veröffentlicht am: Do. 15.10.20 um 19:00 Uhr</p><div class=\"abobar\"><a href=\"https://youtu.be/Nff7O1KDwUo\" target=\"_blank\" class=\"red\">zum Video</a></div></div></td>', 1432, '2020-10-15T17:00:04+00:00', '201015190004', 'ch');
INSERT INTO `channels` VALUES (61, 0, 'UCCMTmBW92nDaZVpJ3WtJlMw', 'Pato', 'Fragt man Pato danach, wieso er Hip-Hop macht und woher er seine Inspiration und Motivation für sein musikalisches Schaffen hernimmt, kommt einfach und ohne weitere Ausschmückung zurück «Eifach so, ohni Grund». Lange wurde Ihm gesagt, er müsse auf eine gewisse Art und Weise Musik machen und fürs Radio auf seine Wortwahl achten. Aus diesem Bünzli-Käfig konnte er sich aber befreien und ist mit einem freien Mind zurück in der puren und echten musikalischen Kunst. Der Solothurner Künstler gibt bei seinen neusten Tracks Einblick in seine Gedankenwelt. Negatives, Gossip und schlechte Gedanken haben da keinen Platz. Das Wesentliche wird mit seinem engsten Kreativkreis «Säubergmacht» und nicht durch irgendeine Kommunikations & Consulting Agentur durch Unkreativität vermainstreamt. Seine Liebe zur Kunst drückt der junge Künstler in seinen Texten gekonnt aus. Wie schon «Einstein» gesagt hat, haben selbst Wissenschaftler für die Liebe noch keine Formel gefunden. Sie ist nicht, wie vieles andere i', 'https://yt3.ggpht.com/a/AATXAJzQ2nQPsCu5G81s6QhYVdrcO3W0kI6iPGroPUHTIw=s88-c-k-c0xffffffff-no-rj-mo', '', 'https://www.youtube.com/patomusic', 'https://www.patomusic.ch', '', '', 'pato.music', '-8-27-', '12.02.2017', '201017-11', '201017-11', 0, 0, 288, 413, 439, 473, NULL, 0, 0, 21325, 41198, 18552, 26970, NULL, 21, NULL, 'Pato  - OHNI GRUND (20.11.2020)', 'xv-fqhbogZE', '<td class=\"yt-lastvideo\" data-sort=\"200913122147\" data-utime=\"201017-11\"><a href=\"https://youtu.be/xv-fqhbogZE\" title=\"Pato  - OHNI GRUND (20.11.2020)\" target=\"_blank\">So. 13.09.20</a><div class=\"info\"><div class=\"close\"></div><div class=\"circle\" style=\"background-image:url(https://i1.ytimg.com/vi/xv-fqhbogZE/hqdefault.jpg)\"></div><p>Pato  - OHNI GRUND (20.11.2020)<br><br>Views: 96 &nbsp; Ø/Video: 1284<br>Veröffentlicht am: So. 13.09.20 um 12:21 Uhr</p><div class=\"abobar\"><a href=\"https://youtu.be/xv-fqhbogZE\" target=\"_blank\" class=\"red\">zum Video</a></div></div></td>', 96, '2020-09-13T10:21:47+00:00', '200913122147', 'ch');
INSERT INTO `channels` VALUES (62, 0, 'UCq_tXJgpCnGYSK_1WaOwy8A', 'Gaggalaaris', 'Zwoi Gaggalaaris hend sich troffe, drum redet de Kanal Mundart. Mundart isch fätzig, Mundart isch geil, öberhaupt und sowieso wennd weisch wasi mein ;)', 'https://yt3.ggpht.com/a/AATXAJzGB_pRSsM6AAAdi5pcsHEOZ8hpfFjd9GfzFrNL=s88-c-k-c0xffffffff-no-rj-mo', '', '', '', '', '', '', '-6-', '17.04.2020', '201017-11', '201017-11', 0, 0, 0, 0, 0, 140, NULL, 0, 0, 0, 0, 0, 3144, NULL, 5, NULL, '„Das esch ned e mim Wortschatz...\"', '5Pm59bjaHNs', '<td class=\"yt-lastvideo\" data-sort=\"200930170811\" data-utime=\"201017-11\"><a href=\"https://youtu.be/5Pm59bjaHNs\" title=\"„Das esch ned e mim Wortschatz...\"\" target=\"_blank\">Mi. 30.09.20</a><div class=\"info\"><div class=\"close\"></div><div class=\"circle\" style=\"background-image:url(https://i2.ytimg.com/vi/5Pm59bjaHNs/hqdefault.jpg)\"></div><p>„Das esch ned e mim Wortschatz...\"<br><br>Views: 198 &nbsp; Ø/Video: 629<br>Veröffentlicht am: Mi. 30.09.20 um 17:08 Uhr</p><div class=\"abobar\"><a href=\"https://youtu.be/5Pm59bjaHNs\" target=\"_blank\" class=\"red\">zum Video</a></div></div></td>', 198, '2020-09-30T15:08:11+00:00', '200930170811', 'ch');
INSERT INTO `channels` VALUES (63, 0, 'UCxCpgTGZQUdKV-Yzts9zoZQ', 'SP Schweiz', 'Sozialdemokratische Partei der Schweiz (SP)', 'https://yt3.ggpht.com/a/AATXAJwi78a53E19xGDxviGNtI29Iz2CQ4WvMLSvWmdsPA=s88-c-k-c0xffffffff-no-rj-mo', '', 'https://www.youtube.com/spschweiz', 'https://www.sp-ps.ch', '', '', '', '-10-', '18.06.2007', '201017-11', '201017-11', 0, 375, 422, 504, 581, 700, NULL, 0, 218213, 254618, 322558, 333870, 339610, NULL, 157, NULL, 'Comment puis-je voter ?', 'OixWlebprhk', '<td class=\"yt-lastvideo\" data-sort=\"201017101526\" data-utime=\"201017-11\"><a href=\"https://youtu.be/OixWlebprhk\" title=\"Comment puis-je voter ?\" target=\"_blank\">Sa. 17.10.20</a><div class=\"info\"><div class=\"close\"></div><div class=\"circle\" style=\"background-image:url(https://i4.ytimg.com/vi/OixWlebprhk/hqdefault.jpg)\"></div><p>Comment puis-je voter ?<br><br>Views: 22 &nbsp; Ø/Video: 2163<br>Veröffentlicht am: Sa. 17.10.20 um 10:15 Uhr</p><div class=\"abobar\"><a href=\"https://youtu.be/OixWlebprhk\" target=\"_blank\" class=\"red\">zum Video</a></div></div></td>', 22, '2020-10-17T08:15:26+00:00', '201017101526', 'ch');
INSERT INTO `channels` VALUES (64, 1, 'UC1ypI4hfojtt3lmzE9PRN5Q', 'Jaeggi LP', '', 'https://yt3.ggpht.com/a/AATXAJyfx8HLPE1EQh2XyIxzIegmlOcqRTgTjdReD-gbqg=s88-c-k-c0xffffffff-no-rj-mo', '', 'https://www.youtube.com/jaeggilp', '', '', 'jaeggiplays', '', '-4-11-', '29.06.2012', '201016-20', '201017-11', 0, 43, 67, 76, 86, 86, NULL, 0, 8744, 11968, 13974, 17689, 1932, NULL, 3, NULL, 'Auf der Jagd. Vertiefungsarbeit: Jagd im Wallis', 'UHg4iBqvFpM', '<td class=\"yt-lastvideo\" data-sort=\"190521095053\" data-utime=\"201017-11\"><a href=\"https://youtu.be/UHg4iBqvFpM\" title=\"Auf der Jagd. Vertiefungsarbeit: Jagd im Wallis\" target=\"_blank\">Di. 21.05.19</a><div class=\"info\"><div class=\"close\"></div><div class=\"circle\" style=\"background-image:url(https://i2.ytimg.com/vi/UHg4iBqvFpM/hqdefault.jpg)\"></div><p>Auf der Jagd. Vertiefungsarbeit: Jagd im Wallis<br><br>Views: 1648 &nbsp; Ø/Video: 644<br>Veröffentlicht am: Di. 21.05.19 um 09:50 Uhr</p><div class=\"abobar\"><a href=\"https://youtu.be/UHg4iBqvFpM\" target=\"_blank\" class=\"red\">zum Video</a></div></div></td>', 1648, '2019-05-21T07:50:53+00:00', '190521095053', 'ch');
INSERT INTO `channels` VALUES (65, 0, 'UC1l8KCZ3NZybuLsRTQJWK4A', 'Rollin Records', '', 'https://yt3.ggpht.com/a/AATXAJzI24fVGuO5JJZ_jS9RM0EOc38SpWEVTBDdYPhz=s88-c-k-c0xffffffff-no-rj-mo', '', '', '', '', '', '', '-8-', '09.12.2017', '201017-11', '201017-11', 0, 0, 0, 0, 0, 392, NULL, 0, 0, 0, 0, 0, 15584, NULL, 8, NULL, 'JULZ X FABREE - 72 BARS (Official Music Video)', 'kU8rpEPWd_k', '<td class=\"yt-lastvideo\" data-sort=\"201002190013\" data-utime=\"201017-11\"><a href=\"https://youtu.be/kU8rpEPWd_k\" title=\"JULZ X FABREE - 72 BARS (Official Music Video)\" target=\"_blank\">Fr. 02.10.20</a><div class=\"info\"><div class=\"close\"></div><div class=\"circle\" style=\"background-image:url(https://i4.ytimg.com/vi/kU8rpEPWd_k/hqdefault.jpg)\"></div><p>JULZ X FABREE - 72 BARS (Official Music Video)<br><br>Views: 695 &nbsp; Ø/Video: 1948<br>Veröffentlicht am: Fr. 02.10.20 um 19:00 Uhr</p><div class=\"abobar\"><a href=\"https://youtu.be/kU8rpEPWd_k\" target=\"_blank\" class=\"red\">zum Video</a></div></div></td>', 695, '2020-10-02T17:00:13+00:00', '201002190013', 'ch');
INSERT INTO `channels` VALUES (66, 0, 'UCFgloF784lLqAPG7Y-7lH9w', 'epic rides', 'Die Sache ist doch die:<br />die funsport-Szene entwickelt sich rasant. War vor einiger Zeit ein backflip noch top, ist dieser heute... aaaach.. ja na, hatten wir ja schon. Geht da nicht noch mehr? Gut zugegeben, anschauen tun wir dies ja alle gerne. Dies auch dann, wenn eine „do-or-die\" Nummer so richtig daneben geht. Insbesondere, weil wir dann vom Sofa aufstehen können um das nächste Bier zu holen und völlig unversehrt wieder zurückkehren können. Doch da die meisten von uns ja weder über die Fähigkeiten noch ein unendliches Schmerzempfinden verfügen, ist es uns nicht vergönnt diese Entwicklung mitzumachen. Ehrlicherweise sollte noch gesagt sein, dass wir dies ja auch nicht wollen.<br />Trotzdem ist epic-rides ein Teil dessen, was in unserem Verständnis der Begriff freeride ausmacht. Das Erlebnis draussen in der Natur und das Gefühl von Freiheit auf eine ganz individuelle Art und Weise. In diesem Sinne... ride on!', 'https://yt3.ggpht.com/a/AATXAJwL56-_649NaquysdwF8it4dWWwEzMUK8t7-KUQPg=s88-c-k-c0xffffffff-no-rj-mo', '', 'https://www.youtube.com/epicridestrails', 'https://www.epic-rides.ch', '', '', 'epicridestrails', '-1-5-', '10.01.2012', '201017-11', '201017-11', 0, 56, 87, 545, 1730, 2370, NULL, 0, 32284, 40251, 160577, 442172, 661551, NULL, 49, NULL, 'Kranjska Gora - Slowenien 2020 | Bike Park | Eco Natura Camp', '1PSiXFTeXjQ', '<td class=\"yt-lastvideo\" data-sort=\"200905222726\" data-utime=\"201017-11\"><a href=\"https://youtu.be/1PSiXFTeXjQ\" title=\"Kranjska Gora - Slowenien 2020 | Bike Park | Eco Natura Camp\" target=\"_blank\">Sa. 05.09.20</a><div class=\"info\"><div class=\"close\"></div><div class=\"circle\" style=\"background-image:url(https://i2.ytimg.com/vi/1PSiXFTeXjQ/hqdefault.jpg)\"></div><p>Kranjska Gora - Slowenien 2020 | Bike Park | Eco Natura Camp<br><br>Views: 293 &nbsp; Ø/Video: 13501<br>Veröffentlicht am: Sa. 05.09.20 um 22:27 Uhr</p><div class=\"abobar\"><a href=\"https://youtu.be/1PSiXFTeXjQ\" target=\"_blank\" class=\"red\">zum Video</a></div></div></td>', 293, '2020-09-05T20:27:26+00:00', '200905222726', 'ch');
INSERT INTO `channels` VALUES (67, 0, 'UC7DIsb2TC_c-T0EmsyfUiIA', 'Jaru', 'artist/producer<br />bern, switzerland<br /><br /><br />NEW SINGLE \"JETSKI\" OUT NOW!!! ❤️', 'https://yt3.ggpht.com/a/AATXAJzz3nHurZJDKXPMntbLy0kC1Uo7myIXgjarOTMGkw=s88-c-k-c0xffffffff-no-rj-mo', '', '', '', '', '', 'jaruvin', '-8-25-', '11.05.2019', '201017-11', '201017-11', 0, 0, 0, 0, 0, 108, NULL, 0, 0, 0, 0, 0, 7116, NULL, 19, NULL, 'Jaru -  So wirds si', 'k2do6_oMCxM', '<td class=\"yt-lastvideo\" data-sort=\"200804203006\" data-utime=\"201017-11\"><a href=\"https://youtu.be/k2do6_oMCxM\" title=\"Jaru -  So wirds si\" target=\"_blank\">Di. 04.08.20</a><div class=\"info\"><div class=\"close\"></div><div class=\"circle\" style=\"background-image:url(https://i4.ytimg.com/vi/k2do6_oMCxM/hqdefault.jpg)\"></div><p>Jaru -  So wirds si<br><br>Views: 110 &nbsp; Ø/Video: 375<br>Veröffentlicht am: Di. 04.08.20 um 20:30 Uhr</p><div class=\"abobar\"><a href=\"https://youtu.be/k2do6_oMCxM\" target=\"_blank\" class=\"red\">zum Video</a></div></div></td>', 110, '2020-08-04T18:30:06+00:00', '200804203006', 'ch');
INSERT INTO `channels` VALUES (68, 0, 'UCgZ06ULEFippjtq2qMx0nGg', 'Greg\'s Channel', 'Hallo zämä!<br />Ich bin de Greg und mach luschtigi Videos uf Schwiizerdütsch!<br /><br /><br />Für gschäftlichi Afrage: gregs.channel@hotmail.com<br /><br />Meilestei:<br />50 Abonnäntä - 28.01.2017<br />100 Abonnäntä - 20.09.2018', 'https://yt3.ggpht.com/a/AATXAJzg3scY1EWTWxV7u7Lie5-_4-pzYoAKp1HGW4d4Bg=s88-c-k-c0xffffffff-no-rj-mo', '', 'https://www.youtube.com/gregschannel', '', '', '', 'gregs.channel', '-6-', '29.01.2016', '201017-11', '201017-11', 0, 0, 64, 124, 182, 202, NULL, 0, 0, 5820, 8316, 11381, 14117, NULL, 106, NULL, 'Zwei Arte z\'läbe | Greg\'s Channel', 'xl6TTPYR-54', '<td class=\"yt-lastvideo\" data-sort=\"201005180014\" data-utime=\"201017-11\"><a href=\"https://youtu.be/xl6TTPYR-54\" title=\"Zwei Arte z\'läbe | Greg\'s Channel\" target=\"_blank\">Mo. 05.10.20</a><div class=\"info\"><div class=\"close\"></div><div class=\"circle\" style=\"background-image:url(https://i1.ytimg.com/vi/xl6TTPYR-54/hqdefault.jpg)\"></div><p>Zwei Arte z\'läbe | Greg\'s Channel<br><br>Views: 72 &nbsp; Ø/Video: 133<br>Veröffentlicht am: Mo. 05.10.20 um 18:00 Uhr</p><div class=\"abobar\"><a href=\"https://youtu.be/xl6TTPYR-54\" target=\"_blank\" class=\"red\">zum Video</a></div></div></td>', 72, '2020-10-05T16:00:14+00:00', '201005180014', 'ch');
INSERT INTO `channels` VALUES (69, 0, 'UCpeUomiLyMBvcMZbJhDv-gA', 'Woldiboy', 'Die Welt von YouTube - Unendliche Möglichkeiten: Wir schreiben das Jahr 2020 und dies sind die neuen Abenteuer von Woldiboy, der aufbricht, um neue faszinierende und spannende Spiele mit Euch zu erforschen. Dabei dringen wir zusammen in Regionen vor, die vor uns noch nie ein Mensch   in der Realität betreten hat.<br /><br />Es erwartet uns eine Fülle von geheimnisumwitterten Schauplätzen mit spektakulären Kampfszenen und hochgradig explosivem Inhalt, gewürzt mit einer feinen Prise Humor und qualitativ hochwertigem Dialog. Seid live dabei, wenn es gilt, den Feinden des Friedens oder den Mächtigen der Welt das Handwerk zu legen und Ihren dunklen Machenschaften ein Ende zu bereiten.<br /><br />Denn wo Recht über Unrecht siegt und wo die Letzten die ersten sein werden, da ist Woldiboy stets an vorderster Front mit dabei, das Unrecht zu bekämpfen und den schwachen und unterdrückten mit Rat und Tat zur Seite zu stehen...', 'https://yt3.ggpht.com/a/AATXAJz2MWmA6uWrNqfIUQBXnTu9K3EU1wVP9sBmh8mw=s88-c-k-c0xffffffff-no-rj-mo', '', '', '', '', 'woldiboy', 'woldiboy', '-4-11-', '25.04.2019', '201017-11', '201017-11', 0, 0, 0, 0, 16, 19, NULL, 0, 0, 0, 0, 4057, 7669, NULL, 599, NULL, 'Das verbotene Paradies - RDR2 - The Storybook - Part 44 - Swiss Edition', 'O8oesdHwicg', '<td class=\"yt-lastvideo\" data-sort=\"200904121317\" data-utime=\"201017-11\"><a href=\"https://youtu.be/O8oesdHwicg\" title=\"Das verbotene Paradies - RDR2 - The Storybook - Part 44 - Swiss Edition\" target=\"_blank\">Fr. 04.09.20</a><div class=\"info\"><div class=\"close\"></div><div class=\"circle\" style=\"background-image:url(https://i4.ytimg.com/vi/O8oesdHwicg/hqdefault.jpg)\"></div><p>Das verbotene Paradies - RDR2 - The Storybook - Part 44 - Swiss Edition<br><br>Views: 46 &nbsp; Ø/Video: 13<br>Veröffentlicht am: Fr. 04.09.20 um 12:13 Uhr</p><div class=\"abobar\"><a href=\"https://youtu.be/O8oesdHwicg\" target=\"_blank\" class=\"red\">zum Video</a></div></div></td>', 46, '2020-09-04T10:13:17+00:00', '200904121317', 'ch');
INSERT INTO `channels` VALUES (70, 0, 'UC8T4JVUyNovYxCDyhraSSiw', 'Photobus Schweiz', 'Wie lieben unseren Job, und das wollen wir mit euch teilen! Wir vermieten den exklusiven Photobus in der Schweiz. Eine mobile Photobooth, eingebaut in einem VW Bus Oldtimer.', 'https://yt3.ggpht.com/a/AATXAJzY3gVpxqystcUByM68mRNqjR8csOvdX2omhhp-SQ=s88-c-k-c0xffffffff-no-rj-mo', 'Lorenz Walter', 'https://www.youtube.com/photobusschweiz', 'https://www.thephotobus.ch', '', '', 'photobus.schweiz', '-2-3-13-20-', '21.02.2016', '201017-11', '201017-11', 0, 0, 74, 107, 132, 149, NULL, 0, 0, 15730, 24214, 33930, 40020, NULL, 104, NULL, 'Der Photobus in der Lenzerheide | Vlog #68', 'KX7t_Z-Z4ds', '<td class=\"yt-lastvideo\" data-sort=\"200605145103\" data-utime=\"201017-11\"><a href=\"https://youtu.be/KX7t_Z-Z4ds\" title=\"Der Photobus in der Lenzerheide | Vlog #68\" target=\"_blank\">Fr. 05.06.20</a><div class=\"info\"><div class=\"close\"></div><div class=\"circle\" style=\"background-image:url(https://i4.ytimg.com/vi/KX7t_Z-Z4ds/hqdefault.jpg)\"></div><p>Der Photobus in der Lenzerheide | Vlog #68<br><br>Views: 69 &nbsp; Ø/Video: 385<br>Veröffentlicht am: Fr. 05.06.20 um 14:51 Uhr</p><div class=\"abobar\"><a href=\"https://youtu.be/KX7t_Z-Z4ds\" target=\"_blank\" class=\"red\">zum Video</a></div></div></td>', 69, '2020-06-05T12:51:03+00:00', '200605145103', 'ch');
INSERT INTO `channels` VALUES (71, 0, 'UC8XEHGapJvqZ-RA8kbJBuqw', 'Mü man', '', 'https://yt3.ggpht.com/a/AATXAJwGAMKP67zq0n5UAfAk2GWLM3fDCF_Zzi11UBi-=s88-c-k-c0xffffffff-no-rj-mo', '', '', 'https://www.mueman.ch', '', '', 'mueman730', '-8-20-', '22.11.2010', '201017-11', '201017-11', 0, 0, 0, 165, 188, 241, NULL, 0, 0, 0, 53164, 63831, 80347, NULL, 23, NULL, 'Mü man -  Stadtrand feat. Weibello & Migo (prod. by  Ben)', 'lLZ45630CcQ', '<td class=\"yt-lastvideo\" data-sort=\"200326142436\" data-utime=\"201017-11\"><a href=\"https://youtu.be/lLZ45630CcQ\" title=\"Mü man -  Stadtrand feat. Weibello & Migo (prod. by  Ben)\" target=\"_blank\">Do. 26.03.20</a><div class=\"info\"><div class=\"close\"></div><div class=\"circle\" style=\"background-image:url(https://i1.ytimg.com/vi/lLZ45630CcQ/hqdefault.jpg)\"></div><p>Mü man -  Stadtrand feat. Weibello & Migo (prod. by  Ben)<br><br>Views: 5476 &nbsp; Ø/Video: 3493<br>Veröffentlicht am: Do. 26.03.20 um 14:24 Uhr</p><div class=\"abobar\"><a href=\"https://youtu.be/lLZ45630CcQ\" target=\"_blank\" class=\"red\">zum Video</a></div></div></td>', 5476, '2020-03-26T13:24:36+00:00', '200326142436', 'ch');
INSERT INTO `channels` VALUES (72, 0, 'UCk4fcf6ZXsAa81VZqqOTCHg', 'Yynthiroshka', 'Dies hier ist ein schweizerdeutscher Kanal für Orakel :).<br /><br />Mein Name ist Cynthia und ich bin eine spirituelle Lehrerin und ein Medium.<br /><br />Sehr gerne kannst Du für eine persönliche Beratung mich über heavensdoor.ch kontaktieren.<br />Falls die Distanzen zwischen mir und Dir zu gross sind, treffen wir uns einfachheitshalber über Skype oder Du erhältst eine Videoberatung :) - ich freue mich über Deine Kontaktaufnahme und dass Du ein Teil meiner Youtube Community bist.<br /><br />Und falls Du nur eine reine Orakelberatung möchtest, dann findest Du dazu weitere Informationen hier heavensdoor.ch/willkommen-auf-heaven-s-door/orakelberatung/ .<br /><br />P.S. Ich spreche auch Hochdeutsch :).', 'https://yt3.ggpht.com/a/AATXAJxzZZFB4Ve3-Re9dBPJQP3gUqlX3gDgH4HfAFUK=s88-c-k-c0xffffffff-no-rj-mo', '', 'https://www.youtube.com/cynthiroshka', 'https://www.heavensdoor.ch', '', '', 'cynthiroshka', '-7-14-', '22.03.2009', '201017-11', '201017-11', 0, 0, 0, 0, 374, 671, NULL, 0, 0, 0, 0, 32279, 76025, NULL, 277, NULL, 'Orakel der Nacht - Öffnung des Herzchakras 15.10.2020', 'dnS7CcCFvas', '<td class=\"yt-lastvideo\" data-sort=\"201015000010\" data-utime=\"201017-11\"><a href=\"https://youtu.be/dnS7CcCFvas\" title=\"Orakel der Nacht - Öffnung des Herzchakras 15.10.2020\" target=\"_blank\">Do. 15.10.20</a><div class=\"info\"><div class=\"close\"></div><div class=\"circle\" style=\"background-image:url(https://i1.ytimg.com/vi/dnS7CcCFvas/hqdefault.jpg)\"></div><p>Orakel der Nacht - Öffnung des Herzchakras 15.10.2020<br><br>Views: 138 &nbsp; Ø/Video: 274<br>Veröffentlicht am: Do. 15.10.20 um 00:00 Uhr</p><div class=\"abobar\"><a href=\"https://youtu.be/dnS7CcCFvas\" target=\"_blank\" class=\"red\">zum Video</a></div></div></td>', 138, '2020-10-14T22:00:10+00:00', '201015000010', 'ch');
INSERT INTO `channels` VALUES (73, 0, 'UCn5cOVDa8zFllWhn71Nga0A', 'Hecht', 'Hecht vermischt gekonnt kluge Mundart-Texte mit wilden Gitarrenriffs. Eines geht dabei nie verloren: Die Freude am perfekten Popsong. Die Fünfer-Formation trifft mit ihren Texten den Nerv der Zeit und die Herzen des Publikums. Kein Hecht-Konzert, an dem die Zuschauer nicht lauthals mitsingen und sich um den Verstand tanzen, von der ersten Sekunde bis zur letzten, von der vordersten Reihe bis zur hintersten. Dies hat die Band jüngst auf ihrer grossen Festival-Tour bewiesen und auf der weit im Voraus ausverkauften Clubtour. Mit dem Gewinn vom Swiss Music Award für den besten Live Act hat sich dieses offene Geheimnis noch einmal bestätigt: Dieser Hecht fühlt sich wohl auf der Bühne. Ganz egal, wie gross oder wie klein diese ist.', 'https://yt3.ggpht.com/a/AATXAJx2f0JqsdwJyqg_2a8A2yWylZ7VvE0uvvlrVF9qqA=s88-c-k-c0xffffffff-no-rj-mo', 'Stefan Buck, Chris Filter, Daniel Gisler, Philipp Morscher, Christoph Schröter', 'https://www.youtube.com/Hechtmusic', 'https://www.hechtimnetz.ch', '', '', 'hecht_band', '-8-20-29-', '17.02.2011', '201017-11', '201017-11', 0, 2889, 5201, 10910, 13900, 15600, NULL, 0, 2774670, 5543551, 11131334, 14785806, 17558203, NULL, 55, NULL, 'HECHT - Gsehnd üs im Sommer', 'ZM2oOgVUivw', '<td class=\"yt-lastvideo\" data-sort=\"200328090647\" data-utime=\"201017-11\"><a href=\"https://youtu.be/ZM2oOgVUivw\" title=\"HECHT - Gsehnd üs im Sommer\" target=\"_blank\">Sa. 28.03.20</a><div class=\"info\"><div class=\"close\"></div><div class=\"circle\" style=\"background-image:url(https://i3.ytimg.com/vi/ZM2oOgVUivw/hqdefault.jpg)\"></div><p>HECHT - Gsehnd üs im Sommer<br><br>Views: 75160 &nbsp; Ø/Video: 319240<br>Veröffentlicht am: Sa. 28.03.20 um 09:06 Uhr</p><div class=\"abobar\"><a href=\"https://youtu.be/ZM2oOgVUivw\" target=\"_blank\" class=\"red\">zum Video</a></div></div></td>', 75160, '2020-03-28T08:06:47+00:00', '200328090647', 'ch');
INSERT INTO `channels` VALUES (74, 0, 'UCCjweo0CKJkDMtU86hiAIJQ', 'Maelo', 'Schwizerdütschi Comedy & Lifestyle Videos gites uf dem Kanal z\'gseh!<br /><br />Mi Name isch Maelo Romani, wohne im Kanton Fribourg und mache uf YouTube Videos um vor allem DIR z\'unterhalte, haha.<br /><br />► Social Media:<br />Twitch: MaeloRomani<br />Instagram @maeloromani<br />Twitter @maeloromani<br /><br />► Podcast:<br />\"Privatchat\" Podcast verfüegbar uf allne gängige Plattforme (Spotify, Apple Music, etc.)<br /><br />► Zweitkanal:<br />MaeLOL<br /><br />- Maelo', 'https://yt3.ggpht.com/a/AATXAJzvs40fLpCLLeVMQt-shoBxbQrYBsquQT0Plcl1WA=s88-c-k-c0xffffffff-no-rj-mo', 'Maelo Romani', 'https://www.youtube.com/MaeloRomani', '', 'https://open.spotify.com/show/1xIBDLWYV7C7fmkrx1krF8', 'maeloromani', 'maeloromani', '-6-11-12-15-16-24-', '18.08.2013', '201017-11', '201017-11', 3188, 6619, 6681, 7944, 9580, 19500, NULL, 149311, 272838, 356308, 614701, 746300, 1216226, NULL, 592, NULL, 'TIKTOKS mit de MEISTE KLICKS', '6T6a6ktbin0', '<td class=\"yt-lastvideo\" data-sort=\"201004180001\" data-utime=\"201017-11\"><a href=\"https://youtu.be/6T6a6ktbin0\" title=\"TIKTOKS mit de MEISTE KLICKS\" target=\"_blank\">So. 04.10.20</a><div class=\"info\"><div class=\"close\"></div><div class=\"circle\" style=\"background-image:url(https://i3.ytimg.com/vi/6T6a6ktbin0/hqdefault.jpg)\"></div><p>TIKTOKS mit de MEISTE KLICKS<br><br>Views: 13376 &nbsp; Ø/Video: 2054<br>Veröffentlicht am: So. 04.10.20 um 18:00 Uhr</p><div class=\"abobar\"><a href=\"https://youtu.be/6T6a6ktbin0\" target=\"_blank\" class=\"red\">zum Video</a></div></div></td>', 13376, '2020-10-04T16:00:01+00:00', '201004180001', 'ch');
INSERT INTO `channels` VALUES (75, 0, 'UCqsz6ADH3LWzpL7a1-RavcA', 'Sirio', 'Froge? oder Wilsch es Video mit mir mache ? folg mir uf Insta: sirio_so', 'https://yt3.ggpht.com/a/AATXAJz7IGZlQ04IQc0GznugfctN8sLN5uxQqKEKfKTE8Q=s88-c-k-c0xffffffff-no-rj-mo', '', 'https://www.youtube.com/solihd', '', '', '', 'sirio_so', '-6-', '19.05.2016', '201017-11', '201017-11', 0, 157, 269, 396, 664, 690, NULL, 0, 1730, 2350, 8230, 24749, 28983, NULL, 8, NULL, 'Eier-Challenge', 'aTIvvv7BTvQ', '<td class=\"yt-lastvideo\" data-sort=\"200605190027\" data-utime=\"201017-11\"><a href=\"https://youtu.be/aTIvvv7BTvQ\" title=\"Eier-Challenge\" target=\"_blank\">Fr. 05.06.20</a><div class=\"info\"><div class=\"close\"></div><div class=\"circle\" style=\"background-image:url(https://i2.ytimg.com/vi/aTIvvv7BTvQ/hqdefault.jpg)\"></div><p>Eier-Challenge<br><br>Views: 1961 &nbsp; Ø/Video: 3623<br>Veröffentlicht am: Fr. 05.06.20 um 19:00 Uhr</p><div class=\"abobar\"><a href=\"https://youtu.be/aTIvvv7BTvQ\" target=\"_blank\" class=\"red\">zum Video</a></div></div></td>', 1961, '2020-06-05T17:00:27+00:00', '200605190027', 'ch');
INSERT INTO `channels` VALUES (76, 1, 'UCd3fdLRSnOYR0GEtHDbEqnA', '3Hunna6', '- 3Hunna6<br />facebook.com/3hunna6<br />instagram.com/3hunna6', 'https://yt3.ggpht.com/a/AATXAJyHNuJ_DszNtPC3KG6oY69BT6Zv3qIXRlljlo3Y=s88-c-k-c0xffffffff-no-rj-mo', '', '', '', '', '', '3hunna6', '-8-', '16.11.2015', '201016-20', '201017-11', 0, 0, 316, 397, 423, 435, NULL, 0, 0, 79366, 103955, 116820, 122299, NULL, 9, NULL, 'Deep vx - High [Official Video]', 'vcu7vHLD7Sw', '<td class=\"yt-lastvideo\" data-sort=\"191220000013\" data-utime=\"201017-11\"><a href=\"https://youtu.be/vcu7vHLD7Sw\" title=\"Deep vx - High [Official Video]\" target=\"_blank\">Fr. 20.12.19</a><div class=\"info\"><div class=\"close\"></div><div class=\"circle\" style=\"background-image:url(https://i3.ytimg.com/vi/vcu7vHLD7Sw/hqdefault.jpg)\"></div><p>Deep vx - High [Official Video]<br><br>Views: 2122 &nbsp; Ø/Video: 13589<br>Veröffentlicht am: Fr. 20.12.19 um 00:00 Uhr</p><div class=\"abobar\"><a href=\"https://youtu.be/vcu7vHLD7Sw\" target=\"_blank\" class=\"red\">zum Video</a></div></div></td>', 2122, '2019-12-19T23:00:13+00:00', '191220000013', 'ch');
INSERT INTO `channels` VALUES (77, 0, 'UCV_jCrogu0_BpQXNlh1IonA', 'Abseits.ch', 'Abseits.ch ist der erste Schweizer YouTube Channel, der sich auf den Schweizer Fussball konzentriert. Mit Schwerpunkt auf den Frauenfussball, bietet Abseits auch eine Plattform für den Europa Cup und allen Engagements der Nationalmannschaften.', 'https://yt3.ggpht.com/a/AATXAJxaCXe1eDFLQ2DnMaW6_U0u6s0UAXvuwR5U313-6w=s88-c-k-c0xffffffff-no-rj-mo', 'André Moita Saraiva & Alea Räber', 'https://www.youtube.com/abseitschannel', 'https://abseits.ch', '', '', 'abseits.ch', '-5-', '24.10.2015', '201017-11', '201017-11', 0, 0, 0, 0, 371, 609, NULL, 0, 0, 0, 0, 117588, 171544, NULL, 309, NULL, 'Abseits Podcast E057 | Women\'s Super League nach einer Runde | Formcheck der #AWSL Teams | #NLB', 'xzJ1C9TGePk', '<td class=\"yt-lastvideo\" data-sort=\"201014060010\" data-utime=\"201017-11\"><a href=\"https://youtu.be/xzJ1C9TGePk\" title=\"Abseits Podcast E057 | Women\'s Super League nach einer Runde | Formcheck der #AWSL Teams | #NLB\" target=\"_blank\">Mi. 14.10.20</a><div class=\"info\"><div class=\"close\"></div><div class=\"circle\" style=\"background-image:url(https://i1.ytimg.com/vi/xzJ1C9TGePk/hqdefault.jpg)\"></div><p>Abseits Podcast E057 | Women\'s Super League nach einer Runde | Formcheck der #AWSL Teams | #NLB<br><br>Views: 197 &nbsp; Ø/Video: 555<br>Veröffentlicht am: Mi. 14.10.20 um 06:00 Uhr</p><div class=\"abobar\"><a href=\"https://youtu.be/xzJ1C9TGePk\" target=\"_blank\" class=\"red\">zum Video</a></div></div></td>', 197, '2020-10-14T04:00:10+00:00', '201014060010', 'ch');
INSERT INTO `channels` VALUES (78, 0, 'UCi32TEPcvy7a7E45jvXa0tw', 'E-Light', '', 'https://yt3.ggpht.com/a/AATXAJwTX60gSfngA3n3x8HM_m_89CQ4HYSbG54mSK_iBw=s88-c-k-c0xffffffff-no-rj-mo', '', '', '', '', '', 'e_light_4436', '-8-', '09.11.2009', '201017-11', '201017-11', 0, 0, 0, 0, 261, 341, NULL, 0, 0, 0, 0, 47157, 61182, NULL, 31, NULL, 'E-Light - Interview bei Xplicit Contents auf RadioX  (24.07.2020)', 'q4XO7YgTkm4', '<td class=\"yt-lastvideo\" data-sort=\"200802142659\" data-utime=\"201017-11\"><a href=\"https://youtu.be/q4XO7YgTkm4\" title=\"E-Light - Interview bei Xplicit Contents auf RadioX  (24.07.2020)\" target=\"_blank\">So. 02.08.20</a><div class=\"info\"><div class=\"close\"></div><div class=\"circle\" style=\"background-image:url(https://i2.ytimg.com/vi/q4XO7YgTkm4/hqdefault.jpg)\"></div><p>E-Light - Interview bei Xplicit Contents auf RadioX  (24.07.2020)<br><br>Views: 238 &nbsp; Ø/Video: 1974<br>Veröffentlicht am: So. 02.08.20 um 14:26 Uhr</p><div class=\"abobar\"><a href=\"https://youtu.be/q4XO7YgTkm4\" target=\"_blank\" class=\"red\">zum Video</a></div></div></td>', 238, '2020-08-02T12:26:59+00:00', '200802142659', 'ch');
INSERT INTO `channels` VALUES (79, 0, 'UCGLlzx_aK_tuqACod_zMeng', 'Yung Glas', '', 'https://yt3.ggpht.com/a/AATXAJzFdBryxHY6gUranOpC6Cie-bpZ8jls4xzr6KDT=s88-c-k-c0xffffffff-no-rj-mo', '', '', '', '', '', '', '-8-', '11.09.2017', '201017-11', '201017-11', 0, 0, 139, 286, 309, 396, NULL, 0, 0, 4734, 21675, 26232, 29557, NULL, 9, NULL, 'glas - movie', 'uzBxoWY-pRU', '<td class=\"yt-lastvideo\" data-sort=\"200701000010\" data-utime=\"201017-11\"><a href=\"https://youtu.be/uzBxoWY-pRU\" title=\"glas - movie\" target=\"_blank\">Mi. 01.07.20</a><div class=\"info\"><div class=\"close\"></div><div class=\"circle\" style=\"background-image:url(https://i2.ytimg.com/vi/uzBxoWY-pRU/hqdefault.jpg)\"></div><p>glas - movie<br><br>Views: 4261 &nbsp; Ø/Video: 3284<br>Veröffentlicht am: Mi. 01.07.20 um 00:00 Uhr</p><div class=\"abobar\"><a href=\"https://youtu.be/uzBxoWY-pRU\" target=\"_blank\" class=\"red\">zum Video</a></div></div></td>', 4261, '2020-06-30T22:00:10+00:00', '200701000010', 'ch');
INSERT INTO `channels` VALUES (80, 0, 'UCjgVbu8CXJwcVBvA9qN4jZQ', 'MB Vision', 'Dir gebe ich frei von der Leber weg, als Fotograf, Tipps und Tricks rund um das Thema Fotografie. Auch helfe ich Dir dein eigenes Business erfolgreich von 0 auf 100% zu bringen.<br /><br />Lerne aus meinen Erfahrungen und Fehlern. Du profitierst von über 14 Jahren Fotografie Knowhow und 18 Jahren Selbständigkeit vom Neben- zum Haupterwerb! (Stand 18.10.18)<br /><br />Ja, du hast richtig gelesen 😉 mit 15 Jahren habe ich mein erstes erfolgreiches Business gegründet.<br />Dich weiter zu bringen und erfolgreich zu machen macht mich unheimlich glücklich!<br />Danke das du deine wertvolle Zeit mit mir und meinem Schweizer YouTube-Kanal verbringst.<br /><br />Dein Mathias Blattmann<br />#mathiasblattmann<br /><br />Buche einen Workshop bei mir: workshop.mathiasblattmann.ch<br />Lasse uns durchstarten: mbvision.ch<br /><br />Sound by. Epidemic Sound; epidemicsound.com/referral/zjhh3t/    *(AL)<br />Mail: info|at|mbvision.ch<br />Für Briefe und Packete; Mathias Blattmann, Poststrasse 9, 6315 Oberägeri, Switzerland', 'https://yt3.ggpht.com/a/AATXAJxvMRpSxL5Cc1JyNcezupGiC4JmBE4TrcYCvksuLg=s88-c-k-c0xffffffff-no-rj-mo', 'Mathias Blattmann', 'https://www.youtube.com/mbvisionunterageri', 'https://www.mathiasblattmann.ch', '', '', 'mbvision.ch', '-3-13-18-31-', '13.03.2016', '201017-11', '201017-11', 0, 0, 0, 0, 37, 77, NULL, 0, 0, 0, 0, 3356, 10647, NULL, 56, NULL, 'Wie bekomme ich mehr Platz für Fotos auf dem Smartphone?', 'yPWRHP0DoTA', '<td class=\"yt-lastvideo\" data-sort=\"201007201505\" data-utime=\"201017-11\"><a href=\"https://youtu.be/yPWRHP0DoTA\" title=\"Wie bekomme ich mehr Platz für Fotos auf dem Smartphone?\" target=\"_blank\">Mi. 07.10.20</a><div class=\"info\"><div class=\"close\"></div><div class=\"circle\" style=\"background-image:url(https://i2.ytimg.com/vi/yPWRHP0DoTA/hqdefault.jpg)\"></div><p>Wie bekomme ich mehr Platz für Fotos auf dem Smartphone?<br><br>Views: 15 &nbsp; Ø/Video: 190<br>Veröffentlicht am: Mi. 07.10.20 um 20:15 Uhr</p><div class=\"abobar\"><a href=\"https://youtu.be/yPWRHP0DoTA\" target=\"_blank\" class=\"red\">zum Video</a></div></div></td>', 15, '2020-10-07T18:15:05+00:00', '201007201505', 'ch');
INSERT INTO `channels` VALUES (81, 0, 'UCyHEt5ndmuILbxL74NfmKJQ', 'Mathias Blattmann', 'Dir helfe ich mit Tipps und Tricks für deine Freizeit und dein \"Familien-\"Altag. Du findest auf diesem Schweizer YouTube-Kanal Filme rund um die Themen; Familienferien und Ausflugsziele sowie Familienleben und Persönlicher-Erfolg, . Wachse mit mir und meiner Lebensaufgabe als Vollzeitvater und Hausmann mit. Lerne aus meinen Erlebnissen und Erkenntnissen und lasse dich von mir inspirieren und motivieren.  <br />Die ungeschminkt und reale Wahrheit; \"kurz\", auf den Punkt mit genialem Sound.<br /><br />Ich wünsche DIR nur das Beste für DEINE Zukunft! <br /><br />Mathias<br /><br /> <br /><br />Buche einen Workshop bei mir: workshop.mathiasblattmann.ch<br />Verfolge meinen Alltag: instagram.com/mathiasblattmann.ch<br />Besuche mich auf Facebook: facebook.com/mathiasblattmann.ch<br />Lasse dich von mir Inspirieren! pinterest.de/mbvision_ch<br /><br />Sound by. Epidemic Sound; player.epidemicsound.com/ <br /><br />Für Pakete und Briefe; Mathias Blattmann, Poststrasse 9, 6315 Oberägeri, Switzerland', 'https://yt3.ggpht.com/a/AATXAJzdvZup07EW4aj9fPD4lvF9PmL3MmJ2N5IA48ckhw=s88-c-k-c0xffffffff-no-rj-mo', '', '', '', '', '', 'mathiasblattmann.ch', '-5-18-31-', '12.05.2013', '201017-11', '201017-11', 0, 0, 0, 0, 37, 65, NULL, 0, 0, 0, 0, 12443, 22037, NULL, 39, NULL, 'Kinderwanderung mit #rivellaunlimited im Sattel Hochstuckli', 'IwxTlxuzWmI', '<td class=\"yt-lastvideo\" data-sort=\"200929201500\" data-utime=\"201017-11\"><a href=\"https://youtu.be/IwxTlxuzWmI\" title=\"Kinderwanderung mit #rivellaunlimited im Sattel Hochstuckli\" target=\"_blank\">Di. 29.09.20</a><div class=\"info\"><div class=\"close\"></div><div class=\"circle\" style=\"background-image:url(https://i2.ytimg.com/vi/IwxTlxuzWmI/hqdefault.jpg)\"></div><p>Kinderwanderung mit #rivellaunlimited im Sattel Hochstuckli<br><br>Views: 18 &nbsp; Ø/Video: 565<br>Veröffentlicht am: Di. 29.09.20 um 20:15 Uhr</p><div class=\"abobar\"><a href=\"https://youtu.be/IwxTlxuzWmI\" target=\"_blank\" class=\"red\">zum Video</a></div></div></td>', 18, '2020-09-29T18:15:00+00:00', '200929201500', 'ch');
INSERT INTO `channels` VALUES (82, 0, 'UC3sInWnrLR6iIzf8wbFo-LA', 'Anna Bora', 'Sali zeme<br />ich bi d AnnaBora<br />u mache wenn ich Lust ha es paar Videos, aber eher so Fanvideos.<br />ussert wenn ich amene spezielle Event bi gits au es paar Volgs.', 'https://yt3.ggpht.com/a/AATXAJykOggcYAdk8SRHXh8PfefFTSqWQQfNO2LmTzmA8wE=s88-c-k-c0xffffffff-no-rj-mo', '', '', '', '', '', 'x.annabora.x', '-6-14-25-', '13.09.2013', '201017-11', '201017-11', 0, 13, 29, 50, 77, 78, NULL, 0, 1180, 1940, 3080, 4348, 4973, NULL, 22, NULL, 'Erkennst du diese Schweizer Youtuber an ihren Nasen', '6smQI_kpIS8', '<td class=\"yt-lastvideo\" data-sort=\"200104170816\" data-utime=\"201017-11\"><a href=\"https://youtu.be/6smQI_kpIS8\" title=\"Erkennst du diese Schweizer Youtuber an ihren Nasen\" target=\"_blank\">Sa. 04.01.20</a><div class=\"info\"><div class=\"close\"></div><div class=\"circle\" style=\"background-image:url(https://i3.ytimg.com/vi/6smQI_kpIS8/hqdefault.jpg)\"></div><p>Erkennst du diese Schweizer Youtuber an ihren Nasen<br><br>Views: 89 &nbsp; Ø/Video: 226<br>Veröffentlicht am: Sa. 04.01.20 um 17:08 Uhr</p><div class=\"abobar\"><a href=\"https://youtu.be/6smQI_kpIS8\" target=\"_blank\" class=\"red\">zum Video</a></div></div></td>', 89, '2020-01-04T16:08:16+00:00', '200104170816', 'ch');
INSERT INTO `channels` VALUES (83, 1, 'UCiyA9LCeX2OCaIBRLdUgS0Q', 'Peter Reber', 'Das ist der offizielle Kanal von Peter Reber. Hier findet ihr meine Klassiker, sowie Geschichten, rund um meine Musik.', 'https://yt3.ggpht.com/a/AATXAJzM4o34H27-fE0BEp8LIVs2fgSbRKwf4HiqYWW7=s88-c-k-c0xffffffff-no-rj-mo', '', 'https://www.youtube.com/peterreberofficial', 'https://peterreber.ch', '', '', '', '-8-25-', '13.06.2011', '201016-20', '201017-11', 0, 0, 803, 980, 1660, 2510, NULL, 0, 0, 1470236, 1694676, 2057918, 2359208, NULL, 60, NULL, 'Geschichten - \"Wo chieme mer o häre\" | PETER REBER', '0ffsfafQqik', '<td class=\"yt-lastvideo\" data-sort=\"191030170002\" data-utime=\"201017-11\"><a href=\"https://youtu.be/0ffsfafQqik\" title=\"Geschichten - \"Wo chieme mer o häre\" | PETER REBER\" target=\"_blank\">Mi. 30.10.19</a><div class=\"info\"><div class=\"close\"></div><div class=\"circle\" style=\"background-image:url(https://i1.ytimg.com/vi/0ffsfafQqik/hqdefault.jpg)\"></div><p>Geschichten - \"Wo chieme mer o häre\" | PETER REBER<br><br>Views: 1649 &nbsp; Ø/Video: 39320<br>Veröffentlicht am: Mi. 30.10.19 um 17:00 Uhr</p><div class=\"abobar\"><a href=\"https://youtu.be/0ffsfafQqik\" target=\"_blank\" class=\"red\">zum Video</a></div></div></td>', 1649, '2019-10-30T16:00:02+00:00', '191030170002', 'ch');
INSERT INTO `channels` VALUES (84, 0, 'UCk4lze4_vOoT8w8fLhHNAWQ', 'VSCC', 'VSCC - Verband Schweizer Content Creators<br /><br />Der Verband unterstützt und fördert die Schweizer Content Creators sowie die Vernetzung mit geeigneten Partnern. Das langfristige Ziel besteht darin, dass Schweizer Content Creators ihre Inhalte einem breiten Publikum anbieten und für ihre Arbeit eine gerechte Entlöhnung bekommen.', 'https://yt3.ggpht.com/a/AATXAJyqz8gjfcQCu7I3NAEL7QnvVW_6SurmRpL9D6k8=s88-c-k-c0xffffffff-no-rj-mo', '', '', 'https://vscc.ch', '', '', '', '-4-', '12.04.2020', '201017-11', '201017-11', 0, 0, 0, 0, 0, 0, NULL, 0, 0, 0, 0, 0, 202, NULL, 2, NULL, 'Neuer Twitch Kanal Layout!', 'UQyvPdZikWs', '<td class=\"yt-lastvideo\" data-sort=\"200420183004\" data-utime=\"201017-11\"><a href=\"https://youtu.be/UQyvPdZikWs\" title=\"Neuer Twitch Kanal Layout!\" target=\"_blank\">Mo. 20.04.20</a><div class=\"info\"><div class=\"close\"></div><div class=\"circle\" style=\"background-image:url(https://i2.ytimg.com/vi/UQyvPdZikWs/hqdefault.jpg)\"></div><p>Neuer Twitch Kanal Layout!<br><br>Views: 81 &nbsp; Ø/Video: 101<br>Veröffentlicht am: Mo. 20.04.20 um 18:30 Uhr</p><div class=\"abobar\"><a href=\"https://youtu.be/UQyvPdZikWs\" target=\"_blank\" class=\"red\">zum Video</a></div></div></td>', 81, '2020-04-20T16:30:04+00:00', '200420183004', 'ch');
INSERT INTO `channels` VALUES (85, 0, 'UCghZlXFJ73VPY6CsHuxRhDw', 'Gimu', 'WAVE EP OUT NOW!!!<br /><br />Streaming / Download:<br />ampl.ink/GkAlE', 'https://yt3.ggpht.com/a/AATXAJzgBuA4aRIR8kXTAnL5_W_Q0RYCLoalG5pcrh5KBQ=s88-c-k-c0xffffffff-no-rj-mo', '', '', 'https://www.gimu.ch', '', '', '', '-8-', '15.06.2018', '201017-11', '201017-11', 0, 0, 0, 0, 0, 95, NULL, 0, 0, 0, 0, 0, 5007, NULL, 17, NULL, 'Gimu - Tough Luck (prod. Vinnie Montana)', 'm8VfMPG5OmE', '<td class=\"yt-lastvideo\" data-sort=\"201016164503\" data-utime=\"201017-11\"><a href=\"https://youtu.be/m8VfMPG5OmE\" title=\"Gimu - Tough Luck (prod. Vinnie Montana)\" target=\"_blank\">Fr. 16.10.20</a><div class=\"info\"><div class=\"close\"></div><div class=\"circle\" style=\"background-image:url(https://i2.ytimg.com/vi/m8VfMPG5OmE/hqdefault.jpg)\"></div><p>Gimu - Tough Luck (prod. Vinnie Montana)<br><br>Views: 27 &nbsp; Ø/Video: 295<br>Veröffentlicht am: Fr. 16.10.20 um 16:45 Uhr</p><div class=\"abobar\"><a href=\"https://youtu.be/m8VfMPG5OmE\" target=\"_blank\" class=\"red\">zum Video</a></div></div></td>', 27, '2020-10-16T14:45:03+00:00', '201016164503', 'ch');
INSERT INTO `channels` VALUES (86, 0, 'UCTJRygFsgQGEf17dvvc1qbA', 'Nilai', 'in progress...', 'https://yt3.ggpht.com/a/AATXAJxD_kkaIzC2VRDzoO_-vEjK4TBtPEqGYgiohX-NTQ=s88-c-k-c0xffffffff-no-rj-mo', 'Marc Scheiwiller', 'https://www.youtube.com/nilaimusic', '', '', '', 'nilaimusic', '-6-25-', '19.03.2017', '201017-11', '201017-11', 0, 0, 6384, 12060, 19500, 22300, NULL, 0, 0, 306228, 905875, 1787812, 2250439, NULL, 105, NULL, 'z\'VIEL SCHLECHTI WITZE (ZÜRICH EDITION) - mit Aditotoro', 'fHgHNmuNHgo', '<td class=\"yt-lastvideo\" data-sort=\"200830200527\" data-utime=\"201017-11\"><a href=\"https://youtu.be/fHgHNmuNHgo\" title=\"z\'VIEL SCHLECHTI WITZE (ZÜRICH EDITION) - mit Aditotoro\" target=\"_blank\">So. 30.08.20</a><div class=\"info\"><div class=\"close\"></div><div class=\"circle\" style=\"background-image:url(https://i3.ytimg.com/vi/fHgHNmuNHgo/hqdefault.jpg)\"></div><p>z\'VIEL SCHLECHTI WITZE (ZÜRICH EDITION) - mit Aditotoro<br><br>Views: 15748 &nbsp; Ø/Video: 21433<br>Veröffentlicht am: So. 30.08.20 um 20:05 Uhr</p><div class=\"abobar\"><a href=\"https://youtu.be/fHgHNmuNHgo\" target=\"_blank\" class=\"red\">zum Video</a></div></div></td>', 15748, '2020-08-30T18:05:27+00:00', '200830200527', 'ch');
INSERT INTO `channels` VALUES (87, 0, 'UCIw8cdNILvehbxKxC9z2zHA', 'swiss drone photos', 'Hi', 'https://yt3.ggpht.com/a/AATXAJxraZfB99JbyptVwQhm6U2urGq6BlmVrszwSJoLnw=s88-c-k-c0xffffffff-no-rj-mo', '', '', '', '', '', 'swiss_drone_photos', '-3-', '02.12.2017', '201017-11', '201017-11', 0, 0, 0, 0, 38, 58, NULL, 0, 0, 0, 0, 849, 1188, NULL, 9, NULL, 'Brugg vs. COVID-19', '_CrEFVejpDo', '<td class=\"yt-lastvideo\" data-sort=\"200613142130\" data-utime=\"201017-11\"><a href=\"https://youtu.be/_CrEFVejpDo\" title=\"Brugg vs. COVID-19\" target=\"_blank\">Sa. 13.06.20</a><div class=\"info\"><div class=\"close\"></div><div class=\"circle\" style=\"background-image:url(https://i4.ytimg.com/vi/_CrEFVejpDo/hqdefault.jpg)\"></div><p>Brugg vs. COVID-19<br><br>Views: 41 &nbsp; Ø/Video: 132<br>Veröffentlicht am: Sa. 13.06.20 um 14:21 Uhr</p><div class=\"abobar\"><a href=\"https://youtu.be/_CrEFVejpDo\" target=\"_blank\" class=\"red\">zum Video</a></div></div></td>', 41, '2020-06-13T12:21:30+00:00', '200613142130', 'ch');
INSERT INTO `channels` VALUES (88, 0, 'UCbhDgbUaz5ewSsPMbleH3_Q', 'Ben Vatter', '', 'https://yt3.ggpht.com/a/AATXAJxCkNeuXKCTYfNBL7E6cTypc_f1j-RirIcStjVE=s88-c-k-c0xffffffff-no-rj-mo', '', '', 'https://www.benvatter.ch', '', '', '', '-6-8-', '09.02.2014', '201017-11', '201017-11', 0, 0, 0, 0, 68, 77, NULL, 0, 0, 0, 0, 31053, 36728, NULL, 26, NULL, 'Ds Wunderwort (Reimschema & Reime)', 'z5-VeK_wr-Q', '<td class=\"yt-lastvideo\" data-sort=\"201008230707\" data-utime=\"201017-11\"><a href=\"https://youtu.be/z5-VeK_wr-Q\" title=\"Ds Wunderwort (Reimschema & Reime)\" target=\"_blank\">Do. 08.10.20</a><div class=\"info\"><div class=\"close\"></div><div class=\"circle\" style=\"background-image:url(https://i3.ytimg.com/vi/z5-VeK_wr-Q/hqdefault.jpg)\"></div><p>Ds Wunderwort (Reimschema & Reime)<br><br>Views: 109 &nbsp; Ø/Video: 1413<br>Veröffentlicht am: Do. 08.10.20 um 23:07 Uhr</p><div class=\"abobar\"><a href=\"https://youtu.be/z5-VeK_wr-Q\" target=\"_blank\" class=\"red\">zum Video</a></div></div></td>', 109, '2020-10-08T21:07:07+00:00', '201008230707', 'ch');
INSERT INTO `channels` VALUES (89, 0, 'UCSv2oFSqZgHAgQ2vUqBRrzA', 'Der Kenner', '', 'https://yt3.ggpht.com/a/AATXAJxE6Kgc5LyuSOeyPnz0Emi4Xmpg0A7d3mTncZu2=s88-c-k-c0xffffffff-no-rj-mo', '', '', '', '', 'derkenner', 'derkenner5', '-6-8-11-', '01.06.2016', '201017-11', '201017-11', 0, 0, 0, 0, 0, 65, NULL, 0, 0, 0, 0, 0, 3536, NULL, 24, NULL, 'Twitch Livestream mit XEN #DerKennerTime', 'I68o4muCaas', '<td class=\"yt-lastvideo\" data-sort=\"201014182338\" data-utime=\"201017-11\"><a href=\"https://youtu.be/I68o4muCaas\" title=\"Twitch Livestream mit XEN #DerKennerTime\" target=\"_blank\">Mi. 14.10.20</a><div class=\"info\"><div class=\"close\"></div><div class=\"circle\" style=\"background-image:url(https://i2.ytimg.com/vi/I68o4muCaas/hqdefault.jpg)\"></div><p>Twitch Livestream mit XEN #DerKennerTime<br><br>Views: 71 &nbsp; Ø/Video: 147<br>Veröffentlicht am: Mi. 14.10.20 um 18:23 Uhr</p><div class=\"abobar\"><a href=\"https://youtu.be/I68o4muCaas\" target=\"_blank\" class=\"red\">zum Video</a></div></div></td>', 71, '2020-10-14T16:23:38+00:00', '201014182338', 'ch');
INSERT INTO `channels` VALUES (90, 1, 'UCEZ7L9zE2bVo26GoCh1r-Kg', 'Nilper', 'Herzlich willkommen bei mir, dem Nilper!<br /><br />Auf meinem Kanal veröffentliche ich Let\'s Plays, welche auf Schweizerdeutsch moderiert sind.', 'https://yt3.ggpht.com/a/AATXAJyHJuE07S-Q567guKVgY5cRqrHxrv729D-NgJYb=s88-c-k-c0xffffffff-no-rj-mo', '', '', '', '', '', '', '-4-', '06.03.2013', '201016-20', '201017-11', 0, 0, 0, 0, 16, 15, NULL, 0, 0, 0, 0, 853, 1000, NULL, 28, NULL, 'Let\'s play Skyrim | 008 | Auf der Suche nach Gandalf | Schweizerdeutsch', 'mZjqRrQVU2E', '<td class=\"yt-lastvideo\" data-sort=\"190217162216\" data-utime=\"201017-11\"><a href=\"https://youtu.be/mZjqRrQVU2E\" title=\"Let\'s play Skyrim | 008 | Auf der Suche nach Gandalf | Schweizerdeutsch\" target=\"_blank\">So. 17.02.19</a><div class=\"info\"><div class=\"close\"></div><div class=\"circle\" style=\"background-image:url(https://i2.ytimg.com/vi/mZjqRrQVU2E/hqdefault.jpg)\"></div><p>Let\'s play Skyrim | 008 | Auf der Suche nach Gandalf | Schweizerdeutsch<br><br>Views: 25 &nbsp; Ø/Video: 36<br>Veröffentlicht am: So. 17.02.19 um 16:22 Uhr</p><div class=\"abobar\"><a href=\"https://youtu.be/mZjqRrQVU2E\" target=\"_blank\" class=\"red\">zum Video</a></div></div></td>', 25, '2019-02-17T15:22:16+00:00', '190217162216', 'ch');
INSERT INTO `channels` VALUES (91, 0, 'UC0_P6Jh82ybNJnvAKxj92IQ', 'Pannerrail', 'Videos von meiner H0 Modelleisenbahn-Anlage und von Schweizer Eisenbahnen (SBB/BLS etc.)', 'https://yt3.ggpht.com/a/AATXAJzkThbD_zj26_8Ij4zkxQQusdAzF9wkxT6KWdaw=s88-c-k-c0xffffffff-no-rj-mo', 'Remo Peer', 'https://www.youtube.com/pannerrail', 'https://www.pannerrail.com', '', '', 'pannerrail', '-7-31-', '27.11.2011', '201017-11', '201017-11', 0, 240, 557, 1386, 2150, 3450, NULL, 0, 50476, 126546, 269255, 414358, 606217, NULL, 55, NULL, '28 Meine H0-Modelleisenbahn-Anlage: Moba-Steuerung mit dem PC (+Verlosung)', 'GzMZg35Twwg', '<td class=\"yt-lastvideo\" data-sort=\"201011184233\" data-utime=\"201017-11\"><a href=\"https://youtu.be/GzMZg35Twwg\" title=\"28 Meine H0-Modelleisenbahn-Anlage: Moba-Steuerung mit dem PC (+Verlosung)\" target=\"_blank\">So. 11.10.20</a><div class=\"info\"><div class=\"close\"></div><div class=\"circle\" style=\"background-image:url(https://i4.ytimg.com/vi/GzMZg35Twwg/hqdefault.jpg)\"></div><p>28 Meine H0-Modelleisenbahn-Anlage: Moba-Steuerung mit dem PC (+Verlosung)<br><br>Views: 2189 &nbsp; Ø/Video: 11022<br>Veröffentlicht am: So. 11.10.20 um 18:42 Uhr</p><div class=\"abobar\"><a href=\"https://youtu.be/GzMZg35Twwg\" target=\"_blank\" class=\"red\">zum Video</a></div></div></td>', 2189, '2020-10-11T16:42:33+00:00', '201011184233', 'ch');
INSERT INTO `channels` VALUES (92, 0, 'UCtO63BTm_OEh701RCDSc12A', 'Lara D\'Aurelio', 'On my journey of self-discovery, leaving behind social and cultural norms  to live an authentic life.', 'https://yt3.ggpht.com/a/AATXAJzLhat5jwcjbHNqCSmhMd0jVG0i4h9MwMFfXKkr=s88-c-k-c0xffffffff-no-rj-mo', 'Lara', '', '', '', '', '', '-2-6-14-', '22.12.2009', '201017-11', '201017-11', 0, 0, 0, 0, 29, 47, NULL, 0, 0, 0, 0, 2305, 2074, NULL, 20, NULL, 'The Problem with Modern Relationships', 'LxiDDZz8Y3A', '<td class=\"yt-lastvideo\" data-sort=\"201017060005\" data-utime=\"201017-11\"><a href=\"https://youtu.be/LxiDDZz8Y3A\" title=\"The Problem with Modern Relationships\" target=\"_blank\">Sa. 17.10.20</a><div class=\"info\"><div class=\"close\"></div><div class=\"circle\" style=\"background-image:url(https://i1.ytimg.com/vi/LxiDDZz8Y3A/hqdefault.jpg)\"></div><p>The Problem with Modern Relationships<br><br>Views: 6 &nbsp; Ø/Video: 104<br>Veröffentlicht am: Sa. 17.10.20 um 06:00 Uhr</p><div class=\"abobar\"><a href=\"https://youtu.be/LxiDDZz8Y3A\" target=\"_blank\" class=\"red\">zum Video</a></div></div></td>', 6, '2020-10-17T04:00:05+00:00', '201017060005', 'en');
INSERT INTO `channels` VALUES (93, 0, 'UCpJLBA_IiCLk0oNvqkgNNBw', 'SwissMisfit', 'Spielen, filmen und quatschen auf Schweizerdeutsch ab Mai 2020!!!', 'https://yt3.ggpht.com/a/AATXAJyeYodqm1Y0XL_Hv0baYoDg9b0CP7FO91n5lbhU=s88-c-k-c0xffffffff-no-rj-mo', 'Dario Montanari', '', '', '', 'swissmisfit', 'theswissmisfit', '-4-11-', '30.04.2020', '201017-11', '201017-11', 0, 0, 0, 0, 0, 4, NULL, 0, 0, 0, 0, 0, 71, NULL, 1, NULL, 'Stöbern auf Steam: HARDTIMES', 'bzSu4q9ZZp4', '<td class=\"yt-lastvideo\" data-sort=\"200513113136\" data-utime=\"201017-11\"><a href=\"https://youtu.be/bzSu4q9ZZp4\" title=\"Stöbern auf Steam: HARDTIMES\" target=\"_blank\">Mi. 13.05.20</a><div class=\"info\"><div class=\"close\"></div><div class=\"circle\" style=\"background-image:url(https://i3.ytimg.com/vi/bzSu4q9ZZp4/hqdefault.jpg)\"></div><p>Stöbern auf Steam: HARDTIMES<br><br>Views: 71 &nbsp; Ø/Video: 71<br>Veröffentlicht am: Mi. 13.05.20 um 11:31 Uhr</p><div class=\"abobar\"><a href=\"https://youtu.be/bzSu4q9ZZp4\" target=\"_blank\" class=\"red\">zum Video</a></div></div></td>', 71, '2020-05-13T09:31:36+00:00', '200513113136', 'ch');
INSERT INTO `channels` VALUES (94, 1, 'UCrcSpYeqWC7-fXlzVq6RZ-w', 'Schwiizchiste', '', 'https://yt3.ggpht.com/a/AATXAJy26rBpw2epfYn2coHw4pSYBDR-mFau5RzMecyI=s88-c-k-c0xffffffff-no-rj-mo', 'Robin Pickis', 'https://www.youtube.com/schwiizchiste', '', '', '', 'schwiizchiste', '-6-', '16.10.2016', '201016-20', '201017-11', 0, 0, 361, 1992, 3460, 3570, NULL, 0, 0, 36461, 147804, 345383, 381858, NULL, 25, NULL, 'Sombrero ft. I Don\'t Kero - Playa Playa (Official Video)', 'D_PZrfOQkLE', '<td class=\"yt-lastvideo\" data-sort=\"190917213011\" data-utime=\"201017-11\"><a href=\"https://youtu.be/D_PZrfOQkLE\" title=\"Sombrero ft. I Don\'t Kero - Playa Playa (Official Video)\" target=\"_blank\">Di. 17.09.19</a><div class=\"info\"><div class=\"close\"></div><div class=\"circle\" style=\"background-image:url(https://i1.ytimg.com/vi/D_PZrfOQkLE/hqdefault.jpg)\"></div><p>Sombrero ft. I Don\'t Kero - Playa Playa (Official Video)<br><br>Views: 64658 &nbsp; Ø/Video: 15274<br>Veröffentlicht am: Di. 17.09.19 um 21:30 Uhr</p><div class=\"abobar\"><a href=\"https://youtu.be/D_PZrfOQkLE\" target=\"_blank\" class=\"red\">zum Video</a></div></div></td>', 64658, '2019-09-17T19:30:11+00:00', '190917213011', 'ch');
INSERT INTO `channels` VALUES (95, 0, 'UC4c7NK2-XveG9uKfSahQcHg', 'Andreas Köng', 'YouTube Kanal vom Schweizer Zeitraffer-Fotograf Andreas Köng.<br /><br />Youtube Channel for Timelapses, Tutorials, Documentaries, Drone Movies and much more<br /><br />I am a passionate Timelapse-Landscape-Photographer and Filmmaker from Switzerland. I realize Music Videos, Documentaries, Advertising Films, Concert Films and much more.<br /><br />Jahdouproduction.com<br />Andreas Köng, Switzerland<br /><br /><br />PLEASE DON\'T USE ANY FOOTAGE WITHOUT MY AUTHORIZATION', 'https://yt3.ggpht.com/a/AATXAJzlD9jNz4KXjjf_pRhD2xMkjCZ3dnahdwwYrC86=s88-c-k-c0xffffffff-no-rj-mo', '', '', 'https://www.jahdouproduction.com', '', '', 'andreas_koeng_photography', '-3-18-20-', '13.04.2014', '201017-11', '201017-11', 0, 0, 0, 513, 1210, 1760, NULL, 0, 0, 0, 114676, 222482, 323308, NULL, 29, NULL, 'Fantastic Sky Switzerland 8K - A Timelapse Adventure', 'bctbDoFgo5M', '<td class=\"yt-lastvideo\" data-sort=\"201016185110\" data-utime=\"201017-11\"><a href=\"https://youtu.be/bctbDoFgo5M\" title=\"Fantastic Sky Switzerland 8K - A Timelapse Adventure\" target=\"_blank\">Fr. 16.10.20</a><div class=\"info\"><div class=\"close\"></div><div class=\"circle\" style=\"background-image:url(https://i3.ytimg.com/vi/bctbDoFgo5M/hqdefault.jpg)\"></div><p>Fantastic Sky Switzerland 8K - A Timelapse Adventure<br><br>Views: 306 &nbsp; Ø/Video: 11149<br>Veröffentlicht am: Fr. 16.10.20 um 18:51 Uhr</p><div class=\"abobar\"><a href=\"https://youtu.be/bctbDoFgo5M\" target=\"_blank\" class=\"red\">zum Video</a></div></div></td>', 306, '2020-10-16T16:51:10+00:00', '201016185110', 'ch');
INSERT INTO `channels` VALUES (96, 0, 'UCFG2pNN4h6CU29M8P8luOew', 'FC Zürich', 'Herzlich willkommen bei dem offiziellen YouTube-Channel des FC Zürich!<br /><br /><br /><br />.', 'https://yt3.ggpht.com/a/AATXAJzBnsqwqrbqD7Gh2bo1_7nz_5hnhQkV12F0pNqm=s88-c-k-c0xffffffff-no-rj-mo', '', '', 'https://www.fcz.ch', '', '', 'fcz_offiziell', '-5-20-', '22.02.2010', '201017-11', '201017-11', 0, 1804, 2014, 2314, 2560, 2840, NULL, 0, 1105404, 1141070, 1196257, 1247814, 1294507, NULL, 434, NULL, 'Saison-Vorschaugespräch mit Ancillo Canepa, Marinko Jurendic und Ludovic Magnin', 'j0vkYSheWtI', '<td class=\"yt-lastvideo\" data-sort=\"200819145048\" data-utime=\"201017-11\"><a href=\"https://youtu.be/j0vkYSheWtI\" title=\"Saison-Vorschaugespräch mit Ancillo Canepa, Marinko Jurendic und Ludovic Magnin\" target=\"_blank\">Mi. 19.08.20</a><div class=\"info\"><div class=\"close\"></div><div class=\"circle\" style=\"background-image:url(https://i3.ytimg.com/vi/j0vkYSheWtI/hqdefault.jpg)\"></div><p>Saison-Vorschaugespräch mit Ancillo Canepa, Marinko Jurendic und Ludovic Magnin<br><br>Views: 1627 &nbsp; Ø/Video: 2983<br>Veröffentlicht am: Mi. 19.08.20 um 14:50 Uhr</p><div class=\"abobar\"><a href=\"https://youtu.be/j0vkYSheWtI\" target=\"_blank\" class=\"red\">zum Video</a></div></div></td>', 1627, '2020-08-19T12:50:48+00:00', '200819145048', 'ch');
INSERT INTO `channels` VALUES (97, 0, 'UCd0NmHBRRAq5O-ye7kx_VlQ', 'SRF Archiv', 'Der offizielle Archivkanal von Schweizer Radio und Fernsehen: Hier knistern die Tonspuren und flimmern die Bilder über den Bildschirm wie anno dazumal. Machen Sie eine Zeitreise und entdecken Sie Archivperlen aus über einem  halben Jahrhundert.', 'https://yt3.ggpht.com/a/AATXAJwu5WoRj9LHkNQF4a74YowrzJAx0G9RgqRDPif2Mw=s88-c-k-c0xffffffff-no-rj-mo', '', 'https://www.youtube.com/srfarchiv', 'https://srf.ch', '', '', '', '-9-', '04.01.2010', '201017-11', '201017-11', 0, 4306, 6716, 10833, 20700, 35100, NULL, 0, 3432243, 5390541, 8288109, 13360841, 20707223, NULL, 860, NULL, 'LAN-Party (2001) | Geschichte eSports | SRF Archiv', 'HjNF-ndTjpg', '<td class=\"yt-lastvideo\" data-sort=\"201014081501\" data-utime=\"201017-11\"><a href=\"https://youtu.be/HjNF-ndTjpg\" title=\"LAN-Party (2001) | Geschichte eSports | SRF Archiv\" target=\"_blank\">Mi. 14.10.20</a><div class=\"info\"><div class=\"close\"></div><div class=\"circle\" style=\"background-image:url(https://i1.ytimg.com/vi/HjNF-ndTjpg/hqdefault.jpg)\"></div><p>LAN-Party (2001) | Geschichte eSports | SRF Archiv<br><br>Views: 4542 &nbsp; Ø/Video: 24078<br>Veröffentlicht am: Mi. 14.10.20 um 08:15 Uhr</p><div class=\"abobar\"><a href=\"https://youtu.be/HjNF-ndTjpg\" target=\"_blank\" class=\"red\">zum Video</a></div></div></td>', 4542, '2020-10-14T06:15:01+00:00', '201014081501', 'ch');
INSERT INTO `channels` VALUES (98, 1, 'UCtBSfWdGWLpBjqKSpPWM7uA', 'Ab Arel', 'Official Channel of Ab Arel<br />♬ ♬ and ♬ !', 'https://yt3.ggpht.com/a/AATXAJyasD_WC6u6qOV2-wAPdTtiKim5NvsyXNV5AuEkug=s88-c-k-c0xffffffff-no-rj-mo', '', '', '', '', '', '', '-8-', '30.05.2013', '201016-20', '201017-11', 0, 620, 819, 915, 938, 934, NULL, 0, 126772, 192741, 230582, 256287, 270758, NULL, 43, NULL, 'FL AzuR RC9 //_AB_AREL_//_A_ZU_R', 'BB36bdzfP-0', '<td class=\"yt-lastvideo\" data-sort=\"191121195350\" data-utime=\"201017-11\"><a href=\"https://youtu.be/BB36bdzfP-0\" title=\"FL AzuR RC9 //_AB_AREL_//_A_ZU_R\" target=\"_blank\">Do. 21.11.19</a><div class=\"info\"><div class=\"close\"></div><div class=\"circle\" style=\"background-image:url(https://i3.ytimg.com/vi/BB36bdzfP-0/hqdefault.jpg)\"></div><p>FL AzuR RC9 //_AB_AREL_//_A_ZU_R<br><br>Views: 2440 &nbsp; Ø/Video: 6297<br>Veröffentlicht am: Do. 21.11.19 um 19:53 Uhr</p><div class=\"abobar\"><a href=\"https://youtu.be/BB36bdzfP-0\" target=\"_blank\" class=\"red\">zum Video</a></div></div></td>', 2440, '2019-11-21T18:53:50+00:00', '191121195350', 'ch');
INSERT INTO `channels` VALUES (99, 0, 'UCj88Pp4scKu5I2YJiy2JWQw', 'Zwei am Morge', 'SRF Zwei am Morge – Danke für die Kenntnisnahme. Drei Lümmel, die das Publikum mit affigen Videos bespassen. Julian, Ramin und Robin von UniGAG und Schwiizchiste liefern dir die geschickt zusammengeschnittenen Clips direkt auf dein Handytelefon und via Antennenkabel ins Fernsehgerät deiner Eltern auf SRF zwei.<br /><br />🔴 PODCAST LIVE – Dienstag ab 20.45 Uhr<br />📺 NEUE FOLGE – Freitag um 6.00 Uhr<br />📺 NEUE FOLGE – Sonntag um 20.00 Uhr<br /><br />► Jetzt abonnieren und die Glocke aktivieren<br />🔔 youtube.com/srfzweiammorge<br /><br />► TikTok @srfzweiammorge<br />🕺🏼 tiktok.com/@srfzweiammorge<br /><br />► Instagram @srfzweiammorge<br />🤳🏾 instagram.com/srfzweiammorge<br /><br />-----------------------------------------------------------------------------------<br /><br />❤️-Briefe und andere Post bitte an:<br /><br />Schweizer Radio und Fernsehen<br />Jugend | Familie | Unterhaltung<br />SRF Zwei am Morge<br />Postfach<br />8042 Zürich<br />___ <br />Social Media Netiquette von SRF<br />► srf.ch/social-netiquette', 'https://yt3.ggpht.com/a/AATXAJxtYakb0NCsMgZCujxQzX0QheR2i-QaDbJ0GSND0g=s88-c-k-c0xffffffff-no-rj-mo', 'Julian Graf & Ramin Yousofzai', 'https://www.youtube.com/srfzweiammorge', '', 'https://www.srf.ch/play/radio/sendung/zwei-am-morge?id=ddd253f8-db02-42dc-bbef-0694610e7fb0', '', 'zweiammorge', '-6-9-12-', '03.01.2018', '201017-11', '201017-11', 0, 0, 0, 15007, 21000, 27800, NULL, 0, 0, 0, 1766428, 3441935, 6191925, NULL, 272, NULL, 'Neue BAG-Plakate: So wird entschieden | SRF Zwei am Morge', 'b_mRQ-T5bJI', '<td class=\"yt-lastvideo\" data-sort=\"201016060009\" data-utime=\"201017-11\"><a href=\"https://youtu.be/b_mRQ-T5bJI\" title=\"Neue BAG-Plakate: So wird entschieden | SRF Zwei am Morge\" target=\"_blank\">Fr. 16.10.20</a><div class=\"info\"><div class=\"close\"></div><div class=\"circle\" style=\"background-image:url(https://i3.ytimg.com/vi/b_mRQ-T5bJI/hqdefault.jpg)\"></div><p>Neue BAG-Plakate: So wird entschieden | SRF Zwei am Morge<br><br>Views: 10141 &nbsp; Ø/Video: 22764<br>Veröffentlicht am: Fr. 16.10.20 um 06:00 Uhr</p><div class=\"abobar\"><a href=\"https://youtu.be/b_mRQ-T5bJI\" target=\"_blank\" class=\"red\">zum Video</a></div></div></td>', 10141, '2020-10-16T04:00:09+00:00', '201016060009', 'ch');
INSERT INTO `channels` VALUES (100, 0, 'UCrGC2cfTB7lD-NfrRTaf0eg', 'Schweizer Bibelkanal', 'D Bibel isch eigentlech es extrem spannent’s Buech u befasst sech mit em Plan wie Gott d Wält wott Rette. Leider isch si nid immer ganz so liecht z verstah. Drum versuechen i mit myne Videos, uf em Schwyzer Bibelkanal, z hälfen u chly Liecht i ds Dunkle z bringe.', 'https://yt3.ggpht.com/a/AATXAJyYWt2PduvIxaGZiaULqRmzmeSdnot7hqI0Stms=s88-c-k-c0xffffffff-no-rj-mo', 'Manuela Gujer', '', 'https://manuela-gujer.jimdofree.com', '', '', '', '-7-14-18-25-', '31.03.2018', '201017-11', '201017-11', 0, 0, 0, 0, 19, 22, NULL, 0, 0, 0, 0, 798, 1293, NULL, 30, NULL, 'Bibelaktuell: Trump und die Bibel (Schweizerdeutsch)', 'iFi3YHbH_sk', '<td class=\"yt-lastvideo\" data-sort=\"200807180032\" data-utime=\"201017-11\"><a href=\"https://youtu.be/iFi3YHbH_sk\" title=\"Bibelaktuell: Trump und die Bibel (Schweizerdeutsch)\" target=\"_blank\">Fr. 07.08.20</a><div class=\"info\"><div class=\"close\"></div><div class=\"circle\" style=\"background-image:url(https://i2.ytimg.com/vi/iFi3YHbH_sk/hqdefault.jpg)\"></div><p>Bibelaktuell: Trump und die Bibel (Schweizerdeutsch)<br><br>Views: 31 &nbsp; Ø/Video: 43<br>Veröffentlicht am: Fr. 07.08.20 um 18:00 Uhr</p><div class=\"abobar\"><a href=\"https://youtu.be/iFi3YHbH_sk\" target=\"_blank\" class=\"red\">zum Video</a></div></div></td>', 31, '2020-08-07T16:00:32+00:00', '200807180032', 'ch');
INSERT INTO `channels` VALUES (101, 0, 'UCedijn7JH_CLvylQKvQ_OXA', 'MundARTprojekt', '', 'https://yt3.ggpht.com/a/AATXAJyR0Tdr-MYA7xjokq-X_AMmknJtS3HCC0Jlcww0=s88-c-k-c0xffffffff-no-rj-mo', '', '', '', '', '', 'mundartprojektbe', '-8-', '12.02.2019', '201017-11', '201017-11', 0, 0, 0, 0, 20, 35, NULL, 0, 0, 0, 0, 5170, 7281, NULL, 17, NULL, 'Mundartprojekt-ging e chli am schnürfele', 'rRFU2v08rXY', '<td class=\"yt-lastvideo\" data-sort=\"200911092755\" data-utime=\"201017-11\"><a href=\"https://youtu.be/rRFU2v08rXY\" title=\"Mundartprojekt-ging e chli am schnürfele\" target=\"_blank\">Fr. 11.09.20</a><div class=\"info\"><div class=\"close\"></div><div class=\"circle\" style=\"background-image:url(https://i3.ytimg.com/vi/rRFU2v08rXY/hqdefault.jpg)\"></div><p>Mundartprojekt-ging e chli am schnürfele<br><br>Views: 49 &nbsp; Ø/Video: 428<br>Veröffentlicht am: Fr. 11.09.20 um 09:27 Uhr</p><div class=\"abobar\"><a href=\"https://youtu.be/rRFU2v08rXY\" target=\"_blank\" class=\"red\">zum Video</a></div></div></td>', 49, '2020-09-11T07:27:55+00:00', '200911092755', 'ch');
INSERT INTO `channels` VALUES (102, 0, 'UCpGOi6Er5zWbgVgFkNKXgEw', 'Retro Cash', 'Einfach Spielen worauf ich lust habe. (meist Retro)<br /><br />Das heisst jeden Sonntag ein Video. Manchmal auch mehr.<br /><br />Mein Ziel: einfach Spass haben.', 'https://yt3.ggpht.com/a/AATXAJzhTHsRoqUfIa0LlFay4yV4T364Ps2lwEai8fZIlQ=s88-c-k-c0xffffffff-no-rj-mo', '', '', '', '', '', 'justgame4u', '-4-', '24.11.2014', '201017-11', '201017-11', 0, 0, 0, 0, 16, 18, NULL, 0, 0, 0, 0, 5486, 8295, NULL, 186, NULL, 'Tony Hawk Downhill Jam (Folge 17)', '7UVxmKN4O7U', '<td class=\"yt-lastvideo\" data-sort=\"201011001501\" data-utime=\"201017-11\"><a href=\"https://youtu.be/7UVxmKN4O7U\" title=\"Tony Hawk Downhill Jam (Folge 17)\" target=\"_blank\">So. 11.10.20</a><div class=\"info\"><div class=\"close\"></div><div class=\"circle\" style=\"background-image:url(https://i4.ytimg.com/vi/7UVxmKN4O7U/hqdefault.jpg)\"></div><p>Tony Hawk Downhill Jam (Folge 17)<br><br>Views: 8 &nbsp; Ø/Video: 45<br>Veröffentlicht am: So. 11.10.20 um 00:15 Uhr</p><div class=\"abobar\"><a href=\"https://youtu.be/7UVxmKN4O7U\" target=\"_blank\" class=\"red\">zum Video</a></div></div></td>', 8, '2020-10-10T22:15:01+00:00', '201011001501', 'ch');
INSERT INTO `channels` VALUES (103, 0, 'UC2tvL64hr2ZReZIpVRNDtPA', 'Maloijx', 'Dieser Kanal ist momentan Offline.', 'https://yt3.ggpht.com/a/AATXAJyVYb6SplfEnBL4TeYux5syynmW7hhjN-lUWRBEjQ=s88-c-k-c0xffffffff-no-rj-mo', '', '', '', '', 'maloijxyt', '', '-4-', '19.02.2019', '201017-11', '201017-11', 0, 0, 0, 0, 44, 360, NULL, 0, 0, 0, 0, 1242, 1538, NULL, 13, NULL, 'Sie lernen es nie.. | Mbrajx und MaLo | MLX-Gaming', 'rszLFcVf-Gc', '<td class=\"yt-lastvideo\" data-sort=\"201013202423\" data-utime=\"201017-11\"><a href=\"https://youtu.be/rszLFcVf-Gc\" title=\"Sie lernen es nie.. | Mbrajx und MaLo | MLX-Gaming\" target=\"_blank\">Di. 13.10.20</a><div class=\"info\"><div class=\"close\"></div><div class=\"circle\" style=\"background-image:url(https://i3.ytimg.com/vi/rszLFcVf-Gc/hqdefault.jpg)\"></div><p>Sie lernen es nie.. | Mbrajx und MaLo | MLX-Gaming<br><br>Views: 34 &nbsp; Ø/Video: 118<br>Veröffentlicht am: Di. 13.10.20 um 20:24 Uhr</p><div class=\"abobar\"><a href=\"https://youtu.be/rszLFcVf-Gc\" target=\"_blank\" class=\"red\">zum Video</a></div></div></td>', 34, '2020-10-13T18:24:23+00:00', '201013202423', 'ch');
INSERT INTO `channels` VALUES (104, 0, 'UCppAOM5tvqV-RdYRy-1ACrA', 'Seya Eggler', '', 'https://yt3.ggpht.com/a/AATXAJz34FwtzFaRIOCGGhDD00r-D4v3fbTop9mzrr3DKQ=s88-c-k-c0xffffffff-no-rj-mo', '', 'https://www.youtube.com/diaryofseya', '', '', '', 'diaryofseya', '-1-', '03.09.2014', '201017-11', '201017-11', 0, 77, 325, 613, 651, 656, NULL, 0, 4180, 22577, 48117, 59183, 68602, NULL, 56, NULL, 'Surfen in der Stadt Bern - Bungeesurfing Royal Ropes', '35rMOlDRH-A', '<td class=\"yt-lastvideo\" data-sort=\"200707152624\" data-utime=\"201017-11\"><a href=\"https://youtu.be/35rMOlDRH-A\" title=\"Surfen in der Stadt Bern - Bungeesurfing Royal Ropes\" target=\"_blank\">Di. 07.07.20</a><div class=\"info\"><div class=\"close\"></div><div class=\"circle\" style=\"background-image:url(https://i4.ytimg.com/vi/35rMOlDRH-A/hqdefault.jpg)\"></div><p>Surfen in der Stadt Bern - Bungeesurfing Royal Ropes<br><br>Views: 633 &nbsp; Ø/Video: 1225<br>Veröffentlicht am: Di. 07.07.20 um 15:26 Uhr</p><div class=\"abobar\"><a href=\"https://youtu.be/35rMOlDRH-A\" target=\"_blank\" class=\"red\">zum Video</a></div></div></td>', 633, '2020-07-07T13:26:24+00:00', '200707152624', 'ch');
INSERT INTO `channels` VALUES (105, 0, 'UCHh4CCPPSEaGViaRFDsmtzA', 'Damous', '► Damous auf Instagram: instagram.com/damous_rap<br />► Damous auf Facebook: facebook.com/damousrap<br />► Damous auf Spotify: open.spotify.com/artist/43Dv7Ih4HnPC10IwEWqRXL', 'https://yt3.ggpht.com/a/AATXAJxV696yjIEmAJpA94vHAziupO7RiVC8gcHx6zdvjQ=s88-c-k-c0xffffffff-no-rj-mo', 'Dave', 'https://www.youtube.com/damousrap', '', '', '', 'damous_rap', '-8-', '09.08.2018', '201017-11', '201017-11', 0, 0, 0, 0, 116, 137, NULL, 0, 0, 0, 0, 6950, 9002, NULL, 8, NULL, 'Damous - 12 Runde (prod. by Encore)', 'kBQ8fI_e6VE', '<td class=\"yt-lastvideo\" data-sort=\"200904000014\" data-utime=\"201017-11\"><a href=\"https://youtu.be/kBQ8fI_e6VE\" title=\"Damous - 12 Runde (prod. by Encore)\" target=\"_blank\">Fr. 04.09.20</a><div class=\"info\"><div class=\"close\"></div><div class=\"circle\" style=\"background-image:url(https://i4.ytimg.com/vi/kBQ8fI_e6VE/hqdefault.jpg)\"></div><p>Damous - 12 Runde (prod. by Encore)<br><br>Views: 80 &nbsp; Ø/Video: 1125<br>Veröffentlicht am: Fr. 04.09.20 um 00:00 Uhr</p><div class=\"abobar\"><a href=\"https://youtu.be/kBQ8fI_e6VE\" target=\"_blank\" class=\"red\">zum Video</a></div></div></td>', 80, '2020-09-03T22:00:14+00:00', '200904000014', 'ch');
INSERT INTO `channels` VALUES (106, 0, 'UCPcrNwaLZwrmx8UHJH2fNtA', 'Randnotiz', 'Rand|no|tiz, ch., {Substantiv, maskulin}, [rantnotiːts]<br /><br />dt. für Rap-Combo / Ferox und Chey /<br /><br />Herkunft; Winterthur (siehe: Epizentrum der Schweiz), Jhrg. 2011. Bedeutung; Randbemerkung, die eine Vielzahl wesentlicher Inhalte auf den Punkt bringt. Synonyme; originell, belebend, geistvoll, gesellig, unterhaltsam, üppig, wohltuend (auch: Lafäris, Substantiv, mz. mundart) Aktueller Bezug; Bringen zusammen mit Disc Jockey (Abkz. DJ) und Band ihre musikalischen Arrangements vor das hungrige Volk.', 'https://yt3.ggpht.com/a/AATXAJxaJKFwvUi6xSk5W-lkN2uBrDHr6QuJSuY9iwFD6A=s88-c-k-c0xffffffff-no-rj-mo', '', '', 'http://randnotiz.biz', '', '', 'randnotiz_official', '-8-', '31.07.2013', '201017-11', '201017-11', 0, 0, 0, 0, 86, 91, NULL, 0, 0, 0, 0, 10315, 9739, NULL, 12, NULL, 'Randnotiz -  Da bi mir  (Lyric Video)', '_AoxnE5f2bI', '<td class=\"yt-lastvideo\" data-sort=\"200925190011\" data-utime=\"201017-11\"><a href=\"https://youtu.be/_AoxnE5f2bI\" title=\"Randnotiz -  Da bi mir  (Lyric Video)\" target=\"_blank\">Fr. 25.09.20</a><div class=\"info\"><div class=\"close\"></div><div class=\"circle\" style=\"background-image:url(https://i4.ytimg.com/vi/_AoxnE5f2bI/hqdefault.jpg)\"></div><p>Randnotiz -  Da bi mir  (Lyric Video)<br><br>Views: 81 &nbsp; Ø/Video: 812<br>Veröffentlicht am: Fr. 25.09.20 um 19:00 Uhr</p><div class=\"abobar\"><a href=\"https://youtu.be/_AoxnE5f2bI\" target=\"_blank\" class=\"red\">zum Video</a></div></div></td>', 81, '2020-09-25T17:00:11+00:00', '200925190011', 'ch');
INSERT INTO `channels` VALUES (107, 0, 'UC5jF58ftx0w4wDvW3B7atNQ', 'Flying Metal Crew', 'Die Flying Metal GmbH bietet Dienstleistungen und Produkte im Bereich Mountain Bike an. Flying Metal baut Bikeparks, Flowtrails und Pumptracks, plant und veranstaltet Events und vertreibt mobile Pumptracks. Flying Metal steht für Innovation, Perfektion und Leidenschaft. Durch die starke Identifikation mit den gebauten Anlagen und verkauften Produkten versprechen die Inhaber höchste Qualität ihrer Arbeit. Durch die enge Zusammenarbeit mit professionellen Partnern stützt sich die Firma breit ab und sucht stets die bestmögliche Lösung für ihre Kunden. <br /><br />Unsere Produkte:<br />- Bikeparks<br />- Flowtrails<br />- Dirt Jumps<br />- Pumptracks<br />- Events<br />- Bike Kurse<br />- Mobile Pumptracks<br />- Mobile Jumpshows<br />- Mobiler Kids Bikeparcour', 'https://yt3.ggpht.com/a/AATXAJywQTerRbgK1WfcvfOB_bkS4cDVM-0rLnR9UNWcTw=s88-c-k-c0xffffffff-no-rj-mo', 'Jérôme & Ramon Hunziker', 'https://www.youtube.com/flyingmetalch', '', '', '', 'flyingmetalcrew', '-5-', '26.07.2013', '201017-11', '201017-11', 0, 758, 1006, 1208, 1390, 1490, NULL, 0, 306232, 393127, 475720, 561662, 594358, NULL, 97, NULL, 'Royal Chills - Flying Metal Season Ender at Royal Hills', 'pPZf8EdkLlc', '<td class=\"yt-lastvideo\" data-sort=\"201005145230\" data-utime=\"201017-11\"><a href=\"https://youtu.be/pPZf8EdkLlc\" title=\"Royal Chills - Flying Metal Season Ender at Royal Hills\" target=\"_blank\">Mo. 05.10.20</a><div class=\"info\"><div class=\"close\"></div><div class=\"circle\" style=\"background-image:url(https://i1.ytimg.com/vi/pPZf8EdkLlc/hqdefault.jpg)\"></div><p>Royal Chills - Flying Metal Season Ender at Royal Hills<br><br>Views: 129 &nbsp; Ø/Video: 6127<br>Veröffentlicht am: Mo. 05.10.20 um 14:52 Uhr</p><div class=\"abobar\"><a href=\"https://youtu.be/pPZf8EdkLlc\" target=\"_blank\" class=\"red\">zum Video</a></div></div></td>', 129, '2020-10-05T12:52:30+00:00', '201005145230', 'ch');
INSERT INTO `channels` VALUES (108, 0, 'UCB3-6qguU2H2WF3ok4rGW1A', 'Young Jeza', '', 'https://yt3.ggpht.com/a/AATXAJyThZUfnDEd9uu57P02aSy3HUIYF6wFAuZgCOYe=s88-c-k-c0xffffffff-no-rj-mo', '', '', '', '', '', 'young_jeza', '-8-', '24.01.2019', '201017-11', '201017-11', 0, 0, 0, 0, 0, 81, NULL, 0, 0, 0, 0, 0, 9983, NULL, 14, NULL, 'Kei Time ft. SHAMZH (Prod. By Hadzi Beats)', 'PDQdLMKPgi8', '<td class=\"yt-lastvideo\" data-sort=\"201015234509\" data-utime=\"201017-11\"><a href=\"https://youtu.be/PDQdLMKPgi8\" title=\"Kei Time ft. SHAMZH (Prod. By Hadzi Beats)\" target=\"_blank\">Do. 15.10.20</a><div class=\"info\"><div class=\"close\"></div><div class=\"circle\" style=\"background-image:url(https://i1.ytimg.com/vi/PDQdLMKPgi8/hqdefault.jpg)\"></div><p>Kei Time ft. SHAMZH (Prod. By Hadzi Beats)<br><br>Views: 56 &nbsp; Ø/Video: 713<br>Veröffentlicht am: Do. 15.10.20 um 23:45 Uhr</p><div class=\"abobar\"><a href=\"https://youtu.be/PDQdLMKPgi8\" target=\"_blank\" class=\"red\">zum Video</a></div></div></td>', 56, '2020-10-15T21:45:09+00:00', '201015234509', 'ch');
INSERT INTO `channels` VALUES (109, 1, 'UCwaKZdAlizFD9HoU4zFGOVw', 'Möchtegang', 'Möchtegang aka Phumaso & Smack, Bandit, C.mEE & Fratelli-B', 'https://yt3.ggpht.com/a/AATXAJywitQcW6_Sbrkaf_2-yKOlmvvTlszvQLzyuVWx=s88-c-k-c0xffffffff-no-rj-mo', 'Möchtegang aka Phumaso & Smack, Bandit, C.mEE & Fratelli-B', 'https://www.youtube.com/mochtegang', 'https://moechtegang.com', '', '', 'moechtegang', '-8-', '11.02.2014', '201016-20', '201017-11', 0, 0, 0, 4492, 4820, 4920, NULL, 0, 0, 0, 1852574, 2213094, 2376921, NULL, 15, NULL, 'Möchtegang feat. iOne - SUMO (Schiiss uf morn!)', '7JvCPsXr_LI', '<td class=\"yt-lastvideo\" data-sort=\"190805005339\" data-utime=\"201017-11\"><a href=\"https://youtu.be/7JvCPsXr_LI\" title=\"Möchtegang feat. iOne - SUMO (Schiiss uf morn!)\" target=\"_blank\">Mo. 05.08.19</a><div class=\"info\"><div class=\"close\"></div><div class=\"circle\" style=\"background-image:url(https://i4.ytimg.com/vi/7JvCPsXr_LI/hqdefault.jpg)\"></div><p>Möchtegang feat. iOne - SUMO (Schiiss uf morn!)<br><br>Views: 159706 &nbsp; Ø/Video: 158461<br>Veröffentlicht am: Mo. 05.08.19 um 00:53 Uhr</p><div class=\"abobar\"><a href=\"https://youtu.be/7JvCPsXr_LI\" target=\"_blank\" class=\"red\">zum Video</a></div></div></td>', 159706, '2019-08-04T22:53:39+00:00', '190805005339', 'ch');
INSERT INTO `channels` VALUES (110, 0, 'UCw-oBFsoAOec7eoXY1-fMFQ', 'Liana Scibetta', 'Ich bin 14 Jahre alt und singe sehr gerne auch Duette machen mir spass😉', 'https://yt3.ggpht.com/a/AATXAJwPis1Yrr9xenpOYTs0eJsvK3vAOc1NOj4rwCloeQ=s88-c-k-c0xffffffff-no-rj-mo', '', '', '', '', '', '', '-6-8-14-', '11.05.2017', '201017-11', '201017-11', 0, 0, 0, 0, 19, 21, NULL, 0, 0, 0, 0, 466, 504, NULL, 5, NULL, 'Hallelujah mit 2 stimmigen refrain und Klavier begleitung', 'ZKos4rHkryU', '<td class=\"yt-lastvideo\" data-sort=\"200110225236\" data-utime=\"201017-11\"><a href=\"https://youtu.be/ZKos4rHkryU\" title=\"Hallelujah mit 2 stimmigen refrain und Klavier begleitung\" target=\"_blank\">Fr. 10.01.20</a><div class=\"info\"><div class=\"close\"></div><div class=\"circle\" style=\"background-image:url(https://i3.ytimg.com/vi/ZKos4rHkryU/hqdefault.jpg)\"></div><p>Hallelujah mit 2 stimmigen refrain und Klavier begleitung<br><br>Views: 37 &nbsp; Ø/Video: 101<br>Veröffentlicht am: Fr. 10.01.20 um 22:52 Uhr</p><div class=\"abobar\"><a href=\"https://youtu.be/ZKos4rHkryU\" target=\"_blank\" class=\"red\">zum Video</a></div></div></td>', 37, '2020-01-10T21:52:36+00:00', '200110225236', 'ch');
INSERT INTO `channels` VALUES (111, 0, 'UCGXeukpkmatW212ghvDigCQ', 'Dario', 'Hii, ich bi de Dario, gebore am 11. September 1999 in Portugal läb aber sit ich dänke kah in de Schwiz.<br /><br />🎬 Ich han e fetti Portion Lideschaft fürs kreiere vo Medie.. Videos.. Storytelling.. Fotos.. Realisiere vo irgendwelli. <br />🏃  Parkour & Freerun ish e sach bi mir, ich bi nämlich Trainer bim geilste Parkourverein StreemFreerun Basel! <br /><br />Ich lieb Organisation und Perfektion. Au neui sache usprobiere und umereise ghöre zu minne favorits.<br /><br />Ich due nid oft sache uploade, aber wenni was upload denne ish es sichr au dinni Zit wärt es z luege, ich mag es nämlich nid, lüt sinni Zit z verschwände.<br />Naja sit 10. September versuechi zwei mol wöchentlich e Video usezhaue... mol luege wie es lauft! Spöter werd ich es uf 1 mol pro Wuche abeschrube miesse.<br /><br />Yoa, that\'s it.. Viel Spass mit mine Videos und loh doch e abo do! :)', 'https://yt3.ggpht.com/a/AATXAJzno_nQalQO--_WEqfjdKMxSs3ylzUCKlzoudg8Tg=s88-c-k-c0xffffffff-no-rj-mo', '', 'https://www.youtube.com/dariography', '', '', 'dariographyy', 'dariographyy', '-5-6-11-21-', '09.09.2014', '201017-11', '201017-11', 0, 0, 0, 158, 178, 206, NULL, 0, 0, 0, 4545, 6836, 7196, NULL, 45, NULL, 'Minni GSCHICHT mit de SCHWIZER YOUTUBE-SZENE!', 'WiDdX7Lhc14', '<td class=\"yt-lastvideo\" data-sort=\"201007180006\" data-utime=\"201017-11\"><a href=\"https://youtu.be/WiDdX7Lhc14\" title=\"Minni GSCHICHT mit de SCHWIZER YOUTUBE-SZENE!\" target=\"_blank\">Mi. 07.10.20</a><div class=\"info\"><div class=\"close\"></div><div class=\"circle\" style=\"background-image:url(https://i4.ytimg.com/vi/WiDdX7Lhc14/hqdefault.jpg)\"></div><p>Minni GSCHICHT mit de SCHWIZER YOUTUBE-SZENE!<br><br>Views: 84 &nbsp; Ø/Video: 160<br>Veröffentlicht am: Mi. 07.10.20 um 18:00 Uhr</p><div class=\"abobar\"><a href=\"https://youtu.be/WiDdX7Lhc14\" target=\"_blank\" class=\"red\">zum Video</a></div></div></td>', 84, '2020-10-07T16:00:06+00:00', '201007180006', 'ch');
INSERT INTO `channels` VALUES (112, 0, 'UCJkJekKGV47GQGKvfi9pSPQ', 'Alexandras Skyline', 'Hier geht es um mich (Alexandra, 17) #swisstuber 🇨🇭🇨🇭🇨🇭<br />und meine Freibergerstuten Samantha und Skyline. Wir reiten klassische Dressur und machen gerne mal Bodenarbeit. Zur Zeit sind Samantha und ich nur auf Gymkhana-Turnieren unterwegs, dafür recht erfolgreich. Das liegt auch daran, dass Samantha Anfang April ein schönes Stutfohlen zur Welt gebracht hat: Chelsy Blue S😊 (von Calypso du Padoc)<br /><br />Ich lege sehr viel wert auf eine faire und reele Ausbildung, habe eine Jungstute zum ausbilden und möchte einfach nur Spass haben mit meinen Vierbeinern. Samanthas letztes Fohlen Skyline (Haloa X Nagano (Samantha)) ist gerade 2 jährig und wir arbeiten an den Basics. <br /><br />Samantha ist eine Freibergerstute aus Nagano X Hendrix und 9 jährig. Denoch ist sie noch nicht sehr weit in der Ausbildung, was aber langsam aber sicher kommt. <br /><br />Instagram:<br />@alexandras_skyline<br /><br />@s_franches.montagnes<br /><br />@fairnessfurpferde <br />(Gruppe die sich für Pferde einsetzt, welche unfair behandelt werden)', 'https://yt3.ggpht.com/a/AATXAJw2fYF1xPU2ycU4yQQIkXTBRiTnWzD6S9s1nMyU=s88-c-k-c0xffffffff-no-rj-mo', '', '', '', '', '', 'alexandras_skyline', '-5-7-14-17-', '25.01.2018', '201017-11', '201017-11', 0, 0, 0, 0, 101, 133, NULL, 0, 0, 0, 0, 6319, 10343, NULL, 48, NULL, 'SAVAGE LOVE ~ Dressur und Springen mit Jungpferd ~ Alexandras Skyline', 'R8XyYcBFvZE', '<td class=\"yt-lastvideo\" data-sort=\"200921215542\" data-utime=\"201017-11\"><a href=\"https://youtu.be/R8XyYcBFvZE\" title=\"SAVAGE LOVE ~ Dressur und Springen mit Jungpferd ~ Alexandras Skyline\" target=\"_blank\">Mo. 21.09.20</a><div class=\"info\"><div class=\"close\"></div><div class=\"circle\" style=\"background-image:url(https://i3.ytimg.com/vi/R8XyYcBFvZE/hqdefault.jpg)\"></div><p>SAVAGE LOVE ~ Dressur und Springen mit Jungpferd ~ Alexandras Skyline<br><br>Views: 69 &nbsp; Ø/Video: 215<br>Veröffentlicht am: Mo. 21.09.20 um 21:55 Uhr</p><div class=\"abobar\"><a href=\"https://youtu.be/R8XyYcBFvZE\" target=\"_blank\" class=\"red\">zum Video</a></div></div></td>', 69, '2020-09-21T19:55:42+00:00', '200921215542', 'ch');
INSERT INTO `channels` VALUES (113, 0, 'UCZuIbX5HZJumlvdUlusUJtA', 'Bauernfilme', 'Wir produzieren Produkt- und Werbefilme sowie Fotografien überwiegend für die Ernährungs- und Landwirtschaft. Viele namenhafte schweizer Unternehmen und Organisationen zählen zu unseren  Kunden. Für Hintergrundstories besuchen Sie uns hier:<br /><br />facebook.com/bauernfilme', 'https://yt3.ggpht.com/a/AATXAJzvST4gku3dsqMk7utsm81Mjdj8Y2XZhNO0zM3S=s88-c-k-c0xffffffff-no-rj-mo', 'Markus, Rebekka, Dario', '', 'https://bauernfilme.ch', '', '', 'bauernfilme', '-7-', '15.03.2008', '201017-11', '201017-11', 0, 6878, 7476, 8496, 10000, 11300, NULL, 0, 4687739, 5308341, 6112312, 7187021, 7813458, NULL, 242, NULL, 'Nomination agroPreis 2020: Familie Blunier, Paspels: Stressfreie Schlachtung (Schweizerdeutsch)', 'TRTGlAdaO_Y', '<td class=\"yt-lastvideo\" data-sort=\"201001111509\" data-utime=\"201017-11\"><a href=\"https://youtu.be/TRTGlAdaO_Y\" title=\"Nomination agroPreis 2020: Familie Blunier, Paspels: Stressfreie Schlachtung (Schweizerdeutsch)\" target=\"_blank\">Do. 01.10.20</a><div class=\"info\"><div class=\"close\"></div><div class=\"circle\" style=\"background-image:url(https://i1.ytimg.com/vi/TRTGlAdaO_Y/hqdefault.jpg)\"></div><p>Nomination agroPreis 2020: Familie Blunier, Paspels: Stressfreie Schlachtung (Schweizerdeutsch)<br><br>Views: 438 &nbsp; Ø/Video: 32287<br>Veröffentlicht am: Do. 01.10.20 um 11:15 Uhr</p><div class=\"abobar\"><a href=\"https://youtu.be/TRTGlAdaO_Y\" target=\"_blank\" class=\"red\">zum Video</a></div></div></td>', 438, '2020-10-01T09:15:09+00:00', '201001111509', 'ch');
INSERT INTO `channels` VALUES (114, 0, 'UC1AUTFT_qp77xwClNy4IzTg', 'Patrick Embacher', 'Begleite mich durch meinen 🇨🇭Unternehmer-Alltag! Jetzt Abonnieren❗<br /><br />Gruss,<br />Patrick<br /><br />☝ Sprich mit mir: patrickembacher.com<br /><br />Folge mir auch auf:<br />▶ LinkedIn: bit.ly/2k4WoAY<br />▶ Instagram: bit.ly/2kws2HA<br />▶ Facebook: bit.ly/2m2IEr5<br />▶ TikTok: bit.ly/2nhekcA<br />▶ Podcast: bit.ly/2lTO33s', 'https://yt3.ggpht.com/a/AATXAJw54agM6Sh64lUnVV2vsVyKc1CVFtepJqRAFybjJw=s88-c-k-c0xffffffff-no-rj-mo', '', 'https://www.youtube.com/patrickembacher', 'https://patrickembacher.com', 'https://anchor.fm/embacherpatrick', '', 'embacherpatrick', '-12-18-33-', '20.12.2017', '201017-11', '201017-11', 0, 0, 0, 0, 2540, 2460, NULL, 0, 0, 0, 0, 174492, 198339, NULL, 120, NULL, 'So kreierst du deinen Personal Brand (3-Schritte-Strategie)', '06fFerjxftE', '<td class=\"yt-lastvideo\" data-sort=\"201005180001\" data-utime=\"201017-11\"><a href=\"https://youtu.be/06fFerjxftE\" title=\"So kreierst du deinen Personal Brand (3-Schritte-Strategie)\" target=\"_blank\">Mo. 05.10.20</a><div class=\"info\"><div class=\"close\"></div><div class=\"circle\" style=\"background-image:url(https://i1.ytimg.com/vi/06fFerjxftE/hqdefault.jpg)\"></div><p>So kreierst du deinen Personal Brand (3-Schritte-Strategie)<br><br>Views: 98 &nbsp; Ø/Video: 1653<br>Veröffentlicht am: Mo. 05.10.20 um 18:00 Uhr</p><div class=\"abobar\"><a href=\"https://youtu.be/06fFerjxftE\" target=\"_blank\" class=\"red\">zum Video</a></div></div></td>', 98, '2020-10-05T16:00:01+00:00', '201005180001', 'ch');
INSERT INTO `channels` VALUES (115, 0, 'UC0BEnq22iCaw1QHn9aEIFCw', 'dä Brüeder vom Heinz', 'Mundart-Pop Singer/Songwriter aus dem Thurgau, Schweiz veröffentlicht hier seine neuesten Videos', 'https://yt3.ggpht.com/a/AATXAJzKBbUX19WshERa_6bbx6WvGkRKjPbha3pRslOifA=s88-c-k-c0xffffffff-no-rj-mo', '', '', '', '', '', 'manfred.fries', '-8-', '18.06.2017', '201017-11', '201017-11', 0, 0, 231, 803, 1060, 1200, NULL, 0, 0, 68366, 251366, 391693, 481055, NULL, 12, NULL, 'Dä Brüeder vom Heinz,   So en Siebesiech', 'G0jM-s5GEBs', '<td class=\"yt-lastvideo\" data-sort=\"200124170003\" data-utime=\"201017-11\"><a href=\"https://youtu.be/G0jM-s5GEBs\" title=\"Dä Brüeder vom Heinz,   So en Siebesiech\" target=\"_blank\">Fr. 24.01.20</a><div class=\"info\"><div class=\"close\"></div><div class=\"circle\" style=\"background-image:url(https://i4.ytimg.com/vi/G0jM-s5GEBs/hqdefault.jpg)\"></div><p>Dä Brüeder vom Heinz,   So en Siebesiech<br><br>Views: 7481 &nbsp; Ø/Video: 40088<br>Veröffentlicht am: Fr. 24.01.20 um 17:00 Uhr</p><div class=\"abobar\"><a href=\"https://youtu.be/G0jM-s5GEBs\" target=\"_blank\" class=\"red\">zum Video</a></div></div></td>', 7481, '2020-01-24T16:00:03+00:00', '200124170003', 'ch');
INSERT INTO `channels` VALUES (116, 1, 'UCC0PzUKu4blgvMueAZfP6vg', 'TReBeats', 'real hiphop music.', 'https://yt3.ggpht.com/a/AATXAJylncRjPr-zbFqs9HOZsoWzQbuqto2moTT4HKvbWA=s88-c-k-c0xffffffff-no-rj-mo', '', 'https://www.youtube.com/trebeatshiphop', 'https://trebeats.ch', '', '', 'trebeatshiphop', '-8-', '10.09.2011', '201016-20', '201017-11', 0, 386, 558, 692, 793, 830, NULL, 0, 84099, 133847, 182040, 220813, 245014, NULL, 47, NULL, 'TReBeats - El Classico feat. Shape (Official Video)', 'kVqmbIUdq-Y', '<td class=\"yt-lastvideo\" data-sort=\"191115000010\" data-utime=\"201017-11\"><a href=\"https://youtu.be/kVqmbIUdq-Y\" title=\"TReBeats - El Classico feat. Shape (Official Video)\" target=\"_blank\">Fr. 15.11.19</a><div class=\"info\"><div class=\"close\"></div><div class=\"circle\" style=\"background-image:url(https://i4.ytimg.com/vi/kVqmbIUdq-Y/hqdefault.jpg)\"></div><p>TReBeats - El Classico feat. Shape (Official Video)<br><br>Views: 3296 &nbsp; Ø/Video: 5213<br>Veröffentlicht am: Fr. 15.11.19 um 00:00 Uhr</p><div class=\"abobar\"><a href=\"https://youtu.be/kVqmbIUdq-Y\" target=\"_blank\" class=\"red\">zum Video</a></div></div></td>', 3296, '2019-11-14T23:00:10+00:00', '191115000010', 'ch');
INSERT INTO `channels` VALUES (117, 0, 'UCP5SzXcvAsTK3jbThpkUadQ', 'Z92', 'Offizielle Kanal vom Z92 Kartell mit de CH-Rap Newcomers Lightsking, Mássimon und Big Bane. Viel Spass bim pumpe.', 'https://yt3.ggpht.com/a/AATXAJwFLe-NtAN78r4jDyNAy0baFjqOzYI2LWFz2gI=s88-c-k-c0xffffffff-no-rj-mo', '', '', '', '', '', '', '-8-', '05.04.2017', '201017-11', '201017-11', 0, 0, 88, 353, 1020, 1330, NULL, 0, 0, 14498, 152299, 231850, 476705, NULL, 17, NULL, 'Senko X Denko - KREIS 92', 'urZ1kEXpvjA', '<td class=\"yt-lastvideo\" data-sort=\"200722221557\" data-utime=\"201017-11\"><a href=\"https://youtu.be/urZ1kEXpvjA\" title=\"Senko X Denko - KREIS 92\" target=\"_blank\">Mi. 22.07.20</a><div class=\"info\"><div class=\"close\"></div><div class=\"circle\" style=\"background-image:url(https://i2.ytimg.com/vi/urZ1kEXpvjA/hqdefault.jpg)\"></div><p>Senko X Denko - KREIS 92<br><br>Views: 5353 &nbsp; Ø/Video: 28041<br>Veröffentlicht am: Mi. 22.07.20 um 22:15 Uhr</p><div class=\"abobar\"><a href=\"https://youtu.be/urZ1kEXpvjA\" target=\"_blank\" class=\"red\">zum Video</a></div></div></td>', 5353, '2020-07-22T20:15:57+00:00', '200722221557', 'ch');
INSERT INTO `channels` VALUES (118, 0, 'UCwWKuglDEyz0ofSPQtLuTcw', 'Fabe Basel', 'Freyi Artikulation bringt Eskalation!🙌🏻', 'https://yt3.ggpht.com/a/AATXAJx3BPJilxogCCMWphVLRHi97QcHx_JBPSpP9BX3TQ=s88-c-k-c0xffffffff-no-rj-mo', '', '', '', '', '', 'fabebasel', '-8-', '22.04.2015', '201017-11', '201017-11', 0, 0, 0, 335, 380, 439, NULL, 0, 0, 0, 52913, 68241, 90180, NULL, 6, NULL, 'Fabe  - Irgendwie [feat. DJ NXK]', 'rfJbsj_MsU0', '<td class=\"yt-lastvideo\" data-sort=\"200228124345\" data-utime=\"201017-11\"><a href=\"https://youtu.be/rfJbsj_MsU0\" title=\"Fabe  - Irgendwie [feat. DJ NXK]\" target=\"_blank\">Fr. 28.02.20</a><div class=\"info\"><div class=\"close\"></div><div class=\"circle\" style=\"background-image:url(https://i3.ytimg.com/vi/rfJbsj_MsU0/hqdefault.jpg)\"></div><p>Fabe  - Irgendwie [feat. DJ NXK]<br><br>Views: 6711 &nbsp; Ø/Video: 15030<br>Veröffentlicht am: Fr. 28.02.20 um 12:43 Uhr</p><div class=\"abobar\"><a href=\"https://youtu.be/rfJbsj_MsU0\" target=\"_blank\" class=\"red\">zum Video</a></div></div></td>', 6711, '2020-02-28T11:43:45+00:00', '200228124345', 'ch');
INSERT INTO `channels` VALUES (119, 1, 'UCtOdehgnnMHjkUXYxmeQC2Q', 'Tina Umbricht', 'Tina Umbricht<br />18<br />I like to act, but I\'m not in a movie. And I also like to sing and entertain people.<br /><br />German, Swiss German and English Videos!', 'https://yt3.ggpht.com/a/AATXAJxudUMZnR6aPw2tWCasqBqXk7R3TXIKTPwRLeaRig=s88-c-k-c0xffffffff-no-rj-mo', '', '', '', '', '', '', '-6-14-25-', '06.08.2011', '201016-20', '201017-11', 2035, 2234, 2988, 3486, 3450, 3420, NULL, 21201, 33900, 63362, 86009, 56923, 57534, NULL, 5, NULL, 'Bruises - Lewis Capaldi (cover) | Tina Umbricht', 'ZK2kzPnUDvY', '<td class=\"yt-lastvideo\" data-sort=\"190615092128\" data-utime=\"201017-11\"><a href=\"https://youtu.be/ZK2kzPnUDvY\" title=\"Bruises - Lewis Capaldi (cover) | Tina Umbricht\" target=\"_blank\">Sa. 15.06.19</a><div class=\"info\"><div class=\"close\"></div><div class=\"circle\" style=\"background-image:url(https://i3.ytimg.com/vi/ZK2kzPnUDvY/hqdefault.jpg)\"></div><p>Bruises - Lewis Capaldi (cover) | Tina Umbricht<br><br>Views: 5987 &nbsp; Ø/Video: 11507<br>Veröffentlicht am: Sa. 15.06.19 um 09:21 Uhr</p><div class=\"abobar\"><a href=\"https://youtu.be/ZK2kzPnUDvY\" target=\"_blank\" class=\"red\">zum Video</a></div></div></td>', 5987, '2019-06-15T07:21:28+00:00', '190615092128', 'ch');
INSERT INTO `channels` VALUES (120, 1, 'UCS3HrpGgS_X_9QvF_savggQ', 'zockTV 2.0', '', 'https://yt3.ggpht.com/a/AATXAJx8Ps8uwLqSxNtTVoYrWfJXd90rWUPOLRCnTk-2iw=s88-c-k-c0xffffffff-no-rj-mo', '', '', '', '', '', '', '-4-', '12.05.2017', '201016-20', '201017-11', 0, 0, 0, 0, 21, 24, NULL, 0, 0, 0, 0, 1147, 1427, NULL, 40, NULL, 'Fortnite Schweizerdeutsch von easyrecken2113', 'ltQaUb1B-C0', '<td class=\"yt-lastvideo\" data-sort=\"190223145349\" data-utime=\"201017-11\"><a href=\"https://youtu.be/ltQaUb1B-C0\" title=\"Fortnite Schweizerdeutsch von easyrecken2113\" target=\"_blank\">Sa. 23.02.19</a><div class=\"info\"><div class=\"close\"></div><div class=\"circle\" style=\"background-image:url(https://i1.ytimg.com/vi/ltQaUb1B-C0/hqdefault.jpg)\"></div><p>Fortnite Schweizerdeutsch von easyrecken2113<br><br>Views: 15 &nbsp; Ø/Video: 36<br>Veröffentlicht am: Sa. 23.02.19 um 14:53 Uhr</p><div class=\"abobar\"><a href=\"https://youtu.be/ltQaUb1B-C0\" target=\"_blank\" class=\"red\">zum Video</a></div></div></td>', 15, '2019-02-23T13:53:49+00:00', '190223145349', 'ch');
INSERT INTO `channels` VALUES (121, 0, 'UCXAyeyp0RxF4fdY0plGd0qQ', 'Carlitoo', 'Hallo zemme😇<br /><br />Härzlich willkomme uf mim Kanal😝<br /><br />Instagram: Carlitoo.37<br />Snapchat: luca_alcapone<br />Twitch: streamluca<br />TikTok: Carlito.37<br /><br />Uf mim Kanal findet er alles mögliche😋 challenges, vlogs, und no viles meh🥰<br />____________________________________________________________<br />Für gschäftlichi Afrage<br /><br />Lucacarlino.apple@bluewin.ch<br />____________________________________________________________<br /><br /><br />Carlitoo', 'https://yt3.ggpht.com/a/AATXAJyDdI2Zrlx-CkWCNGxg6kQYVxTTT6yif0oozSGAoQ=s88-c-k-c0xffffffff-no-rj-mo', '', '', '', '', '', 'Carlitoo.37', '-6-', '16.02.2017', '201017-11', '201017-11', 0, 0, 0, 0, 0, 124, NULL, 0, 0, 0, 0, 0, 2897, NULL, 13, NULL, 'Meine Top 5 Netflix Serien🤩 (schweizerdeutsch🇨🇭)', 'ymGgzZLYwUY', '<td class=\"yt-lastvideo\" data-sort=\"200630140022\" data-utime=\"201017-11\"><a href=\"https://youtu.be/ymGgzZLYwUY\" title=\"Meine Top 5 Netflix Serien🤩 (schweizerdeutsch🇨🇭)\" target=\"_blank\">Di. 30.06.20</a><div class=\"info\"><div class=\"close\"></div><div class=\"circle\" style=\"background-image:url(https://i2.ytimg.com/vi/ymGgzZLYwUY/hqdefault.jpg)\"></div><p>Meine Top 5 Netflix Serien🤩 (schweizerdeutsch🇨🇭)<br><br>Views: 109 &nbsp; Ø/Video: 223<br>Veröffentlicht am: Di. 30.06.20 um 14:00 Uhr</p><div class=\"abobar\"><a href=\"https://youtu.be/ymGgzZLYwUY\" target=\"_blank\" class=\"red\">zum Video</a></div></div></td>', 109, '2020-06-30T12:00:22+00:00', '200630140022', 'ch');
INSERT INTO `channels` VALUES (122, 0, 'UCjiHk9LbGDbHE_LU2hoBJog', 'Bernhards', '', 'https://yt3.ggpht.com/a/AATXAJxbjlz4Do3NlTVfi5BkHWLbLwisWwY1Qkh0i913=s88-c-k-c0xffffffff-no-rj-mo', 'Carol & Marcel', '', 'https://fridafashion.ch', '', '', 'carolxbernhard', '-6-33-', '31.10.2019', '201017-11', '201017-11', 0, 0, 0, 0, 181, 329, NULL, 0, 0, 0, 0, 6299, 27727, NULL, 13, NULL, 'BIG NEWS - Wir ziehen um! - Bernhards doing things', 'jOBe73KQQ8Q', '<td class=\"yt-lastvideo\" data-sort=\"200906170030\" data-utime=\"201017-11\"><a href=\"https://youtu.be/jOBe73KQQ8Q\" title=\"BIG NEWS - Wir ziehen um! - Bernhards doing things\" target=\"_blank\">So. 06.09.20</a><div class=\"info\"><div class=\"close\"></div><div class=\"circle\" style=\"background-image:url(https://i3.ytimg.com/vi/jOBe73KQQ8Q/hqdefault.jpg)\"></div><p>BIG NEWS - Wir ziehen um! - Bernhards doing things<br><br>Views: 1207 &nbsp; Ø/Video: 2133<br>Veröffentlicht am: So. 06.09.20 um 17:00 Uhr</p><div class=\"abobar\"><a href=\"https://youtu.be/jOBe73KQQ8Q\" target=\"_blank\" class=\"red\">zum Video</a></div></div></td>', 1207, '2020-09-06T15:00:30+00:00', '200906170030', 'ch');
INSERT INTO `channels` VALUES (123, 1, 'UC5Yi45Une921Ntq4Q_euTpQ', 'Kummerbuben', 'Kummerbuben - offizieller Band-Kanal.', 'https://yt3.ggpht.com/a/AATXAJwasZA5OUKU01D5CDixqYwNUW66zJVOSFktg1tosw=s88-c-k-c0xffffffff-no-rj-mo', 'Simon Jäggi & Urs Gilgen', 'https://www.youtube.com/kummerbuben', 'https://www.kummerbuben.com', '', '', 'kummerbuben', '-8-', '04.04.2007', '201016-20', '201017-11', 162, 182, 272, 325, 338, 355, NULL, 172052, 201741, 258334, 288655, 306560, 323005, NULL, 26, NULL, 'Live: Kummerbuben & Variaton  «Itz mau Apokalypse»', 'cyAwNVEibjY', '<td class=\"yt-lastvideo\" data-sort=\"190322145559\" data-utime=\"201017-11\"><a href=\"https://youtu.be/cyAwNVEibjY\" title=\"Live: Kummerbuben & Variaton  «Itz mau Apokalypse»\" target=\"_blank\">Fr. 22.03.19</a><div class=\"info\"><div class=\"close\"></div><div class=\"circle\" style=\"background-image:url(https://i4.ytimg.com/vi/cyAwNVEibjY/hqdefault.jpg)\"></div><p>Live: Kummerbuben & Variaton  «Itz mau Apokalypse»<br><br>Views: 1318 &nbsp; Ø/Video: 12423<br>Veröffentlicht am: Fr. 22.03.19 um 14:55 Uhr</p><div class=\"abobar\"><a href=\"https://youtu.be/cyAwNVEibjY\" target=\"_blank\" class=\"red\">zum Video</a></div></div></td>', 1318, '2019-03-22T13:55:59+00:00', '190322145559', 'ch');
INSERT INTO `channels` VALUES (124, 0, 'UCGyc0_wFCE7cCz9xFZWpmgQ', 'MadLipz Swiss', 'wilkommen auf dem <br />Kanal MadlipzSchweiz™ Hier gibt\'s die besten Madlipz us de schwiz und andere Gugus<br />\" sendet Madlipz an  madlipzschweizbusiness@gmail.com  \"<br />~~~~~~~~~~~~~~~~~~~~<br />Geknackte abo Marken<br /><br />450 Abos ✓<br />500 Abos ✓ <br />550 Abos✓<br />600Abos ✓<br />650Abos ✓<br />700Abos ✓<br />750Abos✓<br />800Abos✓<br />850Abos✓<br />900 Abos ✓<br />950 Abos✓<br />1k  Abos✓<br />1.5k Abos x<br /><br />~~~~~~~~~~~~~~~~~~~~<br />{Abonnieren}✓', 'https://yt3.ggpht.com/a/AATXAJyjg09jDjDWDGgTSXQND9Tj3qBNKi7vHVepuuf80mI=s88-c-k-c0xffffffff-no-rj-mo', '', '', '', '', '', 'madlipz_schweiz', '-6-', '02.05.2014', '201017-11', '201017-11', 0, 0, 477, 1520, 1970, 2640, NULL, 0, 0, 151852, 408555, 589008, 878414, NULL, 339, NULL, 'Klopapier', 'pEGcvoD8s4U', '<td class=\"yt-lastvideo\" data-sort=\"200319202530\" data-utime=\"201017-11\"><a href=\"https://youtu.be/pEGcvoD8s4U\" title=\"Klopapier\" target=\"_blank\">Do. 19.03.20</a><div class=\"info\"><div class=\"close\"></div><div class=\"circle\" style=\"background-image:url(https://i1.ytimg.com/vi/pEGcvoD8s4U/hqdefault.jpg)\"></div><p>Klopapier<br><br>Views: 5807 &nbsp; Ø/Video: 2591<br>Veröffentlicht am: Do. 19.03.20 um 20:25 Uhr</p><div class=\"abobar\"><a href=\"https://youtu.be/pEGcvoD8s4U\" target=\"_blank\" class=\"red\">zum Video</a></div></div></td>', 5807, '2020-03-19T19:25:30+00:00', '200319202530', 'ch');
INSERT INTO `channels` VALUES (125, 0, 'UCFLOHJLX8H9KcW8QDbPC8tA', 'Gamerocker', 'Hoi You Tube Freund! Schön dass es dich gibt! <br /><br />Ich rocke das Leben, manchmal sind es auch Games. Das alles in einem deutschverständlichen Schwizerdütsch.<br /><br />++++++++++++++++++++++++++++++++++++++++++++++++++++++++<br /><br />Ich spiele hauptsächlich (rundenbasierte) Strategiespiele und (Wirtschafts-)Simulationen, aber auch Anderes, das mir Spass macht. Schau doch einfach mal in ein Game, das ich hier rocke und bilde dir eine eigene Meinung. Diese darfst du mir natürlich auch mitteilen.<br />Let\'s rock the games! & die Welt! <br />und nicht umgekehrt ;-)<br /><br />++++++++++++++++++++++++++++++++++++++++++++++++++++++++<br /><br />Upload: wann dann um 12:30 Uhr<br /><br />++++++++++++++++++++++++++++++++++++++++++++++++++++++++<br /><br />mein Facebook<br />lausiges Gezwitscher: @gamerocker.lp<br />Kein Instagram oder Ähnliches<br />Twitch: twitch.tv/gamerocker<br />Keine Homepage (was ist das eigentlich?)<br />Aber ein Zuhause.<br /><br />Vell Spass!', 'https://yt3.ggpht.com/a/AATXAJzkqoZsf67eUNMQu76lYBTBd3-qxKtqBAokp-1Upg=s88-c-k-c0xffffffff-no-rj-mo', '', '', '', '', 'gamerocker', 'gamerocker.lp', '-4-11-20-', '17.02.2014', '201017-11', '201017-11', 9, 45, 70, 100, 108, 114, NULL, 1169, 8262, 20771, 27343, 31005, 33835, NULL, 1387, NULL, 'LATE NIGHT Vollmondstream 2020/10 ¦ schweizerdeutsch', 'Snmv10dl6AA', '<td class=\"yt-lastvideo\" data-sort=\"201011123002\" data-utime=\"201017-11\"><a href=\"https://youtu.be/Snmv10dl6AA\" title=\"LATE NIGHT Vollmondstream 2020/10 ¦ schweizerdeutsch\" target=\"_blank\">So. 11.10.20</a><div class=\"info\"><div class=\"close\"></div><div class=\"circle\" style=\"background-image:url(https://i4.ytimg.com/vi/Snmv10dl6AA/hqdefault.jpg)\"></div><p>LATE NIGHT Vollmondstream 2020/10 ¦ schweizerdeutsch<br><br>Views: 1 &nbsp; Ø/Video: 24<br>Veröffentlicht am: So. 11.10.20 um 12:30 Uhr</p><div class=\"abobar\"><a href=\"https://youtu.be/Snmv10dl6AA\" target=\"_blank\" class=\"red\">zum Video</a></div></div></td>', 1, '2020-10-11T10:30:02+00:00', '201011123002', 'ch');
INSERT INTO `channels` VALUES (126, 0, 'UCyX_EEcey41KF0rEGO6vxnw', 'Andreas Glarner', 'Herzlich willkommen auf meinem Youtube-Kanal. Hier finden Sie politische Statements, meine Voten aus dem Nationalrat und Sie erfahren über meine Tätigkeiten fernab der Politik. In der Rubrik/Playlist \"Glarner trifft\" spreche ich regelmässig mit spannenden Persönlichkeiten aus Politik, Wirtschaft und Gesellschaft. Gerne helfe ich Ihnen, wenn Sie eine Frage haben oder auf einen Missstand hinweisen möchten. Schicken Sie einfach eine Videobotschaft auf andreas@glarner.tv und ich gebe Ihnen Antwort. Viel Spass beim Durchstöbern. <br />Ihr Andreas Glarner', 'https://yt3.ggpht.com/a/AATXAJzJx38yeh8Rr7mlQKPG6y-pTf4LhadEbHmnMA=s88-c-k-c0xffffffff-no-rj-mo', '', '', '', '', '', '', '-10-', '08.09.2019', '201017-11', '201017-11', 0, 0, 0, 0, 93, 126, NULL, 0, 0, 0, 0, 12122, 17253, NULL, 72, NULL, 'Aufhebung SUVA-Teilmonopol', 'MLQY2paSv9I', '<td class=\"yt-lastvideo\" data-sort=\"200917080730\" data-utime=\"201017-11\"><a href=\"https://youtu.be/MLQY2paSv9I\" title=\"Aufhebung SUVA-Teilmonopol\" target=\"_blank\">Do. 17.09.20</a><div class=\"info\"><div class=\"close\"></div><div class=\"circle\" style=\"background-image:url(https://i2.ytimg.com/vi/MLQY2paSv9I/hqdefault.jpg)\"></div><p>Aufhebung SUVA-Teilmonopol<br><br>Views: 51 &nbsp; Ø/Video: 240<br>Veröffentlicht am: Do. 17.09.20 um 08:07 Uhr</p><div class=\"abobar\"><a href=\"https://youtu.be/MLQY2paSv9I\" target=\"_blank\" class=\"red\">zum Video</a></div></div></td>', 51, '2020-09-17T06:07:30+00:00', '200917080730', 'ch');
INSERT INTO `channels` VALUES (127, 1, 'UCF2FCkyBRafy1FI2j86IP1Q', 'All In Music', 'Infos & Fragen<br />Email: allin12.prod@outlook.com<br />Instagram: @nanditomusic_<br />Instagram: @allin12.prod<br />Instagram: @dpm.off<br />Instagram: @micka_0fficial<br />Instagram: @elevenmusica_', 'https://yt3.ggpht.com/a/AATXAJyKPYSsv2Mkj87Q1Gi0OYIUqOKz08nNG_uH5yf5cg=s88-c-k-c0xffffffff-no-rj-mo', '', 'https://www.youtube.com/allinmusic', '', '', '', '', '-8-', '11.02.2019', '201016-20', '201017-11', 0, 0, 0, 0, 569, 688, NULL, 0, 0, 0, 0, 57731, 87785, NULL, 7, NULL, 'BUNTE CA$H - MICKA Feat. NANDITO', 'wkJ3Gbc2NwU', '<td class=\"yt-lastvideo\" data-sort=\"191214141512\" data-utime=\"201017-11\"><a href=\"https://youtu.be/wkJ3Gbc2NwU\" title=\"BUNTE CA$H - MICKA Feat. NANDITO\" target=\"_blank\">Sa. 14.12.19</a><div class=\"info\"><div class=\"close\"></div><div class=\"circle\" style=\"background-image:url(https://i4.ytimg.com/vi/wkJ3Gbc2NwU/hqdefault.jpg)\"></div><p>BUNTE CA$H - MICKA Feat. NANDITO<br><br>Views: 6843 &nbsp; Ø/Video: 12541<br>Veröffentlicht am: Sa. 14.12.19 um 14:15 Uhr</p><div class=\"abobar\"><a href=\"https://youtu.be/wkJ3Gbc2NwU\" target=\"_blank\" class=\"red\">zum Video</a></div></div></td>', 6843, '2019-12-14T13:15:12+00:00', '191214141512', 'ch');
INSERT INTO `channels` VALUES (128, 0, 'UC32nI00UHzvDyUNIrkykGPQ', 'BURNING_KEYS', 'Dave Bichsel aka BURNING_KEYS / Luck`n`LOLer, ist ein begeisterter Musiker / Gamer, im Level 37<br /><br />...und wahrscheinlich durch die BASS DRUM auf die Welt gekrochen, hat 6 Jahre Klavierunterricht genossen und in etlichen Formationen, hauptsächlich als Drummer musiziert. Später kamen auch elektronische Sampling Arrangements, die per Drum Computer integriert wurden, dazu. Da ich zur Zeit in keiner Band tätig bin, widme ich mich dem SOUNDTRACK COMPOSING und dies bereitet mir sehr viel Spass ! Dokumentarfilme, Trailer, Clips, bis hin zu Kurzfilme, kann ich dir mit meiner modernen Filmmusik untermalen.<br /><br />\"YOU TELL THE STORY, I SET THE TONE\"<br /><br />Aber VORSICHT...seit kurzem hab ich durch ein nicht ganz harmloses Ereignis, das Drumming wieder entfacht und mache sporadische Live Streams mit meinem akkustik Set. Ich spiele zu euren Sound Wünschen so gut es geht ;-) schau rein auf twitch.tv/luck_n_loler und lets groove ^^<br /><br />cheers Dave', 'https://yt3.ggpht.com/a/AATXAJw6kmPcq-_iXVubuMCugrj9kC2h5FERuY05CTDMkQ=s88-c-k-c0xffffffff-no-rj-mo', 'Dave Bichsel', 'https://www.youtube.com/burningkeys', '', '', 'luck_n_loler', 'dave_bichsel', '-4-8-11-', '26.01.2008', '201017-11', '201017-11', 79, 81, 86, 98, 112, 129, NULL, 52722, 55021, 57399, 60776, 64247, 66994, NULL, 73, NULL, '\"Typical\" by Mute Math - Live Drum Cover', 'TbCuJoXyar8', '<td class=\"yt-lastvideo\" data-sort=\"201006160015\" data-utime=\"201017-11\"><a href=\"https://youtu.be/TbCuJoXyar8\" title=\"\"Typical\" by Mute Math - Live Drum Cover\" target=\"_blank\">Di. 06.10.20</a><div class=\"info\"><div class=\"close\"></div><div class=\"circle\" style=\"background-image:url(https://i1.ytimg.com/vi/TbCuJoXyar8/hqdefault.jpg)\"></div><p>\"Typical\" by Mute Math - Live Drum Cover<br><br>Views: 18 &nbsp; Ø/Video: 918<br>Veröffentlicht am: Di. 06.10.20 um 16:00 Uhr</p><div class=\"abobar\"><a href=\"https://youtu.be/TbCuJoXyar8\" target=\"_blank\" class=\"red\">zum Video</a></div></div></td>', 18, '2020-10-06T14:00:15+00:00', '201006160015', 'ch');
INSERT INTO `channels` VALUES (129, 1, 'UCNuY3fBjqnbUfX_nI1ewu3A', 'Roki', 'Jo zämme herzlich Willkomme uf min Kanal! <br /><br />Travelvideos und cinematics.<br /><br />Alle Infos zu meinem Equipment ist in der Videobeschreibung.<br />Infos zur Musik  🎵 in der Videobeschreibung.<br />Impressum/Kontakt per E-Mail 📧', 'https://yt3.ggpht.com/a/AATXAJyoaDoziZjtiD6bLj43VCGY-zDySZjRU10NQKsddA=s88-c-k-c0xffffffff-no-rj-mo', '', 'https://www.youtube.com/rokiofficial', '', '', '', 'yt_roki', '-6-', '26.10.2016', '201016-20', '201017-11', 0, 0, 722, 831, 829, 817, NULL, 0, 0, 10549, 11782, 21759, 1727, NULL, 7, NULL, 'Amsterdam 🇳🇱, Brüssel 🇧🇪 and Luxembourg 🇱🇺 Trip 2019 | Travel Video', 'FzH6St6IN0M', '<td class=\"yt-lastvideo\" data-sort=\"191020181500\" data-utime=\"201017-11\"><a href=\"https://youtu.be/FzH6St6IN0M\" title=\"Amsterdam 🇳🇱, Brüssel 🇧🇪 and Luxembourg 🇱🇺 Trip 2019 | Travel Video\" target=\"_blank\">So. 20.10.19</a><div class=\"info\"><div class=\"close\"></div><div class=\"circle\" style=\"background-image:url(https://i3.ytimg.com/vi/FzH6St6IN0M/hqdefault.jpg)\"></div><p>Amsterdam 🇳🇱, Brüssel 🇧🇪 and Luxembourg 🇱🇺 Trip 2019 | Travel Video<br><br>Views: 117 &nbsp; Ø/Video: 247<br>Veröffentlicht am: So. 20.10.19 um 18:15 Uhr</p><div class=\"abobar\"><a href=\"https://youtu.be/FzH6St6IN0M\" target=\"_blank\" class=\"red\">zum Video</a></div></div></td>', 117, '2019-10-20T16:15:00+00:00', '191020181500', 'ch');
INSERT INTO `channels` VALUES (130, 1, 'UCpSfhhi8mb__QoZ6lxeiorQ', 'StudioZweiSechs', 'Swiss Filmer Based In Switzerland<br />Videos Genres: Mountainbiking, Motocross, Snowboarding And Drones. Check out my 2nd Channel ZweiSechsFPV for Cinematic and Freestyle Drone Videos. <br />100% Selfmade With Help Of My Cameras: GoPro Hero 2 & 5 And Yuneec Typhoon H With CGO3+<br /><br />Follow Me On Facebook (StudioZweiSechs) & Instagram (Studiozweisechs)<br /><br />Link Below<br />Thanks For Watching :-D<br /><br />For Buissnes Contact: studiozweisechs@gmail.com<br /><br />(C) Copyrights by Tobias Walser', 'https://yt3.ggpht.com/a/AATXAJwaPgcHbuGuIFUMZv0uAqS21J0CZrXHh2EDl-a8OQ=s88-c-k-c0xffffffff-no-rj-mo', 'Tobias Walser', 'https://www.youtube.com/StudioZweiSechs', '', '', '', 'StudioZweiSechs', '-5-', '03.10.2015', '201016-20', '201017-11', 0, 12, 44, 119, 144, 168, NULL, 0, 6726, 19378, 46369, 64540, 84210, NULL, 65, NULL, 'Chörbsch Horn Trail | Standort & Full Trail | Davos Klosters Parsenn | EpicAlps Trail kann einpacken', '1oe_x60VPZM', '<td class=\"yt-lastvideo\" data-sort=\"190919213631\" data-utime=\"201017-11\"><a href=\"https://youtu.be/1oe_x60VPZM\" title=\"Chörbsch Horn Trail | Standort & Full Trail | Davos Klosters Parsenn | EpicAlps Trail kann einpacken\" target=\"_blank\">Do. 19.09.19</a><div class=\"info\"><div class=\"close\"></div><div class=\"circle\" style=\"background-image:url(https://i2.ytimg.com/vi/1oe_x60VPZM/hqdefault.jpg)\"></div><p>Chörbsch Horn Trail | Standort & Full Trail | Davos Klosters Parsenn | EpicAlps Trail kann einpacken<br><br>Views: 565 &nbsp; Ø/Video: 1296<br>Veröffentlicht am: Do. 19.09.19 um 21:36 Uhr</p><div class=\"abobar\"><a href=\"https://youtu.be/1oe_x60VPZM\" target=\"_blank\" class=\"red\">zum Video</a></div></div></td>', 565, '2019-09-19T19:36:31+00:00', '190919213631', 'ch');
INSERT INTO `channels` VALUES (131, 0, 'UCJF0pAawcNhH0j2jeGKi6qQ', 'NAJAnja', 'Hey ;) <br />Kei Plan, wie du do glandet bisch<br />Aber wenns dir do gfallt, loh doch es Abo do :)', 'https://yt3.ggpht.com/a/AATXAJziBBe6Ya5HBYijyL84OOJ6j5LwtsAMmvgEhtE4NA=s88-c-k-c0xffffffff-no-rj-mo', '', '', '', '', '', 'najanja_', '-6-', '24.04.2020', '201017-11', '201017-11', 0, 0, 0, 0, 0, 73, NULL, 0, 0, 0, 0, 0, 359, NULL, 1, NULL, 'Schwarzwäldertorte bache - mis erschte Video | NAJAnja', 'kHWdg3LWXs4', '<td class=\"yt-lastvideo\" data-sort=\"200809190009\" data-utime=\"201017-11\"><a href=\"https://youtu.be/kHWdg3LWXs4\" title=\"Schwarzwäldertorte bache - mis erschte Video | NAJAnja\" target=\"_blank\">So. 09.08.20</a><div class=\"info\"><div class=\"close\"></div><div class=\"circle\" style=\"background-image:url(https://i4.ytimg.com/vi/kHWdg3LWXs4/hqdefault.jpg)\"></div><p>Schwarzwäldertorte bache - mis erschte Video | NAJAnja<br><br>Views: 359 &nbsp; Ø/Video: 359<br>Veröffentlicht am: So. 09.08.20 um 19:00 Uhr</p><div class=\"abobar\"><a href=\"https://youtu.be/kHWdg3LWXs4\" target=\"_blank\" class=\"red\">zum Video</a></div></div></td>', 359, '2020-08-09T17:00:09+00:00', '200809190009', 'ch');
INSERT INTO `channels` VALUES (132, 0, 'UCpNH2AFiI0G4ZHQSRqJb7fw', 'SAR - Neon & Santa', 'SAR Recordz', 'https://yt3.ggpht.com/a/AATXAJxRHlxl7LNEMJOBEVGz0Jx51yRK8SuY5oLA1nbdmA=s88-c-k-c0xffffffff-no-rj-mo', '', 'https://www.youtube.com/sarrec', '', '', '', '', '-8-', '19.05.2013', '201017-11', '201017-11', 0, 0, 144, 182, 215, 239, NULL, 0, 0, 28915, 36745, 26414, 28347, NULL, 19, NULL, 'Neon - Honey (Official Video)', 'As0TXtrARMY', '<td class=\"yt-lastvideo\" data-sort=\"200710183011\" data-utime=\"201017-11\"><a href=\"https://youtu.be/As0TXtrARMY\" title=\"Neon - Honey (Official Video)\" target=\"_blank\">Fr. 10.07.20</a><div class=\"info\"><div class=\"close\"></div><div class=\"circle\" style=\"background-image:url(https://i2.ytimg.com/vi/As0TXtrARMY/hqdefault.jpg)\"></div><p>Neon - Honey (Official Video)<br><br>Views: 1477 &nbsp; Ø/Video: 1492<br>Veröffentlicht am: Fr. 10.07.20 um 18:30 Uhr</p><div class=\"abobar\"><a href=\"https://youtu.be/As0TXtrARMY\" target=\"_blank\" class=\"red\">zum Video</a></div></div></td>', 1477, '2020-07-10T16:30:11+00:00', '200710183011', 'ch');
INSERT INTO `channels` VALUES (133, 0, 'UC92YEZ9Yti0uhzusW40HoGw', 'Güschä', 'Güschä mag rosa Lichter, fancy Sonnenbrillen und Tracksuits mit Schulterpolster. Er sieht aus als wäre er in den 80ies stehengeblieben. Obwohl er gar nie dort war.', 'https://yt3.ggpht.com/a/AATXAJxEQ4xlFBP7NCjQEiyiTEiYHc7H90BbtjY9GkUV=s88-c-k-c0xffffffff-no-rj-mo', 'Marco Gurtner', '', 'https://marcozy.tumblr.com', '', '', 'marrcozzy', '-8-', '17.04.2020', '201017-11', '201017-11', 0, 0, 0, 0, 0, 74, NULL, 0, 0, 0, 0, 0, 6090, NULL, 1, NULL, 'Güschä – Geil Wids Machsch feat. Knackeboul', 'FR0EOt9rpK8', '<td class=\"yt-lastvideo\" data-sort=\"200501100013\" data-utime=\"201017-11\"><a href=\"https://youtu.be/FR0EOt9rpK8\" title=\"Güschä – Geil Wids Machsch feat. Knackeboul\" target=\"_blank\">Fr. 01.05.20</a><div class=\"info\"><div class=\"close\"></div><div class=\"circle\" style=\"background-image:url(https://i3.ytimg.com/vi/FR0EOt9rpK8/hqdefault.jpg)\"></div><p>Güschä – Geil Wids Machsch feat. Knackeboul<br><br>Views: 6090 &nbsp; Ø/Video: 6090<br>Veröffentlicht am: Fr. 01.05.20 um 10:00 Uhr</p><div class=\"abobar\"><a href=\"https://youtu.be/FR0EOt9rpK8\" target=\"_blank\" class=\"red\">zum Video</a></div></div></td>', 6090, '2020-05-01T08:00:13+00:00', '200501100013', 'ch');
INSERT INTO `channels` VALUES (134, 0, 'UCNgPDdl-jnr7uIidc5Ydi9w', 'Swissly', 'Oh, du hier? Freut mich sehr dass du vorbeischaust!<br /><br />Was erwartet dich hier:<br /><br />Zeugs aus meinem Reallife<br />Meine Meinungen<br />Alles zum Thema gaming<br />Politik<br />Vlogs<br />und natürlich vieles mehr!<br /><br />Zur meiner Person: Mein Name ist Fabian, ich wohne in der Schweiz und bin 20 Jahre alt. Youtube war ist schon lange ein Hobby von mir. Vor über einem Jahr gründete ich meinen Hauptkanal Swiss Warface, wo sich alles um den Free to play shooter Warrface dreht.', 'https://yt3.ggpht.com/a/AATXAJxFeOLrgU24iHq1ufPBjF8JycrLAKJMnJ6LcCKM=s88-c-k-c0xffffffff-no-rj-mo', 'Fabian Heimgartner', 'https://www.youtube.com/swissly', '', '', '', 'swiss.yt', '-4-', '21.09.2016', '201017-11', '201017-11', 0, 106, 161, 147, 143, 557, NULL, 0, 388, 4985, 5044, 5075, 32322, NULL, 20, NULL, 'SNIPER der MILITÄRPOLIZEI [Schweizer Armee]', 'dNiBRee-gzs', '<td class=\"yt-lastvideo\" data-sort=\"201014175238\" data-utime=\"201017-11\"><a href=\"https://youtu.be/dNiBRee-gzs\" title=\"SNIPER der MILITÄRPOLIZEI [Schweizer Armee]\" target=\"_blank\">Mi. 14.10.20</a><div class=\"info\"><div class=\"close\"></div><div class=\"circle\" style=\"background-image:url(https://i1.ytimg.com/vi/dNiBRee-gzs/hqdefault.jpg)\"></div><p>SNIPER der MILITÄRPOLIZEI [Schweizer Armee]<br><br>Views: 706 &nbsp; Ø/Video: 1616<br>Veröffentlicht am: Mi. 14.10.20 um 17:52 Uhr</p><div class=\"abobar\"><a href=\"https://youtu.be/dNiBRee-gzs\" target=\"_blank\" class=\"red\">zum Video</a></div></div></td>', 706, '2020-10-14T15:52:38+00:00', '201014175238', 'ch');
INSERT INTO `channels` VALUES (135, 0, 'UCUlAKNDJ5QviM79lN1eK0Yg', 'K1ngda Ka88', 'POV´s and K´nex coasters in Full HD.', 'https://yt3.ggpht.com/a/AATXAJyzkJIE4Wvo3nBVVpNMGFvX2V6XkpcpYQ6q6xXASg=s88-c-k-c0xffffffff-no-rj-mo', 'Lukas Wehrli', 'https://www.youtube.com/k1ngdaka88', '', '', '', 'k1ngdaka88', '-1-7-', '10.11.2011', '201017-11', '201017-11', 0, 172, 226, 266, 343, 396, NULL, 0, 47012, 67180, 87178, 129395, 163600, NULL, 235, NULL, 'Space Booster - Energylandia (Onride) 2019', 'SQoco48QTzU', '<td class=\"yt-lastvideo\" data-sort=\"200919224126\" data-utime=\"201017-11\"><a href=\"https://youtu.be/SQoco48QTzU\" title=\"Space Booster - Energylandia (Onride) 2019\" target=\"_blank\">Sa. 19.09.20</a><div class=\"info\"><div class=\"close\"></div><div class=\"circle\" style=\"background-image:url(https://i4.ytimg.com/vi/SQoco48QTzU/hqdefault.jpg)\"></div><p>Space Booster - Energylandia (Onride) 2019<br><br>Views: 83 &nbsp; Ø/Video: 696<br>Veröffentlicht am: Sa. 19.09.20 um 22:41 Uhr</p><div class=\"abobar\"><a href=\"https://youtu.be/SQoco48QTzU\" target=\"_blank\" class=\"red\">zum Video</a></div></div></td>', 83, '2020-09-19T20:41:26+00:00', '200919224126', 'ch');
INSERT INTO `channels` VALUES (136, 0, 'UC0Zdm70gCb2sQkX17_AlANA', 'Michito', 'Hey, ich bin de Michito und din persönliche Gastgeber uf dem Channel! 😁✌🏼<br /><br />Nice, dasss du genau bi mir glandet bisch! Ich hoffe, dass ich dich chan underhalte & wünsch dr vil spass bim erkunde vo dem nöd ganz normale Youtube-Kanal. 😂🤙🏼', 'https://yt3.ggpht.com/a/AATXAJw4YlUjiXbXpm6lmMe05uKKewSmJIQT726XBuayVA=s88-c-k-c0xffffffff-no-rj-mo', '', '', '', '', '', 'michito96', '-6-20-', '24.01.2017', '201017-11', '201017-11', 0, 0, 264, 481, 978, 1220, NULL, 0, 0, 4758, 15437, 30934, 41038, NULL, 39, NULL, 'Söll ich mir en MOUSTACHE wachse lah? 😅 (Q&A)', '47GtBOa8O3k', '<td class=\"yt-lastvideo\" data-sort=\"200415180002\" data-utime=\"201017-11\"><a href=\"https://youtu.be/47GtBOa8O3k\" title=\"Söll ich mir en MOUSTACHE wachse lah? 😅 (Q&A)\" target=\"_blank\">Mi. 15.04.20</a><div class=\"info\"><div class=\"close\"></div><div class=\"circle\" style=\"background-image:url(https://i1.ytimg.com/vi/47GtBOa8O3k/hqdefault.jpg)\"></div><p>Söll ich mir en MOUSTACHE wachse lah? 😅 (Q&A)<br><br>Views: 705 &nbsp; Ø/Video: 1052<br>Veröffentlicht am: Mi. 15.04.20 um 18:00 Uhr</p><div class=\"abobar\"><a href=\"https://youtu.be/47GtBOa8O3k\" target=\"_blank\" class=\"red\">zum Video</a></div></div></td>', 705, '2020-04-15T16:00:02+00:00', '200415180002', 'ch');
INSERT INTO `channels` VALUES (137, 0, 'UCLcbN5TRR017Y3zfP-8b1wA', 'Forever Yung', 'Contact; musikpere@gmail.com<br /><br />Music Youtube channel from<br />Yung Jamps and Begi Jones<br /><br />Swiss Musicians, Rappers, Songwriters', 'https://yt3.ggpht.com/a/AATXAJyNff9I7Be2QIC5enhZqvzZyUYPW6weIwjuTNpO=s88-c-k-c0xffffffff-no-rj-mo', '', '', '', '', '', 'yungjamps', '-8-', '27.06.2015', '201017-11', '201017-11', 0, 0, 0, 0, 183, 180, NULL, 0, 0, 0, 0, 12001, 6008, NULL, 5, NULL, 'Yung Jamps x BASIC - MGF', 'Nwt3IBgyNbM', '<td class=\"yt-lastvideo\" data-sort=\"200801201512\" data-utime=\"201017-11\"><a href=\"https://youtu.be/Nwt3IBgyNbM\" title=\"Yung Jamps x BASIC - MGF\" target=\"_blank\">Sa. 01.08.20</a><div class=\"info\"><div class=\"close\"></div><div class=\"circle\" style=\"background-image:url(https://i3.ytimg.com/vi/Nwt3IBgyNbM/hqdefault.jpg)\"></div><p>Yung Jamps x BASIC - MGF<br><br>Views: 143 &nbsp; Ø/Video: 1202<br>Veröffentlicht am: Sa. 01.08.20 um 20:15 Uhr</p><div class=\"abobar\"><a href=\"https://youtu.be/Nwt3IBgyNbM\" target=\"_blank\" class=\"red\">zum Video</a></div></div></td>', 143, '2020-08-01T18:15:12+00:00', '200801201512', 'ch');
INSERT INTO `channels` VALUES (138, 0, 'UC9X7VYpRVSC7cfAxoUJuKtA', 'BuskapéTV', '', 'https://yt3.ggpht.com/a/AATXAJwwbg8qQdmgCOGiHe0PDXQXLaGta0QCPZLqQvsx=s88-c-k-c0xffffffff-no-rj-mo', '', '', 'http://buskape.ch', '', '', '', '-8-', '10.01.2011', '201017-11', '201017-11', 0, 0, 32, 32, 32, 56, NULL, 0, 0, 9242, 9743, 10035, 14403, NULL, 15, NULL, 'Buskapé - Paul Gascoigne (Home Edition)', 'enR3g12ad38', '<td class=\"yt-lastvideo\" data-sort=\"200329120152\" data-utime=\"201017-11\"><a href=\"https://youtu.be/enR3g12ad38\" title=\"Buskapé - Paul Gascoigne (Home Edition)\" target=\"_blank\">So. 29.03.20</a><div class=\"info\"><div class=\"close\"></div><div class=\"circle\" style=\"background-image:url(https://i2.ytimg.com/vi/enR3g12ad38/hqdefault.jpg)\"></div><p>Buskapé - Paul Gascoigne (Home Edition)<br><br>Views: 1793 &nbsp; Ø/Video: 960<br>Veröffentlicht am: So. 29.03.20 um 12:01 Uhr</p><div class=\"abobar\"><a href=\"https://youtu.be/enR3g12ad38\" target=\"_blank\" class=\"red\">zum Video</a></div></div></td>', 1793, '2020-03-29T10:01:52+00:00', '200329120152', 'ch');
INSERT INTO `channels` VALUES (139, 0, 'UCi6OZKCxLTLY3qmI5l_ot9w', 'Soukey', '', 'https://yt3.ggpht.com/a/AATXAJwUQqi7R2Nc6g49RcoQGTHjRJDKuQl2629wgd6CqQ=s88-c-k-c0xffffffff-no-rj-mo', '', '', '', '', '', '', '-8-', '07.07.2014', '201017-11', '201017-11', 0, 0, 0, 0, 768, 888, NULL, 0, 0, 0, 0, 36393, 53197, NULL, 5, NULL, 'TÜFFUSKREIS', 'ziuu6YNmCNA', '<td class=\"yt-lastvideo\" data-sort=\"200427211036\" data-utime=\"201017-11\"><a href=\"https://youtu.be/ziuu6YNmCNA\" title=\"TÜFFUSKREIS\" target=\"_blank\">Mo. 27.04.20</a><div class=\"info\"><div class=\"close\"></div><div class=\"circle\" style=\"background-image:url(https://i3.ytimg.com/vi/ziuu6YNmCNA/hqdefault.jpg)\"></div><p>TÜFFUSKREIS<br><br>Views: 1272 &nbsp; Ø/Video: 10639<br>Veröffentlicht am: Mo. 27.04.20 um 21:10 Uhr</p><div class=\"abobar\"><a href=\"https://youtu.be/ziuu6YNmCNA\" target=\"_blank\" class=\"red\">zum Video</a></div></div></td>', 1272, '2020-04-27T19:10:36+00:00', '200427211036', 'ch');
INSERT INTO `channels` VALUES (140, 0, 'UCaM1ElekeCdDiZJiSm-KNHA', 'Hipster Gnogg', 'Hipster Gnogg isch e schwizerdütsche YouTube-Kanau, gründet im Jahr 2013.<br />Mir si dr Nik und dr Morris us Bärn, und Videos für YouTube z produziere isch üsi Lideschaft.<br /><br />Uf dem Kanau erschine verschideni Videos, vo Unterhaltig über Fuessbau bis hin zu ernste Theme.<br /><br />Es freut üs sehr, we du Hipster Gnogg mitemne Abo unterstützisch.<br /><br /><br />Für geschäftliche Anfragen: gnogg12@gmail.com<br /><br /><br />©Hipster Gnogg', 'https://yt3.ggpht.com/a/AATXAJz_B3pVgttfNNIyJ_o955-f5Os8U-bq-8gXvVMIWA=s88-c-k-c0xffffffff-no-rj-mo', 'Nik und Morris', 'https://www.youtube.com/HipsterGnogg', 'https://hipstergnogg.jimdo.com', '', '', 'hipstergnogg', '-6-25-', '09.12.2012', '201017-11', '201017-11', 1125, 13705, 21132, 24299, 24100, 23600, NULL, 40399, 302953, 571665, 1017155, 804275, 839179, NULL, 96, NULL, 'Lieblingsschüeler und viu Ferie: LEHRER reagiere uf VORURTEIL', 'Q49Gk-xS9k4', '<td class=\"yt-lastvideo\" data-sort=\"200711170008\" data-utime=\"201017-11\"><a href=\"https://youtu.be/Q49Gk-xS9k4\" title=\"Lieblingsschüeler und viu Ferie: LEHRER reagiere uf VORURTEIL\" target=\"_blank\">Sa. 11.07.20</a><div class=\"info\"><div class=\"close\"></div><div class=\"circle\" style=\"background-image:url(https://i2.ytimg.com/vi/Q49Gk-xS9k4/hqdefault.jpg)\"></div><p>Lieblingsschüeler und viu Ferie: LEHRER reagiere uf VORURTEIL<br><br>Views: 1238 &nbsp; Ø/Video: 8741<br>Veröffentlicht am: Sa. 11.07.20 um 17:00 Uhr</p><div class=\"abobar\"><a href=\"https://youtu.be/Q49Gk-xS9k4\" target=\"_blank\" class=\"red\">zum Video</a></div></div></td>', 1238, '2020-07-11T15:00:08+00:00', '200711170008', 'ch');
INSERT INTO `channels` VALUES (141, 0, 'UCO8Spz1GVJRzcJ3zBcFl5SQ', 'SwissIceHockey', 'The official YouTube channel of the Swiss Ice Hockey Federation', 'https://yt3.ggpht.com/a/AATXAJwYmbzS9tWW3Fku1GxyyGMBZ4uRfuJokOwP2YB7=s88-c-k-c0xffffffff-no-rj-mo', 'Swiss Ice Hockey Federation SIHF', 'https://www.youtube.com/swissicehockeyfederation', 'https://www.sihf.ch', '', '', '', '-5-', '02.11.2010', '201017-11', '201017-11', 0, 610, 933, 1414, 2430, 3120, NULL, 0, 367638, 445516, 563374, 739774, 183307, NULL, 134, NULL, 'Education: Faceoffs mit Alina Müller | Women\'s National Team', 'eLdmVbvG5Ss', '<td class=\"yt-lastvideo\" data-sort=\"201016142809\" data-utime=\"201017-11\"><a href=\"https://youtu.be/eLdmVbvG5Ss\" title=\"Education: Faceoffs mit Alina Müller | Women\'s National Team\" target=\"_blank\">Fr. 16.10.20</a><div class=\"info\"><div class=\"close\"></div><div class=\"circle\" style=\"background-image:url(https://i2.ytimg.com/vi/eLdmVbvG5Ss/hqdefault.jpg)\"></div><p>Education: Faceoffs mit Alina Müller | Women\'s National Team<br><br>Views: 78 &nbsp; Ø/Video: 1368<br>Veröffentlicht am: Fr. 16.10.20 um 14:28 Uhr</p><div class=\"abobar\"><a href=\"https://youtu.be/eLdmVbvG5Ss\" target=\"_blank\" class=\"red\">zum Video</a></div></div></td>', 78, '2020-10-16T12:28:09+00:00', '201016142809', 'ch');
INSERT INTO `channels` VALUES (142, 0, 'UCQAc15AZelPJxl0tCAkwWsA', 'Swissrapbrandnew', '', 'https://yt3.ggpht.com/a/AATXAJwc0OFxYG8rIFJVgJcR7Q6ve8AcIqIOOPkYs7Qi=s88-c-k-c0xffffffff-no-rj-mo', '', '', '', '', '', 'swissrapbrandnew', '-6-8-', '06.02.2020', '201017-11', '201017-11', 0, 0, 0, 0, 0, 208, NULL, 0, 0, 0, 0, 0, 8644, NULL, 16, NULL, 'CRUISE CRUISE CRUISEEEE 🏎 🏎 🚓 🚓  CRIMINEL - ISMA - CRUISE', '5zmCxbQ4mbU', '<td class=\"yt-lastvideo\" data-sort=\"200520180017\" data-utime=\"201017-11\"><a href=\"https://youtu.be/5zmCxbQ4mbU\" title=\"CRUISE CRUISE CRUISEEEE 🏎 🏎 🚓 🚓  CRIMINEL - ISMA - CRUISE\" target=\"_blank\">Mi. 20.05.20</a><div class=\"info\"><div class=\"close\"></div><div class=\"circle\" style=\"background-image:url(https://i2.ytimg.com/vi/5zmCxbQ4mbU/hqdefault.jpg)\"></div><p>CRUISE CRUISE CRUISEEEE 🏎 🏎 🚓 🚓  CRIMINEL - ISMA - CRUISE<br><br>Views: 427 &nbsp; Ø/Video: 540<br>Veröffentlicht am: Mi. 20.05.20 um 18:00 Uhr</p><div class=\"abobar\"><a href=\"https://youtu.be/5zmCxbQ4mbU\" target=\"_blank\" class=\"red\">zum Video</a></div></div></td>', 427, '2020-05-20T16:00:17+00:00', '200520180017', 'ch');
INSERT INTO `channels` VALUES (143, 0, 'UCzSfehdTpCpBD-x0HFSLryA', 'Patrick Mueller', '', 'https://yt3.ggpht.com/a/AATXAJzn0k91mhlF29h9F3E6c56pGDW5wWmIhhrRn8E9Wg=s88-c-k-c0xffffffff-no-rj-mo', '', '', 'https://www.patrickmueller.ch', '', '', '', '-3-20-', '16.06.2015', '201017-11', '201017-11', 0, 0, 0, 0, 1, 1, NULL, 0, 0, 0, 0, 815, 1094, NULL, 23, NULL, 'Kurt für Menu-Casa: Isch guet, isch guet! :)', 'Ht5AuVj6Uk0', '<td class=\"yt-lastvideo\" data-sort=\"200907195329\" data-utime=\"201017-11\"><a href=\"https://youtu.be/Ht5AuVj6Uk0\" title=\"Kurt für Menu-Casa: Isch guet, isch guet! :)\" target=\"_blank\">Mo. 07.09.20</a><div class=\"info\"><div class=\"close\"></div><div class=\"circle\" style=\"background-image:url(https://i1.ytimg.com/vi/Ht5AuVj6Uk0/hqdefault.jpg)\"></div><p>Kurt für Menu-Casa: Isch guet, isch guet! :)<br><br>Views: 9 &nbsp; Ø/Video: 48<br>Veröffentlicht am: Mo. 07.09.20 um 19:53 Uhr</p><div class=\"abobar\"><a href=\"https://youtu.be/Ht5AuVj6Uk0\" target=\"_blank\" class=\"red\">zum Video</a></div></div></td>', 9, '2020-09-07T17:53:29+00:00', '200907195329', 'ch');
INSERT INTO `channels` VALUES (144, 0, 'UCH_Opu2mXlsvVVVm8Eble4Q', 'LIFEWITHLEONIE', 'Hi und willkomme uf min Kanal: LifeWithLeonie<br /><br />🔸️Ich heiss Leonie, bi 16 Johr alt und läb im schöne Basel-Land (Schweiz)<br /><br />🔹️Mini Hobbies sin Hip Hop tanze und halt YouTube mache.<br /><br />🔺️Uf däm Kanal kömme vieli verschiedeni Videos<br /><br />Also viel Spass uf däm Kanal❤<br />------------------------------------------------------------------------------<br />STALK MI...<br />Instagram➡️ daslifewithleonie<br />Twitter➡️ tweetwithleonie<br />Snapchat➡️ leonie04.gruett<br />Tik Tok➡️ daslifewithleonie15<br />Instagram Lola➡️ _lolathepomsky<br />Instagram Lana➡️ lana_das_lama_<br /><br />Und gern no ABONNIERE!!<br /><br />---Geschäftliche Anfragen---<br /><br />lifewith.leonie15@gmail.com', 'https://yt3.ggpht.com/a/AATXAJxna_sSUXYW2Se1bLQXI1T6bcT4GGpdO7_YQV0NIAw=s88-c-k-c0xffffffff-no-rj-mo', 'Leonie Grütter', 'https://www.youtube.com/lifewithleonie', '', '', '', 'daslifewithleonie', '-6-14-21-', '24.12.2014', '201017-11', '201017-11', 0, 0, 0, 161, 206, 317, NULL, 0, 0, 0, 5062, 11836, 21826, NULL, 94, NULL, '12 russischi Lieder PART 3.|| LifeWithLeonie', 'cjNjyNJhhQ0', '<td class=\"yt-lastvideo\" data-sort=\"201007180015\" data-utime=\"201017-11\"><a href=\"https://youtu.be/cjNjyNJhhQ0\" title=\"12 russischi Lieder PART 3.|| LifeWithLeonie\" target=\"_blank\">Mi. 07.10.20</a><div class=\"info\"><div class=\"close\"></div><div class=\"circle\" style=\"background-image:url(https://i4.ytimg.com/vi/cjNjyNJhhQ0/hqdefault.jpg)\"></div><p>12 russischi Lieder PART 3.|| LifeWithLeonie<br><br>Views: 83 &nbsp; Ø/Video: 232<br>Veröffentlicht am: Mi. 07.10.20 um 18:00 Uhr</p><div class=\"abobar\"><a href=\"https://youtu.be/cjNjyNJhhQ0\" target=\"_blank\" class=\"red\">zum Video</a></div></div></td>', 83, '2020-10-07T16:00:15+00:00', '201007180015', 'ch');
INSERT INTO `channels` VALUES (145, 0, 'UCLDL5dG1r05NdiEW_zq7Yhg', 'Lidl Schweiz', 'Lidl lohnt sich – auch auf YouTube.<br />Entdeckt Videos von spannenden PR-Aktionen, Infos zum Arbeitgeber Lidl Schweiz, lustige und unterhaltsame Spots mit den Hunzikers, Fitness-Videos mit Anita Buri und Produktvideos die Appetit auf mehr machen.', 'https://yt3.ggpht.com/a/AATXAJx_DumpszR_6XUp0qNlOvbrHVjgvyiXbgqql4PdUw=s88-c-k-c0xffffffff-no-rj-mo', '', 'https://www.youtube.com/lidlschweizch', 'https://www.lidl.ch', '', '', 'lidlch', '-13-', '20.12.2012', '201017-11', '201017-11', 0, 709, 764, 840, 961, 1160, NULL, 0, 4127208, 1993787, 2239651, 1020567, 3994996, NULL, 114, NULL, 'Halloween: Kürbisgesicht schnitzen Anleitung | Lidl Schweiz', 'qiZgJ2oBe0I', '<td class=\"yt-lastvideo\" data-sort=\"201016112907\" data-utime=\"201017-11\"><a href=\"https://youtu.be/qiZgJ2oBe0I\" title=\"Halloween: Kürbisgesicht schnitzen Anleitung | Lidl Schweiz\" target=\"_blank\">Fr. 16.10.20</a><div class=\"info\"><div class=\"close\"></div><div class=\"circle\" style=\"background-image:url(https://i2.ytimg.com/vi/qiZgJ2oBe0I/hqdefault.jpg)\"></div><p>Halloween: Kürbisgesicht schnitzen Anleitung | Lidl Schweiz<br><br>Views: 177 &nbsp; Ø/Video: 35044<br>Veröffentlicht am: Fr. 16.10.20 um 11:29 Uhr</p><div class=\"abobar\"><a href=\"https://youtu.be/qiZgJ2oBe0I\" target=\"_blank\" class=\"red\">zum Video</a></div></div></td>', 177, '2020-10-16T09:29:07+00:00', '201016112907', 'ch');
INSERT INTO `channels` VALUES (146, 0, 'UC73RcscxiPXmOzK_AkEiinA', 'Martin Rechsteiner', 'Ich bin Papa von drei süssen Mädels. Hier im Kanal gibts vieles zu sehen. VLOGs von unseren Ausflügen, Ferien oder auch mal beim Kochen. <br /><br />Meine zweite Tochter möchte in Zukunft gerne das eine oder andere Technik-Unboxing Video machen. <br /><br />Ansonsten, ich bin ein totaler Gadget-Liebhaber, Leidenschaftlicher Podcaster und Blogger<br /><br />#SwissBlogFamily #BahnhofsFotoCH <br />👉🏻👉🏻MO/DI/SA = #PapaTag 👈🏻👈🏻<br /><br />Meine Gadget-Tipps gibts auf dem youtube.com/PokipsieBlog Account zu sehen. <br /><br />Instagram: @pokipsie<br />Twitter: @pokipsie', 'https://yt3.ggpht.com/a/AATXAJyAnIesU7O9bUrBASCqU3qcHxKPViM-RVtpqg=s88-c-k-c0xffffffff-no-rj-mo', '', 'https://www.youtube.com/martinrechsteiner', 'https://martinrechsteiner.ch', 'https://open.spotify.com/show/7MuPNw7iD8lgqfF8rke0cu?si=q0FjWEWJRVqlcIcDED5d2A', '', 'pokipsie', '-1-6-12-18-27-', '10.10.2006', '201017-11', '201017-11', 22, 28, 38, 38, 51, 61, NULL, 4986, 5651, 6579, 7135, 8294, 5784, NULL, 26, NULL, 'Shanayas Tag in (etwas mehr als) 60 Sekunden', 'lNu8VmV_xRg', '<td class=\"yt-lastvideo\" data-sort=\"200930100105\" data-utime=\"201017-11\"><a href=\"https://youtu.be/lNu8VmV_xRg\" title=\"Shanayas Tag in (etwas mehr als) 60 Sekunden\" target=\"_blank\">Mi. 30.09.20</a><div class=\"info\"><div class=\"close\"></div><div class=\"circle\" style=\"background-image:url(https://i1.ytimg.com/vi/lNu8VmV_xRg/hqdefault.jpg)\"></div><p>Shanayas Tag in (etwas mehr als) 60 Sekunden<br><br>Views: 36 &nbsp; Ø/Video: 222<br>Veröffentlicht am: Mi. 30.09.20 um 10:01 Uhr</p><div class=\"abobar\"><a href=\"https://youtu.be/lNu8VmV_xRg\" target=\"_blank\" class=\"red\">zum Video</a></div></div></td>', 36, '2020-09-30T08:01:05+00:00', '200930100105', 'ch');
INSERT INTO `channels` VALUES (147, 0, 'UCq7oOVijWYMnAjw-iHkKkoQ', 'Sandro Schmid', '', 'https://yt3.ggpht.com/a/AATXAJym7SJS1BEAW41zo-QDZivuEPThgj8dBbXlD3G6WQ=s88-c-k-c0xffffffff-no-rj-mo', '', '', '', '', '', 'sandrusmith', '-5-33-', '04.12.2009', '201017-11', '201017-11', 0, 893, 1159, 1539, 1720, 1810, NULL, 0, 192539, 298736, 345797, 379874, 401546, NULL, 97, NULL, 'Trail Preview | Interlaken | SANDRO SCHMID', 'Cs1ka31I8g0', '<td class=\"yt-lastvideo\" data-sort=\"200725131552\" data-utime=\"201017-11\"><a href=\"https://youtu.be/Cs1ka31I8g0\" title=\"Trail Preview | Interlaken | SANDRO SCHMID\" target=\"_blank\">Sa. 25.07.20</a><div class=\"info\"><div class=\"close\"></div><div class=\"circle\" style=\"background-image:url(https://i4.ytimg.com/vi/Cs1ka31I8g0/hqdefault.jpg)\"></div><p>Trail Preview | Interlaken | SANDRO SCHMID<br><br>Views: 304 &nbsp; Ø/Video: 4140<br>Veröffentlicht am: Sa. 25.07.20 um 13:15 Uhr</p><div class=\"abobar\"><a href=\"https://youtu.be/Cs1ka31I8g0\" target=\"_blank\" class=\"red\">zum Video</a></div></div></td>', 304, '2020-07-25T11:15:52+00:00', '200725131552', 'ch');
INSERT INTO `channels` VALUES (148, 0, 'UCS9WVExKcTulB0JPgpuajRw', 'HarleyRoadrunner', 'Karmann Dexter 595 mit Hubbett  Reise-Camper', 'https://yt3.ggpht.com/a/AATXAJwlmBPuMHF_DzxKZ5lGj6HZ-JYqh_YdtokadxJaNA=s88-c-k-c0xffffffff-no-rj-mo', '', '', '', '', '', '', '-1-', '28.07.2016', '201017-11', '201017-11', 0, 0, 0, 0, 0, 23, NULL, 0, 0, 0, 0, 0, 3039, NULL, 27, NULL, 'Marokkanische  Tagine Zubereitung', 'L5yqD-uTG10', '<td class=\"yt-lastvideo\" data-sort=\"200822141857\" data-utime=\"201017-11\"><a href=\"https://youtu.be/L5yqD-uTG10\" title=\"Marokkanische  Tagine Zubereitung\" target=\"_blank\">Sa. 22.08.20</a><div class=\"info\"><div class=\"close\"></div><div class=\"circle\" style=\"background-image:url(https://i1.ytimg.com/vi/L5yqD-uTG10/hqdefault.jpg)\"></div><p>Marokkanische  Tagine Zubereitung<br><br>Views: 23 &nbsp; Ø/Video: 113<br>Veröffentlicht am: Sa. 22.08.20 um 14:18 Uhr</p><div class=\"abobar\"><a href=\"https://youtu.be/L5yqD-uTG10\" target=\"_blank\" class=\"red\">zum Video</a></div></div></td>', 23, '2020-08-22T12:18:57+00:00', '200822141857', 'ch');
INSERT INTO `channels` VALUES (149, 0, 'UChzKOhU2KgjUH4KHlu2wATA', 'SveFa on Tour', 'Wir, das sind Sven und Fabienne (SveFa), nehmen euch alle mit auf unseren Abenteuern mit dem Wohnmobil. Wir lieben das Reisen auf diese Weise und geniessen jede Minute in vollen Zügen. Unsere Vlogs sind auf Schweizerdeutsch. Wir wünschen viel Spass beim Videos Gucken. Wenn euch unsere Filme gefallen, würden wir uns sehr darüber freuen wenn Ihr uns einen Daumen hoch gebt und / oder Abonniert. So verpasst Ihr sicher keine News!', 'https://yt3.ggpht.com/a/AATXAJymwaqCkT4kG64MmDTBoWZbWvhMZxfIgBrBJI7U=s88-c-k-c0xffffffff-no-rj-mo', 'Fabienne & Sven Burkhard', '', 'http://svefa-ontour.ch', '', '', 'svefaontour', '-1-', '19.12.2016', '201017-11', '201017-11', 0, 0, 172, 414, 625, 744, NULL, 0, 0, 14591, 52874, 96713, 133263, NULL, 146, NULL, 'Biken, Wandern und Sturm im Wallis | SveFa on Tour S5 E10', 'kFsXPskuH5s', '<td class=\"yt-lastvideo\" data-sort=\"201007181806\" data-utime=\"201017-11\"><a href=\"https://youtu.be/kFsXPskuH5s\" title=\"Biken, Wandern und Sturm im Wallis | SveFa on Tour S5 E10\" target=\"_blank\">Mi. 07.10.20</a><div class=\"info\"><div class=\"close\"></div><div class=\"circle\" style=\"background-image:url(https://i4.ytimg.com/vi/kFsXPskuH5s/hqdefault.jpg)\"></div><p>Biken, Wandern und Sturm im Wallis | SveFa on Tour S5 E10<br><br>Views: 263 &nbsp; Ø/Video: 913<br>Veröffentlicht am: Mi. 07.10.20 um 18:18 Uhr</p><div class=\"abobar\"><a href=\"https://youtu.be/kFsXPskuH5s\" target=\"_blank\" class=\"red\">zum Video</a></div></div></td>', 263, '2020-10-07T16:18:06+00:00', '201007181806', 'ch');
INSERT INTO `channels` VALUES (150, 0, 'UCIZxolyyMeLrLD1KYBoX4uQ', 'Rapide x Alawi', 'R A P I D E  X  A L A W I<br />Instagram: @rapidexalawi<br />E-Mail/Bookings: rapidexalawi@gmail.com', 'https://yt3.ggpht.com/a/AATXAJx-a9F14IvJe7OOg8zYqfm586UsBf06twX1jOGLJw=s88-c-k-c0xffffffff-no-rj-mo', '', '', '', '', '', 'rapidexalawi', '-8-', '19.03.2017', '201017-11', '201017-11', 0, 0, 166, 810, 4420, 7770, NULL, 0, 0, 4159, 80994, 729988, 1711565, NULL, 16, NULL, 'Rapide - C\'EST BON (prod. by EZ)', 'nssQrp6mrCM', '<td class=\"yt-lastvideo\" data-sort=\"201015200011\" data-utime=\"201017-11\"><a href=\"https://youtu.be/nssQrp6mrCM\" title=\"Rapide - C\'EST BON (prod. by EZ)\" target=\"_blank\">Do. 15.10.20</a><div class=\"info\"><div class=\"close\"></div><div class=\"circle\" style=\"background-image:url(https://i3.ytimg.com/vi/nssQrp6mrCM/hqdefault.jpg)\"></div><p>Rapide - C\'EST BON (prod. by EZ)<br><br>Views: 12589 &nbsp; Ø/Video: 106973<br>Veröffentlicht am: Do. 15.10.20 um 20:00 Uhr</p><div class=\"abobar\"><a href=\"https://youtu.be/nssQrp6mrCM\" target=\"_blank\" class=\"red\">zum Video</a></div></div></td>', 12589, '2020-10-15T18:00:11+00:00', '201015200011', 'ch');
INSERT INTO `channels` VALUES (151, 0, 'UC4b0Zc5gTZqupfe0Twh-6RA', 'StrickerTV', 'StrickerTV - Das Echte Schweizer Tagesschau - 100% unabhängig & serafefrei', 'https://yt3.ggpht.com/a/AATXAJwKoDqZhRREo038RDb7DV9yoc4NbKqsjED6AKxe_Q=s88-c-k-c0xffffffff-no-rj-mo', '', 'https://www.youtube.com/strickertv', 'http://www.stricker.tv', '', '', 'danielstricker', '-10-', '09.09.2006', '201017-11', '201017-11', 0, 0, 177, 205, 206, 10300, NULL, 0, 0, 126425, 131114, 131757, 1154334, NULL, 299, NULL, 'Im Gespräch: Gerald Brei, Andreas Heisler & Ursula Spring von Frühling 2020', 'eiDG-HXjFfU', '<td class=\"yt-lastvideo\" data-sort=\"201016225003\" data-utime=\"201017-11\"><a href=\"https://youtu.be/eiDG-HXjFfU\" title=\"Im Gespräch: Gerald Brei, Andreas Heisler & Ursula Spring von Frühling 2020\" target=\"_blank\">Fr. 16.10.20</a><div class=\"info\"><div class=\"close\"></div><div class=\"circle\" style=\"background-image:url(https://i2.ytimg.com/vi/eiDG-HXjFfU/hqdefault.jpg)\"></div><p>Im Gespräch: Gerald Brei, Andreas Heisler & Ursula Spring von Frühling 2020<br><br>Views: 5527 &nbsp; Ø/Video: 3861<br>Veröffentlicht am: Fr. 16.10.20 um 22:50 Uhr</p><div class=\"abobar\"><a href=\"https://youtu.be/eiDG-HXjFfU\" target=\"_blank\" class=\"red\">zum Video</a></div></div></td>', 5527, '2020-10-16T20:50:03+00:00', '201016225003', 'ch');
INSERT INTO `channels` VALUES (152, 0, 'UCEABIt007mtmZS7FULdVh8Q', 'Storyflow', 'Hey! Wir sind Meli & Flo, zwei Schweizer Youtuber und Content Creator aus Aarau. Auf unserem Kanal Storyflow versorgen wir dich seit 3 Jahren mit Reise- und Ausflugstipps und inspirieren dich dazu mehr raus zu gehen und etwas zu erleben – natürlech uf Schwizzerdütsch 😉 <br /><br />Egal ob beim auf Wanderungen und Ausflügen in der Schweiz, Reisen in entfernte Länder oder bald auch aus unserem selbst umgebauten Campervan – Unser Motto «Gang usse ond schrieb dini eigeti Gschecht!» 🔥 🙌<br /><br />Ond för was schloht dis Härz? ❤️<br />Flo & Meli <br /><br />📸 INSTAGRAM - instagram.com/storyflow<br />❤️ FACEBOOK - facebook.com/StoryflowCH', 'https://yt3.ggpht.com/a/AATXAJxkhs52FrP9AedlSgN1lZv9uTM7oBtE1EPpv8P5tg=s88-c-k-c0xffffffff-no-rj-mo', 'Meli & Florian Schindler', 'https://www.youtube.com/Storyflow', 'http://storyflow.ch', '', '', 'storyflow', '-1-22-', '08.06.2015', '201017-11', '201017-11', 0, 73, 492, 990, 1450, 2050, NULL, 0, 6148, 53630, 103270, 180867, 263958, NULL, 192, NULL, 'Vanlife Stories vom Vanlife Schweiz Festival 2019 🚐🇨🇭', 'sW0BtHiFafQ', '<td class=\"yt-lastvideo\" data-sort=\"200813200006\" data-utime=\"201017-11\"><a href=\"https://youtu.be/sW0BtHiFafQ\" title=\"Vanlife Stories vom Vanlife Schweiz Festival 2019 🚐🇨🇭\" target=\"_blank\">Do. 13.08.20</a><div class=\"info\"><div class=\"close\"></div><div class=\"circle\" style=\"background-image:url(https://i4.ytimg.com/vi/sW0BtHiFafQ/hqdefault.jpg)\"></div><p>Vanlife Stories vom Vanlife Schweiz Festival 2019 🚐🇨🇭<br><br>Views: 601 &nbsp; Ø/Video: 1375<br>Veröffentlicht am: Do. 13.08.20 um 20:00 Uhr</p><div class=\"abobar\"><a href=\"https://youtu.be/sW0BtHiFafQ\" target=\"_blank\" class=\"red\">zum Video</a></div></div></td>', 601, '2020-08-13T18:00:06+00:00', '200813200006', 'ch');
INSERT INTO `channels` VALUES (153, 0, 'UCfMWwidS6nxYVuC9HSz9wDw', 'Flowcast', 'Flowcast.FM - das Konzept<br /><br />Seit der Glücksforscher Mihály Csíkszentmihályi den Begriff «Flow» definierte, versuchen<br />immer mehr Menschen im Flow zu sein. Doch was ist Flow überhaupt? Dieser Frage geht der<br />«Flowcast» nach.<br /><br />Flavio Camenzind spricht mit erfolgreichen Zeitgenossen über ihr ganz persönliches<br />Flow-Rezept: Wie wurden sie zu dem, was sie heute sind? Was treibt sie an? Und was hält<br />sie im Flow? Viele haben beruflich oder privat viel erreicht. Einige sogar alles. Weil sie<br />täglich im Flow sind. Andere sind ganz anders im Flow. Und brauchen den Erfolg nicht<br />(mehr).<br /><br />Der Flowcast setzt auf «Modelling Excellence»; also dem Lernen von den Besten. Statt<br />jahrelang die gleichen Fehler zu machen, die andere bereits gemacht haben, können die<br />Zuhörerinnen und Zuhörer die besten Erfolgsstrategien kopieren und auf Ihr Leben<br />adaptieren.', 'https://yt3.ggpht.com/a/AATXAJzDJ0y7hiSqyO52w9gkVEwmfq_0SDFcbM70-0FO=s88-c-k-c0xffffffff-no-rj-mo', 'Flavio Camenzind', 'https://www.youtube.com/flowcastfm', 'https://www.flowcast.fm', 'https://www.flowcast.fm/flowcast-podcast/', '', 'flaviocamenzind', '-9-12-18-', '12.12.2017', '201017-11', '201017-11', 0, 0, 0, 0, 442, 681, NULL, 0, 0, 0, 0, 185522, 244389, NULL, 142, NULL, 'Christoph Blochers Führungskonzept live erleben! - Flowcast on Tour mit Christoph Blocher', 'ZGOFukix8uU', '<td class=\"yt-lastvideo\" data-sort=\"201004100012\" data-utime=\"201017-11\"><a href=\"https://youtu.be/ZGOFukix8uU\" title=\"Christoph Blochers Führungskonzept live erleben! - Flowcast on Tour mit Christoph Blocher\" target=\"_blank\">So. 04.10.20</a><div class=\"info\"><div class=\"close\"></div><div class=\"circle\" style=\"background-image:url(https://i3.ytimg.com/vi/ZGOFukix8uU/hqdefault.jpg)\"></div><p>Christoph Blochers Führungskonzept live erleben! - Flowcast on Tour mit Christoph Blocher<br><br>Views: 96 &nbsp; Ø/Video: 1721<br>Veröffentlicht am: So. 04.10.20 um 10:00 Uhr</p><div class=\"abobar\"><a href=\"https://youtu.be/ZGOFukix8uU\" target=\"_blank\" class=\"red\">zum Video</a></div></div></td>', 96, '2020-10-04T08:00:12+00:00', '201004100012', 'ch');
INSERT INTO `channels` VALUES (154, 0, 'UCbeuXAKx_wm4bnNs1_WU1eA', 'PablodoesVideos', 'youtube uf schwizerdütsch! games und so', 'https://yt3.ggpht.com/a/AATXAJwIPA23KiE9NBuYzR_lvKdbzTSEW_o4LMbPyMUl=s88-c-k-c0xffffffff-no-rj-mo', '', '', '', '', '', 'pablodoesvideos', '-4-', '07.02.2020', '201017-11', '201017-11', 0, 0, 0, 0, 0, 18, NULL, 0, 0, 0, 0, 0, 703, NULL, 19, NULL, 'ROCKET LEAGUE #2 MIT DE BOYS AGAIN', 'WjGA8_AgtvY', '<td class=\"yt-lastvideo\" data-sort=\"200426173006\" data-utime=\"201017-11\"><a href=\"https://youtu.be/WjGA8_AgtvY\" title=\"ROCKET LEAGUE #2 MIT DE BOYS AGAIN\" target=\"_blank\">So. 26.04.20</a><div class=\"info\"><div class=\"close\"></div><div class=\"circle\" style=\"background-image:url(https://i4.ytimg.com/vi/WjGA8_AgtvY/hqdefault.jpg)\"></div><p>ROCKET LEAGUE #2 MIT DE BOYS AGAIN<br><br>Views: 23 &nbsp; Ø/Video: 37<br>Veröffentlicht am: So. 26.04.20 um 17:30 Uhr</p><div class=\"abobar\"><a href=\"https://youtu.be/WjGA8_AgtvY\" target=\"_blank\" class=\"red\">zum Video</a></div></div></td>', 23, '2020-04-26T15:30:06+00:00', '200426173006', 'ch');
INSERT INTO `channels` VALUES (155, 0, 'UCCdrmGY_lPJbEi3JpA0z6vA', 'S.Oppliger Design', 'Hallo, mein Name ist Oppliger Stefan.<br /><br />Ich bin gelernter Zimmermann, bin fasziniert von dem Baustoff Holz. Durch meine Weiterbildung zum Holzbau Techniker HF konnte ich mein Fachwissen erweitern.<br /><br />Ich liebe Herausforderungen. Aus diesem Grund kaufte ich mir eine CNC Fräse. Zuerst stellte ich die Produkte für den Eigengebrauch her. <br /><br />Nun möchte ich die Produkte nicht nur für mich behalten, sondern Euch allen zugänglich machen. Dies führte zur Erstellung dieses Onlineshops. soppligerdesign.ch und zum Eröffnen von diesem Youtube Kanal<br /><br />Es freut mich das Sie hier vorbeischauen und es freut mich wenn ich für Sie einzigartige Produkte herstellen darf', 'https://yt3.ggpht.com/a/AATXAJyeC6oPZoy8DOgeQAoqTm7wPmuDtmk2QntqPmGI=s88-c-k-c0xffffffff-no-rj-mo', 'Stefan Oppliger', '', 'https://www.soppligerdesign.ch', '', '', 's.oppliger_design', '-13-25-', '02.12.2014', '201017-11', '201017-11', 0, 0, 0, 0, 108, 171, NULL, 0, 0, 0, 0, 16765, 36392, NULL, 37, NULL, 'Kinderbett selber bauen V1.0 | DIY', 'NSJggEL2BUI', '<td class=\"yt-lastvideo\" data-sort=\"200704192724\" data-utime=\"201017-11\"><a href=\"https://youtu.be/NSJggEL2BUI\" title=\"Kinderbett selber bauen V1.0 | DIY\" target=\"_blank\">Sa. 04.07.20</a><div class=\"info\"><div class=\"close\"></div><div class=\"circle\" style=\"background-image:url(https://i3.ytimg.com/vi/NSJggEL2BUI/hqdefault.jpg)\"></div><p>Kinderbett selber bauen V1.0 | DIY<br><br>Views: 173 &nbsp; Ø/Video: 984<br>Veröffentlicht am: Sa. 04.07.20 um 19:27 Uhr</p><div class=\"abobar\"><a href=\"https://youtu.be/NSJggEL2BUI\" target=\"_blank\" class=\"red\">zum Video</a></div></div></td>', 173, '2020-07-04T17:27:24+00:00', '200704192724', 'ch');
INSERT INTO `channels` VALUES (156, 0, 'UCMuIx3CZpLF-BFNiBA-XyKA', 'Lieni', 'Lieni ist ein Träumer und trotzdem findet er immer wieder die richtigen Worte, um Songs zu schreiben, die hängenbleiben und nicht fernab von der Realität sind. Tiefgründige Texte mit Melodien, die Aufbruch Stimmung ankünden und zum mitsingen animieren.<br />Schubladendenken  gibt es bei ihm nicht, Arbeiten in vorgegebenen Schemen genauso wenig. Ehrliche Musik mit Texten, die direkt in die Seele gehen.Das Genre Mundart Pop Rap als seine Identität.<br />Oder wie er sagenwürde, einfach Musik mit Herz .<br /><br />Für sein Debüt Album \"Wäg\", das endlich nach 10 Jahren musizieren im Juni erscheint, wird er seine Selbstzweifel und kritische Art  für einmal vergessen lassen.', 'https://yt3.ggpht.com/a/AATXAJxOL3VuoutezZcYGByUPhA8svLZjZE3UQGZsiFJ8g=s88-c-k-c0xffffffff-no-rj-mo', '', '', 'https://www.lieni.org', '', '', 'lieni24', '-8-', '22.08.2010', '201017-11', '201017-11', 0, 0, 0, 0, 51, 96, NULL, 0, 0, 0, 0, 23537, 25428, NULL, 48, NULL, 'Lieni - Atme i Atme us ft. Raffi P', '2P0HW6nw1ho', '<td class=\"yt-lastvideo\" data-sort=\"200704172518\" data-utime=\"201017-11\"><a href=\"https://youtu.be/2P0HW6nw1ho\" title=\"Lieni - Atme i Atme us ft. Raffi P\" target=\"_blank\">Sa. 04.07.20</a><div class=\"info\"><div class=\"close\"></div><div class=\"circle\" style=\"background-image:url(https://i3.ytimg.com/vi/2P0HW6nw1ho/hqdefault.jpg)\"></div><p>Lieni - Atme i Atme us ft. Raffi P<br><br>Views: 46 &nbsp; Ø/Video: 530<br>Veröffentlicht am: Sa. 04.07.20 um 17:25 Uhr</p><div class=\"abobar\"><a href=\"https://youtu.be/2P0HW6nw1ho\" target=\"_blank\" class=\"red\">zum Video</a></div></div></td>', 46, '2020-07-04T15:25:18+00:00', '200704172518', 'ch');
INSERT INTO `channels` VALUES (157, 0, 'UCn6VgBKu93FOIgJY0dLuAzw', 'Politik CH', '', 'https://yt3.ggpht.com/a/AATXAJyeeIW-nnb1kOAwXajYrT-LnN28dEBuiBpjYTeC=s88-c-k-c0xffffffff-no-rj-mo', '', '', '', '', '', '', '-10-', '10.10.2019', '201017-11', '201017-11', 0, 0, 0, 0, 0, 388, NULL, 0, 0, 0, 0, 0, 17894, NULL, 10, NULL, 'Abstimmung über den Bundesbeschluss über die Beschaffung neuer Kampfflugzeuge. Neutral erklärt.', 'QhSmGUaSmp4', '<td class=\"yt-lastvideo\" data-sort=\"200905105901\" data-utime=\"201017-11\"><a href=\"https://youtu.be/QhSmGUaSmp4\" title=\"Abstimmung über den Bundesbeschluss über die Beschaffung neuer Kampfflugzeuge. Neutral erklärt.\" target=\"_blank\">Sa. 05.09.20</a><div class=\"info\"><div class=\"close\"></div><div class=\"circle\" style=\"background-image:url(https://i2.ytimg.com/vi/QhSmGUaSmp4/hqdefault.jpg)\"></div><p>Abstimmung über den Bundesbeschluss über die Beschaffung neuer Kampfflugzeuge. Neutral erklärt.<br><br>Views: 1300 &nbsp; Ø/Video: 1789<br>Veröffentlicht am: Sa. 05.09.20 um 10:59 Uhr</p><div class=\"abobar\"><a href=\"https://youtu.be/QhSmGUaSmp4\" target=\"_blank\" class=\"red\">zum Video</a></div></div></td>', 1300, '2020-09-05T08:59:01+00:00', '200905105901', 'ch');
INSERT INTO `channels` VALUES (158, 0, 'UC4yHZ2ki_ja39O2yw2YcfFg', 'Androto', 'Hey Du ! :)<br />im echten Leben heiße ich Jannik und bin 18 Jahre jung.<br />Was ich genau auf meinen Kanal mache? Ich weiß es selber nicht! :D<br />Ich möchte einfach meinen Traum leben und versuchen DICH zu unterhalten und zum lachen zu bringen! :)<br /><br />Viel Spaß auf meinen Kanal,<br />Jannik', 'https://yt3.ggpht.com/a/AATXAJxjDMEmcA0GrPA17P3mH_ryxhwQi9csHBhiIKss4Q=s88-c-k-c0xffffffff-no-rj-mo', 'Jannik', '', '', '', '', 'jannik0fficial', '-6-15-', '21.07.2015', '201017-11', '201017-11', 0, 15, 31, 271, 599, 658, NULL, 0, 276, 1407, 2472, 9498, 10645, NULL, 71, NULL, 'Dji mavic mini |jannik0fficial', 'wFfQlSulVwE', '<td class=\"yt-lastvideo\" data-sort=\"200808124539\" data-utime=\"201017-11\"><a href=\"https://youtu.be/wFfQlSulVwE\" title=\"Dji mavic mini |jannik0fficial\" target=\"_blank\">Sa. 08.08.20</a><div class=\"info\"><div class=\"close\"></div><div class=\"circle\" style=\"background-image:url(https://i4.ytimg.com/vi/wFfQlSulVwE/hqdefault.jpg)\"></div><p>Dji mavic mini |jannik0fficial<br><br>Views: 14 &nbsp; Ø/Video: 150<br>Veröffentlicht am: Sa. 08.08.20 um 12:45 Uhr</p><div class=\"abobar\"><a href=\"https://youtu.be/wFfQlSulVwE\" target=\"_blank\" class=\"red\">zum Video</a></div></div></td>', 14, '2020-08-08T10:45:39+00:00', '200808124539', 'ch');
INSERT INTO `channels` VALUES (159, 0, 'UCKhuZRTBAkdos5V3DWyQfQQ', 'Cédric Wermuth', 'Cédric Wermuth am 20. Oktober für den Aargau in den Ständerat.<br /><br />Für Menschen statt Profite.<br /><br />Jetzt Teil der Kampagne werden auf cedricwermuth.ch<br />Oder unterstütze uns mit einer Spende auf cedricwermuth.ch/spenden', 'https://yt3.ggpht.com/a/AATXAJwORfqaGOY8IQwIqU1kKsXMsAONdxEyEabcPyBt-A=s88-c-k-c0xffffffff-no-rj-mo', '', '', 'https://cedricwermuth.ch', '', '', 'cedricwermuth', '-10-22-', '19.02.2007', '201017-11', '201017-11', 0, 0, 0, 0, 83, 88, NULL, 0, 0, 0, 0, 81644, 82102, NULL, 8, NULL, 'Grussbotschaft zum Tag der Arbeit 2020 - aus dem Home Office', 'nuYdqF8Tdwc', '<td class=\"yt-lastvideo\" data-sort=\"200501000331\" data-utime=\"201017-11\"><a href=\"https://youtu.be/nuYdqF8Tdwc\" title=\"Grussbotschaft zum Tag der Arbeit 2020 - aus dem Home Office\" target=\"_blank\">Fr. 01.05.20</a><div class=\"info\"><div class=\"close\"></div><div class=\"circle\" style=\"background-image:url(https://i3.ytimg.com/vi/nuYdqF8Tdwc/hqdefault.jpg)\"></div><p>Grussbotschaft zum Tag der Arbeit 2020 - aus dem Home Office<br><br>Views: 343 &nbsp; Ø/Video: 10263<br>Veröffentlicht am: Fr. 01.05.20 um 00:03 Uhr</p><div class=\"abobar\"><a href=\"https://youtu.be/nuYdqF8Tdwc\" target=\"_blank\" class=\"red\">zum Video</a></div></div></td>', 343, '2020-04-30T22:03:31+00:00', '200501000331', 'ch');
INSERT INTO `channels` VALUES (160, 1, 'UCYUw18YUW012Z2ruHXR5lcw', 'Gourmendo', 'Nur für Hungrige!<br />🍕 🍺🍔🍸🍟 ☕ 🍰 🇨🇭 🌍<br />Entdecke Speisen, Drinks und Lokale in Zürich, in der Schweiz und der Welt.', 'https://yt3.ggpht.com/a/AATXAJy5ZOdQ8txW8n83GU2KDjokvEk8dYjBiq8lJUo5cA=s88-c-k-c0xffffffff-no-rj-mo', 'Ivan Schnoz', 'https://www.youtube.com/gourmendoch', 'https://gourmendo.com', '', '', 'gourmendo', '-2-', '27.08.2013', '201016-20', '201017-11', 0, 0, 0, 0, 44, 44, NULL, 0, 0, 0, 0, 6416, 7624, NULL, 16, NULL, 'Verblüffend! Apfel verhindert Ertrinken', 'SE1J0pVWMQk', '<td class=\"yt-lastvideo\" data-sort=\"190718174919\" data-utime=\"201017-11\"><a href=\"https://youtu.be/SE1J0pVWMQk\" title=\"Verblüffend! Apfel verhindert Ertrinken\" target=\"_blank\">Do. 18.07.19</a><div class=\"info\"><div class=\"close\"></div><div class=\"circle\" style=\"background-image:url(https://i4.ytimg.com/vi/SE1J0pVWMQk/hqdefault.jpg)\"></div><p>Verblüffend! Apfel verhindert Ertrinken<br><br>Views: 180 &nbsp; Ø/Video: 477<br>Veröffentlicht am: Do. 18.07.19 um 17:49 Uhr</p><div class=\"abobar\"><a href=\"https://youtu.be/SE1J0pVWMQk\" target=\"_blank\" class=\"red\">zum Video</a></div></div></td>', 180, '2019-07-18T15:49:19+00:00', '190718174919', 'ch');
INSERT INTO `channels` VALUES (161, 0, 'UCxevfQbf-z0J01OSnbUNjbw', 'Heinz de Specht', 'Musikalische Kurztherapien', 'https://yt3.ggpht.com/a/AATXAJxacOrEbPaJckzynjd6NwpK2vKlzPUfuSf8JMq-=s88-c-k-c0xffffffff-no-rj-mo', 'Christian Weiss, Daniel Schaub, Roman Riklin', 'https://www.youtube.com/heinzdespecht', 'https://www.heinzdespecht.ch', '', '', 'heinzdespecht', '-8-', '16.10.2011', '201017-11', '201017-11', 197, 607, 722, 839, 921, 969, NULL, 124895, 290515, 373490, 440891, 508463, 540734, NULL, 39, NULL, 'Heinz de Specht -  PAPIER', 'IRY6K0VZE-E', '<td class=\"yt-lastvideo\" data-sort=\"200320224036\" data-utime=\"201017-11\"><a href=\"https://youtu.be/IRY6K0VZE-E\" title=\"Heinz de Specht -  PAPIER\" target=\"_blank\">Fr. 20.03.20</a><div class=\"info\"><div class=\"close\"></div><div class=\"circle\" style=\"background-image:url(https://i2.ytimg.com/vi/IRY6K0VZE-E/hqdefault.jpg)\"></div><p>Heinz de Specht -  PAPIER<br><br>Views: 2823 &nbsp; Ø/Video: 13865<br>Veröffentlicht am: Fr. 20.03.20 um 22:40 Uhr</p><div class=\"abobar\"><a href=\"https://youtu.be/IRY6K0VZE-E\" target=\"_blank\" class=\"red\">zum Video</a></div></div></td>', 2823, '2020-03-20T21:40:36+00:00', '200320224036', 'ch');
INSERT INTO `channels` VALUES (162, 0, 'UCgS_OtFhFq5LTuyGKdafoNA', 'Coop', 'Willkommen auf unserem YouTube-Kanal. Hier erhaltet ihr spannende Neuigkeiten aus der Coop-Welt.<br /><br />Coop ist viel mehr als nur Supermarkt, Supercard & Coop Superpunkte.<br />Wir sind das vielfältigste Unternehmen der Schweiz mit einer riesigen Auswahl an Marken und Produkten. Wir sind rund 85´000 Mitarbeitende aus 120 Nationen. Wir sind Nachhaltigkeit, Frische und Genuss. Und wir sind überall da, wo ihr seid - Vor Ort und digital.<br /><br />In unseren 9 Playlists findet ihr viele spannende und lehrreiche Videos zu den verschiedensten Themen:<br />- Mondovino - Euer persönlicher Weinexperte<br />- Taten statt Worte. Nachhaltiges Engagement!<br />- Coop Lifehacks<br />- Jetzt chame grillieren<br />- Coop Familie<br />- Coop Zukunft - Coop als Arbeitgeber<br />- Coop TV-Spots<br />- Coop Festtagsstimmung<br />- Offizielle Mitteilungen <br /><br />Wir sind nah, vielfältig, profiliert, innovativ, partnerschaftlich und am wichtigsten: eins der nachhaltigsten Unternehmen der Schweiz!<br /><br />Wir freuen uns über eure Anregungen und Kommentare.<br />Viel Spass beim Entdecken!', 'https://yt3.ggpht.com/a/AATXAJwPc6CRlNdtNFFJTi2bFD-leb9x1jc0jJfYsKlLdA=s88-c-k-c0xffffffff-no-rj-mo', '', 'https://www.youtube.com/coopschweiz', 'https://www.coop.ch', '', '', 'coop.ch', '-13-', '07.02.2012', '201017-11', '201017-11', 2857, 3426, 4718, 5725, 7220, 7900, NULL, 0, 4632349, 3116195, 6747580, 9898494, 11506483, NULL, 437, NULL, 'Weisswein und Rotwein', 'RsZHsWKm140', '<td class=\"yt-lastvideo\" data-sort=\"201016001502\" data-utime=\"201017-11\"><a href=\"https://youtu.be/RsZHsWKm140\" title=\"Weisswein und Rotwein\" target=\"_blank\">Fr. 16.10.20</a><div class=\"info\"><div class=\"close\"></div><div class=\"circle\" style=\"background-image:url(https://i3.ytimg.com/vi/RsZHsWKm140/hqdefault.jpg)\"></div><p>Weisswein und Rotwein<br><br>Views: 40 &nbsp; Ø/Video: 26331<br>Veröffentlicht am: Fr. 16.10.20 um 00:15 Uhr</p><div class=\"abobar\"><a href=\"https://youtu.be/RsZHsWKm140\" target=\"_blank\" class=\"red\">zum Video</a></div></div></td>', 40, '2020-10-15T22:15:02+00:00', '201016001502', 'ch');
INSERT INTO `channels` VALUES (163, 0, 'UClcpLPCkgEl_Zhhdg0KS5eA', 'Silvan Schletti', 'Hallo! <br />Mein Name ist Silvan Schletti. <br />Auf diesem Kanal werden verschiedene Videos zu den Themen Sport, Foto und Reisen hochgeladen.', 'https://yt3.ggpht.com/a/AATXAJzxRKKoOqCuH7HnK_oQMCdZcn2stIGsKO3EDOHxVw=s88-c-k-c0xffffffff-no-rj-mo', '', '', 'https://silvan-schletti.jimdosite.com', '', '', 'silvan_schletti', '-5-6-25-', '14.01.2017', '201017-11', '201017-11', 0, 0, 0, 0, 0, 72, NULL, 0, 0, 0, 0, 0, 3168, NULL, 20, NULL, 'A dream for orienteering runners', 'zDv8WcWbqDY', '<td class=\"yt-lastvideo\" data-sort=\"200802130543\" data-utime=\"201017-11\"><a href=\"https://youtu.be/zDv8WcWbqDY\" title=\"A dream for orienteering runners\" target=\"_blank\">So. 02.08.20</a><div class=\"info\"><div class=\"close\"></div><div class=\"circle\" style=\"background-image:url(https://i3.ytimg.com/vi/zDv8WcWbqDY/hqdefault.jpg)\"></div><p>A dream for orienteering runners<br><br>Views: 77 &nbsp; Ø/Video: 158<br>Veröffentlicht am: So. 02.08.20 um 13:05 Uhr</p><div class=\"abobar\"><a href=\"https://youtu.be/zDv8WcWbqDY\" target=\"_blank\" class=\"red\">zum Video</a></div></div></td>', 77, '2020-08-02T11:05:43+00:00', '200802130543', 'ch');
INSERT INTO `channels` VALUES (164, 0, 'UCX_13xYHkyiIkMvs4mSsprA', 'WSER - Radiovision', 'WSER-Radiovision<br />Whatsoeverrecords (WSER) ist nicht ein Name, sondern eine Einstellung. Auf dem gemeinsamen Kanal von „WSER-Globalradio“, „WSER-Medivalpunk“, sowie „Transivroom“ und „3EyesOnTop“ erwarten euch eine Fülle von Musik Playlists für fast jede Stimmung. <br />Abwechslungsreiches aus der Welt der Unterhaltung sowie Wissenswertes aus Wissenschaft und Alltag ist künftig geplant. Ach ja… da war ja noch was. Ihr könnt über die Clips aus unser Sound und Video Schmiede, meckern, nörgeln, sie in der Luft zerreißen, sie doof finden, verschmähen, oder sie bestaunen, mögen und uns einen ‚like‘ schenken. Oder gar, unseren Kanal Abonnieren.', 'https://yt3.ggpht.com/a/AATXAJxrM345FTLEZHufbpEmQPtIxQ-V7kfMR-mN2UIH=s88-c-k-c0xffffffff-no-rj-mo', '', '', 'https://www.whatsoeverrecords.net', '', '', 'WSERRadiovision', '-5-9-', '02.11.2017', '201017-11', '201017-11', 0, 0, 0, 0, 0, 6, NULL, 0, 0, 0, 0, 0, 120, NULL, 17, NULL, 'Der Fuessballzyschtig 13.10.2020 | MTV Stuttgart im Finale | 2020/21 (Schweizerdeutsch)', 'BiKvqu5SqBo', '<td class=\"yt-lastvideo\" data-sort=\"201016211025\" data-utime=\"201017-11\"><a href=\"https://youtu.be/BiKvqu5SqBo\" title=\"Der Fuessballzyschtig 13.10.2020 | MTV Stuttgart im Finale | 2020/21 (Schweizerdeutsch)\" target=\"_blank\">Fr. 16.10.20</a><div class=\"info\"><div class=\"close\"></div><div class=\"circle\" style=\"background-image:url(https://i3.ytimg.com/vi/BiKvqu5SqBo/hqdefault.jpg)\"></div><p>Der Fuessballzyschtig 13.10.2020 | MTV Stuttgart im Finale | 2020/21 (Schweizerdeutsch)<br><br>Views: 0 &nbsp; Ø/Video: 7<br>Veröffentlicht am: Fr. 16.10.20 um 21:10 Uhr</p><div class=\"abobar\"><a href=\"https://youtu.be/BiKvqu5SqBo\" target=\"_blank\" class=\"red\">zum Video</a></div></div></td>', 0, '2020-10-16T19:10:25+00:00', '201016211025', 'ch');
INSERT INTO `channels` VALUES (165, 0, 'UCwlEhmHVDQkoCcKLBynkdwA', 'Odyssee Stories', 'Odysee versteht sich als eine weitreichende Plattform, <br />welche jungen Talenten ein Gehör verschaffen will. <br />Seien es aufsteigende Sportler oder musikbegabte Jugendliche wir begleiten sie bei ihrem Werdegang. Blicken hinter die Kulissen und fragen über die Vergangenheit und zukünftige Pläne und Visionen nach. Talente gibt es viele und wir möchten die, <br />die ihr Potential zur Geltung bringen wollen, unterstützen und ihnen ein Sprachrohr bieten.<br />Viele unterschiedliche Geschichten und Erfolge doch was sie alle gemeinsam haben,<br />ist ihre damit verbundene Odysee', 'https://yt3.ggpht.com/a/AATXAJzg4jIIcVykkUAuKjumVIxmkFcnPwRv6BJl31hz=s88-c-k-c0xffffffff-no-rj-mo', '', 'https://www.youtube.com/odysseestories', 'https://thisisodyssee.com', '', '', 'this.is.odyssee', '-8-', '12.11.2019', '201017-11', '201017-11', 0, 0, 0, 0, 0, 0, NULL, 0, 0, 0, 0, 0, 17510, NULL, 6, NULL, 'S.M.D │“ KLAVIERUNTERRICHT, BEWAFFNETER RAUB, 50\'000.- GEWINN “│ ODYSSEE STORIES #06', 'qye7I_SBons', '<td class=\"yt-lastvideo\" data-sort=\"200127231832\" data-utime=\"201017-11\"><a href=\"https://youtu.be/qye7I_SBons\" title=\"S.M.D │“ KLAVIERUNTERRICHT, BEWAFFNETER RAUB, 50\'000.- GEWINN “│ ODYSSEE STORIES #06\" target=\"_blank\">Mo. 27.01.20</a><div class=\"info\"><div class=\"close\"></div><div class=\"circle\" style=\"background-image:url(https://i2.ytimg.com/vi/qye7I_SBons/hqdefault.jpg)\"></div><p>S.M.D │“ KLAVIERUNTERRICHT, BEWAFFNETER RAUB, 50\'000.- GEWINN “│ ODYSSEE STORIES #06<br><br>Views: 1656 &nbsp; Ø/Video: 2918<br>Veröffentlicht am: Mo. 27.01.20 um 23:18 Uhr</p><div class=\"abobar\"><a href=\"https://youtu.be/qye7I_SBons\" target=\"_blank\" class=\"red\">zum Video</a></div></div></td>', 1656, '2020-01-27T22:18:32+00:00', '200127231832', 'ch');
INSERT INTO `channels` VALUES (166, 0, 'UCjmkxGUcyFnCDSaaexytB9w', 'Jungsund', '', 'https://yt3.ggpht.com/a/AATXAJyKbM95AMS1zFimnmDIqFzPEW5d7OxJBI6sygZE=s88-c-k-c0xffffffff-no-rj-mo', '', '', '', '', '', '_jungsund', '-8-', '28.03.2016', '201017-11', '201017-11', 0, 0, 0, 98, 126, 152, NULL, 0, 0, 0, 8079, 11484, 16922, NULL, 27, NULL, 'Riddler - Schlüssu zur Stadt (prod. CM)', 'DEnrV4WwnUo', '<td class=\"yt-lastvideo\" data-sort=\"200313170012\" data-utime=\"201017-11\"><a href=\"https://youtu.be/DEnrV4WwnUo\" title=\"Riddler - Schlüssu zur Stadt (prod. CM)\" target=\"_blank\">Fr. 13.03.20</a><div class=\"info\"><div class=\"close\"></div><div class=\"circle\" style=\"background-image:url(https://i1.ytimg.com/vi/DEnrV4WwnUo/hqdefault.jpg)\"></div><p>Riddler - Schlüssu zur Stadt (prod. CM)<br><br>Views: 2608 &nbsp; Ø/Video: 627<br>Veröffentlicht am: Fr. 13.03.20 um 17:00 Uhr</p><div class=\"abobar\"><a href=\"https://youtu.be/DEnrV4WwnUo\" target=\"_blank\" class=\"red\">zum Video</a></div></div></td>', 2608, '2020-03-13T16:00:12+00:00', '200313170012', 'ch');
INSERT INTO `channels` VALUES (167, 0, 'UChkfCpN74VMFdDoEw7WDz0w', 'Konterbier', 'De Channel isch sit 2018 TOT gsi... GSI! <br /><br />Da mier wieder da sind, hani denkt schribi en neui Kanal Beschribig.<br /><br />Es wird wiiterhin allerhand Blödsinn cho uf dem Channel. Streame wird es GROSSES Thema si i de nögschte Ziit. <br /><br />Gnüsseds', 'https://yt3.ggpht.com/a/AATXAJyQpEmfcPt0GFkEDlGMgZnH8rlYzweHst-Wm4rEEA=s88-c-k-c0xffffffff-no-rj-mo', '', 'https://www.youtube.com/konterbier', '', '', '', 'konterbrauerei', '-6-', '03.01.2017', '201017-11', '201017-11', 0, 0, 260, 288, 301, 305, NULL, 0, 0, 34857, 48386, 29071, 22011, NULL, 69, NULL, 'Furz', 'SW83EFut_Bo', '<td class=\"yt-lastvideo\" data-sort=\"201007160608\" data-utime=\"201017-11\"><a href=\"https://youtu.be/SW83EFut_Bo\" title=\"Furz\" target=\"_blank\">Mi. 07.10.20</a><div class=\"info\"><div class=\"close\"></div><div class=\"circle\" style=\"background-image:url(https://i4.ytimg.com/vi/SW83EFut_Bo/hqdefault.jpg)\"></div><p>Furz<br><br>Views: 55 &nbsp; Ø/Video: 319<br>Veröffentlicht am: Mi. 07.10.20 um 16:06 Uhr</p><div class=\"abobar\"><a href=\"https://youtu.be/SW83EFut_Bo\" target=\"_blank\" class=\"red\">zum Video</a></div></div></td>', 55, '2020-10-07T14:06:08+00:00', '201007160608', 'ch');
INSERT INTO `channels` VALUES (168, 0, 'UCSbznc36yo73qeOn5AfdrhQ', 'Patent Ochsner', 'Patent Ochsner - Offizielle Youtube Page<br /> <br />Die Band wurde 1990 in Bern gegründet. Der Bandname stammt von einer Aufschrift auf Abfalleimern und Müllcontainern der Firma J. Ochsner AG<br />Eine detaillierte Biografie ist auf patentochsner.ch zu finden.<br /> <br />Patent Ochsner: Büne Huber (Gesang, Gitarre), Monic Mathys (Bass), Andi Hug (Schlagzeug), Christian Brantschen (Keyboard, Akkordeon), Menk Grossniklaus (Saxophon), Disu Gmünder (Gitarre), Daniel Woodtli (Trompete), Daniela Bertschinger (Posaune, Geige)<br /> <br />1991 Schlachtplatte<br />1993 Fischer<br />1994 Gmües<br />1997 Stella Nera<br />1998 Wildbolz & Süsstrunk - live<br />2003 Trybguet<br />2005 Liebi, Tod & Tüüfu<br />2008 The Rimini Flashdown<br />2010 Bundesplatz<br />2012 Johnny - The Rimini Flashdown Part II<br />2015 Finitolavoro - The Rimini Flashdown Part III<br /><br /><br />Stellanera GmbH<br />Universal Music Switzerland', 'https://yt3.ggpht.com/a/AATXAJz3WYVDw5aGuoUoDKo2K44TAmIDfKgPnuwYK_ZPuA=s88-c-k-c0xffffffff-no-rj-mo', '', '', 'https://patentochsner.ch', '', '', 'patentochsner', '-8-25-', '21.05.2015', '201017-11', '201017-11', 0, 0, 0, 0, 3920, 6300, NULL, 0, 0, 0, 0, 92432, 162161, NULL, 60, NULL, 'Patent Ochsner live am Blausee - Ein Rückblick', 'uN7VQGaqsKM', '<td class=\"yt-lastvideo\" data-sort=\"200916180012\" data-utime=\"201017-11\"><a href=\"https://youtu.be/uN7VQGaqsKM\" title=\"Patent Ochsner live am Blausee - Ein Rückblick\" target=\"_blank\">Mi. 16.09.20</a><div class=\"info\"><div class=\"close\"></div><div class=\"circle\" style=\"background-image:url(https://i2.ytimg.com/vi/uN7VQGaqsKM/hqdefault.jpg)\"></div><p>Patent Ochsner live am Blausee - Ein Rückblick<br><br>Views: 1057 &nbsp; Ø/Video: 2703<br>Veröffentlicht am: Mi. 16.09.20 um 18:00 Uhr</p><div class=\"abobar\"><a href=\"https://youtu.be/uN7VQGaqsKM\" target=\"_blank\" class=\"red\">zum Video</a></div></div></td>', 1057, '2020-09-16T16:00:12+00:00', '200916180012', 'ch');
INSERT INTO `channels` VALUES (169, 0, 'UCeHBA2jYZUfgku9GwLrbTZA', 'Timata Music', '', 'https://yt3.ggpht.com/a/AATXAJwiwkqkr6eYtLx_h9PyJrnhv26xiBH_EEucBkOI=s88-c-k-c0xffffffff-no-rj-mo', '', '', '', '', '', 'timata_music', '-8-', '14.04.2019', '201017-11', '201017-11', 0, 0, 0, 0, 0, 83, NULL, 0, 0, 0, 0, 0, 6037, NULL, 13, NULL, 'Timata - Langwilig (feat. Junia Bardo)', 'uvVrSw8bOmY', '<td class=\"yt-lastvideo\" data-sort=\"200829202209\" data-utime=\"201017-11\"><a href=\"https://youtu.be/uvVrSw8bOmY\" title=\"Timata - Langwilig (feat. Junia Bardo)\" target=\"_blank\">Sa. 29.08.20</a><div class=\"info\"><div class=\"close\"></div><div class=\"circle\" style=\"background-image:url(https://i2.ytimg.com/vi/uvVrSw8bOmY/hqdefault.jpg)\"></div><p>Timata - Langwilig (feat. Junia Bardo)<br><br>Views: 64 &nbsp; Ø/Video: 464<br>Veröffentlicht am: Sa. 29.08.20 um 20:22 Uhr</p><div class=\"abobar\"><a href=\"https://youtu.be/uvVrSw8bOmY\" target=\"_blank\" class=\"red\">zum Video</a></div></div></td>', 64, '2020-08-29T18:22:09+00:00', '200829202209', 'ch');
INSERT INTO `channels` VALUES (170, 0, 'UCOOIsnVCiM8M7Q-465wxL3w', 'Audiodelikt', '', 'https://yt3.ggpht.com/a/AATXAJyscZaZqDdSyhmGlJeeO3GwGrKpy2QWZtBIyLde9g=s88-c-k-c0xffffffff-no-rj-mo', '', '', 'https://www.audiodelikt.ch', '', '', 'audiodelikt', '-8-', '28.11.2012', '201017-11', '201017-11', 0, 0, 0, 0, 0, 70, NULL, 0, 0, 0, 0, 0, 12812, NULL, 11, NULL, 'audiodelikt - \"Cho & Gah\" Offizieller Videoclip', 'f7xX-u47NM8', '<td class=\"yt-lastvideo\" data-sort=\"200927001513\" data-utime=\"201017-11\"><a href=\"https://youtu.be/f7xX-u47NM8\" title=\"audiodelikt - \"Cho & Gah\" Offizieller Videoclip\" target=\"_blank\">So. 27.09.20</a><div class=\"info\"><div class=\"close\"></div><div class=\"circle\" style=\"background-image:url(https://i3.ytimg.com/vi/f7xX-u47NM8/hqdefault.jpg)\"></div><p>audiodelikt - \"Cho & Gah\" Offizieller Videoclip<br><br>Views: 98 &nbsp; Ø/Video: 1165<br>Veröffentlicht am: So. 27.09.20 um 00:15 Uhr</p><div class=\"abobar\"><a href=\"https://youtu.be/f7xX-u47NM8\" target=\"_blank\" class=\"red\">zum Video</a></div></div></td>', 98, '2020-09-26T22:15:13+00:00', '200927001513', 'ch');
INSERT INTO `channels` VALUES (171, 0, 'UCv8c4VvKK2Lrm3eYL-rwutg', 'EquipeMusic', '', 'https://yt3.ggpht.com/a/AATXAJyd1l7lnGnGILpnlXFoZ62qKeQ9AJ56stNiVNNw=s88-c-k-c0xffffffff-no-rj-mo', '', '', 'http://www.equipemusic.ch', '', '', '', '-8-', '27.05.2008', '201017-11', '201017-11', 140, 144, 185, 366, 422, 513, NULL, 363879, 400691, 441382, 575534, 623254, 676261, NULL, 45, NULL, '11Ä - Retour', 'bPlDKQNB61c', '<td class=\"yt-lastvideo\" data-sort=\"200828000011\" data-utime=\"201017-11\"><a href=\"https://youtu.be/bPlDKQNB61c\" title=\"11Ä - Retour\" target=\"_blank\">Fr. 28.08.20</a><div class=\"info\"><div class=\"close\"></div><div class=\"circle\" style=\"background-image:url(https://i3.ytimg.com/vi/bPlDKQNB61c/hqdefault.jpg)\"></div><p>11Ä - Retour<br><br>Views: 5780 &nbsp; Ø/Video: 15028<br>Veröffentlicht am: Fr. 28.08.20 um 00:00 Uhr</p><div class=\"abobar\"><a href=\"https://youtu.be/bPlDKQNB61c\" target=\"_blank\" class=\"red\">zum Video</a></div></div></td>', 5780, '2020-08-27T22:00:11+00:00', '200828000011', 'ch');
INSERT INTO `channels` VALUES (172, 0, 'UCtOEFtmUrALape8MlYPMSYg', 'SVP Schweiz', 'Offizielle Videos und Clips der Schweizerischen Volkspartei.', 'https://yt3.ggpht.com/a/AATXAJzOF1uVFfQgLLuOJM3OuwU7oMu4z7Nxjop-qyX2=s88-c-k-c0xffffffff-no-rj-mo', '', 'https://www.youtube.com/svpch', 'https://www.svp.ch/partei/', '', '', 'svpch', '-10-', '23.08.2007', '201017-11', '201017-11', 0, 1573, 1674, 2230, 2930, 3540, NULL, 0, 1468365, 1504631, 2747681, 3048748, 3212384, NULL, 403, NULL, 'SVP bi de Lüt mit Marco Chiesa', 'YSiOo0sKujY', '<td class=\"yt-lastvideo\" data-sort=\"200929194002\" data-utime=\"201017-11\"><a href=\"https://youtu.be/YSiOo0sKujY\" title=\"SVP bi de Lüt mit Marco Chiesa\" target=\"_blank\">Di. 29.09.20</a><div class=\"info\"><div class=\"close\"></div><div class=\"circle\" style=\"background-image:url(https://i2.ytimg.com/vi/YSiOo0sKujY/hqdefault.jpg)\"></div><p>SVP bi de Lüt mit Marco Chiesa<br><br>Views: 671 &nbsp; Ø/Video: 7971<br>Veröffentlicht am: Di. 29.09.20 um 19:40 Uhr</p><div class=\"abobar\"><a href=\"https://youtu.be/YSiOo0sKujY\" target=\"_blank\" class=\"red\">zum Video</a></div></div></td>', 671, '2020-09-29T17:40:02+00:00', '200929194002', 'ch');
INSERT INTO `channels` VALUES (173, 0, 'UCT4fRIJRyW9wYZsubdtRNXA', 'Rammsie Hartman', '', 'https://yt3.ggpht.com/a/AATXAJzo0FLXoCcLgL9D74orknycNDcQTAI4EFXUQNCq=s88-c-k-c0xffffffff-no-rj-mo', '', '', '', '', '', 'r.hartman_', '-8-', '12.11.2015', '201017-11', '201017-11', 0, 0, 0, 337, 386, 405, NULL, 0, 0, 0, 36462, 50840, 58152, NULL, 10, NULL, 'Rammsie Hartman - Malibu Club (prod. by Vrich City x Melik)', 'ciUYc5Tce0s', '<td class=\"yt-lastvideo\" data-sort=\"201015114853\" data-utime=\"201017-11\"><a href=\"https://youtu.be/ciUYc5Tce0s\" title=\"Rammsie Hartman - Malibu Club (prod. by Vrich City x Melik)\" target=\"_blank\">Do. 15.10.20</a><div class=\"info\"><div class=\"close\"></div><div class=\"circle\" style=\"background-image:url(https://i4.ytimg.com/vi/ciUYc5Tce0s/hqdefault.jpg)\"></div><p>Rammsie Hartman - Malibu Club (prod. by Vrich City x Melik)<br><br>Views: 181 &nbsp; Ø/Video: 5815<br>Veröffentlicht am: Do. 15.10.20 um 11:48 Uhr</p><div class=\"abobar\"><a href=\"https://youtu.be/ciUYc5Tce0s\" target=\"_blank\" class=\"red\">zum Video</a></div></div></td>', 181, '2020-10-15T09:48:53+00:00', '201015114853', 'ch');
INSERT INTO `channels` VALUES (174, 0, 'UCV-NveL3y0HdOABzA4YRIMw', 'Fotichaestli AG', 'Fotichaestli ist der grösste Onlineshop für Fotozubehör in der Schweiz. Auf diesem Kanal gibt es Informationen und Neuigkeiten aus dem Fotiversum.', 'https://yt3.ggpht.com/a/AATXAJw4CcBL-oAP1WFKNWsAUZ68STV33XDls7WkA9N6-w=s88-c-k-c0xffffffff-no-rj-mo', '', 'https://www.youtube.com/fotichaestlich', 'https://www.fotichaestli.ch', '', '', 'fotichaestli.ch', '-3-13-18-', '01.11.2016', '201017-11', '201017-11', 0, 0, 391, 723, 1060, 1260, NULL, 0, 0, 22651, 61915, 143118, 202198, NULL, 243, NULL, 'rundes Ringlicht SL-360ARC von Patona - sanftes Videolicht', '-yjWqkO9YLY', '<td class=\"yt-lastvideo\" data-sort=\"201015154328\" data-utime=\"201017-11\"><a href=\"https://youtu.be/-yjWqkO9YLY\" title=\"rundes Ringlicht SL-360ARC von Patona - sanftes Videolicht\" target=\"_blank\">Do. 15.10.20</a><div class=\"info\"><div class=\"close\"></div><div class=\"circle\" style=\"background-image:url(https://i2.ytimg.com/vi/-yjWqkO9YLY/hqdefault.jpg)\"></div><p>rundes Ringlicht SL-360ARC von Patona - sanftes Videolicht<br><br>Views: 73 &nbsp; Ø/Video: 832<br>Veröffentlicht am: Do. 15.10.20 um 15:43 Uhr</p><div class=\"abobar\"><a href=\"https://youtu.be/-yjWqkO9YLY\" target=\"_blank\" class=\"red\">zum Video</a></div></div></td>', 73, '2020-10-15T13:43:28+00:00', '201015154328', 'ch');
INSERT INTO `channels` VALUES (175, 0, 'UCTKf8IgTX4hjXRjFJXljVxA', 'Imkerei Schneider', 'Willkommen!<br /><br />Schön das du hierher gefunden hast.<br /><br />Da sind wir also, die Imkerei Schneider aus dem Berner Oberland in den Schweizer Alpen.<br />Wir imkern mit dem bekannten Schweizerkastenmass und pflegen in unserer kleinen Imkerei rund 10 Bienenvölker. Unsere Imkerei achtet stark auf eine natürliche Bienenhaltung und wir bemühen uns, unseren Bienen eine möglichst artgerechte Haltung zu garantieren.<br />Damit die Unkosten unserer Arbeit besser gedeckt werden können, betreiben wir einen kleinen Online-Shop. Wir verkaufen unsere Produkte aber natürlich auch direkt vor Ort. <br />Viel Spass mit unseren Videos.', 'https://yt3.ggpht.com/a/AATXAJxkyp0SeMB2nmriuYT-GGj38EpYTlKZLHilNG3i=s88-c-k-c0xffffffff-no-rj-mo', '', '', 'https://imkereischneider.ch', '', '', 'imkereischneider.ch', '-7-17-18-25-', '18.04.2018', '201017-11', '201017-11', 0, 0, 0, 54, 60, 58, NULL, 0, 0, 0, 861, 1183, 1458, NULL, 9, NULL, 'Die Geschichte vom Honig - Imkerei Schneider', 'uifZKm5Ra5w', '<td class=\"yt-lastvideo\" data-sort=\"200604202222\" data-utime=\"201017-11\"><a href=\"https://youtu.be/uifZKm5Ra5w\" title=\"Die Geschichte vom Honig - Imkerei Schneider\" target=\"_blank\">Do. 04.06.20</a><div class=\"info\"><div class=\"close\"></div><div class=\"circle\" style=\"background-image:url(https://i2.ytimg.com/vi/uifZKm5Ra5w/hqdefault.jpg)\"></div><p>Die Geschichte vom Honig - Imkerei Schneider<br><br>Views: 37 &nbsp; Ø/Video: 162<br>Veröffentlicht am: Do. 04.06.20 um 20:22 Uhr</p><div class=\"abobar\"><a href=\"https://youtu.be/uifZKm5Ra5w\" target=\"_blank\" class=\"red\">zum Video</a></div></div></td>', 37, '2020-06-04T18:22:22+00:00', '200604202222', 'ch');
INSERT INTO `channels` VALUES (176, 0, 'UCqCSl8Eq_0by8ad7u5JNSOQ', 'Greneey', 'Ich baue um. Sorry.<br />greneey.ch<br /><br />Greneey – Nur echt aus der Dose!', 'https://yt3.ggpht.com/a/AATXAJwzZPJLV4Kki76N3NKa5iMi_X_5q6bVqWZRPSkZAw=s88-c-k-c0xffffffff-no-rj-mo', 'Roger Keller', 'https://www.youtube.com/Greneey', 'https://greneey.ch', '', 'greneey', 'insta.greneey', '-4-6-11-15-18-', '11.03.2012', '201017-11', '201017-11', 1024, 1218, 1921, 2196, 2290, 2390, NULL, 177864, 232031, 277216, 358925, 413015, 472409, NULL, 255, NULL, 'Talking to strangers and landing in NYC', 'G_FmwMhUgiM', '<td class=\"yt-lastvideo\" data-sort=\"201008223318\" data-utime=\"201017-11\"><a href=\"https://youtu.be/G_FmwMhUgiM\" title=\"Talking to strangers and landing in NYC\" target=\"_blank\">Do. 08.10.20</a><div class=\"info\"><div class=\"close\"></div><div class=\"circle\" style=\"background-image:url(https://i4.ytimg.com/vi/G_FmwMhUgiM/hqdefault.jpg)\"></div><p>Talking to strangers and landing in NYC<br><br>Views: 51 &nbsp; Ø/Video: 1853<br>Veröffentlicht am: Do. 08.10.20 um 22:33 Uhr</p><div class=\"abobar\"><a href=\"https://youtu.be/G_FmwMhUgiM\" target=\"_blank\" class=\"red\">zum Video</a></div></div></td>', 51, '2020-10-08T20:33:18+00:00', '201008223318', 'ch');
INSERT INTO `channels` VALUES (177, 0, 'UCmH3TjJNlfqOqLMBV8plOlQ', 'Luuk', 'LUUK hat den Flow, die Inhalte und die Ausstrahlung. Dank stetigem Output und seiner Echtheit, ist er aus der Schweizer Hip Hop-Szene nicht mehr wegzudenken. Vier Alben, EPs und viele weitere Projekte wie etwa der Pottcast, hat er bereits auf dem Zettel. Mit seinem neuen Album „LUUK“ hisst der Zürcher Rapper 2020 seine Fahne ganz oben auf dem Rap-Gipfel.', 'https://yt3.ggpht.com/a/AATXAJyhJ0Jed4GmFDnWEBA-1uDkVU30Ufg_0-KR9SS-pg=s88-c-k-c0xffffffff-no-rj-mo', '', 'https://www.youtube.com/LuukOfficial', '', '', '', 'luukofficial', '-8-20-', '30.05.2011', '201017-11', '201017-11', 0, 0, 1097, 1961, 2750, 3620, NULL, 0, 0, 447853, 718367, 1015172, 1269254, NULL, 41, NULL, 'Finito - LUUK (Prod. by Questbeatz)', 'PyUGk4IY1pg', '<td class=\"yt-lastvideo\" data-sort=\"200610165913\" data-utime=\"201017-11\"><a href=\"https://youtu.be/PyUGk4IY1pg\" title=\"Finito - LUUK (Prod. by Questbeatz)\" target=\"_blank\">Mi. 10.06.20</a><div class=\"info\"><div class=\"close\"></div><div class=\"circle\" style=\"background-image:url(https://i1.ytimg.com/vi/PyUGk4IY1pg/hqdefault.jpg)\"></div><p>Finito - LUUK (Prod. by Questbeatz)<br><br>Views: 9097 &nbsp; Ø/Video: 30957<br>Veröffentlicht am: Mi. 10.06.20 um 16:59 Uhr</p><div class=\"abobar\"><a href=\"https://youtu.be/PyUGk4IY1pg\" target=\"_blank\" class=\"red\">zum Video</a></div></div></td>', 9097, '2020-06-10T14:59:13+00:00', '200610165913', 'ch');
INSERT INTO `channels` VALUES (178, 1, 'UCyH74boxzuFAY5zQTH4ED5w', 'Zock mit Mike', 'Sali zäme und willkomme uf Zock Mit Mike... <br /><br /><br />Da ich scho en Italienische Let\'s Play kanal han, hani dänkt hey ich chönnt eis uf schwitzerdütsch mache :) <br /><br />Ich zocke viel Horror Games und han no kein Schwitzer Youtuber gfunde wo das macht ( velecht beni zblöd zum eine finde ) .. Aber Hey!! esch doch e gueti idee. <br /><br />Also lüts, do gihts hauptsächlich lustigi videos mit Horror Games, ab und zue oder uf wunsch zocki natürli au anderi sache wie ; Survival, Shooters, RPG oder was ihr wänd :D <br /><br />Sooo viel spass uf dem Channel und Zock Mit Mike ;)', 'https://yt3.ggpht.com/a/AATXAJwY_n6O8U4Um5riXYVAzk3j7_Cwnl_Obo9qquzZ=s88-c-k-c0xffffffff-no-rj-mo', 'Mike', '', '', '', 'zockmitmike', '', '-4-11-', '06.03.2019', '201016-20', '201017-11', 0, 0, 0, 0, 24, 25, NULL, 0, 0, 0, 0, 358, 507, NULL, 5, NULL, 'Albanian Swiss German Let\'s Play', 'tRqX29ZGl8E', '<td class=\"yt-lastvideo\" data-sort=\"190721231302\" data-utime=\"201017-11\"><a href=\"https://youtu.be/tRqX29ZGl8E\" title=\"Albanian Swiss German Let\'s Play\" target=\"_blank\">So. 21.07.19</a><div class=\"info\"><div class=\"close\"></div><div class=\"circle\" style=\"background-image:url(https://i1.ytimg.com/vi/tRqX29ZGl8E/hqdefault.jpg)\"></div><p>Albanian Swiss German Let\'s Play<br><br>Views: 37 &nbsp; Ø/Video: 101<br>Veröffentlicht am: So. 21.07.19 um 23:13 Uhr</p><div class=\"abobar\"><a href=\"https://youtu.be/tRqX29ZGl8E\" target=\"_blank\" class=\"red\">zum Video</a></div></div></td>', 37, '2019-07-21T21:13:02+00:00', '190721231302', 'ch');
INSERT INTO `channels` VALUES (179, 0, 'UCpJo5jH6tazCfXoSUaSO5_w', 'jokeTV', 'jokeTV is your channel where you can see your favorite Star telling a joke !!<br />So enjoy jokeTV on YouTube or go to :<br />joketv.eu', 'https://yt3.ggpht.com/a/AATXAJwXCN3ZFWXOUTzB2E82GAf4lOdhQM3ee7mZNqA_9w=s88-c-k-c0xffffffff-no-rj-mo', 'Marcel Meier', '', 'https://www.joketv.eu', '', '', '', '-6-', '24.02.2008', '201017-11', '201017-11', 0, 1354, 1369, 1435, 1470, 1520, NULL, 0, 2281120, 231480, 2380418, 2406552, 2451595, NULL, 1154, NULL, 'Maxim Essindi jokeTV', '-2WsImHmcuU', '<td class=\"yt-lastvideo\" data-sort=\"201011223028\" data-utime=\"201017-11\"><a href=\"https://youtu.be/-2WsImHmcuU\" title=\"Maxim Essindi jokeTV\" target=\"_blank\">So. 11.10.20</a><div class=\"info\"><div class=\"close\"></div><div class=\"circle\" style=\"background-image:url(https://i2.ytimg.com/vi/-2WsImHmcuU/hqdefault.jpg)\"></div><p>Maxim Essindi jokeTV<br><br>Views: 17 &nbsp; Ø/Video: 2124<br>Veröffentlicht am: So. 11.10.20 um 22:30 Uhr</p><div class=\"abobar\"><a href=\"https://youtu.be/-2WsImHmcuU\" target=\"_blank\" class=\"red\">zum Video</a></div></div></td>', 17, '2020-10-11T20:30:28+00:00', '201011223028', 'ch');
INSERT INTO `channels` VALUES (180, 0, 'UCeYIwna2CkpFP8huwaXWTgQ', 'ZweiSechs FPV', 'FPV Drone Videos 😎<br />This is my 2nd channel. My main channel is StudioZweiSechs. Maybe soon this Channel will be my main channel 🚀🛩️🇨🇭', 'https://yt3.ggpht.com/a/AATXAJySNxVjrVau1thpLj885ofvq7k9he2JNX8HddvgnA=s88-c-k-c0xffffffff-no-rj-mo', '', '', '', '', '', 'studiozweisechs', '-7-', '08.12.2016', '201017-11', '201017-11', 0, 0, 0, 0, 0, 38, NULL, 0, 0, 0, 0, 0, 1684, NULL, 16, NULL, '3rd Person Enduro | FPV | ZweiSechsFPV', '1zP_cp8fIME', '<td class=\"yt-lastvideo\" data-sort=\"200518003802\" data-utime=\"201017-11\"><a href=\"https://youtu.be/1zP_cp8fIME\" title=\"3rd Person Enduro | FPV | ZweiSechsFPV\" target=\"_blank\">Mo. 18.05.20</a><div class=\"info\"><div class=\"close\"></div><div class=\"circle\" style=\"background-image:url(https://i2.ytimg.com/vi/1zP_cp8fIME/hqdefault.jpg)\"></div><p>3rd Person Enduro | FPV | ZweiSechsFPV<br><br>Views: 78 &nbsp; Ø/Video: 105<br>Veröffentlicht am: Mo. 18.05.20 um 00:38 Uhr</p><div class=\"abobar\"><a href=\"https://youtu.be/1zP_cp8fIME\" target=\"_blank\" class=\"red\">zum Video</a></div></div></td>', 78, '2020-05-17T22:38:02+00:00', '200518003802', 'ch');
INSERT INTO `channels` VALUES (181, 0, 'UCEsT59BBHueS2dV-75lJHXw', 'Chaostruppe', 'chaostruppe.net', 'https://yt3.ggpht.com/a/AATXAJwuUqTDqMXT3Kt0IVcb5AtRsaMlevEe1l4chKC6=s88-c-k-c0xffffffff-no-rj-mo', '', 'https://www.youtube.com/chaostruppebern', 'http://chaostruppe.net', '', '', 'chaostruppe_official', '-8-25-', '05.08.2014', '201017-11', '201017-11', 0, 673, 1329, 2010, 2680, 3270, NULL, 0, 136023, 317973, 576977, 824122, 1088993, NULL, 61, NULL, 'Chaostruppe - Wisi wei', '03q93bjSt5c', '<td class=\"yt-lastvideo\" data-sort=\"200911012249\" data-utime=\"201017-11\"><a href=\"https://youtu.be/03q93bjSt5c\" title=\"Chaostruppe - Wisi wei\" target=\"_blank\">Fr. 11.09.20</a><div class=\"info\"><div class=\"close\"></div><div class=\"circle\" style=\"background-image:url(https://i1.ytimg.com/vi/03q93bjSt5c/hqdefault.jpg)\"></div><p>Chaostruppe - Wisi wei<br><br>Views: 7086 &nbsp; Ø/Video: 17852<br>Veröffentlicht am: Fr. 11.09.20 um 01:22 Uhr</p><div class=\"abobar\"><a href=\"https://youtu.be/03q93bjSt5c\" target=\"_blank\" class=\"red\">zum Video</a></div></div></td>', 7086, '2020-09-10T23:22:49+00:00', '200911012249', 'ch');
INSERT INTO `channels` VALUES (182, 0, 'UCP_7s1hufKK31LbJZHJrJUA', 'Kunz', 'Lieber KUNZ-Fan. Herzlich Willkommen auf meinem YouTube Channel. Hier nehme ich dich in die Kunz-Welt mit. Verpasse keine neuen Musikvideos, Covers, Vlogs oder sonstige lustige Videos von mir. Abonniere den Kanal und sei ein Teil meiner KUNZ-Community.', 'https://yt3.ggpht.com/a/AATXAJxhDoTSgKMfKSyuzJC1jwNAKje_RE9hfhLBvzsBFA=s88-c-k-c0xffffffff-no-rj-mo', 'Marco Kunz', 'https://www.youtube.com/marcokunzmusik', 'https://www.kunzmusik.ch', '', '', 'kunzmusik', '-8-29-', '01.04.2011', '201017-11', '201017-11', 0, 0, 2894, 3592, 9490, 10900, NULL, 0, 0, 1317286, 1706616, 2158363, 2365112, NULL, 110, NULL, 'KUNZ - Live am Gampel 2019', 'TF5QCQe35Dk', '<td class=\"yt-lastvideo\" data-sort=\"200819200011\" data-utime=\"201017-11\"><a href=\"https://youtu.be/TF5QCQe35Dk\" title=\"KUNZ - Live am Gampel 2019\" target=\"_blank\">Mi. 19.08.20</a><div class=\"info\"><div class=\"close\"></div><div class=\"circle\" style=\"background-image:url(https://i1.ytimg.com/vi/TF5QCQe35Dk/hqdefault.jpg)\"></div><p>KUNZ - Live am Gampel 2019<br><br>Views: 1506 &nbsp; Ø/Video: 21501<br>Veröffentlicht am: Mi. 19.08.20 um 20:00 Uhr</p><div class=\"abobar\"><a href=\"https://youtu.be/TF5QCQe35Dk\" target=\"_blank\" class=\"red\">zum Video</a></div></div></td>', 1506, '2020-08-19T18:00:11+00:00', '200819200011', 'ch');
INSERT INTO `channels` VALUES (183, 0, 'UCK8iSDkDpKsaMlVpz38qLUw', 'SRF Virus', 'Deine Geschichten, deine Emotionen, deine Musik – das ist SRF Virus, mit allem und scharf! 💚🌶️ <br /><br />SRF Virus auf YouTube abonnieren<br />▶️ youtube.com/srfvirus?sub_confirmation=1<br /><br />SRF Virus auf Facebook<br />👥 fb.com/srfvirus<br /><br />SRF Virus auf Instagram<br />📸 instagram.com/srfvirus<br /><br />SRF Virus auf srf.ch<br />👉 srf.ch/radio-srf-virus/', 'https://yt3.ggpht.com/a/AATXAJyTpv0IZA4S7e91Wc2o_V0QlhN5GPRlxJzBIt-F1g=s88-c-k-c0xffffffff-no-rj-mo', '', 'https://www.youtube.com/srfvirus', 'https://www.virus.ch', '', '', 'srfvirus', '-8-9-15-', '24.08.2009', '201017-11', '201017-11', 2542, 4527, 9901, 19619, 27200, 36300, NULL, 3605710, 6421264, 13190731, 22503213, 30824339, 37049157, NULL, 2039, NULL, 'NHL-Profi Jonas Siegenthaler hat seine Mentalität von der Thai-Kultur | Helvetia | SRF Virus', 't8URu-PSWW0', '<td class=\"yt-lastvideo\" data-sort=\"201016170013\" data-utime=\"201017-11\"><a href=\"https://youtu.be/t8URu-PSWW0\" title=\"NHL-Profi Jonas Siegenthaler hat seine Mentalität von der Thai-Kultur | Helvetia | SRF Virus\" target=\"_blank\">Fr. 16.10.20</a><div class=\"info\"><div class=\"close\"></div><div class=\"circle\" style=\"background-image:url(https://i1.ytimg.com/vi/t8URu-PSWW0/hqdefault.jpg)\"></div><p>NHL-Profi Jonas Siegenthaler hat seine Mentalität von der Thai-Kultur | Helvetia | SRF Virus<br><br>Views: 1388 &nbsp; Ø/Video: 18170<br>Veröffentlicht am: Fr. 16.10.20 um 17:00 Uhr</p><div class=\"abobar\"><a href=\"https://youtu.be/t8URu-PSWW0\" target=\"_blank\" class=\"red\">zum Video</a></div></div></td>', 1388, '2020-10-16T15:00:13+00:00', '201016170013', 'ch');
INSERT INTO `channels` VALUES (184, 0, 'UCUSainlhtRRE2ceUDHG0xeg', 'Herbert Blaser', 'Meine Arbeiten als Videojournalist für regioTVplus und Berichte über mich vom ehemaligen Baselland TV.', 'https://yt3.ggpht.com/a/AATXAJxBye2Df6oPhTOuoliyRndUOVFodZzTWSfvxA-13R8=s88-c-k-c0xffffffff-no-rj-mo', '', 'https://www.youtube.com/herbertblaser', 'http://www.herbert-blaser.ch', '', '', 'herbieblaser', '-9-10-21-', '03.03.2008', '201017-11', '201017-11', 0, 43, 55, 61, 93, 102, NULL, 0, 52362, 67767, 77929, 97360, 110677, NULL, 255, NULL, 'Hans A. Jenny – «Blaues Haus» am Rheinsprung – Der Aussichtskamin', 'gdUTXS7IpYw', '<td class=\"yt-lastvideo\" data-sort=\"201013160805\" data-utime=\"201017-11\"><a href=\"https://youtu.be/gdUTXS7IpYw\" title=\"Hans A. Jenny – «Blaues Haus» am Rheinsprung – Der Aussichtskamin\" target=\"_blank\">Di. 13.10.20</a><div class=\"info\"><div class=\"close\"></div><div class=\"circle\" style=\"background-image:url(https://i4.ytimg.com/vi/gdUTXS7IpYw/hqdefault.jpg)\"></div><p>Hans A. Jenny – «Blaues Haus» am Rheinsprung – Der Aussichtskamin<br><br>Views: 19 &nbsp; Ø/Video: 434<br>Veröffentlicht am: Di. 13.10.20 um 16:08 Uhr</p><div class=\"abobar\"><a href=\"https://youtu.be/gdUTXS7IpYw\" target=\"_blank\" class=\"red\">zum Video</a></div></div></td>', 19, '2020-10-13T14:08:05+00:00', '201013160805', 'ch');
INSERT INTO `channels` VALUES (185, 0, 'UC1-g9E0BKQo5pID4y55K5iA', 'SRF 3', 'SRF 3 - Das führende New Media, Pop- und Rockradio der Schweiz', 'https://yt3.ggpht.com/a/AATXAJy50T-yjYJd630dYgUoeSaYMqOafglJ1HSN9g0XuQ=s88-c-k-c0xffffffff-no-rj-mo', '', 'https://www.youtube.com/srf3', 'https://www.srf.ch/radio-srf-3', '', '', 'srf3', '-9-', '19.02.2008', '201017-11', '201017-11', 5134, 6884, 9824, 23362, 35600, 41100, NULL, 7521301, 10125530, 13485330, 22287885, 28390183, 32337245, NULL, 3124, NULL, 'Bliib Gsund! | Gizzle Shizzle | Radio SRF 3', 'UNNJ6BldUsc', '<td class=\"yt-lastvideo\" data-sort=\"201016144921\" data-utime=\"201017-11\"><a href=\"https://youtu.be/UNNJ6BldUsc\" title=\"Bliib Gsund! | Gizzle Shizzle | Radio SRF 3\" target=\"_blank\">Fr. 16.10.20</a><div class=\"info\"><div class=\"close\"></div><div class=\"circle\" style=\"background-image:url(https://i2.ytimg.com/vi/UNNJ6BldUsc/hqdefault.jpg)\"></div><p>Bliib Gsund! | Gizzle Shizzle | Radio SRF 3<br><br>Views: 320 &nbsp; Ø/Video: 10351<br>Veröffentlicht am: Fr. 16.10.20 um 14:49 Uhr</p><div class=\"abobar\"><a href=\"https://youtu.be/UNNJ6BldUsc\" target=\"_blank\" class=\"red\">zum Video</a></div></div></td>', 320, '2020-10-16T12:49:21+00:00', '201016144921', 'ch');
INSERT INTO `channels` VALUES (186, 0, 'UC8MiHJ4N7C22o8o5A3saakQ', 'NethsBlog', 'Schlauer als du meinsch, dümmer als du denksch.', 'https://yt3.ggpht.com/a/AATXAJyYk9blBQDO4xCcEOFUdNU5qdGgN_oD6WvTXXKT=s88-c-k-c0xffffffff-no-rj-mo', '', 'https://www.youtube.com/NethsBlog', '', '', '', 'nethsblog', '-6-', '23.10.2012', '201017-11', '201017-11', 0, 0, 1862, 3865, 4280, 4390, NULL, 0, 0, 122711, 317964, 415103, 466429, NULL, 62, NULL, 'Von Veränderung und Drohnenabstürzen | #MentalHealthAwareness', 'Wk-K5nKHjY0', '<td class=\"yt-lastvideo\" data-sort=\"200524220121\" data-utime=\"201017-11\"><a href=\"https://youtu.be/Wk-K5nKHjY0\" title=\"Von Veränderung und Drohnenabstürzen | #MentalHealthAwareness\" target=\"_blank\">So. 24.05.20</a><div class=\"info\"><div class=\"close\"></div><div class=\"circle\" style=\"background-image:url(https://i4.ytimg.com/vi/Wk-K5nKHjY0/hqdefault.jpg)\"></div><p>Von Veränderung und Drohnenabstürzen | #MentalHealthAwareness<br><br>Views: 1443 &nbsp; Ø/Video: 7523<br>Veröffentlicht am: So. 24.05.20 um 22:01 Uhr</p><div class=\"abobar\"><a href=\"https://youtu.be/Wk-K5nKHjY0\" target=\"_blank\" class=\"red\">zum Video</a></div></div></td>', 1443, '2020-05-24T20:01:21+00:00', '200524220121', 'ch');
INSERT INTO `channels` VALUES (187, 0, 'UC2P3YNzPhdcOTdQQTyMHTaw', 'Pegu17', 'Pegu17, Rapper us der Schwiz, Admin: Madlipz.swiss<br /><br />Album 2019 Los zue', 'https://yt3.ggpht.com/a/AATXAJyXT-p56CdljsDrhz0D5I8IzpM55I1Uaz45V11E2g=s88-c-k-c0xffffffff-no-rj-mo', 'Fabio Wenger', '', '', '', '', 'pegu17', '-8-', '25.04.2017', '201017-11', '201017-11', 0, 0, 0, 0, 814, 1090, NULL, 0, 0, 0, 0, 42754, 61666, NULL, 7, NULL, 'Pegu17 “Lucky Luke” prod. By Hilox', 'LeS0HMcdtVY', '<td class=\"yt-lastvideo\" data-sort=\"200807085129\" data-utime=\"201017-11\"><a href=\"https://youtu.be/LeS0HMcdtVY\" title=\"Pegu17 “Lucky Luke” prod. By Hilox\" target=\"_blank\">Fr. 07.08.20</a><div class=\"info\"><div class=\"close\"></div><div class=\"circle\" style=\"background-image:url(https://i1.ytimg.com/vi/LeS0HMcdtVY/hqdefault.jpg)\"></div><p>Pegu17 “Lucky Luke” prod. By Hilox<br><br>Views: 1496 &nbsp; Ø/Video: 8809<br>Veröffentlicht am: Fr. 07.08.20 um 08:51 Uhr</p><div class=\"abobar\"><a href=\"https://youtu.be/LeS0HMcdtVY\" target=\"_blank\" class=\"red\">zum Video</a></div></div></td>', 1496, '2020-08-07T06:51:29+00:00', '200807085129', 'ch');
INSERT INTO `channels` VALUES (188, 0, 'UCm9YhVSnefdS8UW9amXN7oA', 'PagerTV', 'Willkommen auf meinem Kanal.<br /><br />Ostern 1990 hat mein leben verändert, da bekam ich meinen ersten Gameboy und seit dieser zeit vergehen fast keine Tage an denen ich nicht am Zocken bin. <br /><br />Im Jahre 2014 fand ich hier auf YouTube Gronkh`s und Sarazar`s Kanäle und ich war so begeistert von Ihnen da dachte ich mir ich möchte mich auch als Let`s Player versuchen.<br /><br />Auch wenn ich fast Täglich Zocke, ich beherrsche nicht alle Games. Also seit nett.<br /><br />Mein Ziel ist es, Spass zu haben, und euch zu unterhalten.<br /><br />Ich bin immer offen für Wünsche und Anregungen, schreibt mir doch einfach einen Kommentar.<br /><br />Euer PagerTV', 'https://yt3.ggpht.com/a/AATXAJwBgMA-CbxbtvRzx23DkHsfrNJzYhW297rPHah3=s88-c-k-c0xffffffff-no-rj-mo', '', '', '', '', '', 'pagertv', '-4-', '20.12.2014', '201017-11', '201017-11', 0, 0, 34, 149, 270, 264, NULL, 0, 0, 5304, 23323, 34699, 37228, NULL, 792, NULL, 'Besuch im Plättlizoo Geschnitten', 'ew6LJHxJ6u0', '<td class=\"yt-lastvideo\" data-sort=\"200922233156\" data-utime=\"201017-11\"><a href=\"https://youtu.be/ew6LJHxJ6u0\" title=\"Besuch im Plättlizoo Geschnitten\" target=\"_blank\">Di. 22.09.20</a><div class=\"info\"><div class=\"close\"></div><div class=\"circle\" style=\"background-image:url(https://i2.ytimg.com/vi/ew6LJHxJ6u0/hqdefault.jpg)\"></div><p>Besuch im Plättlizoo Geschnitten<br><br>Views: 26 &nbsp; Ø/Video: 47<br>Veröffentlicht am: Di. 22.09.20 um 23:31 Uhr</p><div class=\"abobar\"><a href=\"https://youtu.be/ew6LJHxJ6u0\" target=\"_blank\" class=\"red\">zum Video</a></div></div></td>', 26, '2020-09-22T21:31:56+00:00', '200922233156', 'ch');
INSERT INTO `channels` VALUES (189, 0, 'UCTPhJ7aAQwiYxvtQOUKSbQQ', 'DJ_Dave_03', 'In meiner Freizeit bin ich Deejay und Schlagzeuger', 'https://yt3.ggpht.com/a/AATXAJxJoevWfLFuVeOc7uBnS-egyi6j4JZiJwGW9U5VRw=s88-c-k-c0xffffffff-no-rj-mo', '', '', '', '', '', '', '-8-', '31.05.2014', '201017-11', '201017-11', 0, 0, 0, 0, 31, 37, NULL, 0, 0, 0, 0, 3544, 5117, NULL, 37, NULL, 'DJ Dave spielt Time Flies New Remix', 'Fun63YtN0UY', '<td class=\"yt-lastvideo\" data-sort=\"201001160010\" data-utime=\"201017-11\"><a href=\"https://youtu.be/Fun63YtN0UY\" title=\"DJ Dave spielt Time Flies New Remix\" target=\"_blank\">Do. 01.10.20</a><div class=\"info\"><div class=\"close\"></div><div class=\"circle\" style=\"background-image:url(https://i3.ytimg.com/vi/Fun63YtN0UY/hqdefault.jpg)\"></div><p>DJ Dave spielt Time Flies New Remix<br><br>Views: 18 &nbsp; Ø/Video: 138<br>Veröffentlicht am: Do. 01.10.20 um 16:00 Uhr</p><div class=\"abobar\"><a href=\"https://youtu.be/Fun63YtN0UY\" target=\"_blank\" class=\"red\">zum Video</a></div></div></td>', 18, '2020-10-01T14:00:10+00:00', '201001160010', 'ch');
INSERT INTO `channels` VALUES (190, 0, 'UCB718pw6KPNRptf93P4mcig', 'Daniel Blättler', '', 'https://yt3.ggpht.com/a/AATXAJxQt2MuJ4EP002JCoWE8FM3Jf4t5yUSlCKqPo4O=s88-c-k-c0xffffffff-no-rj-mo', '', '', '', '', '', '', '-1-Politik-', '08.08.2016', '201017-11', '201017-11', 0, 0, 13, 44, 100, 142, NULL, 0, 0, 2242, 7608, 28462, 47806, NULL, 36, NULL, 'Die Erweiterung der Schulanlage Lindenfeld Eschenbach 2018 - 2020', 'P-SVZNp8bpU', '<td class=\"yt-lastvideo\" data-sort=\"200907165818\" data-utime=\"201017-11\"><a href=\"https://youtu.be/P-SVZNp8bpU\" title=\"Die Erweiterung der Schulanlage Lindenfeld Eschenbach 2018 - 2020\" target=\"_blank\">Mo. 07.09.20</a><div class=\"info\"><div class=\"close\"></div><div class=\"circle\" style=\"background-image:url(https://i1.ytimg.com/vi/P-SVZNp8bpU/hqdefault.jpg)\"></div><p>Die Erweiterung der Schulanlage Lindenfeld Eschenbach 2018 - 2020<br><br>Views: 540 &nbsp; Ø/Video: 1328<br>Veröffentlicht am: Mo. 07.09.20 um 16:58 Uhr</p><div class=\"abobar\"><a href=\"https://youtu.be/P-SVZNp8bpU\" target=\"_blank\" class=\"red\">zum Video</a></div></div></td>', 540, '2020-09-07T14:58:18+00:00', '200907165818', 'ch');
INSERT INTO `channels` VALUES (191, 0, 'UCdq5K0fx0k4GfWaYqn9CaSA', 'ProjektBreakDown', 'Schweizer YouTuber🕹️| Profil noch in Bearbeitung    #SwissTuber #YouTubeSchweiz #SchweizerYouTuber', 'https://yt3.ggpht.com/a/AATXAJyQhvLZbxV_2Ige7eRZy_-NkEeha2x8N6TlWP9sGA=s88-c-k-c0xffffffff-no-rj-mo', '', '', '', '', 'ProjektBreakDown', '', '-4-11-', '17.03.2019', '201017-11', '201017-11', 0, 0, 0, 0, 0, 20, NULL, 0, 0, 0, 0, 0, 2274, NULL, 147, NULL, 'Die Ratten Hölle im Untergrund| 06 | Dark Souls Remastered', 'jZ_xvjMjjrA', '<td class=\"yt-lastvideo\" data-sort=\"201006160009\" data-utime=\"201017-11\"><a href=\"https://youtu.be/jZ_xvjMjjrA\" title=\"Die Ratten Hölle im Untergrund| 06 | Dark Souls Remastered\" target=\"_blank\">Di. 06.10.20</a><div class=\"info\"><div class=\"close\"></div><div class=\"circle\" style=\"background-image:url(https://i3.ytimg.com/vi/jZ_xvjMjjrA/hqdefault.jpg)\"></div><p>Die Ratten Hölle im Untergrund| 06 | Dark Souls Remastered<br><br>Views: 15 &nbsp; Ø/Video: 15<br>Veröffentlicht am: Di. 06.10.20 um 16:00 Uhr</p><div class=\"abobar\"><a href=\"https://youtu.be/jZ_xvjMjjrA\" target=\"_blank\" class=\"red\">zum Video</a></div></div></td>', 15, '2020-10-06T14:00:09+00:00', '201006160009', 'ch');
INSERT INTO `channels` VALUES (192, 0, 'UCD2pkctWxQdoZVUgdEOTMiw', 'HugiCrafter', 'I bi dr HugiCrafter<br />I ha am 25. Juni 2020 agfangä ds Schloss vo Harry Potter in Minecraft im Survival Mod nachä z Bouä. Im Momänt wart ig no uf d Capture Card. Mit derä chani de o Let\'s Plays übr Zelda BotW und Mario Kart 8 Deluxe machä. I redä I minä Videos Schwizerdütsch.<br /><br />Dä Kanau isch Für aui wo Schwizerdütsch gärn hei, Interässä Minecraft und Harry Potter hei.<br /><br />04.5.2020: 00 Abos<br />05.5.2020: 03 Abos<br />06.5.2020: 05 Abos<br />10.5.2020: 10 Abos<br />23.6.2020: 20 Abos<br />29.7.2020: 25 Abos<br />23.9.2020: 30 Abos', 'https://yt3.ggpht.com/a/AATXAJwsqWMuUJWu5X9rqHA6XW0rwUV3ngBanTogY2y2=s88-c-k-c0xffffffff-no-rj-mo', '', '', '', '', '', 'hugicrafter', '-4-6-', '04.05.2020', '201017-11', '201017-11', 0, 0, 0, 0, 0, 32, NULL, 0, 0, 0, 0, 0, 773, NULL, 13, NULL, 'Extreme Car driving Simulator', 'ngQaePgunGw', '<td class=\"yt-lastvideo\" data-sort=\"200911214958\" data-utime=\"201017-11\"><a href=\"https://youtu.be/ngQaePgunGw\" title=\"Extreme Car driving Simulator\" target=\"_blank\">Fr. 11.09.20</a><div class=\"info\"><div class=\"close\"></div><div class=\"circle\" style=\"background-image:url(https://i3.ytimg.com/vi/ngQaePgunGw/hqdefault.jpg)\"></div><p>Extreme Car driving Simulator<br><br>Views: 23 &nbsp; Ø/Video: 59<br>Veröffentlicht am: Fr. 11.09.20 um 21:49 Uhr</p><div class=\"abobar\"><a href=\"https://youtu.be/ngQaePgunGw\" target=\"_blank\" class=\"red\">zum Video</a></div></div></td>', 23, '2020-09-11T19:49:58+00:00', '200911214958', 'ch');
INSERT INTO `channels` VALUES (193, 0, 'UCIsfNJIQTylYF-dw0p7ZKYQ', 'Dijana Beauty', '', 'https://yt3.ggpht.com/a/AATXAJzAbnoCXAqNHScN_0ziUrNB7kmKBlodb87VlI48U0M=s88-c-k-c0xffffffff-no-rj-mo', '', '', '', '', '', 'dijanabeauty', '-2-14-18-', '26.06.2017', '201017-11', '201017-11', 0, 0, 100, 143, 184, 190, NULL, 0, 0, 3038, 11103, 16846, 19226, NULL, 48, NULL, '𝑳𝑰𝑭𝑻𝑰𝑵𝑮 | 𝑭𝒐𝒙𝒚 𝑬𝒚𝒆𝒔 🔥  • 𝒷𝓎 𝒟𝒾𝒿𝒶𝓃𝒶ℬ𝑒𝒶𝓊𝓉𝓎💄', 'Dniiq78YmQQ', '<td class=\"yt-lastvideo\" data-sort=\"201017100150\" data-utime=\"201017-11\"><a href=\"https://youtu.be/Dniiq78YmQQ\" title=\"𝑳𝑰𝑭𝑻𝑰𝑵𝑮 | 𝑭𝒐𝒙𝒚 𝑬𝒚𝒆𝒔 🔥  • 𝒷𝓎 𝒟𝒾𝒿𝒶𝓃𝒶ℬ𝑒𝒶𝓊𝓉𝓎💄\" target=\"_blank\">Sa. 17.10.20</a><div class=\"info\"><div class=\"close\"></div><div class=\"circle\" style=\"background-image:url(https://i1.ytimg.com/vi/Dniiq78YmQQ/hqdefault.jpg)\"></div><p>𝑳𝑰𝑭𝑻𝑰𝑵𝑮 | 𝑭𝒐𝒙𝒚 𝑬𝒚𝒆𝒔 🔥  • 𝒷𝓎 𝒟𝒾𝒿𝒶𝓃𝒶ℬ𝑒𝒶𝓊𝓉𝓎💄<br><br>Views: 21 &nbsp; Ø/Video: 401<br>Veröffentlicht am: Sa. 17.10.20 um 10:01 Uhr</p><div class=\"abobar\"><a href=\"https://youtu.be/Dniiq78YmQQ\" target=\"_blank\" class=\"red\">zum Video</a></div></div></td>', 21, '2020-10-17T08:01:50+00:00', '201017100150', 'de');
INSERT INTO `channels` VALUES (194, 0, 'UCdjH9pmLHOyNiY8SeolqpPA', '- 6 Studio', '-6 STUDIO', 'https://yt3.ggpht.com/a/AATXAJwjERuS9zVm7CmncRSR8xCJm4jEbIg8xqmOflz9=s88-c-k-c0xffffffff-no-rj-mo', '', '', '', '', '', 'minus6studio', '-8-', '17.11.2019', '201017-11', '201017-11', 0, 0, 0, 0, 0, 314, NULL, 0, 0, 0, 0, 0, 133310, NULL, 17, NULL, 'Minus 6 Gaming (Sims 4/ Folge 4)', 'oCOpBPe7SUE', '<td class=\"yt-lastvideo\" data-sort=\"200908204800\" data-utime=\"201017-11\"><a href=\"https://youtu.be/oCOpBPe7SUE\" title=\"Minus 6 Gaming (Sims 4/ Folge 4)\" target=\"_blank\">Di. 08.09.20</a><div class=\"info\"><div class=\"close\"></div><div class=\"circle\" style=\"background-image:url(https://i4.ytimg.com/vi/oCOpBPe7SUE/hqdefault.jpg)\"></div><p>Minus 6 Gaming (Sims 4/ Folge 4)<br><br>Views: 53 &nbsp; Ø/Video: 7842<br>Veröffentlicht am: Di. 08.09.20 um 20:48 Uhr</p><div class=\"abobar\"><a href=\"https://youtu.be/oCOpBPe7SUE\" target=\"_blank\" class=\"red\">zum Video</a></div></div></td>', 53, '2020-09-08T18:48:00+00:00', '200908204800', 'ch');
INSERT INTO `channels` VALUES (195, 0, 'UCgng902D2LqUNlGnVsyGenA', 'AemJaY plays DiscGolf', 'Hallo zusammen, schön habt Ihr den weiten Weg durch das World Wide Web zu mir gefunden. Mein Name ist AemJaY und auf diesem Kanal dreht sich alles rund ums Thema Disc Golf.<br /><br />►► discgolf.aemjay.tv<br /><br />Was gibt es zu sehen:<br /><br />►► News zu meiner «Karriere»<br />►► Tipps und Tricks<br />►► Kurs Vorstellungen<br />►► Disc Reviews<br /><br />Was Ihr auf meinem Kanal nicht finden werdet:<br /><br />►► Pro plays <br /><br />Ich habe mit Disc Golf im März 2020 begonnen, bin also blutiger Anfänger. Dennoch der Weg ist das Ziel und so auch dieser Youtube Kanal.', 'https://yt3.ggpht.com/a/AATXAJyjny1yYiouEC-w1yuV1EvCyznFOCRcdB9PKktZ=s88-c-k-c0xffffffff-no-rj-mo', 'Marco Juen', '', '', '', 'aemjay', 'zackenamsle', '-5-11-20-', '28.04.2020', '201017-11', '201017-11', 0, 0, 0, 0, 0, 32, NULL, 0, 0, 0, 0, 0, 1478, NULL, 16, NULL, 'Adliswil im Tal #Discgolf #park #review', 'rxoLnt8uYHk', '<td class=\"yt-lastvideo\" data-sort=\"201016104001\" data-utime=\"201017-11\"><a href=\"https://youtu.be/rxoLnt8uYHk\" title=\"Adliswil im Tal #Discgolf #park #review\" target=\"_blank\">Fr. 16.10.20</a><div class=\"info\"><div class=\"close\"></div><div class=\"circle\" style=\"background-image:url(https://i3.ytimg.com/vi/rxoLnt8uYHk/hqdefault.jpg)\"></div><p>Adliswil im Tal #Discgolf #park #review<br><br>Views: 18 &nbsp; Ø/Video: 92<br>Veröffentlicht am: Fr. 16.10.20 um 10:40 Uhr</p><div class=\"abobar\"><a href=\"https://youtu.be/rxoLnt8uYHk\" target=\"_blank\" class=\"red\">zum Video</a></div></div></td>', 18, '2020-10-16T08:40:01+00:00', '201016104001', 'ch');
INSERT INTO `channels` VALUES (196, 0, 'UCfleEb6O_oBTpBuYO7JBp9A', 'Spiegelbild', 'Spiegelbild ist eine Mundart-Rock-Band aus Wetzikon ZH. Unter anderem Namen bereits 2006 zusammen gekommen und einiges erlebt - u.A. Gewinn Newcomer-Contest im damaligen Alpenrock House in Kloten. Aber auch Unterbruch. Nun wieder unterwegs zu viert als \"Spiegelbild\".<br /><br />Monika Wiegele – vocals<br />Pascal Kunz – guitar, vocals<br />Olivier Kägi – drums<br />Sam Steiner – bass', 'https://yt3.ggpht.com/a/AATXAJwyHE6R6SYPDyud-XRBAzv9URl36rGEBr_a9fj-Rw=s88-c-k-c0xffffffff-no-rj-mo', 'Monika Wagner, Pascal Kunz, Olivier Kägi, Sam Steiner', 'https://www.youtube.com/spiegelbild', 'https://spiegelbildband.ch', '', '', 'spiegelbildband.ch', '-8-20-', '08.05.2017', '201017-11', '201017-11', 0, 0, 0, 0, 52, 119, NULL, 0, 0, 0, 0, 1382, 30395, NULL, 16, NULL, 'Maskeball - Spiegelbild', 'O_eevDjrrnk', '<td class=\"yt-lastvideo\" data-sort=\"200920132519\" data-utime=\"201017-11\"><a href=\"https://youtu.be/O_eevDjrrnk\" title=\"Maskeball - Spiegelbild\" target=\"_blank\">So. 20.09.20</a><div class=\"info\"><div class=\"close\"></div><div class=\"circle\" style=\"background-image:url(https://i4.ytimg.com/vi/O_eevDjrrnk/hqdefault.jpg)\"></div><p>Maskeball - Spiegelbild<br><br>Views: 45 &nbsp; Ø/Video: 1900<br>Veröffentlicht am: So. 20.09.20 um 13:25 Uhr</p><div class=\"abobar\"><a href=\"https://youtu.be/O_eevDjrrnk\" target=\"_blank\" class=\"red\">zum Video</a></div></div></td>', 45, '2020-09-20T11:25:19+00:00', '200920132519', 'ch');
INSERT INTO `channels` VALUES (197, 0, 'UCFploxCyTY6C_lTnPXcEy4Q', 'Boyband CHIC', 'Wir sind Boyband CHIC! <br />Eine aufstrebende Boyband bestehend aus David Bregenzer, Samuel Rauber und Jonas Weber.<br />boyband.ch', 'https://yt3.ggpht.com/a/AATXAJybYa2-T3BDOdniUAqHH-tE6CMT9dlMPfCKnHfP=s88-c-k-c0xffffffff-no-rj-mo', '', '', 'https://boyband.ch', '', '', '', '-8-', '06.06.2018', '201017-11', '201017-11', 0, 0, 0, 0, 0, 174, NULL, 0, 0, 0, 0, 0, 19794, NULL, 4, NULL, 'Boyband CHIC - si tanzet', 'Wqnyc8x9_9A', '<td class=\"yt-lastvideo\" data-sort=\"200710120850\" data-utime=\"201017-11\"><a href=\"https://youtu.be/Wqnyc8x9_9A\" title=\"Boyband CHIC - si tanzet\" target=\"_blank\">Fr. 10.07.20</a><div class=\"info\"><div class=\"close\"></div><div class=\"circle\" style=\"background-image:url(https://i4.ytimg.com/vi/Wqnyc8x9_9A/hqdefault.jpg)\"></div><p>Boyband CHIC - si tanzet<br><br>Views: 898 &nbsp; Ø/Video: 4949<br>Veröffentlicht am: Fr. 10.07.20 um 12:08 Uhr</p><div class=\"abobar\"><a href=\"https://youtu.be/Wqnyc8x9_9A\" target=\"_blank\" class=\"red\">zum Video</a></div></div></td>', 898, '2020-07-10T10:08:50+00:00', '200710120850', 'ch');
INSERT INTO `channels` VALUES (198, 0, 'UCMo5DJ_gJDlm0h_2iEHuyJw', 'New Aura Ent', '', 'https://yt3.ggpht.com/a/AATXAJzWW40khzR0Lx45kEPzk1mNJu6WWPrR8GySPqSJIFY=s88-c-k-c0xffffffff-no-rj-mo', '', 'https://www.youtube.com/newauraent', '', '', '', 'lievinnewaura', '-8-', '15.03.2013', '201017-11', '201017-11', 0, 0, 456, 1140, 1350, 2160, NULL, 0, 0, 89978, 256854, 344577, 677239, NULL, 16, NULL, 'LieVin - Bounce', 'UgDCm4d2nnU', '<td class=\"yt-lastvideo\" data-sort=\"200904000011\" data-utime=\"201017-11\"><a href=\"https://youtu.be/UgDCm4d2nnU\" title=\"LieVin - Bounce\" target=\"_blank\">Fr. 04.09.20</a><div class=\"info\"><div class=\"close\"></div><div class=\"circle\" style=\"background-image:url(https://i2.ytimg.com/vi/UgDCm4d2nnU/hqdefault.jpg)\"></div><p>LieVin - Bounce<br><br>Views: 92154 &nbsp; Ø/Video: 42327<br>Veröffentlicht am: Fr. 04.09.20 um 00:00 Uhr</p><div class=\"abobar\"><a href=\"https://youtu.be/UgDCm4d2nnU\" target=\"_blank\" class=\"red\">zum Video</a></div></div></td>', 92154, '2020-09-03T22:00:11+00:00', '200904000011', 'ch');
INSERT INTO `channels` VALUES (199, 0, 'UC7CAGoduO7Tl8HdMxvvGSJg', 'Steine Meister', 'Liebe Steine Freunde. <br />Herzlich Willkommen beim Steine Meister. Aus dem Herzen der Schweiz, aus dem wunderschönen Städtchen Zofingen.<br /><br />Ich zeige euch auf diesem Kanal Tipps und Tricks wie ihr als Bauherr schöne Modulare Bauten wie bspw.. Häuser erstellt und zum Master werdet. Dieser Kanal ist explizit für Erwachsene und nicht Kinder gedacht, und soll dich als Erwachsene animieren dank Klemmbausteine (Noppensteine) unter anderem mehrheitlich der Firma Lego®️ aber auch Wange, Xingbao, Sembo, Hsahne, usw.  kreativ zu sein. Dieses Hobby macht Spass und du kannst nach der Arbeit gut abschalten.<br /><br />Dein Steine Meister - Thomas Affentranger', 'https://yt3.ggpht.com/a/AATXAJwSYMI6-sf2QxZYmqd_jt_-ZZpmotJ0LWp7HUw64w=s88-c-k-c0xffffffff-no-rj-mo', 'Thomas Affentranger', '', 'https://thomas-affentranger.ch/steinemeister/', '', '', '', '-7-15-', '28.11.2019', '201017-11', '201017-11', 0, 0, 0, 0, 0, 1350, NULL, 0, 0, 0, 0, 0, 77627, NULL, 102, NULL, 'Pizzeria MOC aus Lego Friends: Wer hat die Pizza erfunden.', 'ACTrD_CiHwk', '<td class=\"yt-lastvideo\" data-sort=\"201015201500\" data-utime=\"201017-11\"><a href=\"https://youtu.be/ACTrD_CiHwk\" title=\"Pizzeria MOC aus Lego Friends: Wer hat die Pizza erfunden.\" target=\"_blank\">Do. 15.10.20</a><div class=\"info\"><div class=\"close\"></div><div class=\"circle\" style=\"background-image:url(https://i2.ytimg.com/vi/ACTrD_CiHwk/hqdefault.jpg)\"></div><p>Pizzeria MOC aus Lego Friends: Wer hat die Pizza erfunden.<br><br>Views: 158 &nbsp; Ø/Video: 761<br>Veröffentlicht am: Do. 15.10.20 um 20:15 Uhr</p><div class=\"abobar\"><a href=\"https://youtu.be/ACTrD_CiHwk\" target=\"_blank\" class=\"red\">zum Video</a></div></div></td>', 158, '2020-10-15T18:15:00+00:00', '201015201500', 'ch');
INSERT INTO `channels` VALUES (200, 0, 'UCQKOGmYTvhYLfA17ZNd_ENQ', 'StefV1985', 'Herzlich Willkommen auf meinem Kanal. Hier erscheinen Videos von Aufzügen in der Schweiz und teilweise auch vom Ausland.<br /><br />Wichtige Info zuerst: Das filmen von Aufzügen und ähnlichen Anlagen ist nicht verboten! Es hat hier auch Videos von Anlagen in Gebäuden, welche immer geschlossen sind. Ich kam aber immer offiziell ins Haus ohne Gewalt etc. Sollte sich jemand betroffen fühlen, dann bitte hier melden, danke. (Für solche Rückmeldungen bin ich dankbar).<br /><br />Der Schwerpunkt an Videos liegt an älteren oder spezielleren Anlagen. Jedoch wird es auch 0815 Aufzüge geben. <br />Die Aufzüge werden mehrheitlich von mir selber gefilmt. Sollte jemand anderes einen Aufzug filmen z.B. meine Freundin, wird dies in der Videobeschreibung erwähnt.<br />Die Angaben in der Videobeschreibung wie Baujahr, Marke, Adressen etc. gelten ausdrücklich ohne Gewähr. Es kann sein, dass ein, vor allem alter originaler Aufzug, in der Zwischenzeit modernisiert wurde.<br />Viel Spass mit meinen Videos.', 'https://yt3.ggpht.com/a/AATXAJwp1BsFvN-NxApHoZCyb9SYCx_6ImGYYbk_Yms75g=s88-c-k-c0xffffffff-no-rj-mo', 'Stefan Veit', 'https://www.youtube.com/StefV1985', 'https://www.facebook.com/StefV1985', '', '', '', '-7-33-', '07.03.2010', '201017-11', '201017-11', 0, 73, 175, 403, 1010, 1140, NULL, 0, 39831, 176617, 514098, 1289486, 1617982, NULL, 636, NULL, 'Aufzug Aufzüge Boltshauser @Kantonsstrasse 24, 7302 Landquart, Schweiz', 'eUkcTQsML5g', '<td class=\"yt-lastvideo\" data-sort=\"201013162123\" data-utime=\"201017-11\"><a href=\"https://youtu.be/eUkcTQsML5g\" title=\"Aufzug Aufzüge Boltshauser @Kantonsstrasse 24, 7302 Landquart, Schweiz\" target=\"_blank\">Di. 13.10.20</a><div class=\"info\"><div class=\"close\"></div><div class=\"circle\" style=\"background-image:url(https://i2.ytimg.com/vi/eUkcTQsML5g/hqdefault.jpg)\"></div><p>Aufzug Aufzüge Boltshauser @Kantonsstrasse 24, 7302 Landquart, Schweiz<br><br>Views: 182 &nbsp; Ø/Video: 2544<br>Veröffentlicht am: Di. 13.10.20 um 16:21 Uhr</p><div class=\"abobar\"><a href=\"https://youtu.be/eUkcTQsML5g\" target=\"_blank\" class=\"red\">zum Video</a></div></div></td>', 182, '2020-10-13T14:21:23+00:00', '201013162123', 'ch');
INSERT INTO `channels` VALUES (201, 0, 'UCqtaev3Q2muauNosvtbD0HA', 'Sevthealman', 'ich mache content uf schwiizerdütsch / uploads jedi 3. wuche', 'https://yt3.ggpht.com/a/AATXAJz01t-PdmTdifaOnfuqZhGwPAzlTl1tlB0K3a14=s88-c-k-c0xffffffff-no-rj-mo', '', '', '', '', '', 'sevthealman', '-6-', '02.07.2020', '201017-11', '201017-11', 0, 0, 0, 0, 0, 428, NULL, 0, 0, 0, 0, 0, 5969, NULL, 6, NULL, 'Wer sind Schwizer Youtuber?', 'NGczo__I-BM', '<td class=\"yt-lastvideo\" data-sort=\"201011193000\" data-utime=\"201017-11\"><a href=\"https://youtu.be/NGczo__I-BM\" title=\"Wer sind Schwizer Youtuber?\" target=\"_blank\">So. 11.10.20</a><div class=\"info\"><div class=\"close\"></div><div class=\"circle\" style=\"background-image:url(https://i3.ytimg.com/vi/NGczo__I-BM/hqdefault.jpg)\"></div><p>Wer sind Schwizer Youtuber?<br><br>Views: 668 &nbsp; Ø/Video: 995<br>Veröffentlicht am: So. 11.10.20 um 19:30 Uhr</p><div class=\"abobar\"><a href=\"https://youtu.be/NGczo__I-BM\" target=\"_blank\" class=\"red\">zum Video</a></div></div></td>', 668, '2020-10-11T17:30:00+00:00', '201011193000', 'ch');
INSERT INTO `channels` VALUES (202, 1, 'UCDFpQQJ7SDTsnjacCPb241g', 'Visu', 'visu beweist dass er kein Rapperklischee erfüllen muss und sich seine eigene Identität herauskristallisieren kann. er ist der gute Junge von nebenan, der Alltagsheld der für dich da ist und der mit seinen Songs und seiner Bühnenpräsenz für Unterhaltung und Stimmung sorgt.', 'https://yt3.ggpht.com/a/AATXAJw6DY-PrWu6vqPmynKpVfpn00-dbWez_x_ZKHazUQ=s88-c-k-c0xffffffff-no-rj-mo', 'Vincenz Suter', 'https://www.visurap.ch', '', '', '', 'visu_vagabundo', '-8-29-', '02.01.2011', '201016-20', '201017-11', 0, 0, 0, 0, 3920, 1300, NULL, 0, 0, 0, 0, 92432, 275637, NULL, 33, NULL, 'LIBRA Plattentaufe - LIVE', 'FkJ6Doc1eSo', '<td class=\"yt-lastvideo\" data-sort=\"190703191553\" data-utime=\"201017-11\"><a href=\"https://youtu.be/FkJ6Doc1eSo\" title=\"LIBRA Plattentaufe - LIVE\" target=\"_blank\">Mi. 03.07.19</a><div class=\"info\"><div class=\"close\"></div><div class=\"circle\" style=\"background-image:url(https://i3.ytimg.com/vi/FkJ6Doc1eSo/hqdefault.jpg)\"></div><p>LIBRA Plattentaufe - LIVE<br><br>Views: 1041 &nbsp; Ø/Video: 8353<br>Veröffentlicht am: Mi. 03.07.19 um 19:15 Uhr</p><div class=\"abobar\"><a href=\"https://youtu.be/FkJ6Doc1eSo\" target=\"_blank\" class=\"red\">zum Video</a></div></div></td>', 1041, '2019-07-03T17:15:53+00:00', '190703191553', 'ch');
INSERT INTO `channels` VALUES (203, 0, 'UCSan8I9qj9ItuETRdkBRjpQ', 'HittekEnt.', 'Musik und Produktion<br /><br />facebook.com/hittekent?ref=tn_tnmn<br /><br />soundcloud.com/hittek-entertainement/sets', 'https://yt3.ggpht.com/a/AATXAJzYR2-KSeRFsfBGEVR2lKA5026bMMny0u-qgD8I=s88-c-k-c0xffffffff-no-rj-mo', '', 'https://www.youtube.com/HittekHD', '', '', '', 'syndikatmusic_official', '-8-', '12.03.2012', '201017-11', '201017-11', 0, 960, 1120, 1740, 2300, 2620, NULL, 0, 492188, 561245, 727885, 944813, 1100766, NULL, 44, NULL, 'Karizhma Dankbar 3:00 EP', 'GWBSmtAuI-E', '<td class=\"yt-lastvideo\" data-sort=\"200110155528\" data-utime=\"201017-11\"><a href=\"https://youtu.be/GWBSmtAuI-E\" title=\"Karizhma Dankbar 3:00 EP\" target=\"_blank\">Fr. 10.01.20</a><div class=\"info\"><div class=\"close\"></div><div class=\"circle\" style=\"background-image:url(https://i4.ytimg.com/vi/GWBSmtAuI-E/hqdefault.jpg)\"></div><p>Karizhma Dankbar 3:00 EP<br><br>Views: 910 &nbsp; Ø/Video: 25017<br>Veröffentlicht am: Fr. 10.01.20 um 15:55 Uhr</p><div class=\"abobar\"><a href=\"https://youtu.be/GWBSmtAuI-E\" target=\"_blank\" class=\"red\">zum Video</a></div></div></td>', 910, '2020-01-10T14:55:28+00:00', '200110155528', 'ch');
INSERT INTO `channels` VALUES (204, 1, 'UCeO7RVj4QTw1I_11a_XCxcQ', 'freelikeabird', '', 'https://yt3.ggpht.com/a/AATXAJwPiykN_R2_H0ladK69QzjpTAedqYz6BTfLU_X0=s88-c-k-c0xffffffff-no-rj-mo', '', '', '', '', '', '', '-1-', '23.06.2017', '201016-20', '201017-11', 0, 0, 0, 290, 296, 297, NULL, 0, 0, 0, 27564, 35084, 37641, NULL, 104, NULL, 'Jetzt ist Schluss!', 'qkaQBhkGS_8', '<td class=\"yt-lastvideo\" data-sort=\"190319180635\" data-utime=\"201017-11\"><a href=\"https://youtu.be/qkaQBhkGS_8\" title=\"Jetzt ist Schluss!\" target=\"_blank\">Di. 19.03.19</a><div class=\"info\"><div class=\"close\"></div><div class=\"circle\" style=\"background-image:url(https://i2.ytimg.com/vi/qkaQBhkGS_8/hqdefault.jpg)\"></div><p>Jetzt ist Schluss!<br><br>Views: 529 &nbsp; Ø/Video: 362<br>Veröffentlicht am: Di. 19.03.19 um 18:06 Uhr</p><div class=\"abobar\"><a href=\"https://youtu.be/qkaQBhkGS_8\" target=\"_blank\" class=\"red\">zum Video</a></div></div></td>', 529, '2019-03-19T17:06:35+00:00', '190319180635', 'ch');
INSERT INTO `channels` VALUES (205, 0, 'UC6-wqyfq7zb-F22q__gB4Ag', 'Diego Brügger', 'Nur ä witere Dude wo chli Filmt und Spass dran het.', 'https://yt3.ggpht.com/a/AATXAJz8ugWhGsHPeWMOwaYik-EgK4hefYhVfHdJ9b4DZg=s88-c-k-c0xffffffff-no-rj-mo', '', '', '', '', '', 'diego.brugger', '-5-', '06.10.2016', '201017-11', '201017-11', 0, 0, 0, 0, 58, 70, NULL, 0, 0, 0, 0, 2131, 3777, NULL, 11, NULL, 'AARE SURF', 'Oc6Su6-V01E', '<td class=\"yt-lastvideo\" data-sort=\"200822155359\" data-utime=\"201017-11\"><a href=\"https://youtu.be/Oc6Su6-V01E\" title=\"AARE SURF\" target=\"_blank\">Sa. 22.08.20</a><div class=\"info\"><div class=\"close\"></div><div class=\"circle\" style=\"background-image:url(https://i4.ytimg.com/vi/Oc6Su6-V01E/hqdefault.jpg)\"></div><p>AARE SURF<br><br>Views: 235 &nbsp; Ø/Video: 343<br>Veröffentlicht am: Sa. 22.08.20 um 15:53 Uhr</p><div class=\"abobar\"><a href=\"https://youtu.be/Oc6Su6-V01E\" target=\"_blank\" class=\"red\">zum Video</a></div></div></td>', 235, '2020-08-22T13:53:59+00:00', '200822155359', 'ch');
INSERT INTO `channels` VALUES (206, 1, 'UCQqncPJ6crTkW_WuoLwXLkg', 'riSurvival89', 'Meine Survival Schule:<br />risurvival-training.ch/<br /><br />Hol dir jetzt mein neues Survival Buch!<br />paramon.ch/produkt/das-grosse-survival-bilder-buch-iller/<br /><br />Mein Name ist Remo Iller, Schweizer Youtuber und Buch Autor.<br />Ich Interesiere mich für Überlebenstraining jeder Art und Form ob es heißt alleine Überleben in der Wildnis oder sich durchkämpfen im Alltag, heutzutage hat Survival eine vielseitigere Form angenommen, als nur Feuer machen und Unterkunft bauen...<br />Ich habe einen starken drang neue wichtige Sachen zu lernen ich mache spannende und Interessante Videos über viele verschiedene Themen. Auf meinem Kanal lernst du alles von A-Z über Survival Training und vieles mehr, hol dir mein Survival Buch um noch intensiver <br />zu lernen. Schau dir meine Videos an und viel spass.<br />Du kannst riSurvival89 mit einer Spende unterstützen, den Paypal Link findest du unten, danke dir.<br /><br />Gruss Remo<br /><br />All Musik Licence by:  audiojungle.net<br />(Standard Licenses)   audiojungle.net/', 'https://yt3.ggpht.com/a/AATXAJxhY4KfttE4dQqhG7RwaXSHmbYvWTxo1Ta_eymsiw=s88-c-k-c0xffffffff-no-rj-mo', 'Remo Iller', 'https://www.youtube.com/risurvival89', 'http://www.risurvival-training.ch', '', '', 'remoiller', '-7-18-21-', '22.11.2013', '201016-20', '201017-11', 0, 16367, 21307, 25110, 27400, 29900, NULL, 0, 2671693, 4067166, 3874063, 5819382, 6406934, NULL, 257, NULL, 'Kilimanjaro 5895m Besteigung Dezember 2019 (Bilder und Videos) Machame Route 6 Days', 'oN9y98mPOsI', '<td class=\"yt-lastvideo\" data-sort=\"191228093820\" data-utime=\"201017-11\"><a href=\"https://youtu.be/oN9y98mPOsI\" title=\"Kilimanjaro 5895m Besteigung Dezember 2019 (Bilder und Videos) Machame Route 6 Days\" target=\"_blank\">Sa. 28.12.19</a><div class=\"info\"><div class=\"close\"></div><div class=\"circle\" style=\"background-image:url(https://i4.ytimg.com/vi/oN9y98mPOsI/hqdefault.jpg)\"></div><p>Kilimanjaro 5895m Besteigung Dezember 2019 (Bilder und Videos) Machame Route 6 Days<br><br>Views: 5371 &nbsp; Ø/Video: 24930<br>Veröffentlicht am: Sa. 28.12.19 um 09:38 Uhr</p><div class=\"abobar\"><a href=\"https://youtu.be/oN9y98mPOsI\" target=\"_blank\" class=\"red\">zum Video</a></div></div></td>', 5371, '2019-12-28T08:38:20+00:00', '191228093820', 'ch');
INSERT INTO `channels` VALUES (207, 1, 'UCTfj33hhCmEDeivyAfrkdZA', 'DiEiniDa', 'Hey Leute :)<br /><br />Für die wo sich wundered wo d Videos ane sind - han si uf privat gstellt, ned komplett glöscht! Das Ganze hed privati Gründ. Es passiert grad recht vill und deswege hani entschide, Abstand vo YouTube z neh (für wie lang weisi selber ned) - aber alles im positive Bereich, ned dass sich jetz epper sorge macht ^^', 'https://yt3.ggpht.com/a/AATXAJyfVEGLIVqaltCFY2gJDXNyU-TtH2HZLTJ81ZCmiQ=s88-c-k-c0xffffffff-no-rj-mo', '', '', '', '', '', '', '-6-', '17.10.2018', '201016-20', '201017-11', 0, 0, 0, 0, 30, 25, NULL, 0, 0, 0, 0, 59, 98, NULL, 2, NULL, 'An autumnal walk (B-Roll)', 'm-HSXOiDEAg', '<td class=\"yt-lastvideo\" data-sort=\"191025165632\" data-utime=\"201017-11\"><a href=\"https://youtu.be/m-HSXOiDEAg\" title=\"An autumnal walk (B-Roll)\" target=\"_blank\">Fr. 25.10.19</a><div class=\"info\"><div class=\"close\"></div><div class=\"circle\" style=\"background-image:url(https://i2.ytimg.com/vi/m-HSXOiDEAg/hqdefault.jpg)\"></div><p>An autumnal walk (B-Roll)<br><br>Views: 51 &nbsp; Ø/Video: 49<br>Veröffentlicht am: Fr. 25.10.19 um 16:56 Uhr</p><div class=\"abobar\"><a href=\"https://youtu.be/m-HSXOiDEAg\" target=\"_blank\" class=\"red\">zum Video</a></div></div></td>', 51, '2019-10-25T14:56:32+00:00', '191025165632', 'ch');
INSERT INTO `channels` VALUES (208, 0, 'UCjrbBT41Yd4URIhUqTah3-g', 'Grüezi TV', 'Wir wünschen Ihnen viel Spass mit unseren Videos! Es würde uns sehr freuen wenn Sie unseren Kanal abonnieren. Seien Sie interaktiv und bewerten Sie unsere Videos. Selbstverständlich stehen wir auch \"Rede und Antwort\" bei Fragen oder Anliegen zu unseren Videos oder Stars!<br /><br />Um keine Neuigkeiten über Neuveröffentlichungen zu verpassen, besuchen Sie uns doch auf Facebook/grüezi music und liken Sie uns... <br /><br />Zu uns:<br /><br />Wir sind einer der grössten Volksmusik Produzenten und Vertreiber der Schweiz. Die Videos in diesem Kanal sind ein kleiner Auszug aus unserem Sortiment den wir immer weiter ausbauen werden. Unsere gesamten Werke finden Sie unter gruezimusic.ch oder gruezishop.ch. Besuchen Sie uns doch und \"stöbern\" Sie in tausenden von Titeln. Sei es eine bestimmte Blaskapelle (regional oder international), eine urchige Örgeli Formation, Klassische Musik von A-Z oder nationale wie internationale Stars. Bei uns werden Sie fündig!<br /><br />enjoy <br /><br />Grüezi TV by Grüezi Music AG', 'https://yt3.ggpht.com/a/AATXAJx-5dB1DBMrAgHM2VuTB9J7324Y40pVnhVMTzGmqQ=s88-c-k-c0xffffffff-no-rj-mo', '', 'https://www.youtube.com/gruezitv', 'https://www.gruezimusic.ch', '', '', '', '-8-', '19.10.2015', '201017-11', '201017-11', 0, 0, 1745, 3960, 6520, 8220, NULL, 0, 0, 1758799, 4055162, 7991108, 10613184, NULL, 320, NULL, 'Rusch Büeblä - en guetä Fründ', 'DTOaHlLpvOw', '<td class=\"yt-lastvideo\" data-sort=\"201012122956\" data-utime=\"201017-11\"><a href=\"https://youtu.be/DTOaHlLpvOw\" title=\"Rusch Büeblä - en guetä Fründ\" target=\"_blank\">Mo. 12.10.20</a><div class=\"info\"><div class=\"close\"></div><div class=\"circle\" style=\"background-image:url(https://i1.ytimg.com/vi/DTOaHlLpvOw/hqdefault.jpg)\"></div><p>Rusch Büeblä - en guetä Fründ<br><br>Views: 3629 &nbsp; Ø/Video: 33166<br>Veröffentlicht am: Mo. 12.10.20 um 12:29 Uhr</p><div class=\"abobar\"><a href=\"https://youtu.be/DTOaHlLpvOw\" target=\"_blank\" class=\"red\">zum Video</a></div></div></td>', 3629, '2020-10-12T10:29:56+00:00', '201012122956', 'ch');
INSERT INTO `channels` VALUES (209, 0, 'UCFMSoxLM2bE2bnfS24RQilQ', 'Sing mit Nelly', 'Willkommen auf dem Kanal -  Sing mit Nelly | Kinderlieder. <br />Regelmäßig werden hier Kinderlieder hochgeladen. Bei diesen Lieder ist Mittanzen sowie Mitsingen nicht nur erlaubt sondern auch sehr erwünscht. <br />Hoffe euch gefallen die Kinderlieder. Wenn ihr Tipps, Anregung oder Feedback für mich habt scheut nicht davor  mir einen Kommentar dar zulassen. :) <br />Für wünsche zu Kinderlieder zum Mittanzen oder Mitsingen gilt das gleiche. Einfach gerne einen Kommentar schreiben. <br />Freue mich sehr über Anregungen von euch.<br />Ich wünsch euch allen noch einen wundervollen Tag und nur das beste für euch.<br /><br />Sing mit Nelly<br /><br />Instagram: SingMitNelly<br />Homepage: sing-mit-nelly.com/<br />Facebook: Sing mit Nelly', 'https://yt3.ggpht.com/a/AATXAJzkHacIhlAvjQ64CajepL0n25cnxFmnC8X2U3q-sw=s88-c-k-c0xffffffff-no-rj-mo', '', 'https://www.youtube.com/SingmitNelly', 'https://www.sing-mit-nelly.com', '', '', 'singmitnelly', '-8-18-20-', '28.07.2015', '201017-11', '201017-11', 0, 0, 0, 0, 127, 2110, NULL, 0, 0, 0, 0, 62759, 292031, NULL, 64, NULL, 'Häsli Ingo stellt sich vor', 'UZMbRiE_Y5I', '<td class=\"yt-lastvideo\" data-sort=\"201016230740\" data-utime=\"201017-11\"><a href=\"https://youtu.be/UZMbRiE_Y5I\" title=\"Häsli Ingo stellt sich vor\" target=\"_blank\">Fr. 16.10.20</a><div class=\"info\"><div class=\"close\"></div><div class=\"circle\" style=\"background-image:url(https://i2.ytimg.com/vi/UZMbRiE_Y5I/hqdefault.jpg)\"></div><p>Häsli Ingo stellt sich vor<br><br>Views: 11 &nbsp; Ø/Video: 4563<br>Veröffentlicht am: Fr. 16.10.20 um 23:07 Uhr</p><div class=\"abobar\"><a href=\"https://youtu.be/UZMbRiE_Y5I\" target=\"_blank\" class=\"red\">zum Video</a></div></div></td>', 11, '2020-10-16T21:07:40+00:00', '201016230740', 'ch');
INSERT INTO `channels` VALUES (210, 0, 'UCzlyABX-JkR7BHRlhGujPXg', 'Sili', 'Willkommen auf unserem Kanal. <br />Auf diesem Kanal erwartet dich vieles zum Thema Motorsport aber auch mit anderen Videos wird für genügend Abwechslung gesorgt. <br />Willst du uns noch genauer kennen lernen dann schau doch auf unsere Homepage vorbei. <br />Wenn du fragen zum Thema Motorsport hast, dann schreibe diese doch gerne in die Kommentare und wir werden diese dir beantworten. <br />Falls du noch nicht Abonnent dieses Kanales bist, dann ändere das doch und klick auf abonnieren. Und wenn du schon dabei bist auch die Glocke aktivieren. <br /><br />Danke fürs durchlesen<br /><br />Swiss Racing', 'https://yt3.ggpht.com/a/AATXAJwF2hQc17-AJkzpnsB1Bqs8kZOH4oRwh96J_agbiyA=s88-c-k-c0xffffffff-no-rj-mo', 'Silvan Kuster', 'https://www.youtube.com/silihd', '', '', '', 'swiss_racing', '-5-6-23-', '28.11.2015', '201017-11', '201017-11', 0, 0, 109, 394, 441, 444, NULL, 0, 0, 3195, 11266, 17985, 21349, NULL, 123, NULL, 'Jetzt wird um dOhre gfahre | Asetto Corsa Singelplayer | SILI | CH-Deutsch', 'o_GZHgtRe5I', '<td class=\"yt-lastvideo\" data-sort=\"200506183155\" data-utime=\"201017-11\"><a href=\"https://youtu.be/o_GZHgtRe5I\" title=\"Jetzt wird um dOhre gfahre | Asetto Corsa Singelplayer | SILI | CH-Deutsch\" target=\"_blank\">Mi. 06.05.20</a><div class=\"info\"><div class=\"close\"></div><div class=\"circle\" style=\"background-image:url(https://i4.ytimg.com/vi/o_GZHgtRe5I/hqdefault.jpg)\"></div><p>Jetzt wird um dOhre gfahre | Asetto Corsa Singelplayer | SILI | CH-Deutsch<br><br>Views: 67 &nbsp; Ø/Video: 174<br>Veröffentlicht am: Mi. 06.05.20 um 18:31 Uhr</p><div class=\"abobar\"><a href=\"https://youtu.be/o_GZHgtRe5I\" target=\"_blank\" class=\"red\">zum Video</a></div></div></td>', 67, '2020-05-06T16:31:55+00:00', '200506183155', 'ch');
INSERT INTO `channels` VALUES (211, 0, 'UCL83Fj7_fROjfQQfv98S2ew', 'Sebufizzzt', 'Hi Ig bi der Sebu vo dä FizZzers<br /><br />Freuä mi wenni euch cha Unterhalt', 'https://yt3.ggpht.com/a/AATXAJwgSwluK3JrlEvIOhRwqE-1SGIHaxur3OdtlOZdqg=s88-c-k-c0xffffffff-no-rj-mo', '', '', '', '', '', 'sebufizzzt', '-6-25-', '20.06.2017', '201017-11', '201017-11', 0, 0, 0, 0, 235, 239, NULL, 0, 0, 0, 0, 9395, 10275, NULL, 52, NULL, 'Sofa RIP', 'GhVplEJWggk', '<td class=\"yt-lastvideo\" data-sort=\"201006100005\" data-utime=\"201017-11\"><a href=\"https://youtu.be/GhVplEJWggk\" title=\"Sofa RIP\" target=\"_blank\">Di. 06.10.20</a><div class=\"info\"><div class=\"close\"></div><div class=\"circle\" style=\"background-image:url(https://i4.ytimg.com/vi/GhVplEJWggk/hqdefault.jpg)\"></div><p>Sofa RIP<br><br>Views: 42 &nbsp; Ø/Video: 198<br>Veröffentlicht am: Di. 06.10.20 um 10:00 Uhr</p><div class=\"abobar\"><a href=\"https://youtu.be/GhVplEJWggk\" target=\"_blank\" class=\"red\">zum Video</a></div></div></td>', 42, '2020-10-06T08:00:05+00:00', '201006100005', 'ch');
INSERT INTO `channels` VALUES (212, 0, 'UCFFb6xejUnA4hIG1CXHOSFg', 'EliteBecker', 'E Wunderschöne guete Daag. Mi Name isch Nico, ich kum vo Basel (CH) und mach Unterhaltigsvideos.', 'https://yt3.ggpht.com/a/AATXAJxNBO6Rxa6sqQWUAJP6vW5Ia1Y1a4eTyiE0Zhgdpw=s88-c-k-c0xffffffff-no-rj-mo', 'Nico Becker', '', '', '', '', 'nicobecker__', '-6-21-', '30.12.2013', '201017-11', '201017-11', 0, 0, 0, 0, 0, 59, NULL, 0, 0, 0, 0, 0, 2487, NULL, 11, NULL, 'Wer kennt d Schwiz besser? (mitem Nico)', 'jNgJtAOGmq4', '<td class=\"yt-lastvideo\" data-sort=\"201005181503\" data-utime=\"201017-11\"><a href=\"https://youtu.be/jNgJtAOGmq4\" title=\"Wer kennt d Schwiz besser? (mitem Nico)\" target=\"_blank\">Mo. 05.10.20</a><div class=\"info\"><div class=\"close\"></div><div class=\"circle\" style=\"background-image:url(https://i3.ytimg.com/vi/jNgJtAOGmq4/hqdefault.jpg)\"></div><p>Wer kennt d Schwiz besser? (mitem Nico)<br><br>Views: 101 &nbsp; Ø/Video: 226<br>Veröffentlicht am: Mo. 05.10.20 um 18:15 Uhr</p><div class=\"abobar\"><a href=\"https://youtu.be/jNgJtAOGmq4\" target=\"_blank\" class=\"red\">zum Video</a></div></div></td>', 101, '2020-10-05T16:15:03+00:00', '201005181503', 'ch');
INSERT INTO `channels` VALUES (213, 0, 'UCatgqy7jqnNLh-bfp7-G95A', 'Kante-K', 'Rap Duo us Bern<br />-Mikado u Lalo-One-<br /><br />ds \"K\" steit für R.A.P', 'https://yt3.ggpht.com/a/AATXAJxWzd-i2S5WjSB1ujU3nuhncs0c8yiLXrdU-fw=s88-c-k-c0xffffffff-no-rj-mo', '', '', 'https://kante-k.live', '', '', 'kantek.official', '-8-25-', '18.12.2019', '201017-11', '201017-11', 0, 0, 0, 0, 39, 64, NULL, 0, 0, 0, 0, 736, 2192, NULL, 11, NULL, 'KanteK - Moonlight (feat. Isyimoku)', 'BpmQZonUc7k', '<td class=\"yt-lastvideo\" data-sort=\"200218083026\" data-utime=\"201017-11\"><a href=\"https://youtu.be/BpmQZonUc7k\" title=\"KanteK - Moonlight (feat. Isyimoku)\" target=\"_blank\">Di. 18.02.20</a><div class=\"info\"><div class=\"close\"></div><div class=\"circle\" style=\"background-image:url(https://i3.ytimg.com/vi/BpmQZonUc7k/hqdefault.jpg)\"></div><p>KanteK - Moonlight (feat. Isyimoku)<br><br>Views: 101 &nbsp; Ø/Video: 199<br>Veröffentlicht am: Di. 18.02.20 um 08:30 Uhr</p><div class=\"abobar\"><a href=\"https://youtu.be/BpmQZonUc7k\" target=\"_blank\" class=\"red\">zum Video</a></div></div></td>', 101, '2020-02-18T07:30:26+00:00', '200218083026', 'ch');
INSERT INTO `channels` VALUES (214, 0, 'UC1brmo4a2K1MCcl6BX-bUAA', 'Aditotoro', 'Jede Sunntig gits e neus Video & ab und zue Streams<br /><br />Lieber duesch abonniere oder ich nimm dini Schlappe weg!<br /><br />______________<br /><br /> - G E S C H Ä F T L I C H E  A N F R A G E N -<br /><br />adi.totoro@gmail.com<br /><br />______________<br /><br />© AdiTotoro / De Bifferent', 'https://yt3.ggpht.com/a/AATXAJy9csq7mO-_mcdpMs9okaubm2jz6R43pJNGryb9lg=s88-c-k-c0xffffffff-no-rj-mo', 'Adrian Vogt', 'https://www.youtube.com/aditotoro', '', 'https://open.spotify.com/show/4l4qN2RHTz7bKpkqjQTvDo', 'aditotoro', 'aditotoro', '-6-11-12-21-', '07.03.2015', '201017-11', '201017-11', 0, 838, 4383, 8030, 14100, 47800, NULL, 0, 39649, 238362, 637919, 1474111, 5057503, NULL, 196, NULL, 'ADITOTORO vs ANDRI RAGETTLI 🇨🇭😂 (Trampolin Battle)', 'oYqHfLKQ23I', '<td class=\"yt-lastvideo\" data-sort=\"201011180021\" data-utime=\"201017-11\"><a href=\"https://youtu.be/oYqHfLKQ23I\" title=\"ADITOTORO vs ANDRI RAGETTLI 🇨🇭😂 (Trampolin Battle)\" target=\"_blank\">So. 11.10.20</a><div class=\"info\"><div class=\"close\"></div><div class=\"circle\" style=\"background-image:url(https://i4.ytimg.com/vi/oYqHfLKQ23I/hqdefault.jpg)\"></div><p>ADITOTORO vs ANDRI RAGETTLI 🇨🇭😂 (Trampolin Battle)<br><br>Views: 28941 &nbsp; Ø/Video: 25804<br>Veröffentlicht am: So. 11.10.20 um 18:00 Uhr</p><div class=\"abobar\"><a href=\"https://youtu.be/oYqHfLKQ23I\" target=\"_blank\" class=\"red\">zum Video</a></div></div></td>', 28941, '2020-10-11T16:00:21+00:00', '201011180021', 'ch');
INSERT INTO `channels` VALUES (215, 0, 'UCqBJkhAJRM3Xt2IoodWsCFA', 'Christkönigsglocke94', 'Ich komme aus der Schweiz und giesse selber Bronzeglocken im Lehmform Verfahren. Da ich gerne auf Kirchtürme gehe, und an Glocken interessiert bin,  filme ich Geläute aus der Schweiz, Österreich und eventuell bald auch aus Deutschland. <br />Verbesserungsvorschläge sind willkommen.', 'https://yt3.ggpht.com/a/AATXAJwHMCZwF4IQwG9rOHNt4fqcdvqCfmY7hCg4J3BkDQ=s88-c-k-c0xffffffff-no-rj-mo', '', 'https://www.youtube.com/MrGT18', '', '', '', '', '-7-', '28.03.2011', '201017-11', '201017-11', 0, 0, 0, 0, 124, 180, NULL, 0, 0, 0, 0, 53099, 75585, NULL, 77, NULL, 'Romanshorn TG: Geläute der ref. Kirche', 'FZ8y3HGRSLg', '<td class=\"yt-lastvideo\" data-sort=\"200830151115\" data-utime=\"201017-11\"><a href=\"https://youtu.be/FZ8y3HGRSLg\" title=\"Romanshorn TG: Geläute der ref. Kirche\" target=\"_blank\">So. 30.08.20</a><div class=\"info\"><div class=\"close\"></div><div class=\"circle\" style=\"background-image:url(https://i3.ytimg.com/vi/FZ8y3HGRSLg/hqdefault.jpg)\"></div><p>Romanshorn TG: Geläute der ref. Kirche<br><br>Views: 415 &nbsp; Ø/Video: 982<br>Veröffentlicht am: So. 30.08.20 um 15:11 Uhr</p><div class=\"abobar\"><a href=\"https://youtu.be/FZ8y3HGRSLg\" target=\"_blank\" class=\"red\">zum Video</a></div></div></td>', 415, '2020-08-30T13:11:15+00:00', '200830151115', 'ch');
INSERT INTO `channels` VALUES (216, 0, 'UCjms9ennZf0b15xGxeTtE1g', 'Robin Rehmann', 'Vlog. Hier dokumentiere ich mein Leben und trete mit Menschen in Kontakt. Ich freue mich dich kennenzulernen!', 'https://yt3.ggpht.com/a/AATXAJxgvWP4nGxrJrPh4nIa9VbteoyGAJb51wufZLpMBg=s88-c-k-c0xffffffff-no-rj-mo', '', 'https://www.youtube.com/robinrehmann', '', '', '', 'robinrehmann', '-6-20-', '10.08.2006', '201017-11', '201017-11', 2355, 2659, 2888, 3410, 4800, 5210, NULL, 2833844, 3092167, 3225630, 3425692, 3921888, 2896037, NULL, 483, NULL, 'Mad Pride Bern', 'euR-0wGYEpg', '<td class=\"yt-lastvideo\" data-sort=\"201010104700\" data-utime=\"201017-11\"><a href=\"https://youtu.be/euR-0wGYEpg\" title=\"Mad Pride Bern\" target=\"_blank\">Sa. 10.10.20</a><div class=\"info\"><div class=\"close\"></div><div class=\"circle\" style=\"background-image:url(https://i2.ytimg.com/vi/euR-0wGYEpg/hqdefault.jpg)\"></div><p>Mad Pride Bern<br><br>Views: 341 &nbsp; Ø/Video: 5996<br>Veröffentlicht am: Sa. 10.10.20 um 10:47 Uhr</p><div class=\"abobar\"><a href=\"https://youtu.be/euR-0wGYEpg\" target=\"_blank\" class=\"red\">zum Video</a></div></div></td>', 341, '2020-10-10T08:47:00+00:00', '201010104700', 'ch');
INSERT INTO `channels` VALUES (217, 0, 'UC5sJAaASDb8nCxMy8Qs2tCw', 'Corner Talk', 'Der HipHop Talk aus der Schweiz! Big Sema und Pretty Steezo laden zum persönlichen Gespräch ein! <br />Mit gutem Schnapps, feinstem CBD und bestem Bier wird mit den Gästen über Kultur, Kunst und Business philosophiert. Achtung: Im Corner Talk wird nicht gelogen!', 'https://yt3.ggpht.com/a/AATXAJy5Qs_OC1Olv65ISFLBNJ9XxHsyAb8eGFwf5iJx=s88-c-k-c0xffffffff-no-rj-mo', '', '', '', '', '', 'cornertalkofficial', '-6-8-', '27.02.2020', '201017-11', '201017-11', 0, 0, 0, 0, 0, 609, NULL, 0, 0, 0, 0, 0, 47247, NULL, 6, NULL, 'Knackeboul & Luuk | Corner Talk (Full Episode)', 'X1axlHKMu_U', '<td class=\"yt-lastvideo\" data-sort=\"201001070006\" data-utime=\"201017-11\"><a href=\"https://youtu.be/X1axlHKMu_U\" title=\"Knackeboul & Luuk | Corner Talk (Full Episode)\" target=\"_blank\">Do. 01.10.20</a><div class=\"info\"><div class=\"close\"></div><div class=\"circle\" style=\"background-image:url(https://i1.ytimg.com/vi/X1axlHKMu_U/hqdefault.jpg)\"></div><p>Knackeboul & Luuk | Corner Talk (Full Episode)<br><br>Views: 3305 &nbsp; Ø/Video: 7875<br>Veröffentlicht am: Do. 01.10.20 um 07:00 Uhr</p><div class=\"abobar\"><a href=\"https://youtu.be/X1axlHKMu_U\" target=\"_blank\" class=\"red\">zum Video</a></div></div></td>', 3305, '2020-10-01T05:00:06+00:00', '201001070006', 'ch');
INSERT INTO `channels` VALUES (218, 0, 'UCgmz-9Z8WbnxGIhfEEXgDpg', 'Anthrazit Pearl', 'ÜBER MICH: goo.gl/t1VK4C<br /><br />⇓⇓⇓↓↓↓MEHR INFOS ÜBER UNS UND DAS VIDEO↓↓↓⇓⇓⇓<br />■KEIN VIDEO VERPASSEN & KOSTENLOS Abonnieren: goo.gl/2t9ciU<br />■Meine Website: goo.gl/N3QFlg<br />■Website vom Club: goo.gl/RHgtPI<br /><br />✖ Equipment ✖<br />✘Aktuelles Smartfone: goo.gl/hEULWM<br />✘Kamera: goo.gl/u0c8ol<br />✘Schnittprogramm: goo.gl/Bqs8cJ<br />✘Stativ: goo.gl/b38nED<br />Mehr Infos und Bilder auf goo.gl/N3QFlg<br />✉ Sozial Networks ✉<br />■Website: goo.gl/1dPaEd<br />■Website vom Club: goo.gl/RHgtPI<br />■Kanal: goo.gl/pEKV2P<br />■Gaming-channel: goo.gl/5cYM0Z<br />■Fanseite auf facebook: goo.gl/rlYuUL<br />■Fanseite auf facebook: (CLUBSEITE) goo.gl/vEb16h<br />■Instagram: goo.gl/OGrV0l<br />■Instagram (PERSÖNLICH): goo.gl/51g6bH', 'https://yt3.ggpht.com/a/AATXAJx-Fnl0T3zczc2EQdRUZyxJl7lMDn7zBX-4sCfs=s88-c-k-c0xffffffff-no-rj-mo', 'Pascal', '', 'https://www.coupe-s.ch', '', '', 'anthrazit_pearl', '-6-7-', '24.10.2013', '201017-11', '201017-11', 0, 26, 33, 45, 62, 93, NULL, 38881, 58225, 58225, 74213, 92321, 116301, NULL, 51, NULL, 'Audi 100 Coupé S - [Anthrazit Pearl] - Die Fahrt und kleine vorstellung', 'RDDkZSmiPIs', '<td class=\"yt-lastvideo\" data-sort=\"200702150008\" data-utime=\"201017-11\"><a href=\"https://youtu.be/RDDkZSmiPIs\" title=\"Audi 100 Coupé S - [Anthrazit Pearl] - Die Fahrt und kleine vorstellung\" target=\"_blank\">Do. 02.07.20</a><div class=\"info\"><div class=\"close\"></div><div class=\"circle\" style=\"background-image:url(https://i3.ytimg.com/vi/RDDkZSmiPIs/hqdefault.jpg)\"></div><p>Audi 100 Coupé S - [Anthrazit Pearl] - Die Fahrt und kleine vorstellung<br><br>Views: 192 &nbsp; Ø/Video: 2280<br>Veröffentlicht am: Do. 02.07.20 um 15:00 Uhr</p><div class=\"abobar\"><a href=\"https://youtu.be/RDDkZSmiPIs\" target=\"_blank\" class=\"red\">zum Video</a></div></div></td>', 192, '2020-07-02T13:00:08+00:00', '200702150008', 'ch');
INSERT INTO `channels` VALUES (219, 0, 'UC611db3Hrtwo1gzMYvyNDOA', 'Ursepio', 'This is the Official Ursepio Youtube Channel! <br />Thank you for visiting and please SUBSCRIBE!<br /><br />Ich suche 1 Sponsor zum Bau eines Zirkusmuseums.<br /><br />Freu mich immer über tolle Comments. Thanks.<br />Please comment my videos.thanks<br /><br />Zirkusmuseum<br />zirkusmuseum.ch<br /><br />& zirkusschule.ch<br /><br />facebook.com/urs.knie2<br /><br />ZIRKUSFESTIVAL FANS:<br />facebook.com/pages/Basel-Switzerland/Zirkusfestival/273353640286?v=wall<br /><br />Urs Rohrer<br />Bahnweg 2<br />CH-4402 Frenkendorf<br />Switzerland', 'https://yt3.ggpht.com/a/AATXAJxbg7SnVCZoo7o6iYz-j7ihobob2GJ2L2WVvFE3xA=s88-c-k-c0xffffffff-no-rj-mo', 'Urs Rohrer', 'https://www.youtube.com/ursepio', 'http://www.zirkusmuseum.ch', '', '', 'ursepio', '-6-21-', '30.06.2007', '201017-11', '201017-11', 0, 366, 392, 549, 751, 1010, NULL, 0, 926530, 1042878, 1228511, 1474708, 1746706, NULL, 491, NULL, '15. Oktober 2020', 'nVdVpdL6vus', '<td class=\"yt-lastvideo\" data-sort=\"201015003025\" data-utime=\"201017-11\"><a href=\"https://youtu.be/nVdVpdL6vus\" title=\"15. Oktober 2020\" target=\"_blank\">Do. 15.10.20</a><div class=\"info\"><div class=\"close\"></div><div class=\"circle\" style=\"background-image:url(https://i3.ytimg.com/vi/nVdVpdL6vus/hqdefault.jpg)\"></div><p>15. Oktober 2020<br><br>Views: 9 &nbsp; Ø/Video: 3557<br>Veröffentlicht am: Do. 15.10.20 um 00:30 Uhr</p><div class=\"abobar\"><a href=\"https://youtu.be/nVdVpdL6vus\" target=\"_blank\" class=\"red\">zum Video</a></div></div></td>', 9, '2020-10-14T22:30:25+00:00', '201015003025', 'ch');
INSERT INTO `channels` VALUES (220, 1, 'UCkZtFbCDWtT5Bc1UbWqyJvQ', 'ROQA', 'Hallihallo liebi schwiizerdütschi YouTube-Community,<br />Ich heisse ROQA und mache Schwiizer-Dütsche Content. Ehemals GREAMGAMES mitglied bini jetz ellei unterwegs. <br />Streame genau so au oft LIVE uf Twitch: twitch.tv/roqa<br /><br />meh infos uf roqa.ch<br />ROQA', 'https://yt3.ggpht.com/a/AATXAJzc75xnyl5vo5glj3LjUn1q1z-sh79FnRzXdkIFoQ=s88-c-k-c0xffffffff-no-rj-mo', '', 'https://www.youtube.com/roqa1', 'https://www.roqa.ch', '', 'roqa', 'roqa.ch', '-4-11-', '31.03.2014', '201016-20', '201017-11', 139, 157, 222, 253, 253, 249, NULL, 18404, 25014, 29411, 32999, 35128, 35088, NULL, 491, NULL, 'RETIMED jetzt uf STEAM?!?', 'BaEu0RdWFe8', '<td class=\"yt-lastvideo\" data-sort=\"191205190003\" data-utime=\"201017-11\"><a href=\"https://youtu.be/BaEu0RdWFe8\" title=\"RETIMED jetzt uf STEAM?!?\" target=\"_blank\">Do. 05.12.19</a><div class=\"info\"><div class=\"close\"></div><div class=\"circle\" style=\"background-image:url(https://i3.ytimg.com/vi/BaEu0RdWFe8/hqdefault.jpg)\"></div><p>RETIMED jetzt uf STEAM?!?<br><br>Views: 64 &nbsp; Ø/Video: 71<br>Veröffentlicht am: Do. 05.12.19 um 19:00 Uhr</p><div class=\"abobar\"><a href=\"https://youtu.be/BaEu0RdWFe8\" target=\"_blank\" class=\"red\">zum Video</a></div></div></td>', 64, '2019-12-05T18:00:03+00:00', '191205190003', 'ch');
INSERT INTO `channels` VALUES (221, 0, 'UCQG8PZaWqUKUcdH583et6pw', 'rontaler media ag', 'die rontaler media ag produziert Videoinhalte und stellt LIVE-Streaming Dienstleistungen zur Verfügung.<br />Der Kanal beinhalten Referenzen, Werbung und LIVE Produktionen.<br />Redaktionell konzentriert sich unsere Playlist rontaler.tv auf Inhalte aus den Gemeinden Ebikon, Adligenswil, Udligenswil, Meggen, Dierikon, Root, Perlen, Buchrain, Inwil, Honau, Maihof- Luzern, Stadt Luzern.<br /><br />Weitere Informationen findest Du unter rontaler-media.ch', 'https://yt3.ggpht.com/a/AATXAJwlOXLlLQTACObgXxhK-O-YxOEj0ZAVOLCa2STiqg=s88-c-k-c0xffffffff-no-rj-mo', '', 'https://www.youtube.com/rontalertv', 'https://www.rontaler.ch', '', '', 'rontaler.ch', '-9-15-29-', '01.09.2014', '201017-11', '201017-11', 0, 0, 0, 0, 0, 0, NULL, 0, 0, 0, 0, 181414, 217887, NULL, 223, NULL, 'AVIA Tankstelle in Adligenswil', 'Sl9N6d02Wtw', '<td class=\"yt-lastvideo\" data-sort=\"200901124459\" data-utime=\"201017-11\"><a href=\"https://youtu.be/Sl9N6d02Wtw\" title=\"AVIA Tankstelle in Adligenswil\" target=\"_blank\">Di. 01.09.20</a><div class=\"info\"><div class=\"close\"></div><div class=\"circle\" style=\"background-image:url(https://i4.ytimg.com/vi/Sl9N6d02Wtw/hqdefault.jpg)\"></div><p>AVIA Tankstelle in Adligenswil<br><br>Views: 73 &nbsp; Ø/Video: 977<br>Veröffentlicht am: Di. 01.09.20 um 12:44 Uhr</p><div class=\"abobar\"><a href=\"https://youtu.be/Sl9N6d02Wtw\" target=\"_blank\" class=\"red\">zum Video</a></div></div></td>', 73, '2020-09-01T10:44:59+00:00', '200901124459', 'ch');
INSERT INTO `channels` VALUES (222, 0, 'UCVAfFYZgAo-Z6DBr43Db84Q', 'Schweizer Bauern', '„Schweizer Bauern – Von hier, von Herzen.“<br /><br />Nach 20 Jahren „Gut, gibt’s die Schweizer Bauern“ verabschiedet sich der Schweizer Bauernverband vom beliebten Kampagnenslogan und dem dazugehörenden Landwirtschaftskreuz. An dessen Stelle tritt neu die Marke „Schweizer Bauern“ begleitet vom Slogan „Von hier, von Herzen“. Auch die Werbelinie mit den Plakaten kommt in einem frischen Kleid daher: Neu erklären die Bäuerinnen und Bauern selber, welche Leistungen sie für die Schweizer Bevölkerung erbringen.', 'https://yt3.ggpht.com/a/AATXAJy6P0Ew4xMenKwjHK6NtZYgJ29bi5dJpHNbycTJ=s88-c-k-c0xffffffff-no-rj-mo', '', 'https://www.youtube.com/bauernpaysanscontadini', 'https://www.vomhof.ch', '', '', 'schweizer.bauern', '-7-', '27.01.2009', '201017-11', '201017-11', 0, 0, 900, 2138, 4720, 6030, NULL, 0, 0, 928503, 1216815, 2052643, 2529041, NULL, 342, NULL, 'Belles toutes rondes : c’est la saison des courges !', 'z-rtCzpRpz8', '<td class=\"yt-lastvideo\" data-sort=\"200922103353\" data-utime=\"201017-11\"><a href=\"https://youtu.be/z-rtCzpRpz8\" title=\"Belles toutes rondes : c’est la saison des courges !\" target=\"_blank\">Di. 22.09.20</a><div class=\"info\"><div class=\"close\"></div><div class=\"circle\" style=\"background-image:url(https://i3.ytimg.com/vi/z-rtCzpRpz8/hqdefault.jpg)\"></div><p>Belles toutes rondes : c’est la saison des courges !<br><br>Views: 41 &nbsp; Ø/Video: 7395<br>Veröffentlicht am: Di. 22.09.20 um 10:33 Uhr</p><div class=\"abobar\"><a href=\"https://youtu.be/z-rtCzpRpz8\" target=\"_blank\" class=\"red\">zum Video</a></div></div></td>', 41, '2020-09-22T08:33:53+00:00', '200922103353', 'ch');
INSERT INTO `channels` VALUES (223, 0, 'UCXPXsPE5PpQ51cxSa4StYnw', 'SurpRice', 'SurpRice - original schwizer Unterhaltig', 'https://yt3.ggpht.com/a/AATXAJwBkbZVactRr2RR6h9Fzm-JaPjEncT4Emef2QSgFA=s88-c-k-c0xffffffff-no-rj-mo', '', '', '', '', '', 'surprice.be', '-6-', '27.01.2017', '201017-11', '201017-11', 0, 0, 204, 336, 576, 643, NULL, 0, 0, 27233, 63623, 188147, 210831, NULL, 9, NULL, 'Quarantine Vibes', 'T4MDGOG8uN4', '<td class=\"yt-lastvideo\" data-sort=\"200510225404\" data-utime=\"201017-11\"><a href=\"https://youtu.be/T4MDGOG8uN4\" title=\"Quarantine Vibes\" target=\"_blank\">So. 10.05.20</a><div class=\"info\"><div class=\"close\"></div><div class=\"circle\" style=\"background-image:url(https://i1.ytimg.com/vi/T4MDGOG8uN4/hqdefault.jpg)\"></div><p>Quarantine Vibes<br><br>Views: 3306 &nbsp; Ø/Video: 23426<br>Veröffentlicht am: So. 10.05.20 um 22:54 Uhr</p><div class=\"abobar\"><a href=\"https://youtu.be/T4MDGOG8uN4\" target=\"_blank\" class=\"red\">zum Video</a></div></div></td>', 3306, '2020-05-10T20:54:04+00:00', '200510225404', 'ch');
INSERT INTO `channels` VALUES (224, 0, 'UCZuj5wTqtUv0wtHLdUBF65g', 'Haris', '', 'https://yt3.ggpht.com/a/AATXAJzbRuskR2bYMnXpAyFJ7GXE2Zl90oi9xnWllDEo=s88-c-k-c0xffffffff-no-rj-mo', '', '', '', '', '', 'haris__gsm', '-8-', '10.09.2018', '201017-11', '201017-11', 0, 0, 0, 0, 0, 155, NULL, 0, 0, 0, 0, 0, 13583, NULL, 30, NULL, 'Haris - Mes amis', 'kcNNR1H0lMU', '<td class=\"yt-lastvideo\" data-sort=\"200814000014\" data-utime=\"201017-11\"><a href=\"https://youtu.be/kcNNR1H0lMU\" title=\"Haris - Mes amis\" target=\"_blank\">Fr. 14.08.20</a><div class=\"info\"><div class=\"close\"></div><div class=\"circle\" style=\"background-image:url(https://i4.ytimg.com/vi/kcNNR1H0lMU/hqdefault.jpg)\"></div><p>Haris - Mes amis<br><br>Views: 315 &nbsp; Ø/Video: 453<br>Veröffentlicht am: Fr. 14.08.20 um 00:00 Uhr</p><div class=\"abobar\"><a href=\"https://youtu.be/kcNNR1H0lMU\" target=\"_blank\" class=\"red\">zum Video</a></div></div></td>', 315, '2020-08-13T22:00:14+00:00', '200814000014', 'ch');
INSERT INTO `channels` VALUES (225, 0, 'UCO_4trUt_UxXU2quYC4iJrg', 'Wicht', '', 'https://yt3.ggpht.com/a/AATXAJyaBUd_IYHpRS95buUNOOLpdeesNBOsCIBk_6K92Q=s88-c-k-c0xffffffff-no-rj-mo', '', '', '', '', '', 'wichtmusic', '-8-20-', '14.03.2014', '201017-11', '201017-11', 0, 0, 0, 80, 87, 222, NULL, 0, 0, 0, 17767, 19838, 28944, NULL, 36, NULL, 'WICHT-\"Anima/Wieder so wiit\"', 'NdGA8EyEgSs', '<td class=\"yt-lastvideo\" data-sort=\"201016175326\" data-utime=\"201017-11\"><a href=\"https://youtu.be/NdGA8EyEgSs\" title=\"WICHT-\"Anima/Wieder so wiit\"\" target=\"_blank\">Fr. 16.10.20</a><div class=\"info\"><div class=\"close\"></div><div class=\"circle\" style=\"background-image:url(https://i3.ytimg.com/vi/NdGA8EyEgSs/hqdefault.jpg)\"></div><p>WICHT-\"Anima/Wieder so wiit\"<br><br>Views: 0 &nbsp; Ø/Video: 804<br>Veröffentlicht am: Fr. 16.10.20 um 17:53 Uhr</p><div class=\"abobar\"><a href=\"https://youtu.be/NdGA8EyEgSs\" target=\"_blank\" class=\"red\">zum Video</a></div></div></td>', 0, '2020-10-16T15:53:26+00:00', '201016175326', 'ch');
INSERT INTO `channels` VALUES (226, 1, 'UCfBeCtDle-DUSpi-dOPjE1A', 'Bloody Mac', 'Gebore i de Stadt Bade/AG 1985, ufgwachse im glichnamige Bezirk. Gröschteteils in Wettige und Neuehof.<br /><br />s\'Erschte Mal mit Hip Hop in Berüerig cho Mitti 90er-Jahr. Im 2001 agfange mit em Rappe als Mitgründer vo de Crew WWS (Wettige Westside).<br /><br />Jetzt bin ich Solo unterwägs und bin dra, mis Züg usezbringe.', 'https://yt3.ggpht.com/a/AATXAJxAZalFbUXnnCADSmj4Mk0Q0NTECdef49sVSxc5=s88-c-k-c0xffffffff-no-rj-mo', '', 'https://www.youtube.com/bloodymac', '', '', '', 'bloody_mac54', '-8-22-', '25.10.2016', '201016-20', '201017-11', 0, 0, 0, 0, 0, 156, NULL, 0, 0, 0, 0, 0, 87072, NULL, 14, NULL, 'Bloody Mac x Delija Momak x Lil Ortega x Colin Haudenschild - Sie wüsset nüt vo mir', 'QkDjWpPhP_0', '<td class=\"yt-lastvideo\" data-sort=\"191122182311\" data-utime=\"201017-11\"><a href=\"https://youtu.be/QkDjWpPhP_0\" title=\"Bloody Mac x Delija Momak x Lil Ortega x Colin Haudenschild - Sie wüsset nüt vo mir\" target=\"_blank\">Fr. 22.11.19</a><div class=\"info\"><div class=\"close\"></div><div class=\"circle\" style=\"background-image:url(https://i2.ytimg.com/vi/QkDjWpPhP_0/hqdefault.jpg)\"></div><p>Bloody Mac x Delija Momak x Lil Ortega x Colin Haudenschild - Sie wüsset nüt vo mir<br><br>Views: 5809 &nbsp; Ø/Video: 6219<br>Veröffentlicht am: Fr. 22.11.19 um 18:23 Uhr</p><div class=\"abobar\"><a href=\"https://youtu.be/QkDjWpPhP_0\" target=\"_blank\" class=\"red\">zum Video</a></div></div></td>', 5809, '2019-11-22T17:23:11+00:00', '191122182311', 'ch');
INSERT INTO `channels` VALUES (227, 0, 'UCKpQEsDbTgIxj-QLoJlaiJQ', 'Love Crew', 'Zurück in die 90er Jahren reisen wir mit Laco, Aline, Blocco, Mato, Dave Mandou und DJ Okay in eine verträumte Musiklandschaft. Ob Funk, Hip Hop, Soul, Reggae oder auch Rock, die L.O.V.E-CREW vereint den Sound für Jedefrau und Jedermann. Mit sozialkritischen Texten, spirituellen Klängen, dreckigen Drumbeats für die Strasse und gespickt mit flinken Scratches representieren die Members der Crew ihre Liebe zur Musik und deren Botschaft. Seit rund 13 Jahren ist die L.O.V.E-CREW im Untergrund unterwegs und wagt sich immer mehr an die Öffentlichkeit. <br />Zeitlose veröffentlichte Werke, an welchen viele talentierte Musiker schon mitgewirkt haben, werden seit kurzem auch live performed. lovecrew.ch', 'https://yt3.ggpht.com/a/AATXAJwTIMX7nURorgNYFkBxRU4u1N9LR1Ap_-3RG6k_TA=s88-c-k-c0xffffffff-no-rj-mo', '', 'https://www.youtube.com/lovecrew', 'http://lovecrew.ch', '', '', 'l.o.v.e_crew', '-8-21-', '15.02.2011', '201017-11', '201017-11', 0, 0, 65, 83, 130, 149, NULL, 0, 0, 18884, 21464, 26537, 29525, NULL, 27, NULL, 'Alma na Rua \"Hemp-Laco-Shun\"', 'FQy0XKw--Vk', '<td class=\"yt-lastvideo\" data-sort=\"200502210947\" data-utime=\"201017-11\"><a href=\"https://youtu.be/FQy0XKw--Vk\" title=\"Alma na Rua \"Hemp-Laco-Shun\"\" target=\"_blank\">Sa. 02.05.20</a><div class=\"info\"><div class=\"close\"></div><div class=\"circle\" style=\"background-image:url(https://i3.ytimg.com/vi/FQy0XKw--Vk/hqdefault.jpg)\"></div><p>Alma na Rua \"Hemp-Laco-Shun\"<br><br>Views: 147 &nbsp; Ø/Video: 1094<br>Veröffentlicht am: Sa. 02.05.20 um 21:09 Uhr</p><div class=\"abobar\"><a href=\"https://youtu.be/FQy0XKw--Vk\" target=\"_blank\" class=\"red\">zum Video</a></div></div></td>', 147, '2020-05-02T19:09:47+00:00', '200502210947', 'ch');
INSERT INTO `channels` VALUES (228, 0, 'UCWVYwVpomrPCV3Ct4PHpGag', '462', '', 'https://yt3.ggpht.com/a/AATXAJxa9c1UmuXrJSQ5-ILt9N_vjwTGjPVQTTuBrxqT8Q=s88-c-k-c0xffffffff-no-rj-mo', '', '', '', '', '', '', '-4-', '12.04.2020', '201017-11', '201017-11', 0, 0, 0, 0, 0, 415, NULL, 0, 0, 0, 0, 0, 278, NULL, 3, NULL, 'INSANE LOCUS SNIPER RIFLE in COD MOBILE! BEST SNIPER in SEASON 11?!', 'QQf8_wwE9BU', '<td class=\"yt-lastvideo\" data-sort=\"201016113418\" data-utime=\"201017-11\"><a href=\"https://youtu.be/QQf8_wwE9BU\" title=\"INSANE LOCUS SNIPER RIFLE in COD MOBILE! BEST SNIPER in SEASON 11?!\" target=\"_blank\">Fr. 16.10.20</a><div class=\"info\"><div class=\"close\"></div><div class=\"circle\" style=\"background-image:url(https://i2.ytimg.com/vi/QQf8_wwE9BU/hqdefault.jpg)\"></div><p>INSANE LOCUS SNIPER RIFLE in COD MOBILE! BEST SNIPER in SEASON 11?!<br><br>Views: 75 &nbsp; Ø/Video: 93<br>Veröffentlicht am: Fr. 16.10.20 um 11:34 Uhr</p><div class=\"abobar\"><a href=\"https://youtu.be/QQf8_wwE9BU\" target=\"_blank\" class=\"red\">zum Video</a></div></div></td>', 75, '2020-10-16T09:34:18+00:00', '201016113418', 'ch');
INSERT INTO `channels` VALUES (229, 1, 'UCEK1_XUuwTALuIEX_4xFBqw', 'Talk Mit', 'We love to TALK MIT you! - Karen Fleischmann und Andy Wolf im Gespräch mit Zentralschweizern aus Wirtschaft, Politik, Sport und Unterhaltung.', 'https://yt3.ggpht.com/a/AATXAJw4m-mgRUYy3kNGoR9lu8EnL8gJwPAgsQPB4Sb5VA=s88-c-k-c0xffffffff-no-rj-mo', 'Andy Wolf, Karen Fleischmann, Severin Parnitzki', '', 'https://www.talkmit.ch', '', '', 'talkmit', '-6-', '21.01.2016', '201016-20', '201017-11', 0, 0, 77, 102, 111, 136, NULL, 0, 0, 43969, 63175, 78404, 91305, NULL, 81, NULL, 'Der Mundart-König ist zurück! TALK MIT #67 - mit Florian Ast', 'qSxTCW90n6g', '<td class=\"yt-lastvideo\" data-sort=\"190621124452\" data-utime=\"201017-11\"><a href=\"https://youtu.be/qSxTCW90n6g\" title=\"Der Mundart-König ist zurück! TALK MIT #67 - mit Florian Ast\" target=\"_blank\">Fr. 21.06.19</a><div class=\"info\"><div class=\"close\"></div><div class=\"circle\" style=\"background-image:url(https://i2.ytimg.com/vi/qSxTCW90n6g/hqdefault.jpg)\"></div><p>Der Mundart-König ist zurück! TALK MIT #67 - mit Florian Ast<br><br>Views: 258 &nbsp; Ø/Video: 1127<br>Veröffentlicht am: Fr. 21.06.19 um 12:44 Uhr</p><div class=\"abobar\"><a href=\"https://youtu.be/qSxTCW90n6g\" target=\"_blank\" class=\"red\">zum Video</a></div></div></td>', 258, '2019-06-21T10:44:52+00:00', '190621124452', 'ch');
INSERT INTO `channels` VALUES (230, 0, 'UCAGJnv1f1TWG0_8FDKJeMtw', '7speed.ch', 'In der Schweiz gibt es keine richtigen Autosendungen – Ausgenommen 7speed.ch<br />Moderator Yves Meyer (Rennfahrer und Autoliebhaber) führt durch die unkonventionelle Sendung. Fahrzeugvergleiche und Testfahrten der anderen Klasse – Bei 7speed.ch gehören Burnout’s und quietschende Reifen zum Standardprogramm.<br /><br />Lass dich überraschen was 7speed.ch alles unternimmt!', 'https://yt3.ggpht.com/a/AATXAJyHTXP5ujfNUZuddiRzZjjE7iLIxbVsO9cbiPGp=s88-c-k-c0xffffffff-no-rj-mo', 'Yves Meyer', 'https://www.youtube.com/7speedch', 'http://7speed.ch', '', '', '7speed.ch', '-5-', '15.11.2017', '201017-11', '201017-11', 0, 0, 0, 0, 0, 0, NULL, 0, 0, 0, 0, 47954, 53840, NULL, 20, NULL, 'Pascal\'s Mazda MX-5 - 7speed.ch - AUTOfokus', 'f0gJN5blCbQ', '<td class=\"yt-lastvideo\" data-sort=\"200329082638\" data-utime=\"201017-11\"><a href=\"https://youtu.be/f0gJN5blCbQ\" title=\"Pascal\'s Mazda MX-5 - 7speed.ch - AUTOfokus\" target=\"_blank\">So. 29.03.20</a><div class=\"info\"><div class=\"close\"></div><div class=\"circle\" style=\"background-image:url(https://i3.ytimg.com/vi/f0gJN5blCbQ/hqdefault.jpg)\"></div><p>Pascal\'s Mazda MX-5 - 7speed.ch - AUTOfokus<br><br>Views: 82 &nbsp; Ø/Video: 2692<br>Veröffentlicht am: So. 29.03.20 um 08:26 Uhr</p><div class=\"abobar\"><a href=\"https://youtu.be/f0gJN5blCbQ\" target=\"_blank\" class=\"red\">zum Video</a></div></div></td>', 82, '2020-03-29T06:26:38+00:00', '200329082638', 'ch');
INSERT INTO `channels` VALUES (231, 0, 'UCx9yK8r_t9WnbfJMA0TFlcw', 'Don Superbe', 'Herzlich willkommen auf dem Youtube-Kanal von Don Superbe!<br />VORWEG: ALLE VIDEOS MIT WERBUNG WURDEN VOM JEWEILIGEN URHEBERRECHTSINHABER MONETARISIERT.<br />ICH SELBER SCHALTE NIE WERBUNG!<br />DESHALB SIND DIE MEISTEN VIDEOS WERBEFREI!<br />Dieser Kanal richtet sich an alle Liebhaber von Hörspielen und Hörbüchern, denen Qualität wichtiger ist als Quantität.<br /><br />Das heisst in concreto: Wer auf der Suche nach liebevoll erstellten, klar und übersichtlich strukturierten und einzeln ausgewählten Hörspielen und Hörbüchern ist, findet hier was er oder sie sucht.<br />Anders als bei vielen anderen Kanälen soll es hier nicht darum gehen, möglichst viele Hörspiele in möglichst kurzer Zeit auszuspucken.<br />Vielmehr wird aus der Millionenfülle das Beste und Interessanteste in schöner und übersichtlicher Darstellung hochgeladen.<br /><br />Ein Teil der Hörspiele kommt aus meiner über Jahrzehnte erweiterten privaten Kassettensammlung und ist nur hier zu finden!', 'https://yt3.ggpht.com/a/AATXAJxPyliQygoO7_Mtls4IxZ7SagSphVcrcOidsHlj=s88-c-k-c0xffffffff-no-rj-mo', '', 'https://www.youtube.com/donsuperbe', '', '', '', '', '-7-', '31.12.2018', '201017-11', '201017-11', 0, 0, 0, 0, 10900, 18900, NULL, 0, 0, 0, 0, 4550577, 9512899, NULL, 343, NULL, 'FEUERMÄHNE HÖRSPIEL FOLGE 17: Die Rache Der Zauberin (Gewidmet: Enzo und Claudia)', 'tLSQuidsS8U', '<td class=\"yt-lastvideo\" data-sort=\"200904123003\" data-utime=\"201017-11\"><a href=\"https://youtu.be/tLSQuidsS8U\" title=\"FEUERMÄHNE HÖRSPIEL FOLGE 17: Die Rache Der Zauberin (Gewidmet: Enzo und Claudia)\" target=\"_blank\">Fr. 04.09.20</a><div class=\"info\"><div class=\"close\"></div><div class=\"circle\" style=\"background-image:url(https://i1.ytimg.com/vi/tLSQuidsS8U/hqdefault.jpg)\"></div><p>FEUERMÄHNE HÖRSPIEL FOLGE 17: Die Rache Der Zauberin (Gewidmet: Enzo und Claudia)<br><br>Views: 647 &nbsp; Ø/Video: 27734<br>Veröffentlicht am: Fr. 04.09.20 um 12:30 Uhr</p><div class=\"abobar\"><a href=\"https://youtu.be/tLSQuidsS8U\" target=\"_blank\" class=\"red\">zum Video</a></div></div></td>', 647, '2020-09-04T10:30:03+00:00', '200904123003', 'ch');
INSERT INTO `channels` VALUES (232, 1, 'UCsjuNqYW5CWu8gXE-MLOipQ', 'berg.land', 'Ich liebe die Berge, vor allem in meiner Heimat im Allgäu und in der benachbarten Schweiz, dem Vorarlberg und dem Tirol. Als Fotograf bin ich hier schon lange unterwegs. Seitdem ich die passende Videokamera und einen ausreichenden PC für die Nachbearbeitung habe, nun auch als Youtube-Filmemacher! 😄<br /><br />Über Kommentare, Fragen und Anregungen freue ich mich immer, und viel Spaß beim Zuschauen!', 'https://yt3.ggpht.com/a/AATXAJx-Q3-Qa-FuMDTJPACiihDxUBEQRvnLcNa50r5fqg=s88-c-k-c0xffffffff-no-rj-mo', '', 'https://www.youtube.com/berglandvideo', '', '', '', '', '-1-5-', '03.11.2006', '201016-20', '201017-11', 5, 7, 8, 13, 252, 255, NULL, 38823, 40365, 42300, 46707, 85388, 103888, NULL, 49, NULL, 'Kurzausflug #14: Wegsuche in LUINO | Lago Maggiore | Italien', 'EvKHYdfU55E', '<td class=\"yt-lastvideo\" data-sort=\"190517141527\" data-utime=\"201017-11\"><a href=\"https://youtu.be/EvKHYdfU55E\" title=\"Kurzausflug #14: Wegsuche in LUINO | Lago Maggiore | Italien\" target=\"_blank\">Fr. 17.05.19</a><div class=\"info\"><div class=\"close\"></div><div class=\"circle\" style=\"background-image:url(https://i2.ytimg.com/vi/EvKHYdfU55E/hqdefault.jpg)\"></div><p>Kurzausflug #14: Wegsuche in LUINO | Lago Maggiore | Italien<br><br>Views: 1891 &nbsp; Ø/Video: 2120<br>Veröffentlicht am: Fr. 17.05.19 um 14:15 Uhr</p><div class=\"abobar\"><a href=\"https://youtu.be/EvKHYdfU55E\" target=\"_blank\" class=\"red\">zum Video</a></div></div></td>', 1891, '2019-05-17T12:15:27+00:00', '190517141527', 'ch');
INSERT INTO `channels` VALUES (233, 0, 'UC78pqWYq7K9d-X3zRDWOIsg', 'CanavaR', 'Album \"20XX\" (VÖ 14.09.2018) jetzt erhältlich: imusiciandigital.lnk.to/WkIO1', 'https://yt3.ggpht.com/a/AATXAJwJI6tsxeYzfgIab40GbyWur7yImj_Ev70UuUm3=s88-c-k-c0xffffffff-no-rj-mo', 'Ferhat Civrilli', 'https://www.youtube.com/canavarstylez', 'http://www.canavar.ch', '', '', '', '-8-', '12.02.2007', '201017-11', '201017-11', 0, 0, 0, 0, 158, 158, NULL, 0, 0, 0, 0, 123480, 125933, NULL, 113, NULL, 'CanavaR, Giuzz, SamC, Shakesbeat, Zertiko - Oise Wäg', 'xNLVVpUljfY', '<td class=\"yt-lastvideo\" data-sort=\"200404192109\" data-utime=\"201017-11\"><a href=\"https://youtu.be/xNLVVpUljfY\" title=\"CanavaR, Giuzz, SamC, Shakesbeat, Zertiko - Oise Wäg\" target=\"_blank\">Sa. 04.04.20</a><div class=\"info\"><div class=\"close\"></div><div class=\"circle\" style=\"background-image:url(https://i1.ytimg.com/vi/xNLVVpUljfY/hqdefault.jpg)\"></div><p>CanavaR, Giuzz, SamC, Shakesbeat, Zertiko - Oise Wäg<br><br>Views: 66 &nbsp; Ø/Video: 1114<br>Veröffentlicht am: Sa. 04.04.20 um 19:21 Uhr</p><div class=\"abobar\"><a href=\"https://youtu.be/xNLVVpUljfY\" target=\"_blank\" class=\"red\">zum Video</a></div></div></td>', 66, '2020-04-04T17:21:09+00:00', '200404192109', 'ch');
INSERT INTO `channels` VALUES (234, 0, 'UCzgxf56BD9MZ4qSGEaZN3jQ', 'Lil Bruzy', '', 'https://yt3.ggpht.com/a/AATXAJxHX3547MdzA6k1D9zFVx3lakp3lLzpJQYJO-eM=s88-c-k-c0xffffffff-no-rj-mo', '', '', 'https://soundcloud.com/lilbruzy', '', '', 'lil_bruzy', '-8-20-', '15.12.2018', '201017-11', '201017-11', 0, 0, 0, 0, 163, 305, NULL, 0, 0, 0, 0, 10763, 26157, NULL, 6, NULL, 'Lil Bruzy - 100 (Prod. by Skillja)', 'JP4TkC56sao', '<td class=\"yt-lastvideo\" data-sort=\"200522120012\" data-utime=\"201017-11\"><a href=\"https://youtu.be/JP4TkC56sao\" title=\"Lil Bruzy - 100 (Prod. by Skillja)\" target=\"_blank\">Fr. 22.05.20</a><div class=\"info\"><div class=\"close\"></div><div class=\"circle\" style=\"background-image:url(https://i3.ytimg.com/vi/JP4TkC56sao/hqdefault.jpg)\"></div><p>Lil Bruzy - 100 (Prod. by Skillja)<br><br>Views: 2253 &nbsp; Ø/Video: 4360<br>Veröffentlicht am: Fr. 22.05.20 um 12:00 Uhr</p><div class=\"abobar\"><a href=\"https://youtu.be/JP4TkC56sao\" target=\"_blank\" class=\"red\">zum Video</a></div></div></td>', 2253, '2020-05-22T10:00:12+00:00', '200522120012', 'ch');
INSERT INTO `channels` VALUES (235, 0, 'UCtVMzzBMc8pfftIQzZXYQWw', 'Obscuro94', 'Hallo Liebi Abonnente｡◕‿◕｡<br /><br />Ich heisse Pascal, bin 26i und fahre e Honda NC750SA<br />Ich filme und kommentier mini usfährtli und das nännt sich dänn MotoVlog.<br />Mini gregleti Uploadzit isch Sunntig am 12i, und suscht au underde wuche wies grad chunnt.<br /><br />Natürlech findet me mii oh uf jegliche Social Media-Plattforme:<br />Instagram @obscuro94<br />Snapchat @obscuro94<br /><br />Hoffe ihr lueged mal ine und wünsche eu viel Spass bim zueluege.<br />Euer Pascal oder eifach Obscuro94', 'https://yt3.ggpht.com/a/AATXAJyr7xoankw6V7GnZp252duL9dCg7HZbxcwiIkhgvg=s88-c-k-c0xffffffff-no-rj-mo', 'Pascal', '', '', '', '', 'obscuro94', '-6-20-', '19.05.2011', '201017-11', '201017-11', 75, 159, 314, 349, 392, 424, NULL, 37381, 78800, 166594, 211801, 250008, 279831, NULL, 558, NULL, 'Jede kännt das gfühl bide Polizei I SwissTuber', 'pLLRRk5Aows', '<td class=\"yt-lastvideo\" data-sort=\"201016160012\" data-utime=\"201017-11\"><a href=\"https://youtu.be/pLLRRk5Aows\" title=\"Jede kännt das gfühl bide Polizei I SwissTuber\" target=\"_blank\">Fr. 16.10.20</a><div class=\"info\"><div class=\"close\"></div><div class=\"circle\" style=\"background-image:url(https://i1.ytimg.com/vi/pLLRRk5Aows/hqdefault.jpg)\"></div><p>Jede kännt das gfühl bide Polizei I SwissTuber<br><br>Views: 5 &nbsp; Ø/Video: 501<br>Veröffentlicht am: Fr. 16.10.20 um 16:00 Uhr</p><div class=\"abobar\"><a href=\"https://youtu.be/pLLRRk5Aows\" target=\"_blank\" class=\"red\">zum Video</a></div></div></td>', 5, '2020-10-16T14:00:12+00:00', '201016160012', 'ch');
INSERT INTO `channels` VALUES (236, 1, 'UCelr8n-nqxfufxteDBCnVBA', 'Schmidi Schmidhauser', 'CHICA TORPEDO nennt sich die neunköpfige Combo, die sich mit Haut und Haar den lateinamerikanischen Rhythmen und Spielweisen verschrieben hat. Hier gibt es eine höchst unbernische berndeutsche Band zu entdecken. Eine warme, entspannte und runde Angelegenheit auf höchstem handwerklichem Niveau, durchgängig tanzbar.', 'https://yt3.ggpht.com/a/AATXAJypTPjTTj6k6p_UcNZZiaXDJZFfE9jClEJZOM5QZA=s88-c-k-c0xffffffff-no-rj-mo', '', 'https://www.youtube.com/chicatorpedo', 'https://www.chicatorpedo.ch', '', '', 'chica_torpedo', '-8-', '10.10.2009', '201016-20', '201017-11', 0, 0, 0, 0, 0, 296, NULL, 0, 0, 0, 0, 0, 249413, NULL, 21, NULL, 'Schmidi Schmidhauser and the Moudis - Tue wid wosch', '70rIHYxAcfc', '<td class=\"yt-lastvideo\" data-sort=\"190812120457\" data-utime=\"201017-11\"><a href=\"https://youtu.be/70rIHYxAcfc\" title=\"Schmidi Schmidhauser and the Moudis - Tue wid wosch\" target=\"_blank\">Mo. 12.08.19</a><div class=\"info\"><div class=\"close\"></div><div class=\"circle\" style=\"background-image:url(https://i4.ytimg.com/vi/70rIHYxAcfc/hqdefault.jpg)\"></div><p>Schmidi Schmidhauser and the Moudis - Tue wid wosch<br><br>Views: 1485 &nbsp; Ø/Video: 11877<br>Veröffentlicht am: Mo. 12.08.19 um 12:04 Uhr</p><div class=\"abobar\"><a href=\"https://youtu.be/70rIHYxAcfc\" target=\"_blank\" class=\"red\">zum Video</a></div></div></td>', 1485, '2019-08-12T10:04:57+00:00', '190812120457', 'ch');
INSERT INTO `channels` VALUES (237, 0, 'UCoOM2CyzvsGam7tl3ZCotSg', 'Romanzone', '\"2019, romanzone startet uf YouTube / romanzone starts on YouTube\"<br /><br />• Blizz News (Nachrichten):<br />Achtung hier gibt\'s nur schweizerdeutsch gesprochenes Videomaterial zu sehen.<br /><br />• Fendy Kool (Musikvideos):<br />Hier gibts alle Videos von und mit der Kunstfigur Fendy Kool - einem schweizer Rapper aus der Zentralschweiz.<br /><br />romanzone.com<br />fendykool.com', 'https://yt3.ggpht.com/a/AATXAJw_vUydPMIpTAXAtodAitwhBgp5kjZ3w8Z_spYK=s88-c-k-c0xffffffff-no-rj-mo', 'Roman Blattmann', '', 'https://www.romanzone.com', '', '', 'romanzone_youtube', '-6-8-', '13.01.2016', '201017-11', '201017-11', 0, 0, 0, 0, 60, 93, NULL, 0, 0, 0, 0, 4688, 7446, NULL, 22, NULL, 'Blizz News #17 - Folge 17 - (romanzone.com)', 'tI2vCvhmAf0', '<td class=\"yt-lastvideo\" data-sort=\"200912203956\" data-utime=\"201017-11\"><a href=\"https://youtu.be/tI2vCvhmAf0\" title=\"Blizz News #17 - Folge 17 - (romanzone.com)\" target=\"_blank\">Sa. 12.09.20</a><div class=\"info\"><div class=\"close\"></div><div class=\"circle\" style=\"background-image:url(https://i1.ytimg.com/vi/tI2vCvhmAf0/hqdefault.jpg)\"></div><p>Blizz News #17 - Folge 17 - (romanzone.com)<br><br>Views: 121 &nbsp; Ø/Video: 338<br>Veröffentlicht am: Sa. 12.09.20 um 20:39 Uhr</p><div class=\"abobar\"><a href=\"https://youtu.be/tI2vCvhmAf0\" target=\"_blank\" class=\"red\">zum Video</a></div></div></td>', 121, '2020-09-12T18:39:56+00:00', '200912203956', 'ch');
INSERT INTO `channels` VALUES (238, 0, 'UCDqBUetb52m_onjB1oOG-jw', 'Young Rah', 'Welcome ! auf dem offiziellen YouTube Channel von YounG RaH. Hier findest du Musikvideos, Behind The Scenes Material oder sonstigen Inhalt rund um YounG RaH. Vergiss nicht den Channel zu abonnieren und sei immer auf dem aktuellsten Stand, wenn neue Alben, EP\'s oder Singles gedroppt werden.<br /><br />Viel Spass !<br /><br />Cheers<br />Young Rah', 'https://yt3.ggpht.com/a/AATXAJwQHyTS8j5G8i-gjTaSK0TL1qvzwaXRYjr21ZDFew=s88-c-k-c0xffffffff-no-rj-mo', '', '', '', '', '', 'youngrah6', '-8-', '14.04.2019', '201017-11', '201017-11', 0, 0, 0, 0, 65, 1530, NULL, 0, 0, 0, 0, 73820, 658843, NULL, 11, NULL, 'Young Rah - Sabaha Kadar (Official Animated Music Video)', 'dlCWDpoEFJM', '<td class=\"yt-lastvideo\" data-sort=\"201015235924\" data-utime=\"201017-11\"><a href=\"https://youtu.be/dlCWDpoEFJM\" title=\"Young Rah - Sabaha Kadar (Official Animated Music Video)\" target=\"_blank\">Do. 15.10.20</a><div class=\"info\"><div class=\"close\"></div><div class=\"circle\" style=\"background-image:url(https://i1.ytimg.com/vi/dlCWDpoEFJM/hqdefault.jpg)\"></div><p>Young Rah - Sabaha Kadar (Official Animated Music Video)<br><br>Views: 5497 &nbsp; Ø/Video: 59895<br>Veröffentlicht am: Do. 15.10.20 um 23:59 Uhr</p><div class=\"abobar\"><a href=\"https://youtu.be/dlCWDpoEFJM\" target=\"_blank\" class=\"red\">zum Video</a></div></div></td>', 5497, '2020-10-15T21:59:24+00:00', '201015235924', 'ch');
INSERT INTO `channels` VALUES (239, 0, 'UCvGLQGXTem08AXlSQpTDziQ', 'Eret Music', '', 'https://yt3.ggpht.com/a/AATXAJy256TJV8Tep5G-LMCD26wfaw2VO--BeQfGuJTEKA=s88-c-k-c0xffffffff-no-rj-mo', '', '', '', '', '', '', '-8-25-', '29.12.2016', '201017-11', '201017-11', 0, 0, 203, 321, 372, 524, NULL, 0, 0, 85365, 189472, 233256, 298984, NULL, 15, NULL, 'Baze «Aus Wo Fägt»', 'FXIc1BiXFp0', '<td class=\"yt-lastvideo\" data-sort=\"200702113012\" data-utime=\"201017-11\"><a href=\"https://youtu.be/FXIc1BiXFp0\" title=\"Baze «Aus Wo Fägt»\" target=\"_blank\">Do. 02.07.20</a><div class=\"info\"><div class=\"close\"></div><div class=\"circle\" style=\"background-image:url(https://i3.ytimg.com/vi/FXIc1BiXFp0/hqdefault.jpg)\"></div><p>Baze «Aus Wo Fägt»<br><br>Views: 2318 &nbsp; Ø/Video: 19932<br>Veröffentlicht am: Do. 02.07.20 um 11:30 Uhr</p><div class=\"abobar\"><a href=\"https://youtu.be/FXIc1BiXFp0\" target=\"_blank\" class=\"red\">zum Video</a></div></div></td>', 2318, '2020-07-02T09:30:12+00:00', '200702113012', 'ch');
INSERT INTO `channels` VALUES (240, 0, 'UCrF2Bk6u4DHvjUynIz_yhaQ', 'DAIF', 'triff DAIF auf twitter dot com, triff DAIF das insta game <br />playen, weil facebook ist tot. triff DAIF auf speed in einer <br />dachstock wohnung, auf ketamin im keller loch, das cap tief <br />im gesicht als wärs 1 sturm maske, die xtc pille als wärs 1 <br />molotow cocktail, depressiv und high, verliebt und besoffen, <br />prosecxo aus der dose und zigaretten und lackierte fingernägel und <br />craving. finde DAIFs videos auf pornhub dot com, weil sie auf <br />youtube dot com nicht sein dürfen, triff DAIF in der cloud, triff<br />DAIF on stage lines ziehen vor den augen der crowd. wirf ein auge <br />auf diesen einen it boi und wirf dir was ein an seiner show oder<br />davor. weil es ist dieser eine avantgarde acid rap anarcho <br />tumblr pop, diese eine vaporwave lowlife highend <br />ästhetik, es ist dieser eine nihilismus.', 'https://yt3.ggpht.com/a/AATXAJxpUxWBWVwZ5pSkmJdmSPnDRjD_heOZpFAB9O4_eA=s88-c-k-c0xffffffff-no-rj-mo', '', 'https://www.youtube.com/daifdaifdaif', '', '', '', 'daifdaifdaif', '-8-', '16.10.2013', '201017-11', '201017-11', 0, 0, 0, 0, 0, 264, NULL, 0, 0, 0, 0, 0, 30490, NULL, 16, NULL, 'DAIF – Liebi i Ziite vo de Mediekriise (Official Video, 2020)', 'bLqC4NKxF9w', '<td class=\"yt-lastvideo\" data-sort=\"200402203539\" data-utime=\"201017-11\"><a href=\"https://youtu.be/bLqC4NKxF9w\" title=\"DAIF – Liebi i Ziite vo de Mediekriise (Official Video, 2020)\" target=\"_blank\">Do. 02.04.20</a><div class=\"info\"><div class=\"close\"></div><div class=\"circle\" style=\"background-image:url(https://i3.ytimg.com/vi/bLqC4NKxF9w/hqdefault.jpg)\"></div><p>DAIF – Liebi i Ziite vo de Mediekriise (Official Video, 2020)<br><br>Views: 733 &nbsp; Ø/Video: 1906<br>Veröffentlicht am: Do. 02.04.20 um 20:35 Uhr</p><div class=\"abobar\"><a href=\"https://youtu.be/bLqC4NKxF9w\" target=\"_blank\" class=\"red\">zum Video</a></div></div></td>', 733, '2020-04-02T18:35:39+00:00', '200402203539', 'ch');
INSERT INTO `channels` VALUES (241, 0, 'UCmS03XOFx0dsLz38AabuaNA', 'Beta-Show Deluxe', 'Beta-Show Deluxe ist die neue Schweizer Satire-Sendung. Du findest uns auf Facecook, Twitter, Instagram oder unter betashowdeluxe.ch.', 'https://yt3.ggpht.com/a/AATXAJx6B2irYJS-8ZjE1d3ZGgE5xZBhTzbqtFVzrKHM=s88-c-k-c0xffffffff-no-rj-mo', '', '', 'https://betashowdeluxe.ch', '', '', 'betashowdeluxe', '-6-', '18.08.2017', '201017-11', '201017-11', 0, 0, 0, 0, 0, 0, NULL, 0, 0, 0, 0, 4401, 8416, NULL, 43, NULL, '1.-August-Strassenumfrage: Jetzt spricht das Volk!', 'XpV96OawpCk', '<td class=\"yt-lastvideo\" data-sort=\"200801123310\" data-utime=\"201017-11\"><a href=\"https://youtu.be/XpV96OawpCk\" title=\"1.-August-Strassenumfrage: Jetzt spricht das Volk!\" target=\"_blank\">Sa. 01.08.20</a><div class=\"info\"><div class=\"close\"></div><div class=\"circle\" style=\"background-image:url(https://i1.ytimg.com/vi/XpV96OawpCk/hqdefault.jpg)\"></div><p>1.-August-Strassenumfrage: Jetzt spricht das Volk!<br><br>Views: 141 &nbsp; Ø/Video: 196<br>Veröffentlicht am: Sa. 01.08.20 um 12:33 Uhr</p><div class=\"abobar\"><a href=\"https://youtu.be/XpV96OawpCk\" target=\"_blank\" class=\"red\">zum Video</a></div></div></td>', 141, '2020-08-01T10:33:10+00:00', '200801123310', 'ch');
INSERT INTO `channels` VALUES (242, 0, 'UClSUNNh2eYk5ECLxuk_uOjg', 'Zuger Shuger', 'zugershuger.ch<br />facebook.com/zugershuger<br />instagram.com/zugershuger<br />facebook.com/chieffrisk<br />mctomahawk.ch<br /><br /><br /><br />Members:<br />Frisk, Tomahawk, Freshe, Freddy K<br /><br />Releases:<br />Zuger Shuger - 6300<br />Frisk - Perspektive<br />Zuger Shuger - Super hert<br />Tomahawk - Hürdespringer<br />Frisk - A jedem Tag verdient<br />yaheard - Fokus<br />Cake & Frisk - Up n Down<br />Freshe - Unikat Streetalbum<br />Freddy K - Nightmare on Disc Smack Mixtape<br />Tomahawk - Maa vo de Stund LP<br />Fresh \'N\' Frisk - Mir sind Da EP<br />yaheard - Hesch ghört?! Mixtape', 'https://yt3.ggpht.com/a/AATXAJyD_zlbVOC2dA44_NMgyJSAIcjRQ11VhJXQCCseJw=s88-c-k-c0xffffffff-no-rj-mo', '', 'https://www.youtube.com/zugershuger', 'http://www.zugershuger.ch', '', '', 'zugershuger', '-8-', '26.08.2007', '201017-11', '201017-11', 0, 0, 154, 166, 191, 202, NULL, 0, 0, 74751, 79508, 86481, 91911, NULL, 65, NULL, 'Tomahawk & Cut-EFX «Mandala» Album Snippet', 'b0h0HxkaR_M', '<td class=\"yt-lastvideo\" data-sort=\"200607122743\" data-utime=\"201017-11\"><a href=\"https://youtu.be/b0h0HxkaR_M\" title=\"Tomahawk & Cut-EFX «Mandala» Album Snippet\" target=\"_blank\">So. 07.06.20</a><div class=\"info\"><div class=\"close\"></div><div class=\"circle\" style=\"background-image:url(https://i3.ytimg.com/vi/b0h0HxkaR_M/hqdefault.jpg)\"></div><p>Tomahawk & Cut-EFX «Mandala» Album Snippet<br><br>Views: 112 &nbsp; Ø/Video: 1414<br>Veröffentlicht am: So. 07.06.20 um 12:27 Uhr</p><div class=\"abobar\"><a href=\"https://youtu.be/b0h0HxkaR_M\" target=\"_blank\" class=\"red\">zum Video</a></div></div></td>', 112, '2020-06-07T10:27:43+00:00', '200607122743', 'ch');
INSERT INTO `channels` VALUES (243, 0, 'UC0y7cKmpBSp6pjyDTSmaj8g', '419 Finesse Gang', '', 'https://yt3.ggpht.com/a/AATXAJzmLa-T-cFB3w-0yLjHZaZc5RcTL7DlCKb0PnFTcA=s88-c-k-c0xffffffff-no-rj-mo', '', '', '', '', '', '419finessegang', '-8-', '11.01.2011', '201017-11', '201017-11', 0, 0, 10696, 15877, 26100, 30600, NULL, 0, 0, 2062021, 3312141, 4211894, 4657589, NULL, 23, NULL, 'Pronto - Priceless // Lyric Video (prod. by Pronto)', '_cyePjMHbBo', '<td class=\"yt-lastvideo\" data-sort=\"200619120016\" data-utime=\"201017-11\"><a href=\"https://youtu.be/_cyePjMHbBo\" title=\"Pronto - Priceless // Lyric Video (prod. by Pronto)\" target=\"_blank\">Fr. 19.06.20</a><div class=\"info\"><div class=\"close\"></div><div class=\"circle\" style=\"background-image:url(https://i4.ytimg.com/vi/_cyePjMHbBo/hqdefault.jpg)\"></div><p>Pronto - Priceless // Lyric Video (prod. by Pronto)<br><br>Views: 271006 &nbsp; Ø/Video: 202504<br>Veröffentlicht am: Fr. 19.06.20 um 12:00 Uhr</p><div class=\"abobar\"><a href=\"https://youtu.be/_cyePjMHbBo\" target=\"_blank\" class=\"red\">zum Video</a></div></div></td>', 271006, '2020-06-19T10:00:16+00:00', '200619120016', 'ch');
INSERT INTO `channels` VALUES (244, 1, 'UCzvXx0T8lpziPTfw4IRLUjg', 'Semantik', 'a real originator...<br />semantik.ch', 'https://yt3.ggpht.com/a/AATXAJwVwjbRDfxGG73mqjUC7PbvDe6nUyp3kH0m9Nfsag=s88-c-k-c0xffffffff-no-rj-mo', '', '', 'http://semantik.ch', '', '', 'sema.ntik', '-8-', '28.08.2006', '201016-20', '201017-11', 0, 0, 0, 173, 210, 222, NULL, 0, 0, 0, 126776, 131656, 136384, NULL, 24, NULL, 'SEMANTIK Feat. LUUK - BUCHEGG ENTERPRISE', 'Y5aiWxYKf2c', '<td class=\"yt-lastvideo\" data-sort=\"190613155819\" data-utime=\"201017-11\"><a href=\"https://youtu.be/Y5aiWxYKf2c\" title=\"SEMANTIK Feat. LUUK - BUCHEGG ENTERPRISE\" target=\"_blank\">Do. 13.06.19</a><div class=\"info\"><div class=\"close\"></div><div class=\"circle\" style=\"background-image:url(https://i2.ytimg.com/vi/Y5aiWxYKf2c/hqdefault.jpg)\"></div><p>SEMANTIK Feat. LUUK - BUCHEGG ENTERPRISE<br><br>Views: 4284 &nbsp; Ø/Video: 5683<br>Veröffentlicht am: Do. 13.06.19 um 15:58 Uhr</p><div class=\"abobar\"><a href=\"https://youtu.be/Y5aiWxYKf2c\" target=\"_blank\" class=\"red\">zum Video</a></div></div></td>', 4284, '2019-06-13T13:58:19+00:00', '190613155819', 'ch');
INSERT INTO `channels` VALUES (245, 0, 'UCDMT3SnK9nJ70u_x4bW-E_A', 'Ol\' Nero', '', 'https://yt3.ggpht.com/a/AATXAJzbFfqPDa6RL77d2gOsDWyoPpaGsVwehHxVnAC3eQ=s88-c-k-c0xffffffff-no-rj-mo', '', '', '', '', '', '', '-8-', '10.11.2014', '201017-11', '201017-11', 0, 0, 116, 192, 274, 390, NULL, 0, 0, 29922, 2384, 12331, 29231, NULL, 5, NULL, 'Ol Nero - Pass Uff (prod. by Vigazbeats)', 'IKD25yvq3U0', '<td class=\"yt-lastvideo\" data-sort=\"200718180013\" data-utime=\"201017-11\"><a href=\"https://youtu.be/IKD25yvq3U0\" title=\"Ol Nero - Pass Uff (prod. by Vigazbeats)\" target=\"_blank\">Sa. 18.07.20</a><div class=\"info\"><div class=\"close\"></div><div class=\"circle\" style=\"background-image:url(https://i2.ytimg.com/vi/IKD25yvq3U0/hqdefault.jpg)\"></div><p>Ol Nero - Pass Uff (prod. by Vigazbeats)<br><br>Views: 3269 &nbsp; Ø/Video: 5846<br>Veröffentlicht am: Sa. 18.07.20 um 18:00 Uhr</p><div class=\"abobar\"><a href=\"https://youtu.be/IKD25yvq3U0\" target=\"_blank\" class=\"red\">zum Video</a></div></div></td>', 3269, '2020-07-18T16:00:13+00:00', '200718180013', 'ch');
INSERT INTO `channels` VALUES (246, 0, 'UC_D2yClelMiDfKBu-vu1ppw', 'WGEB4503', 'Solothurn - West', 'https://yt3.ggpht.com/a/AATXAJzyMbRJpXmy76MKgUq6J5F8ZqJ9UCABjk67K0D6=s88-c-k-c0xffffffff-no-rj-mo', '', '', '', '', '', 'mr.salini', '-8-', '18.10.2019', '201017-11', '201017-11', 0, 0, 0, 0, 0, 0, NULL, 0, 0, 0, 0, 0, 45001, NULL, 6, NULL, 'Dream03 - AuesLauftGuet (Official Video) / Prod. by Claptomanik', 'FmweQqL-Z1s', '<td class=\"yt-lastvideo\" data-sort=\"200918180012\" data-utime=\"201017-11\"><a href=\"https://youtu.be/FmweQqL-Z1s\" title=\"Dream03 - AuesLauftGuet (Official Video) / Prod. by Claptomanik\" target=\"_blank\">Fr. 18.09.20</a><div class=\"info\"><div class=\"close\"></div><div class=\"circle\" style=\"background-image:url(https://i3.ytimg.com/vi/FmweQqL-Z1s/hqdefault.jpg)\"></div><p>Dream03 - AuesLauftGuet (Official Video) / Prod. by Claptomanik<br><br>Views: 4126 &nbsp; Ø/Video: 7500<br>Veröffentlicht am: Fr. 18.09.20 um 18:00 Uhr</p><div class=\"abobar\"><a href=\"https://youtu.be/FmweQqL-Z1s\" target=\"_blank\" class=\"red\">zum Video</a></div></div></td>', 4126, '2020-09-18T16:00:12+00:00', '200918180012', 'ch');
INSERT INTO `channels` VALUES (247, 1, 'UCJdYcnGakuBka0kTU1FrOFw', 'Jakko Bratko', 'Dies ist der offizielle YouTube Kanal von Jakko Bratko<br />Jakko - Ignorant ab 18.08.2017 erhältlich!', 'https://yt3.ggpht.com/a/AATXAJyD4yq7pVjOxTyZEtIDpk8_rNnNaYkatKZ1u0T4Iw=s88-c-k-c0xffffffff-no-rj-mo', '', '', '', '', '', 'jakko.bratko', '-8-', '06.03.2013', '201016-20', '201017-11', 0, 0, 0, 0, 0, 0, NULL, 0, 0, 0, 0, 0, 57519, NULL, 32, NULL, 'Jakko Bratko - Dali (prod. by The Cratez)', '2fWJhn2CDtY', '<td class=\"yt-lastvideo\" data-sort=\"191101113245\" data-utime=\"201017-11\"><a href=\"https://youtu.be/2fWJhn2CDtY\" title=\"Jakko Bratko - Dali (prod. by The Cratez)\" target=\"_blank\">Fr. 01.11.19</a><div class=\"info\"><div class=\"close\"></div><div class=\"circle\" style=\"background-image:url(https://i3.ytimg.com/vi/2fWJhn2CDtY/hqdefault.jpg)\"></div><p>Jakko Bratko - Dali (prod. by The Cratez)<br><br>Views: 1185 &nbsp; Ø/Video: 1797<br>Veröffentlicht am: Fr. 01.11.19 um 11:32 Uhr</p><div class=\"abobar\"><a href=\"https://youtu.be/2fWJhn2CDtY\" target=\"_blank\" class=\"red\">zum Video</a></div></div></td>', 1185, '2019-11-01T10:32:45+00:00', '191101113245', 'ch');
INSERT INTO `channels` VALUES (248, 0, 'UCcUB8t47AAu5WKmaUSdaN_g', 'Jucker Farm', 'Obstbau zum Erlebnis machen. Das ist unser Ding. Angefangen hat alles vor 20 Jahren mit der verrückten Idee einer Kürbisausstellung nachdem die Brüder Martin und Beat Jucker den elterlichen Hof übernommen haben. Heute haben besteht die Jucker Farm AG aus 4 Höfen:<br /><br />Juckerhof in Seegräben: Erlebnishof mit Restaurant, eigener Bäckerei, Hofladen, ÖpfelGarte, Heidelbeeren und Kirschen Selberpflücken, Geisslipark und beste Lage am Pfäffikersee. Hier werden noch immer Äpfel und Birnen sowie einige Beeren und Wein produziert.<br /><br />Bächlihof in Jona: Erlebnishof mit Hofladenrestaurant, Heidelbeeren zum Selberpflücken, Geissli und Häsli, ideal gelegen in mitten von Obstbäumen direkt am Obersee. Hier wachsen Äpfel, Birnen, Heidelbeeren und sogar ein paar Kiwis. Ausserdem befindet sich hier die Hofmanufaktur.<br /><br />Spargelhof in Rafz: Hier wachsen Spargeln, Kürbis und Co. Inkl. grossem Hofladen.<br /><br />Römerhof in Kloten: Hofladen und Blumen zum Selberpflücken.<br /><br />Wir freuen uns auf Ihren Besuch!', 'https://yt3.ggpht.com/a/AATXAJyFr2YT9BQHDatYKmDYDeXZ6pAMe0eK6l4-G-eI7A=s88-c-k-c0xffffffff-no-rj-mo', 'Beat & Martin Jucker', 'https://www.youtube.com/juckerfarmag', 'https://www.juckerfarm.ch', '', '', 'jucker_farm', '-13-18-20-', '27.09.2009', '201017-11', '201017-11', 0, 0, 0, 246, 342, 427, NULL, 0, 0, 0, 220700, 273276, 315595, NULL, 205, NULL, '#FarmTalk N°17: Spezialfall Juckerhof', 'pnCT5Xxfj1I', '<td class=\"yt-lastvideo\" data-sort=\"201002092508\" data-utime=\"201017-11\"><a href=\"https://youtu.be/pnCT5Xxfj1I\" title=\"#FarmTalk N°17: Spezialfall Juckerhof\" target=\"_blank\">Fr. 02.10.20</a><div class=\"info\"><div class=\"close\"></div><div class=\"circle\" style=\"background-image:url(https://i1.ytimg.com/vi/pnCT5Xxfj1I/hqdefault.jpg)\"></div><p>#FarmTalk N°17: Spezialfall Juckerhof<br><br>Views: 113 &nbsp; Ø/Video: 1539<br>Veröffentlicht am: Fr. 02.10.20 um 09:25 Uhr</p><div class=\"abobar\"><a href=\"https://youtu.be/pnCT5Xxfj1I\" target=\"_blank\" class=\"red\">zum Video</a></div></div></td>', 113, '2020-10-02T07:25:08+00:00', '201002092508', 'ch');
INSERT INTO `channels` VALUES (249, 0, 'UCB1eXsilXNWXG9njBte77lQ', 'Collie Herb', 'Collie Herb macht Musik, als läge die Schweiz an einem Palmen-Strand. Texte in Mundart, getragen von Klängen aus Übersee. Seine Songs sind mal leichtfüssig und bunt, mal nachdenklich und poetisch, doch stets zwingend. In knapp zehn Jahren hat er sich und seinen druckvollen Mix aus urbanem Reggae, Dancehall und Rap in der heimischen Musikwelt etabliert. Mit der Soundsystem-Kultur gross geworden, ist die Bühne sein Zuhause, sie zum Brennen zu bringen Pflicht.<br />​<br />Wer Collie Herb live erlebt und seine enorme Bühnenpräsenz spürt, wird von einem Entertainer unterhalten, der sowohl als Sänger als auch als Rapper fasziniert. Dank Charisma knipst er die Lächeln im Publikum bereits im ersten Song an. Ob mit der Mighty Roots-Band oder DJ Lex Killa, allfällige puristische Ansprüche sollten zuhause bleiben. Mitbringen muss man dafür tanzwütige Beine – denn nur Kopfnicken oder mit dem Fuss wippen, reicht bei dieser Musik bei weitem nicht aus.', 'https://yt3.ggpht.com/a/AATXAJyMdSRAtzMM30pAWsg3DWW-dM1iFbm3H82Hehqqrg=s88-c-k-c0xffffffff-no-rj-mo', '', 'https://www.youtube.com/collieherb', 'https://www.collieherb.ch', '', '', 'collieherb', '-8-27-', '28.01.2009', '201017-11', '201017-11', 0, 414, 502, 566, 611, 695, NULL, 0, 152765, 202167, 239784, 258547, 286823, NULL, 188, NULL, 'Collie Herb - Forever feat. Skarra Mucci & Pyro (Loopsided Remix)', 'URci6LV_gkQ', '<td class=\"yt-lastvideo\" data-sort=\"200925112234\" data-utime=\"201017-11\"><a href=\"https://youtu.be/URci6LV_gkQ\" title=\"Collie Herb - Forever feat. Skarra Mucci & Pyro (Loopsided Remix)\" target=\"_blank\">Fr. 25.09.20</a><div class=\"info\"><div class=\"close\"></div><div class=\"circle\" style=\"background-image:url(https://i2.ytimg.com/vi/URci6LV_gkQ/hqdefault.jpg)\"></div><p>Collie Herb - Forever feat. Skarra Mucci & Pyro (Loopsided Remix)<br><br>Views: 215 &nbsp; Ø/Video: 1526<br>Veröffentlicht am: Fr. 25.09.20 um 11:22 Uhr</p><div class=\"abobar\"><a href=\"https://youtu.be/URci6LV_gkQ\" target=\"_blank\" class=\"red\">zum Video</a></div></div></td>', 215, '2020-09-25T09:22:34+00:00', '200925112234', 'ch');
INSERT INTO `channels` VALUES (250, 0, 'UCzTS-cKceoKzYPQBCnDOtrg', 'Joël von Mutzenbecher', 'Feel Good Comedian', 'https://yt3.ggpht.com/a/AATXAJwW8_UL8nUedSC3xhE48d7mXUkbqi_9o2jM9H_s2w=s88-c-k-c0xffffffff-no-rj-mo', '', 'https://www.youtube.com/joelvonmutzenbecher', 'https://www.joelvonmutzenbecher.ch', 'https://open.spotify.com/show/6LlCWg0YSsCtWMfI0ubyvi', '', 'vonmutzenbecher', '-6-12-', '11.10.2010', '201017-11', '201017-11', 0, 0, 0, 0, 707, 928, NULL, 0, 0, 0, 0, 130764, 202225, NULL, 79, NULL, 'FEEL GOOD PODCAST #31 | Jonny Fischer', 'U8bA1gw5xKw', '<td class=\"yt-lastvideo\" data-sort=\"201016151407\" data-utime=\"201017-11\"><a href=\"https://youtu.be/U8bA1gw5xKw\" title=\"FEEL GOOD PODCAST #31 | Jonny Fischer\" target=\"_blank\">Fr. 16.10.20</a><div class=\"info\"><div class=\"close\"></div><div class=\"circle\" style=\"background-image:url(https://i2.ytimg.com/vi/U8bA1gw5xKw/hqdefault.jpg)\"></div><p>FEEL GOOD PODCAST #31 | Jonny Fischer<br><br>Views: 489 &nbsp; Ø/Video: 2560<br>Veröffentlicht am: Fr. 16.10.20 um 15:14 Uhr</p><div class=\"abobar\"><a href=\"https://youtu.be/U8bA1gw5xKw\" target=\"_blank\" class=\"red\">zum Video</a></div></div></td>', 489, '2020-10-16T13:14:07+00:00', '201016151407', 'ch');
INSERT INTO `channels` VALUES (251, 0, 'UCn4DYnlcZQQ_LNHUHaQhObQ', 'R&R On Tour', 'Wir sind Rahel & René und aktuell reisen wir um die Welt, während wir unser Geschäft avenwood.ch weiter betreiben und ausbauen. <br /><br />Folgt uns auch auf Instagram @r.r.on.tour , auf Facebook facebook.com/RRonTourCH oder auf unserem Blog avenwood.ch/blog', 'https://yt3.ggpht.com/a/AATXAJw6zWdJCtCCMoGY6sZa8MHzAcOVchzHcN4MyIivsg=s88-c-k-c0xffffffff-no-rj-mo', 'Rahel & René', '', 'http://rr-on-tour.ch', '', '', 'r.r.on.tour', '-1-', '10.02.2018', '201017-11', '201017-11', 0, 0, 0, 0, 88, 91, NULL, 0, 0, 0, 0, 40289, 188624, NULL, 57, NULL, 'ROWDY Rucksack Stop Motion', 'GvbJPDbQioc', '<td class=\"yt-lastvideo\" data-sort=\"200901094506\" data-utime=\"201017-11\"><a href=\"https://youtu.be/GvbJPDbQioc\" title=\"ROWDY Rucksack Stop Motion\" target=\"_blank\">Di. 01.09.20</a><div class=\"info\"><div class=\"close\"></div><div class=\"circle\" style=\"background-image:url(https://i4.ytimg.com/vi/GvbJPDbQioc/hqdefault.jpg)\"></div><p>ROWDY Rucksack Stop Motion<br><br>Views: 8 &nbsp; Ø/Video: 3309<br>Veröffentlicht am: Di. 01.09.20 um 09:45 Uhr</p><div class=\"abobar\"><a href=\"https://youtu.be/GvbJPDbQioc\" target=\"_blank\" class=\"red\">zum Video</a></div></div></td>', 8, '2020-09-01T07:45:06+00:00', '200901094506', 'ch');
INSERT INTO `channels` VALUES (252, 0, 'UC9e-XjSmv_fUm78NjqjWTPw', 'Swiss GamingTV', 'Hallo mein Name ist Joel und ich bin 19 Jahre alt. Ich komme aus der schönen Schweiz.<br /> <br />Ich würde mich über ein Abo von dir sehr freuen. Hier erwarteten dich tolle Livestreams und ab und zu werden auch Videos zu verschiedenen Games hochladen. Ich werde hier Hochdeutsch sprechen aber da ich ein Schweizer bin kann es halt noch einen Dialekt in der Sprache mit dabei sein.<br /><br />Die Livestream starten um 19:00 Uhr. Ich werde so oft wie es geht einen Livestream planen. Also aktiviere am besten die Glocke, denn dann verpasst du nichts mehr. Also ich werde versuchen, dass am Mittwoch und Sonntag, jeweils ein Stream Online kommt. Dies ist jedoch nicht garantiert.<br /><br />Herzlichen Dank für dein Verständnis.<br />Viel Spass wünscht dir dein Swiss :)', 'https://yt3.ggpht.com/a/AATXAJxIelLwUR1D7NrAxlV0VyJ3Rs2-2n3qXmHsOS948Gw=s88-c-k-c0xffffffff-no-rj-mo', 'Joel', '', '', '', '', 'joel_swissgamingtv', '-4-15-23-', '14.08.2012', '201017-11', '201017-11', 0, 0, 0, 138, 336, 560, NULL, 0, 0, 0, 6116, 12944, 29467, NULL, 438, NULL, 'Was wollt ihr sehen? | Sag mir bitte eure Meinung🤩🤩', '-kOfTc7lVFQ', '<td class=\"yt-lastvideo\" data-sort=\"201016135032\" data-utime=\"201017-11\"><a href=\"https://youtu.be/-kOfTc7lVFQ\" title=\"Was wollt ihr sehen? | Sag mir bitte eure Meinung🤩🤩\" target=\"_blank\">Fr. 16.10.20</a><div class=\"info\"><div class=\"close\"></div><div class=\"circle\" style=\"background-image:url(https://i2.ytimg.com/vi/-kOfTc7lVFQ/hqdefault.jpg)\"></div><p>Was wollt ihr sehen? | Sag mir bitte eure Meinung🤩🤩<br><br>Views: 55 &nbsp; Ø/Video: 67<br>Veröffentlicht am: Fr. 16.10.20 um 13:50 Uhr</p><div class=\"abobar\"><a href=\"https://youtu.be/-kOfTc7lVFQ\" target=\"_blank\" class=\"red\">zum Video</a></div></div></td>', 55, '2020-10-16T11:50:32+00:00', '201016135032', 'ch');
INSERT INTO `channels` VALUES (253, 0, 'UCpkYP_woRKj1ltLdoIPO8UQ', 'Studioeins', 'Wir zeigen dir auf diesem Kanal Tricks rund ums Filmemachen und Tipps für bessere Videoproduktionen. Du lernst die neusten Kameras kennen oder Gadgets, Software und Plugins, die dir helfen, noch schneller und kreativer zu arbeiten.<br /><br />Unsere Studierenden präsentieren hier auch ihre Arbeiten, die sie in den Lehrgängen und Kursen produzieren.<br /><br />Studio 1 ist ein eigenständiges Ausbildungscenter für Film, Video und Medien. <br />Seit 2019 ist Studio 1 Adobe autorisiertes Trainingscenter.', 'https://yt3.ggpht.com/a/AATXAJwCsZv8aoHoJtDnJxhtAU216Qfc22xFDXImlOn-=s88-c-k-c0xffffffff-no-rj-mo', 'Roman Lehmann, Manfred Hager, Stefan Tüscher', 'https://www.youtube.com/studioeins', 'https://www.studioeins.ch', '', '', 'studioeins', '-3-13-18-', '27.08.2018', '201017-11', '201017-11', 0, 0, 0, 0, 69, 173, NULL, 0, 0, 0, 0, 18462, 169994, NULL, 116, NULL, 'Die Geister, die uns riefen – Unterwegs mit den GhostHunters Schweiz', 'ToK5wPGW950', '<td class=\"yt-lastvideo\" data-sort=\"200916233848\" data-utime=\"201017-11\"><a href=\"https://youtu.be/ToK5wPGW950\" title=\"Die Geister, die uns riefen – Unterwegs mit den GhostHunters Schweiz\" target=\"_blank\">Mi. 16.09.20</a><div class=\"info\"><div class=\"close\"></div><div class=\"circle\" style=\"background-image:url(https://i1.ytimg.com/vi/ToK5wPGW950/hqdefault.jpg)\"></div><p>Die Geister, die uns riefen – Unterwegs mit den GhostHunters Schweiz<br><br>Views: 125 &nbsp; Ø/Video: 1465<br>Veröffentlicht am: Mi. 16.09.20 um 23:38 Uhr</p><div class=\"abobar\"><a href=\"https://youtu.be/ToK5wPGW950\" target=\"_blank\" class=\"red\">zum Video</a></div></div></td>', 125, '2020-09-16T21:38:48+00:00', '200916233848', 'ch');
INSERT INTO `channels` VALUES (254, 0, 'UCDj1JYtAp5RCgt9FR3KvfKA', 'GeilerAsDu', '', 'https://yt3.ggpht.com/a/AATXAJx3rXrRTnhcgrHwu0FP87LzAEdMBASh3LEZkBoZwA=s88-c-k-c0xffffffff-no-rj-mo', 'Fabrizio Zihlmann, Luzi Rast, Mike Walker', 'https://www.youtube.com/geilerasdu', 'http://geilerasdu.ch', '', '', 'geilerasdu_official', '-8-', '27.05.2011', '201017-11', '201017-11', 0, 0, 511, 530, 555, 581, NULL, 0, 0, 211182, 225282, 236210, 246872, NULL, 24, NULL, 'GeilerAsDu - Freibad feat. Little Miss Sunshine (Live @Studio vom Dach)', 'MpBLRxH_iX0', '<td class=\"yt-lastvideo\" data-sort=\"200102170005\" data-utime=\"201017-11\"><a href=\"https://youtu.be/MpBLRxH_iX0\" title=\"GeilerAsDu - Freibad feat. Little Miss Sunshine (Live @Studio vom Dach)\" target=\"_blank\">Do. 02.01.20</a><div class=\"info\"><div class=\"close\"></div><div class=\"circle\" style=\"background-image:url(https://i2.ytimg.com/vi/MpBLRxH_iX0/hqdefault.jpg)\"></div><p>GeilerAsDu - Freibad feat. Little Miss Sunshine (Live @Studio vom Dach)<br><br>Views: 2796 &nbsp; Ø/Video: 10286<br>Veröffentlicht am: Do. 02.01.20 um 17:00 Uhr</p><div class=\"abobar\"><a href=\"https://youtu.be/MpBLRxH_iX0\" target=\"_blank\" class=\"red\">zum Video</a></div></div></td>', 2796, '2020-01-02T16:00:05+00:00', '200102170005', 'ch');
INSERT INTO `channels` VALUES (255, 0, 'UC2M898yRYpwqWvA3PUCZGhA', 'Sterneis', 'Ultra Independent!', 'https://yt3.ggpht.com/a/AATXAJy3RF6IHLVNelacgaIHaYyDySgYM6wt9veg2NK1=s88-c-k-c0xffffffff-no-rj-mo', '', 'https://www.youtube.com/sterneismusig', 'https://sterneismusig.bandcamp.com', '', '', 'sylvesterstarone', '-8-20-', '27.03.2009', '201017-11', '201017-11', 0, 0, 103, 249, 531, 874, NULL, 0, 0, 22975, 50093, 129599, 216975, NULL, 75, NULL, 'PORTAVOZ - Pow', 'O5GW8rjcw0Q', '<td class=\"yt-lastvideo\" data-sort=\"201002193405\" data-utime=\"201017-11\"><a href=\"https://youtu.be/O5GW8rjcw0Q\" title=\"PORTAVOZ - Pow\" target=\"_blank\">Fr. 02.10.20</a><div class=\"info\"><div class=\"close\"></div><div class=\"circle\" style=\"background-image:url(https://i4.ytimg.com/vi/O5GW8rjcw0Q/hqdefault.jpg)\"></div><p>PORTAVOZ - Pow<br><br>Views: 676 &nbsp; Ø/Video: 2893<br>Veröffentlicht am: Fr. 02.10.20 um 19:34 Uhr</p><div class=\"abobar\"><a href=\"https://youtu.be/O5GW8rjcw0Q\" target=\"_blank\" class=\"red\">zum Video</a></div></div></td>', 676, '2020-10-02T17:34:05+00:00', '201002193405', 'ch');
INSERT INTO `channels` VALUES (256, 0, 'UCguyr4xPH2PsGdArUljEoJw', 'Codec O', 'Offizieller Youtube Kanal von Codec O', 'https://yt3.ggpht.com/a/AATXAJzrDXocMVbAAIaxd7YUzPuWl9FYcK8XPQVm2Dk-fg=s88-c-k-c0xffffffff-no-rj-mo', '', '', '', '', '', 'codec.o', '-8-', '05.11.2018', '201017-11', '201017-11', 0, 0, 0, 0, 0, 109, NULL, 0, 0, 0, 0, 0, 2430, NULL, 3, NULL, 'Codec O - Inception (Official Video)', 'q1ZDVIIUULA', '<td class=\"yt-lastvideo\" data-sort=\"200814160010\" data-utime=\"201017-11\"><a href=\"https://youtu.be/q1ZDVIIUULA\" title=\"Codec O - Inception (Official Video)\" target=\"_blank\">Fr. 14.08.20</a><div class=\"info\"><div class=\"close\"></div><div class=\"circle\" style=\"background-image:url(https://i2.ytimg.com/vi/q1ZDVIIUULA/hqdefault.jpg)\"></div><p>Codec O - Inception (Official Video)<br><br>Views: 340 &nbsp; Ø/Video: 810<br>Veröffentlicht am: Fr. 14.08.20 um 16:00 Uhr</p><div class=\"abobar\"><a href=\"https://youtu.be/q1ZDVIIUULA\" target=\"_blank\" class=\"red\">zum Video</a></div></div></td>', 340, '2020-08-14T14:00:10+00:00', '200814160010', 'ch');
INSERT INTO `channels` VALUES (257, 1, 'UC4KL2AZAa4n5GFZXnmfi3qQ', 'André Burri Fotografie', 'Willkommen auf meinem YouTube Channel. Hier findest Du Videos über\'s Fotografieren und alles drum herum. Viel Spass! :-)<br /><br />Weitere Informationen über mich und meine Arbeit findest Du auf meiner Homepage unter unter burrifotografie.ch', 'https://yt3.ggpht.com/a/AATXAJzFP3tLPf5LKYFeZoQLmRCaJlOllvl252m3jEzj-A=s88-c-k-c0xffffffff-no-rj-mo', '', '', 'https://www.burrifotografie.ch', '', '', 'burrifotografie.ch', '-3-', '29.11.2014', '201016-20', '201017-11', 0, 0, 0, 0, 14, 16, NULL, 0, 0, 0, 0, 7158, 8013, NULL, 26, NULL, 'Tastaturkürzel einrichten in Photoshop', 'VMGyeNCKdDc', '<td class=\"yt-lastvideo\" data-sort=\"191018124454\" data-utime=\"201017-11\"><a href=\"https://youtu.be/VMGyeNCKdDc\" title=\"Tastaturkürzel einrichten in Photoshop\" target=\"_blank\">Fr. 18.10.19</a><div class=\"info\"><div class=\"close\"></div><div class=\"circle\" style=\"background-image:url(https://i3.ytimg.com/vi/VMGyeNCKdDc/hqdefault.jpg)\"></div><p>Tastaturkürzel einrichten in Photoshop<br><br>Views: 8 &nbsp; Ø/Video: 308<br>Veröffentlicht am: Fr. 18.10.19 um 12:44 Uhr</p><div class=\"abobar\"><a href=\"https://youtu.be/VMGyeNCKdDc\" target=\"_blank\" class=\"red\">zum Video</a></div></div></td>', 8, '2019-10-18T10:44:54+00:00', '191018124454', 'ch');
INSERT INTO `channels` VALUES (258, 1, 'UCLqs8-BRLc7anXSHXZHBXeQ', 'think.answer.share', 'Wir sprechen über Musik', 'https://yt3.ggpht.com/a/AATXAJyPXvTG891CTl7wuuEGw4rPI8E7k2JRMZXtrf7evQ=s88-c-k-c0xffffffff-no-rj-mo', '', '', '', '', '', 'think.answer.share', '-6-8-', '17.12.2018', '201016-20', '201017-11', 0, 0, 0, 0, 72, 78, NULL, 0, 0, 0, 0, 13474, 16011, NULL, 21, NULL, '#thinkanswershare #Eliel #2000jetzt Eliel im Interview', 'JBEQgQGLKgk', '<td class=\"yt-lastvideo\" data-sort=\"191212210711\" data-utime=\"201017-11\"><a href=\"https://youtu.be/JBEQgQGLKgk\" title=\"#thinkanswershare #Eliel #2000jetzt Eliel im Interview\" target=\"_blank\">Do. 12.12.19</a><div class=\"info\"><div class=\"close\"></div><div class=\"circle\" style=\"background-image:url(https://i3.ytimg.com/vi/JBEQgQGLKgk/hqdefault.jpg)\"></div><p>#thinkanswershare #Eliel #2000jetzt Eliel im Interview<br><br>Views: 173 &nbsp; Ø/Video: 762<br>Veröffentlicht am: Do. 12.12.19 um 21:07 Uhr</p><div class=\"abobar\"><a href=\"https://youtu.be/JBEQgQGLKgk\" target=\"_blank\" class=\"red\">zum Video</a></div></div></td>', 173, '2019-12-12T20:07:11+00:00', '191212210711', 'ch');
INSERT INTO `channels` VALUES (259, 0, 'UCm1FcqQxzuDMQG-xEIoXDig', 'Vergleiche', 'vergleiche.ch ist ein Produkte und Dienstleistungs Vergleichsportal für die Schweiz.<br /><br />Bei uns findest Du über 7 Mio. Produkte im Preisvergleich und auf unserem Channel stellen wir jeweils neue Produkte vor, besuchen Messen oder vergleichen Anbieter miteinander. Grundsätzlich behandeln wir alle Themen, die wir aus der Sicht des Konsumenten als Interessant erachten.<br /><br />Wir freuen uns, wenn Du unsere Beiträge kommentierst, oder noch besser gleich unseren Kanal abonnierst. :)', 'https://yt3.ggpht.com/a/AATXAJxf7IORvbyjn2wuWlV7yg4Ddwa7Ng4SwRWaCL8c=s88-c-k-c0xffffffff-no-rj-mo', '', '', 'https://www.vergleiche.ch', '', '', 'vergleiche.ch', '-7-18-', '05.09.2008', '201017-11', '201017-11', 0, 0, 0, 0, 33, 56, NULL, 0, 0, 0, 0, 22567, 34345, NULL, 8, NULL, 'Black Friday Schweiz 2020 | Interview mit Black Friday Deals | vergleiche.ch', 'righqD437Vs', '<td class=\"yt-lastvideo\" data-sort=\"200722193604\" data-utime=\"201017-11\"><a href=\"https://youtu.be/righqD437Vs\" title=\"Black Friday Schweiz 2020 | Interview mit Black Friday Deals | vergleiche.ch\" target=\"_blank\">Mi. 22.07.20</a><div class=\"info\"><div class=\"close\"></div><div class=\"circle\" style=\"background-image:url(https://i3.ytimg.com/vi/righqD437Vs/hqdefault.jpg)\"></div><p>Black Friday Schweiz 2020 | Interview mit Black Friday Deals | vergleiche.ch<br><br>Views: 50 &nbsp; Ø/Video: 4293<br>Veröffentlicht am: Mi. 22.07.20 um 19:36 Uhr</p><div class=\"abobar\"><a href=\"https://youtu.be/righqD437Vs\" target=\"_blank\" class=\"red\">zum Video</a></div></div></td>', 50, '2020-07-22T17:36:04+00:00', '200722193604', 'ch');
INSERT INTO `channels` VALUES (260, 0, 'UCsODl_kFzH21bN0v5Ub3W3g', 'Sina', 'sina.ch<br />Schweizer Mundartsängerin.<br />geb. im Süden der Schweiz, im Wallis.<br />Es sind 13 Alben von 1994-2018 erschienen.<br />9 Gold- und 2 Platinauszeichnungen<br />Alle Studio-Alben TopTen Chartsplatzierungen<br />Seit 20 Jahren mit ihrer Band in Helvetien und rundum unterwegs.', 'https://yt3.ggpht.com/a/AATXAJw-nBardmvvubEOESYg11OcmxtluCIoUD5AxbuF=s88-c-k-c0xffffffff-no-rj-mo', '', '', 'https://www.sina.ch', '', '', '', '-8-34-', '02.10.2009', '201017-11', '201017-11', 0, 0, 976, 1162, 1450, 1670, NULL, 0, 0, 1209041, 1410676, 1718102, 1933239, NULL, 40, NULL, 'SINA Im Summärwind (Lovers Lullaby)', 'PMgHgkTY0ig', '<td class=\"yt-lastvideo\" data-sort=\"200417070434\" data-utime=\"201017-11\"><a href=\"https://youtu.be/PMgHgkTY0ig\" title=\"SINA Im Summärwind (Lovers Lullaby)\" target=\"_blank\">Fr. 17.04.20</a><div class=\"info\"><div class=\"close\"></div><div class=\"circle\" style=\"background-image:url(https://i1.ytimg.com/vi/PMgHgkTY0ig/hqdefault.jpg)\"></div><p>SINA Im Summärwind (Lovers Lullaby)<br><br>Views: 6090 &nbsp; Ø/Video: 48331<br>Veröffentlicht am: Fr. 17.04.20 um 07:04 Uhr</p><div class=\"abobar\"><a href=\"https://youtu.be/PMgHgkTY0ig\" target=\"_blank\" class=\"red\">zum Video</a></div></div></td>', 6090, '2020-04-17T05:04:34+00:00', '200417070434', 'ch');
INSERT INTO `channels` VALUES (261, 0, 'UCCfpKXMBuL0hP83BADHbaDA', 'Hoschi', '❤LICH WILLKOMMEN BEIM HOSCHI!!!<br /><br /><br />INFORMATIONEN:<br /><br />Wen Ihr Fragen oder Anregungen habt einfach mir Schreiben, entweder in Instagram, TikTok und YouTube oder unter der E-Mail: hoschi97@gmx.net<br /><br />Für Geschäftliche Anfragen Bitte an die E-Mail Adresse melden hoschi97@gmx.net<br /><br /><br />Freundliche Grüsse<br />Fabian Hostettler', 'https://yt3.ggpht.com/a/AATXAJyumpo8hHJlvrn8OYQupjDsSVIgdtjypk2F9nQzcg=s88-c-k-c0xffffffff-no-rj-mo', 'Fabian Hostettler', '', '', '', '', 'hoschi1997', '-7-21-', '28.07.2015', '201017-11', '201017-11', 0, 25, 25, 25, 0, 0, NULL, 0, 32438, 69798, 130336, 209921, 345577, NULL, 705, NULL, 'SpezialVideo (Rückblick Sep. 2020)', 'oN4X4Xr51zs', '<td class=\"yt-lastvideo\" data-sort=\"201016184657\" data-utime=\"201017-11\"><a href=\"https://youtu.be/oN4X4Xr51zs\" title=\"SpezialVideo (Rückblick Sep. 2020)\" target=\"_blank\">Fr. 16.10.20</a><div class=\"info\"><div class=\"close\"></div><div class=\"circle\" style=\"background-image:url(https://i4.ytimg.com/vi/oN4X4Xr51zs/hqdefault.jpg)\"></div><p>SpezialVideo (Rückblick Sep. 2020)<br><br>Views: 31 &nbsp; Ø/Video: 490<br>Veröffentlicht am: Fr. 16.10.20 um 18:46 Uhr</p><div class=\"abobar\"><a href=\"https://youtu.be/oN4X4Xr51zs\" target=\"_blank\" class=\"red\">zum Video</a></div></div></td>', 31, '2020-10-16T16:46:57+00:00', '201016184657', 'ch');
INSERT INTO `channels` VALUES (262, 0, 'UCiSZ-iXxtcvd0Be0pEG0SEQ', 'THIRD EYE FILMS', 'in Cooperation with THIRD EYE FILMS', 'https://yt3.ggpht.com/a/AATXAJx45suoxvfBOXhHwElbOOa57uSGVCOXYPYIpJL6=s88-c-k-c0xffffffff-no-rj-mo', 'Blanco Monee', '', 'http://www.3-ovision.com', '', '', '_vizionart_', '-3-8-', '29.07.2009', '201017-11', '201017-11', 0, 0, 0, 0, 0, 266, NULL, 0, 0, 0, 0, 0, 99641, NULL, 39, NULL, 'WICHT - Griff nach dä Sterne', 'yqpVOb9QP7s', '<td class=\"yt-lastvideo\" data-sort=\"201002000017\" data-utime=\"201017-11\"><a href=\"https://youtu.be/yqpVOb9QP7s\" title=\"WICHT - Griff nach dä Sterne\" target=\"_blank\">Fr. 02.10.20</a><div class=\"info\"><div class=\"close\"></div><div class=\"circle\" style=\"background-image:url(https://i2.ytimg.com/vi/yqpVOb9QP7s/hqdefault.jpg)\"></div><p>WICHT - Griff nach dä Sterne<br><br>Views: 992 &nbsp; Ø/Video: 2555<br>Veröffentlicht am: Fr. 02.10.20 um 00:00 Uhr</p><div class=\"abobar\"><a href=\"https://youtu.be/yqpVOb9QP7s\" target=\"_blank\" class=\"red\">zum Video</a></div></div></td>', 992, '2020-10-01T22:00:17+00:00', '201002000017', 'ch');
INSERT INTO `channels` VALUES (263, 0, 'UC0Rcwf8aMBpi0tHCtIll7KQ', 'GrischaYeti', 'Ciao zämma, i bin d Jürg<br />Auf meinem Channel findest du hauptsächlich verschiedenstes Gameplay und ab und zu auch mal einen VLOG. Damit du nichts verpasst, du kennst es ;) abonnieren und Glocke aktivieren <br /><br />Upload-Plan: Donnerstag und Sonntag sowie ab und zu am Dienstag ein Bonus-Video<br /><br />►►►CreatorCode: GRISCHAYETI<br />Den Code muss man nach 14 Tagen wieder neu eingeben! :3 <br />ᵂᴱᴿᴮᵁᴺᴳ #CreatorCodeGrischaYeti<br /><br />►► Mein Merch: shop.spreadshirt.ch/grischayeti<br /><br />▼▼▼ du bist cool? dann folge mir auch hier ▼▼▼<br />► Twitch: twitch.tv/grischayeti<br />► Instagram: goo.gl/2XkSyG<br />► Twitter: goo.gl/1JtjwY<br /><br />▼▼▼ Mein PC ▼▼▼<br />► JoulePerformance Craft2<br />► Grafikkarte: 2x Asus ROG Strix RTX 2080 Ti O11G Gaming<br />► CPU: Intel Core i9-9940X (14 cores )<br />► RAM: 64GB G.Skill Trident Z RGB DDR4 3600Mhz<br />► SSD: 1TB – Samsung 970 PRO <br />► SSD2: 1TB – Samsung 860 Evo<br /><br />► Yeti-Logo Design by \"Mottla Brutal Art\": goo.gl/xnWw6<br />► YouTube Banner by \"Michael Mayer\":  michaelmayer.ch', 'https://yt3.ggpht.com/a/AATXAJzoSdRj2-8QyBbex4MWYWgI_Fr_L2Up-TIESh61uA=s88-c-k-c0xffffffff-no-rj-mo', 'Jürg Hartmann', 'https://www.youtube.com/grischayeti', 'https://shop.spreadshirt.ch/grischayeti', '', 'grischayeti', 'grischayeti', '-4-11-15-33-', '27.02.2015', '201017-11', '201017-11', 260, 616, 1301, 1990, 2590, 2900, NULL, 8231, 42183, 114865, 243918, 356375, 419059, NULL, 959, NULL, 'NHL 21 - IT\'S HOCKEY TIME 🏒🥅 - [StreamHighlight]', '0csu_NTVqhA', '<td class=\"yt-lastvideo\" data-sort=\"201013114515\" data-utime=\"201017-11\"><a href=\"https://youtu.be/0csu_NTVqhA\" title=\"NHL 21 - IT\'S HOCKEY TIME 🏒🥅 - [StreamHighlight]\" target=\"_blank\">Di. 13.10.20</a><div class=\"info\"><div class=\"close\"></div><div class=\"circle\" style=\"background-image:url(https://i1.ytimg.com/vi/0csu_NTVqhA/hqdefault.jpg)\"></div><p>NHL 21 - IT\'S HOCKEY TIME 🏒🥅 - [StreamHighlight]<br><br>Views: 275 &nbsp; Ø/Video: 437<br>Veröffentlicht am: Di. 13.10.20 um 11:45 Uhr</p><div class=\"abobar\"><a href=\"https://youtu.be/0csu_NTVqhA\" target=\"_blank\" class=\"red\">zum Video</a></div></div></td>', 275, '2020-10-13T09:45:15+00:00', '201013114515', 'ch');
INSERT INTO `channels` VALUES (264, 0, 'UC--ryeowLnmiige-iFqxp5A', 'JoshuaSpielt', 'Herzlich willkommä uf mim Kanal! Bi mir findet ihr Vlogs und Realtalk Videos, und natürlich no viel meh! Ich würdi mich mega über es Abo freue😉', 'https://yt3.ggpht.com/a/AATXAJxu8tvpNxf_HYbMXZ46d2eEqYTh7O7PKzHntVxwSg=s88-c-k-c0xffffffff-no-rj-mo', 'Joshua', 'https://www.youtube.com/joshuaspielt', '', '', 'joshuaspieltch', 'joshuaspielt', '-6-11-20-', '21.02.2014', '201017-11', '201017-11', 0, 0, 166, 533, 872, 985, NULL, 0, 0, 13849, 18810, 39168, 38081, NULL, 41, NULL, 'Was dänked Basler über Züri? STRASSENUMFRAGEN #001', 'HFgQL-Zp8HU', '<td class=\"yt-lastvideo\" data-sort=\"200916144118\" data-utime=\"201017-11\"><a href=\"https://youtu.be/HFgQL-Zp8HU\" title=\"Was dänked Basler über Züri? STRASSENUMFRAGEN #001\" target=\"_blank\">Mi. 16.09.20</a><div class=\"info\"><div class=\"close\"></div><div class=\"circle\" style=\"background-image:url(https://i1.ytimg.com/vi/HFgQL-Zp8HU/hqdefault.jpg)\"></div><p>Was dänked Basler über Züri? STRASSENUMFRAGEN #001<br><br>Views: 369 &nbsp; Ø/Video: 929<br>Veröffentlicht am: Mi. 16.09.20 um 14:41 Uhr</p><div class=\"abobar\"><a href=\"https://youtu.be/HFgQL-Zp8HU\" target=\"_blank\" class=\"red\">zum Video</a></div></div></td>', 369, '2020-09-16T12:41:18+00:00', '200916144118', 'ch');
INSERT INTO `channels` VALUES (265, 0, 'UC1un-ntTO7GVbBGWdjWq1hg', 'Bligg', 'Herzlich willkommen auf dem offiziellen Bligg-Kanal!<br />Hier findest du Music-Clips, Videos, Webisoden und vieles mehr von BLIGG.', 'https://yt3.ggpht.com/a/AATXAJy74-XsyEY5Xcd3KEY_2JKC5eoNm7xJ2EQ1wuE7YQ=s88-c-k-c0xffffffff-no-rj-mo', 'Marco Bliggensdorfer', 'https://www.youtube.com/BliggTv', 'https://bligg.ch', '', '', 'bligg_blizo', '-8-20-', '21.10.2008', '201017-11', '201017-11', 7513, 9368, 10476, 16949, 20500, 24500, NULL, 7629173, 9448364, 10679631, 14621288, 17347280, 20233334, NULL, 243, NULL, 'SMA Kids by Generali feat. Bligg - Narbe (Official Video)', 'UxbJtnMxDR0', '<td class=\"yt-lastvideo\" data-sort=\"201005170016\" data-utime=\"201017-11\"><a href=\"https://youtu.be/UxbJtnMxDR0\" title=\"SMA Kids by Generali feat. Bligg - Narbe (Official Video)\" target=\"_blank\">Mo. 05.10.20</a><div class=\"info\"><div class=\"close\"></div><div class=\"circle\" style=\"background-image:url(https://i2.ytimg.com/vi/UxbJtnMxDR0/hqdefault.jpg)\"></div><p>SMA Kids by Generali feat. Bligg - Narbe (Official Video)<br><br>Views: 7510 &nbsp; Ø/Video: 83265<br>Veröffentlicht am: Mo. 05.10.20 um 17:00 Uhr</p><div class=\"abobar\"><a href=\"https://youtu.be/UxbJtnMxDR0\" target=\"_blank\" class=\"red\">zum Video</a></div></div></td>', 7510, '2020-10-05T15:00:16+00:00', '201005170016', 'ch');
INSERT INTO `channels` VALUES (266, 0, 'UChJa-I_3JCZ0iWrkJStCMbA', 'Dominik Widmer', 'Mountainbike, Dirtjump, Park, Freeride and Downhill riding.', 'https://yt3.ggpht.com/a/AATXAJzYjUfgmD1p6tchIn1ToASqJH22k5rYzfSISmuKJw=s88-c-k-c0xffffffff-no-rj-mo', '', 'https://www.youtube.com/dominikwidmer', '', '', '', 'domi.widmer', '-5-', '16.10.2011', '201017-11', '201017-11', 0, 0, 0, 0, 0, 106, NULL, 0, 0, 0, 0, 0, 35157, NULL, 62, NULL, 'First Ride - Rocky Mountain Altitude 2021', 'Ji8pwv_tX4o', '<td class=\"yt-lastvideo\" data-sort=\"200924195858\" data-utime=\"201017-11\"><a href=\"https://youtu.be/Ji8pwv_tX4o\" title=\"First Ride - Rocky Mountain Altitude 2021\" target=\"_blank\">Do. 24.09.20</a><div class=\"info\"><div class=\"close\"></div><div class=\"circle\" style=\"background-image:url(https://i3.ytimg.com/vi/Ji8pwv_tX4o/hqdefault.jpg)\"></div><p>First Ride - Rocky Mountain Altitude 2021<br><br>Views: 632 &nbsp; Ø/Video: 567<br>Veröffentlicht am: Do. 24.09.20 um 19:58 Uhr</p><div class=\"abobar\"><a href=\"https://youtu.be/Ji8pwv_tX4o\" target=\"_blank\" class=\"red\">zum Video</a></div></div></td>', 632, '2020-09-24T17:58:58+00:00', '200924195858', 'ch');
INSERT INTO `channels` VALUES (267, 0, 'UCTB7mdyAxm8jF97cSuVxDpA', 'Dabu Fantastic', 'Nach langer Brutzeit sind Dabu Fantastic 2019 wie frisch aus dem Ei gepellt: Kräftig entstaubter Sound, neue Lieblingslieder fürs Lieblingspublikum, möglicherweise besser getrimmte Bärte und Bierbäuche sowie eine Band, die nur eines will: Endlich wieder raus zum Spielen! <br />Das machen sie an ausgewählten Festivals und zwei exklusiven Shows im Herbst im Plaza Zürich und in der Mühle Hunziken.', 'https://yt3.ggpht.com/a/AATXAJyAsH1hL47HEoe6SYWpWsWfFfv6_hfRZIWJyvkMqw=s88-c-k-c0xffffffff-no-rj-mo', 'Andreas Christen & David Bucher', 'https://www.youtube.com/dabufantastic', 'http://dabufantastic.ch', '', '', 'dabufantastic', '-8-20-', '24.11.2006', '201017-11', '201017-11', 406, 669, 909, 1015, 5240, 5630, NULL, 496595, 642867, 767468, 826073, 866015, 925483, NULL, 111, NULL, 'Die Nacht vor Schlaf Us - Episode 12: Late Check-Out & Simon Britschgi', 'yeZ0dYKztwY', '<td class=\"yt-lastvideo\" data-sort=\"200816200010\" data-utime=\"201017-11\"><a href=\"https://youtu.be/yeZ0dYKztwY\" title=\"Die Nacht vor Schlaf Us - Episode 12: Late Check-Out & Simon Britschgi\" target=\"_blank\">So. 16.08.20</a><div class=\"info\"><div class=\"close\"></div><div class=\"circle\" style=\"background-image:url(https://i2.ytimg.com/vi/yeZ0dYKztwY/hqdefault.jpg)\"></div><p>Die Nacht vor Schlaf Us - Episode 12: Late Check-Out & Simon Britschgi<br><br>Views: 552 &nbsp; Ø/Video: 8338<br>Veröffentlicht am: So. 16.08.20 um 20:00 Uhr</p><div class=\"abobar\"><a href=\"https://youtu.be/yeZ0dYKztwY\" target=\"_blank\" class=\"red\">zum Video</a></div></div></td>', 552, '2020-08-16T18:00:10+00:00', '200816200010', 'ch');
INSERT INTO `channels` VALUES (268, 1, 'UCbJ_20OaOxa3JUTAIdUp-tw', '24Dias', '', 'https://yt3.ggpht.com/a/AATXAJyHJmWqNT3HpiO9vW95qeBabyeIlWc_Ih9hwrMy=s88-c-k-c0xffffffff-no-rj-mo', '', '', '', '', '', '24dias_5k', '-8-22-', '06.04.2015', '201016-20', '201017-11', 0, 0, 0, 0, 164, 176, NULL, 0, 0, 0, 0, 19068, 20113, NULL, 6, NULL, '24Dias - Zahltag (prod. ZeDe) / ViewsDigital', '_m6e9TIryNA', '<td class=\"yt-lastvideo\" data-sort=\"190510115745\" data-utime=\"201017-11\"><a href=\"https://youtu.be/_m6e9TIryNA\" title=\"24Dias - Zahltag (prod. ZeDe) / ViewsDigital\" target=\"_blank\">Fr. 10.05.19</a><div class=\"info\"><div class=\"close\"></div><div class=\"circle\" style=\"background-image:url(https://i4.ytimg.com/vi/_m6e9TIryNA/hqdefault.jpg)\"></div><p>24Dias - Zahltag (prod. ZeDe) / ViewsDigital<br><br>Views: 3431 &nbsp; Ø/Video: 3352<br>Veröffentlicht am: Fr. 10.05.19 um 11:57 Uhr</p><div class=\"abobar\"><a href=\"https://youtu.be/_m6e9TIryNA\" target=\"_blank\" class=\"red\">zum Video</a></div></div></td>', 3431, '2019-05-10T09:57:45+00:00', '190510115745', 'ch');
INSERT INTO `channels` VALUES (269, 0, 'UCodcq_vXa4cQdRIRzSuQwgw', 'SchlauMeier.online', 'Bis die Schule wieder losgeht: Tägliche Online-Lektionen von Erwachsenen für Kinder. Live und zu vielen spannenden Themen.', 'https://yt3.ggpht.com/a/AATXAJxW4KCoB_WsEcivfJqTfnyGG6zLWvb-5ZEAq68g=s88-c-k-c0xffffffff-no-rj-mo', 'Roman Camenzind', 'https://www.youtube.com/schlaumeieronline', 'https://www.schlaumeier.online', '', '', 'schlaumeier.online', '-7-18-', '17.03.2020', '201017-11', '201017-11', 0, 0, 0, 0, 0, 1050, NULL, 0, 0, 0, 0, 0, 51492, NULL, 37, NULL, 'Kei Wort meh. Nur no es Lied, es paar Moment und es riesigs Danke', 'WaCBB-X4PrY', '<td class=\"yt-lastvideo\" data-sort=\"200508095537\" data-utime=\"201017-11\"><a href=\"https://youtu.be/WaCBB-X4PrY\" title=\"Kei Wort meh. Nur no es Lied, es paar Moment und es riesigs Danke\" target=\"_blank\">Fr. 08.05.20</a><div class=\"info\"><div class=\"close\"></div><div class=\"circle\" style=\"background-image:url(https://i4.ytimg.com/vi/WaCBB-X4PrY/hqdefault.jpg)\"></div><p>Kei Wort meh. Nur no es Lied, es paar Moment und es riesigs Danke<br><br>Views: 1999 &nbsp; Ø/Video: 1392<br>Veröffentlicht am: Fr. 08.05.20 um 09:55 Uhr</p><div class=\"abobar\"><a href=\"https://youtu.be/WaCBB-X4PrY\" target=\"_blank\" class=\"red\">zum Video</a></div></div></td>', 1999, '2020-05-08T07:55:37+00:00', '200508095537', 'ch');
INSERT INTO `channels` VALUES (270, 0, 'UC81iQn__mnZ5TZc5nSNCE4g', 'Darian', 'Hoi ich bin de Darian ond mache videos of Schwiizerdütsch👍<br />für ahfrage  schrib mer uf Insta.', 'https://yt3.ggpht.com/a/AATXAJypj94kzNJVikcTjtvPRSsoriikPzGNXNGN3iQZ=s88-c-k-c0xffffffff-no-rj-mo', '', '', '', '', '', 'schwiizer_youtuber_memes', '-6-', '25.09.2018', '201017-11', '201017-11', 0, 0, 0, 0, 0, 132, NULL, 0, 0, 0, 0, 0, 1777, NULL, 13, NULL, 'Wer lügt besser vs NICI?|Darian', 'DE82S1XhL2M', '<td class=\"yt-lastvideo\" data-sort=\"201005160002\" data-utime=\"201017-11\"><a href=\"https://youtu.be/DE82S1XhL2M\" title=\"Wer lügt besser vs NICI?|Darian\" target=\"_blank\">Mo. 05.10.20</a><div class=\"info\"><div class=\"close\"></div><div class=\"circle\" style=\"background-image:url(https://i1.ytimg.com/vi/DE82S1XhL2M/hqdefault.jpg)\"></div><p>Wer lügt besser vs NICI?|Darian<br><br>Views: 83 &nbsp; Ø/Video: 137<br>Veröffentlicht am: Mo. 05.10.20 um 16:00 Uhr</p><div class=\"abobar\"><a href=\"https://youtu.be/DE82S1XhL2M\" target=\"_blank\" class=\"red\">zum Video</a></div></div></td>', 83, '2020-10-05T14:00:02+00:00', '201005160002', 'ch');
INSERT INTO `channels` VALUES (271, 0, 'UCrUHHlrVtbPrbs_lsC0Eu4A', 'Timi Time', 'Morgää zäme<br />Ich bin eine vo de wenige Schwiizer YouTuber und mache das Hobbymässig. <br />Falls dir min Kanal gfallt chansch mich jo miteme Abo unterstütze :D<br />Dankä das du do bisch, nur wege dir chan ich das do e so machä ❤️<br /><br />Wenn mehr wilsch ghöre vo mir, folg mir doch no do :D<br />Instagram und TikTok: Timon1475', 'https://yt3.ggpht.com/a/AATXAJxOLGs_hfheBlUj-A6B_adkoRSMBqm1GpPQTcO7Ng=s88-c-k-c0xffffffff-no-rj-mo', 'Timon', 'https://www.youtube.com/timitime', '', '', '', 'timon1475', '-4-21-', '17.03.2019', '201017-11', '201017-11', 0, 0, 0, 0, 468, 1090, NULL, 0, 0, 0, 0, 16641, 44893, NULL, 114, NULL, 'ES ANDERS WORT FÜR!! Mit @Larush und @Ollie Nelson', 'D-rlsEXb2ps', '<td class=\"yt-lastvideo\" data-sort=\"201005190006\" data-utime=\"201017-11\"><a href=\"https://youtu.be/D-rlsEXb2ps\" title=\"ES ANDERS WORT FÜR!! Mit @Larush und @Ollie Nelson\" target=\"_blank\">Mo. 05.10.20</a><div class=\"info\"><div class=\"close\"></div><div class=\"circle\" style=\"background-image:url(https://i1.ytimg.com/vi/D-rlsEXb2ps/hqdefault.jpg)\"></div><p>ES ANDERS WORT FÜR!! Mit @Larush und @Ollie Nelson<br><br>Views: 529 &nbsp; Ø/Video: 394<br>Veröffentlicht am: Mo. 05.10.20 um 19:00 Uhr</p><div class=\"abobar\"><a href=\"https://youtu.be/D-rlsEXb2ps\" target=\"_blank\" class=\"red\">zum Video</a></div></div></td>', 529, '2020-10-05T17:00:06+00:00', '201005190006', 'ch');
INSERT INTO `channels` VALUES (272, 0, 'UCcAAr1QHSTYiATwQb78xLdg', 'S.O.S', '', 'https://yt3.ggpht.com/a/AATXAJwKK0NBEkW-O7ujlCozK7ltrjaq9jQ9PGH49-QCRA=s88-c-k-c0xffffffff-no-rj-mo', 'Thierry Gnahoré (Nativ) & Danilo Rosario (Dawill)', '', 'https://hrdrec.ch', '', '', '', '-8-', '21.08.2015', '201017-11', '201017-11', 0, 1971, 6114, 9338, 11300, 11900, NULL, 0, 484395, 1798018, 2926813, 4057070, 4608383, NULL, 59, NULL, 'Nativ - #dababyflow (prod. Questbeatz)', 'qFazdMQEO1s', '<td class=\"yt-lastvideo\" data-sort=\"200326120022\" data-utime=\"201017-11\"><a href=\"https://youtu.be/qFazdMQEO1s\" title=\"Nativ - #dababyflow (prod. Questbeatz)\" target=\"_blank\">Do. 26.03.20</a><div class=\"info\"><div class=\"close\"></div><div class=\"circle\" style=\"background-image:url(https://i2.ytimg.com/vi/qFazdMQEO1s/hqdefault.jpg)\"></div><p>Nativ - #dababyflow (prod. Questbeatz)<br><br>Views: 19305 &nbsp; Ø/Video: 78108<br>Veröffentlicht am: Do. 26.03.20 um 12:00 Uhr</p><div class=\"abobar\"><a href=\"https://youtu.be/qFazdMQEO1s\" target=\"_blank\" class=\"red\">zum Video</a></div></div></td>', 19305, '2020-03-26T11:00:22+00:00', '200326120022', 'ch');
INSERT INTO `channels` VALUES (273, 0, 'UCWM5vHWTmsvoTZKD3ry7p5w', 'Umweltentdecker', '', 'https://yt3.ggpht.com/a/AATXAJx5-j4FVzmkdB_lOhcr4nv1Bh8V1sb43z7pGDOe=s88-c-k-c0xffffffff-no-rj-mo', 'Dani & Janine', '', 'https://umweltentdecker.ch', 'https://umweltentdecker.ch/category/podcast/', '', 'umweltentdecker', '-1-12-18-25-', '24.07.2019', '201017-11', '201017-11', 0, 0, 0, 0, 0, 27, NULL, 0, 0, 0, 0, 0, 1659, NULL, 12, NULL, 'Interrail Guide 2020: günstige Alternativen zum Hotel', 'qXnxop5x5rg', '<td class=\"yt-lastvideo\" data-sort=\"200728082349\" data-utime=\"201017-11\"><a href=\"https://youtu.be/qXnxop5x5rg\" title=\"Interrail Guide 2020: günstige Alternativen zum Hotel\" target=\"_blank\">Di. 28.07.20</a><div class=\"info\"><div class=\"close\"></div><div class=\"circle\" style=\"background-image:url(https://i2.ytimg.com/vi/qXnxop5x5rg/hqdefault.jpg)\"></div><p>Interrail Guide 2020: günstige Alternativen zum Hotel<br><br>Views: 24 &nbsp; Ø/Video: 138<br>Veröffentlicht am: Di. 28.07.20 um 08:23 Uhr</p><div class=\"abobar\"><a href=\"https://youtu.be/qXnxop5x5rg\" target=\"_blank\" class=\"red\">zum Video</a></div></div></td>', 24, '2020-07-28T06:23:49+00:00', '200728082349', 'ch');
INSERT INTO `channels` VALUES (274, 0, 'UCCQXmMV34CCiJbE0iJGwcOQ', 'Arnold in Action TV', 'Email: arnold.anto05@gmail.com', 'https://yt3.ggpht.com/a/AATXAJw6s7RTzVYF1nssCq7mJqmjhYQOuTMfrdl8bjQh7A=s88-c-k-c0xffffffff-no-rj-mo', '', 'https://www.youtube.com/arnoldinactiontv', '', '', '', 'arnold_in_action_tv', '-6-', '19.02.2015', '201017-11', '201017-11', 0, 52, 73, 137, 203, 264, NULL, 0, 682, 7158, 5070, 10032, 15355, NULL, 34, NULL, 'MOFAVLOG AUF SCHWEIZERDEUTSCH 🇨🇭 #2', 'hdunMLwBUjM', '<td class=\"yt-lastvideo\" data-sort=\"200510184000\" data-utime=\"201017-11\"><a href=\"https://youtu.be/hdunMLwBUjM\" title=\"MOFAVLOG AUF SCHWEIZERDEUTSCH 🇨🇭 #2\" target=\"_blank\">So. 10.05.20</a><div class=\"info\"><div class=\"close\"></div><div class=\"circle\" style=\"background-image:url(https://i1.ytimg.com/vi/hdunMLwBUjM/hqdefault.jpg)\"></div><p>MOFAVLOG AUF SCHWEIZERDEUTSCH 🇨🇭 #2<br><br>Views: 332 &nbsp; Ø/Video: 452<br>Veröffentlicht am: So. 10.05.20 um 18:40 Uhr</p><div class=\"abobar\"><a href=\"https://youtu.be/hdunMLwBUjM\" target=\"_blank\" class=\"red\">zum Video</a></div></div></td>', 332, '2020-05-10T16:40:00+00:00', '200510184000', 'ch');
INSERT INTO `channels` VALUES (275, 0, 'UCOUe4Mk-lHPsIQZ4qrfvwkw', 'Bregy Pictures', 'Ihr findet auf meinem Kanal Videos über die wunderschöne Schweiz, insbesondere die Schweizer Alpen, Kühe und Helikopter. Ich würde mich freuen, dich als meinen Abonnenten begrüssen zu dürfen. Weitere Infos gibt\'s auf Facebook, Instagram oder meiner Webseite.', 'https://yt3.ggpht.com/a/AATXAJz5C7wyWFHUETQ0-3bBFhFJDpqLAFsprnB-2ly0kQ=s88-c-k-c0xffffffff-no-rj-mo', 'Stefan Bregy', 'https://www.youtube.com/bregypictures', 'https://bregypictures.com', '', '', 'bregypictures', '-7-34-', '02.03.2009', '201017-11', '201017-11', 0, 0, 0, 31180, 58700, 68500, NULL, 0, 0, 0, 11000000, 22823816, 27542604, NULL, 76, NULL, 'Murmeltiere und Rehbock auf der Guggialp', '45iFDh85-ms', '<td class=\"yt-lastvideo\" data-sort=\"200927063000\" data-utime=\"201017-11\"><a href=\"https://youtu.be/45iFDh85-ms\" title=\"Murmeltiere und Rehbock auf der Guggialp\" target=\"_blank\">So. 27.09.20</a><div class=\"info\"><div class=\"close\"></div><div class=\"circle\" style=\"background-image:url(https://i1.ytimg.com/vi/45iFDh85-ms/hqdefault.jpg)\"></div><p>Murmeltiere und Rehbock auf der Guggialp<br><br>Views: 105 &nbsp; Ø/Video: 362403<br>Veröffentlicht am: So. 27.09.20 um 06:30 Uhr</p><div class=\"abobar\"><a href=\"https://youtu.be/45iFDh85-ms\" target=\"_blank\" class=\"red\">zum Video</a></div></div></td>', 105, '2020-09-27T04:30:00+00:00', '200927063000', 'ch');
INSERT INTO `channels` VALUES (276, 0, 'UCrsd_S0gN5IHtAPdeVR_ivg', 'Florian Summer', 'Mit seinem Debut Album „Poolboy“ hat Florian Summer 2018 einen regelrechten Senkrechtstart hingelegt  und ist direkt auf Platz 11 der Schweizer-Album-Charts eingestiegen. Mit „Rimini“  und \"Machu Picchu\" sind ihm zwei kleine Radiohits gelungen und der Festivalsommer 2018 mit über 20 Konzerten war Rock&Roll pur. Medien schreiben über ihn: \"He did the best show of all bands at the (Rock am Weiher) Festival\".Florian Summers Texte spielen mit Klischees, die er augenzwinkernd betrachtet und besitzen einen einzigartigen Charme, dem man sich nur schwer entziehen kann. Musikalisch verleiht der freche Newcomer dem Mundartpop ein erfrischendes Elektropop-Gewand und erschafft so seine ganz eigene Klangwelt. 2020 steht im Zeichen einer neuen Platte - TOYBOY!<br /><br />With his debut album “Poolboy”, Florian Summer mad an impressive start and entered the Swiss album charts at number 11. His second album \"Toyboy\" will come out this summer.', 'https://yt3.ggpht.com/a/AATXAJzx_3U9YZZg5EWzPZrpBUNv9bHc6P0VGXypsJxvDQ=s88-c-k-c0xffffffff-no-rj-mo', '', '', 'http://www.floriansummer.ch', '', '', 'florian_summer_music', '-8-20-', '04.03.2017', '201017-11', '201017-11', 0, 0, 0, 0, 0, 776, NULL, 0, 0, 0, 0, 0, 1521234, NULL, 31, NULL, 'Florian Summer - 500\'000 (4 twins edition)', 'vj78K94m09o', '<td class=\"yt-lastvideo\" data-sort=\"201004120010\" data-utime=\"201017-11\"><a href=\"https://youtu.be/vj78K94m09o\" title=\"Florian Summer - 500\'000 (4 twins edition)\" target=\"_blank\">So. 04.10.20</a><div class=\"info\"><div class=\"close\"></div><div class=\"circle\" style=\"background-image:url(https://i3.ytimg.com/vi/vj78K94m09o/hqdefault.jpg)\"></div><p>Florian Summer - 500\'000 (4 twins edition)<br><br>Views: 7907 &nbsp; Ø/Video: 49072<br>Veröffentlicht am: So. 04.10.20 um 12:00 Uhr</p><div class=\"abobar\"><a href=\"https://youtu.be/vj78K94m09o\" target=\"_blank\" class=\"red\">zum Video</a></div></div></td>', 7907, '2020-10-04T10:00:10+00:00', '201004120010', 'ch');
INSERT INTO `channels` VALUES (277, 0, 'UCQBe58uAlyWR_avwCYkx1Rw', 'Lehrstellen Schweiz', 'Schülerinnen und Schüler finden bei Yousty neben Informationen zu den Berufen auch Tipps für ihre Bewerbungen und viele offenen Lehrstellen.<br />Yousty wird von „Your Style“ abgeleitet, weil wir glauben, dass Erfolg im Beruf viel mit Menschen und Vorbildern zu tun hat. Deshalb bieten wir als erste Plattform das Online-Schnuppern an und ermöglichen den Jugendlichen damit umfassende und authentische Einblicke in die Berufe und Firmen.', 'https://yt3.ggpht.com/a/AATXAJwu2Zkg9nCawp6JSEtGxfKQ2DquRUkVEPZ6ivAfzg=s88-c-k-c0xffffffff-no-rj-mo', '', 'https://www.youtube.com/lehrstellenschweiz', 'https://www.yousty.ch', '', '', 'yousty.ch', '-7-', '15.08.2013', '201017-11', '201017-11', 0, 282, 632, 1191, 1840, 2390, NULL, 0, 238231, 531914, 754879, 1200127, 1606532, NULL, 972, NULL, 'Werde Netzelektriker/in EFZ!', 'V0FBNtHio3o', '<td class=\"yt-lastvideo\" data-sort=\"201015125638\" data-utime=\"201017-11\"><a href=\"https://youtu.be/V0FBNtHio3o\" title=\"Werde Netzelektriker/in EFZ!\" target=\"_blank\">Do. 15.10.20</a><div class=\"info\"><div class=\"close\"></div><div class=\"circle\" style=\"background-image:url(https://i3.ytimg.com/vi/V0FBNtHio3o/hqdefault.jpg)\"></div><p>Werde Netzelektriker/in EFZ!<br><br>Views: 108 &nbsp; Ø/Video: 1653<br>Veröffentlicht am: Do. 15.10.20 um 12:56 Uhr</p><div class=\"abobar\"><a href=\"https://youtu.be/V0FBNtHio3o\" target=\"_blank\" class=\"red\">zum Video</a></div></div></td>', 108, '2020-10-15T10:56:38+00:00', '201015125638', 'ch');
INSERT INTO `channels` VALUES (278, 0, 'UCDb1j9QtteeNv130GBuzfAg', 'Police Valais', 'Police cantonale valaisanne - Pour votre sécurité<br />En vertu des missions qui lui sont confiées, la Police cantonale valaisanne veille au maintien de l\'ordre, de la paix et de la sécurité publique. Elle assure la protection des personnes et des biens . Elle est au service de la population valaisanne.<br /><br />Kantonspolizei Wallis - Für Ihre Sicherheit<br />Die Kantonspolizei Wallis hat die Aufgabe, im Rahmen des Gesetzes die öffentliche Ordnung, Sicherheit und Ruhe aufrecht zu erhalten und den Schutz von Personen und Sachen sicherzustellen. Sie handelt im Auftrag der Walliser Bevölkerung.', 'https://yt3.ggpht.com/a/AATXAJwnSKDnaWE4fHh4Dp-mdirieatQhAC6eI2ZVE0=s88-c-k-c0xffffffff-no-rj-mo', '', 'https://www.youtube.com/policevalais', 'https://www.policevalais.ch', '', '', '', '-7-', '12.09.2011', '201017-11', '201017-11', 0, 121, 161, 240, 348, 456, NULL, 0, 31947, 40119, 65470, 97749, 153270, NULL, 108, NULL, 'AGO - Sternwarte Simplon', 'Xtx49IsBclk', '<td class=\"yt-lastvideo\" data-sort=\"201002102310\" data-utime=\"201017-11\"><a href=\"https://youtu.be/Xtx49IsBclk\" title=\"AGO - Sternwarte Simplon\" target=\"_blank\">Fr. 02.10.20</a><div class=\"info\"><div class=\"close\"></div><div class=\"circle\" style=\"background-image:url(https://i1.ytimg.com/vi/Xtx49IsBclk/hqdefault.jpg)\"></div><p>AGO - Sternwarte Simplon<br><br>Views: 55 &nbsp; Ø/Video: 1419<br>Veröffentlicht am: Fr. 02.10.20 um 10:23 Uhr</p><div class=\"abobar\"><a href=\"https://youtu.be/Xtx49IsBclk\" target=\"_blank\" class=\"red\">zum Video</a></div></div></td>', 55, '2020-10-02T08:23:10+00:00', '201002102310', 'ch');
INSERT INTO `channels` VALUES (279, 0, 'UCzqKocYHOtPr8WC1P8yTCAA', 'Raul Eira', '', 'https://yt3.ggpht.com/a/AATXAJyksdKFTzMLX3KaWJNrxjbxNOuiAaXjsNv4h0ZpWw=s88-c-k-c0xffffffff-no-rj-mo', '', 'https://www.youtube.com/rauleiramusic', 'https://open.spotify.com/artist/6fI6KGZpPnzbapfLNFQtlc', '', '', '', '-8-', '21.09.2012', '201017-11', '201017-11', 0, 0, 1982, 1951, 1930, 1920, NULL, 0, 0, 23058, 14574, 15379, 16778, NULL, 5, NULL, 'Raul Eira - Bittersweet (Lyric Video)', 'YzRPTS686Kc', '<td class=\"yt-lastvideo\" data-sort=\"200710000012\" data-utime=\"201017-11\"><a href=\"https://youtu.be/YzRPTS686Kc\" title=\"Raul Eira - Bittersweet (Lyric Video)\" target=\"_blank\">Fr. 10.07.20</a><div class=\"info\"><div class=\"close\"></div><div class=\"circle\" style=\"background-image:url(https://i2.ytimg.com/vi/YzRPTS686Kc/hqdefault.jpg)\"></div><p>Raul Eira - Bittersweet (Lyric Video)<br><br>Views: 223 &nbsp; Ø/Video: 3356<br>Veröffentlicht am: Fr. 10.07.20 um 00:00 Uhr</p><div class=\"abobar\"><a href=\"https://youtu.be/YzRPTS686Kc\" target=\"_blank\" class=\"red\">zum Video</a></div></div></td>', 223, '2020-07-09T22:00:12+00:00', '200710000012', 'ch');
INSERT INTO `channels` VALUES (280, 0, 'UCwvPxhXdX66roloN0IGwKrA', 'Geekstübli', '♠ SCHWITZER GEEKCHANNEL ♣ <br />We du fan bisch vo:<br />► Gaming uf Schwitzerdütsch <br />► Geekstuff<br />► Gmeinschaft<br />► Nöigkeite uss dr Game/Filmwält<br />► Humor<br /><br />...de bisch hie genau richtig!<br />♥- lich Willkomme im Geekstübli<br /><br />Und itz vill Spass!<br /><br />Liebe Gruess<br /><br /> Eues Geekstübli Team<br /><br />------------------------------------------------------------------------------------------------------------------------------------------------------<br /><br />♣ UPLOADPLAN ♣<br /><br />► Mir si nid a feschti Upload zite bunde! Da mir das alles als Hobby betriebe si d Uploads sehr individuell. Mir versueche trotzdäm regelmässig Content ur Verfüegig z Stelle! :-)', 'https://yt3.ggpht.com/a/AATXAJxiWgTa40TsCVc20Z9OCRdxyFURDHJxX9e1I_nqgQ=s88-c-k-c0xffffffff-no-rj-mo', '', 'https://www.youtube.com/geekstubli', '', '', 'geekstuebli', 'geek_stuebli', '-4-11-15-', '23.08.2016', '201017-11', '201017-11', 0, 0, 143, 229, 252, 263, NULL, 0, 0, 8236, 14696, 16203, 18588, NULL, 441, NULL, 'TWITCH HIGHLIGHT AUGUST 2020', 'm9EIlbzA1dM', '<td class=\"yt-lastvideo\" data-sort=\"200829100006\" data-utime=\"201017-11\"><a href=\"https://youtu.be/m9EIlbzA1dM\" title=\"TWITCH HIGHLIGHT AUGUST 2020\" target=\"_blank\">Sa. 29.08.20</a><div class=\"info\"><div class=\"close\"></div><div class=\"circle\" style=\"background-image:url(https://i2.ytimg.com/vi/m9EIlbzA1dM/hqdefault.jpg)\"></div><p>TWITCH HIGHLIGHT AUGUST 2020<br><br>Views: 62 &nbsp; Ø/Video: 42<br>Veröffentlicht am: Sa. 29.08.20 um 10:00 Uhr</p><div class=\"abobar\"><a href=\"https://youtu.be/m9EIlbzA1dM\" target=\"_blank\" class=\"red\">zum Video</a></div></div></td>', 62, '2020-08-29T08:00:06+00:00', '200829100006', 'ch');
INSERT INTO `channels` VALUES (281, 0, 'UCnpk5PM6g0mxFH7tWGjAiaw', 'San Mattia', 'rapper, producer, musiker, songwriter usem kanton bern. #bringunsnochsoeinen', 'https://yt3.ggpht.com/a/AATXAJz07IO7acKE-DGLK1f2qEIKqCyC_r7Uaf_6jsb2=s88-c-k-c0xffffffff-no-rj-mo', '', '', 'https://soundcloud.com/user-771129909', '', '', 'sansmattia', '-8-25-', '26.11.2018', '201017-11', '201017-11', 0, 0, 0, 0, 0, 211, NULL, 0, 0, 0, 0, 0, 8205, NULL, 22, NULL, 'san mattia - NORTH FACE', '_uzD7kx4WAk', '<td class=\"yt-lastvideo\" data-sort=\"201008200009\" data-utime=\"201017-11\"><a href=\"https://youtu.be/_uzD7kx4WAk\" title=\"san mattia - NORTH FACE\" target=\"_blank\">Do. 08.10.20</a><div class=\"info\"><div class=\"close\"></div><div class=\"circle\" style=\"background-image:url(https://i4.ytimg.com/vi/_uzD7kx4WAk/hqdefault.jpg)\"></div><p>san mattia - NORTH FACE<br><br>Views: 1006 &nbsp; Ø/Video: 373<br>Veröffentlicht am: Do. 08.10.20 um 20:00 Uhr</p><div class=\"abobar\"><a href=\"https://youtu.be/_uzD7kx4WAk\" target=\"_blank\" class=\"red\">zum Video</a></div></div></td>', 1006, '2020-10-08T18:00:09+00:00', '201008200009', 'ch');
INSERT INTO `channels` VALUES (282, 1, 'UCK4opi9aGrXo_WsmlvNnHIQ', 'Alexander Rodshtein', 'Hi, ich komme aus der Schweiz und mag es, mit Videos emotionale Geschichten zu kreieren. Manchmal erzähle ich auch was vor der Kamera.', 'https://yt3.ggpht.com/a/AATXAJxdAg8vLy_SA5kqDKhRWHDTLEBF3YjkHhRBgylPaw=s88-c-k-c0xffffffff-no-rj-mo', 'Roger Gloor', '', '', '', '', 'alex.rodshtein', '-3-6-22-', '08.12.2014', '201016-20', '201017-11', 0, 0, 0, 65, 89, 100, NULL, 0, 0, 0, 13651, 22739, 25733, NULL, 20, NULL, 'ETF 2019 - Der Weg nach Aarau (Follow our Passion - Turnshow)', '3s_93bFxI_A', '<td class=\"yt-lastvideo\" data-sort=\"191013210903\" data-utime=\"201017-11\"><a href=\"https://youtu.be/3s_93bFxI_A\" title=\"ETF 2019 - Der Weg nach Aarau (Follow our Passion - Turnshow)\" target=\"_blank\">So. 13.10.19</a><div class=\"info\"><div class=\"close\"></div><div class=\"circle\" style=\"background-image:url(https://i4.ytimg.com/vi/3s_93bFxI_A/hqdefault.jpg)\"></div><p>ETF 2019 - Der Weg nach Aarau (Follow our Passion - Turnshow)<br><br>Views: 146 &nbsp; Ø/Video: 1287<br>Veröffentlicht am: So. 13.10.19 um 21:09 Uhr</p><div class=\"abobar\"><a href=\"https://youtu.be/3s_93bFxI_A\" target=\"_blank\" class=\"red\">zum Video</a></div></div></td>', 146, '2019-10-13T19:09:03+00:00', '191013210903', 'ch');
INSERT INTO `channels` VALUES (283, 0, 'UCMzigHL8C_A27XmudyeN7Sg', 'TeleZüri', 'TeleZüri ist nahe an seinen Zuschauerinnen und Zuschauern: aktuell, informativ und unterhaltend. TeleZüri berichtet über Themen aus dem Grossraum Zürich und den umliegenden Kantonen, bei wichtigen Ereignissen rücken auch nationale oder internationale Themen in den Mittelpunkt. Mit seinen Nachrichten, Talks und Unterhaltungssendungen ist TeleZüri dank seiner hohen Glaubwürdigkeit und Akzeptanz in der Bevölkerung die klare Nummer 1 unter den Schweizer Regionalfernsehsendern.', 'https://yt3.ggpht.com/a/AATXAJzBUj_kOV38_v9tLxcJR20NIzz41L9Loxo-Zjo2bA=s88-c-k-c0xffffffff-no-rj-mo', '', 'https://www.youtube.com/TeleZueriOffiziell', 'https://www.telezueri.ch', '', '', 'telezuri', '-9-20-', '21.06.2012', '201017-11', '201017-11', 0, 953, 1137, 1341, 1490, 2190, NULL, 0, 668781, 789736, 877007, 945450, 1209453, NULL, 346, NULL, 'Betreiberin verweigerte Maskenpflicht: Vegan-Shop in Winterthur geschlossen', 'mBr7sR_7xw4', '<td class=\"yt-lastvideo\" data-sort=\"201015120032\" data-utime=\"201017-11\"><a href=\"https://youtu.be/mBr7sR_7xw4\" title=\"Betreiberin verweigerte Maskenpflicht: Vegan-Shop in Winterthur geschlossen\" target=\"_blank\">Do. 15.10.20</a><div class=\"info\"><div class=\"close\"></div><div class=\"circle\" style=\"background-image:url(https://i2.ytimg.com/vi/mBr7sR_7xw4/hqdefault.jpg)\"></div><p>Betreiberin verweigerte Maskenpflicht: Vegan-Shop in Winterthur geschlossen<br><br>Views: 147 &nbsp; Ø/Video: 3496<br>Veröffentlicht am: Do. 15.10.20 um 12:00 Uhr</p><div class=\"abobar\"><a href=\"https://youtu.be/mBr7sR_7xw4\" target=\"_blank\" class=\"red\">zum Video</a></div></div></td>', 147, '2020-10-15T10:00:32+00:00', '201015120032', 'ch');
INSERT INTO `channels` VALUES (284, 0, 'UC9fn0CqTGSH2mIXHNVMu4Ow', 'Artcore Radio', 'Artcore Radio is a Hip Hop Radio Show and Blog based in Zurich/Switzerland. We focus on international and swiss underground hip hop acts.<br />Blog: facebook.com/artcoreradio/<br />Podcast: mixcloud.com/artcoreradio/', 'https://yt3.ggpht.com/a/AATXAJxQBpwBP6cirHxnRQNLcFUkM41mNbRHX5Pz4Nze=s88-c-k-c0xffffffff-no-rj-mo', '', '', '', 'https://www.mixcloud.com/artcoreradio/', '', 'artcoreradio', '-9-12-', '17.01.2013', '201017-11', '201017-11', 0, 0, 23, 25, 48, 90, NULL, 0, 0, 24468, 35760, 48962, 58684, NULL, 355, NULL, 'Kurz Interview OG Florin & The Architects', '7usEHgyy6VU', '<td class=\"yt-lastvideo\" data-sort=\"201011132158\" data-utime=\"201017-11\"><a href=\"https://youtu.be/7usEHgyy6VU\" title=\"Kurz Interview OG Florin & The Architects\" target=\"_blank\">So. 11.10.20</a><div class=\"info\"><div class=\"close\"></div><div class=\"circle\" style=\"background-image:url(https://i4.ytimg.com/vi/7usEHgyy6VU/hqdefault.jpg)\"></div><p>Kurz Interview OG Florin & The Architects<br><br>Views: 14 &nbsp; Ø/Video: 165<br>Veröffentlicht am: So. 11.10.20 um 13:21 Uhr</p><div class=\"abobar\"><a href=\"https://youtu.be/7usEHgyy6VU\" target=\"_blank\" class=\"red\">zum Video</a></div></div></td>', 14, '2020-10-11T11:21:58+00:00', '201011132158', 'ch');
INSERT INTO `channels` VALUES (285, 0, 'UC0cyCeavSLZokLnYZZUdObg', 'Mediafisch', 'Dies ist der offizielle Youtube Kanal der Produktionsfirma Mediafisch.', 'https://yt3.ggpht.com/a/AATXAJyOM_uwpsC_J3YdHVlCt-bgozlCPtGBg5UZrRxZ=s88-c-k-c0xffffffff-no-rj-mo', 'Björn Hering', '', 'http://www.mediafisch.ch', '', '', '', '-6-', '10.05.2011', '201017-11', '201017-11', 0, 116, 182, 875, 928, 955, NULL, 0, 138433, 217463, 934741, 1011564, 1342537, NULL, 312, NULL, 'Die Promi Griller (2020) - DJ Tatana vs. Nadine Vinzens', 'RRTrV0zr0YM', '<td class=\"yt-lastvideo\" data-sort=\"200724150013\" data-utime=\"201017-11\"><a href=\"https://youtu.be/RRTrV0zr0YM\" title=\"Die Promi Griller (2020) - DJ Tatana vs. Nadine Vinzens\" target=\"_blank\">Fr. 24.07.20</a><div class=\"info\"><div class=\"close\"></div><div class=\"circle\" style=\"background-image:url(https://i3.ytimg.com/vi/RRTrV0zr0YM/hqdefault.jpg)\"></div><p>Die Promi Griller (2020) - DJ Tatana vs. Nadine Vinzens<br><br>Views: 28925 &nbsp; Ø/Video: 4303<br>Veröffentlicht am: Fr. 24.07.20 um 15:00 Uhr</p><div class=\"abobar\"><a href=\"https://youtu.be/RRTrV0zr0YM\" target=\"_blank\" class=\"red\">zum Video</a></div></div></td>', 28925, '2020-07-24T13:00:13+00:00', '200724150013', 'ch');
INSERT INTO `channels` VALUES (286, 0, 'UCQgdpazWn8r9gloQqwGUWmA', 'Gummi Love', 'Dein Ratgeber rund ums Liebesleben.<br />Mit GummiLove dropst 🛹du tiefer ins Thema Sexualität ❤ und fliegst höher in der Liebe als je zuvor. «Making Safe Love Sexy» ist der Beat, dem wir treu folgen, um das Thema sexuelle Gesundheit auf den Höhepunkt zu bringen. Damit du deine Sexualität so gesund und selbstbestimmt wie möglich leben kannst.<br />#MakingSafeLoveSexy #GummiDrum<br /><br />😘gummilove.ch<br />😘instagram/gummilove.ch<br />😘facebook./gummilovecom<br />😘TikTok /gummilove.ch', 'https://yt3.ggpht.com/a/AATXAJwufIuMCM_BALfFbQhrLpsfaRIBfVmUpEBsWEyuiw=s88-c-k-c0xffffffff-no-rj-mo', '', '', 'https://www.gummilove.com', '', '', 'gummi_love', '-6-13-18-', '28.05.2014', '201017-11', '201017-11', 0, 0, 0, 0, 220, 291, NULL, 0, 0, 0, 0, 40652, 58250, NULL, 101, NULL, 'Die 10 Artikel 📜 für die Sexuelle Rechte 🎓', 'fkiw5rG41pE', '<td class=\"yt-lastvideo\" data-sort=\"201002164137\" data-utime=\"201017-11\"><a href=\"https://youtu.be/fkiw5rG41pE\" title=\"Die 10 Artikel 📜 für die Sexuelle Rechte 🎓\" target=\"_blank\">Fr. 02.10.20</a><div class=\"info\"><div class=\"close\"></div><div class=\"circle\" style=\"background-image:url(https://i3.ytimg.com/vi/fkiw5rG41pE/hqdefault.jpg)\"></div><p>Die 10 Artikel 📜 für die Sexuelle Rechte 🎓<br><br>Views: 29 &nbsp; Ø/Video: 577<br>Veröffentlicht am: Fr. 02.10.20 um 16:41 Uhr</p><div class=\"abobar\"><a href=\"https://youtu.be/fkiw5rG41pE\" target=\"_blank\" class=\"red\">zum Video</a></div></div></td>', 29, '2020-10-02T14:41:37+00:00', '201002164137', 'ch');
INSERT INTO `channels` VALUES (287, 0, 'UCWDVFeshha5CxOULxawNVBg', 'Jan Breitenstein', 'Hey Du ! :)<br />im echten Leben heiße ich Jan und bin 18 Jahre jung.<br />Was ich genau auf meinen Kanal mache? Ich weiß es selber nicht! :D<br />Ich möchte einfach meinen Traum leben und versuchen DICH zu unterhalten und zum lachen zu bringen! :)<br /><br />Viel Spaß auf meinen Kanal,<br />Jan', 'https://yt3.ggpht.com/a/AATXAJwZ9fK1dYdfIlZ4UYZvI0UbGKPagPqUGbysSHwa4j0=s88-c-k-c0xffffffff-no-rj-mo', '', 'https://www.youtube.com/janbreitenstein', 'https://www.mobitecco.com', '', '', 'jantravesh', '-15-20-', '26.12.2017', '201017-11', '201017-11', 0, 0, 0, 244, 955, 950, NULL, 0, 0, 0, 1888, 3506, 6661, NULL, 12, NULL, 'Urlaubs Vlog / Hane Family Resort', 'EfOFrs4OU_o', '<td class=\"yt-lastvideo\" data-sort=\"200821152536\" data-utime=\"201017-11\"><a href=\"https://youtu.be/EfOFrs4OU_o\" title=\"Urlaubs Vlog / Hane Family Resort\" target=\"_blank\">Fr. 21.08.20</a><div class=\"info\"><div class=\"close\"></div><div class=\"circle\" style=\"background-image:url(https://i2.ytimg.com/vi/EfOFrs4OU_o/hqdefault.jpg)\"></div><p>Urlaubs Vlog / Hane Family Resort<br><br>Views: 277 &nbsp; Ø/Video: 555<br>Veröffentlicht am: Fr. 21.08.20 um 15:25 Uhr</p><div class=\"abobar\"><a href=\"https://youtu.be/EfOFrs4OU_o\" target=\"_blank\" class=\"red\">zum Video</a></div></div></td>', 277, '2020-08-21T13:25:36+00:00', '200821152536', 'ch');
INSERT INTO `channels` VALUES (288, 0, 'UC2I4vIv7VI2mSM-QzmHnJRA', 'Kirmesfan Schweiz', 'Seit fünf Jahren gibt es auf diesem Kanal Videos von diversen Kirmesveranstaltungen aus der Schweiz.<br />Mein Reisegebiet geht aber noch viel weiter durch ganz Europa. Regelmässig werden On - und Offride Videos der Fahrgeschäfte hochgeladen von allen Kirmesplätzen und Freizeitparks, die ich besucht habe. Meine nächsten geplanten Veranstaltungen werden dauernd aktualisiert, diese findet Ihr weiter unten in der Beschreibung ;) Wenn Ihr Interesse habt würde ich mich sehr über ein Abo freuen :)<br /><br />Zusätzlich gibt es auf meiner Facebookseite viele Bilderserien von den besuchten Plätzen oder News zu Beschickungen oder Neuheiten, auch da würde ich mich sehr über ein Like freuen :)<br /><br />Nächste geplante Kirmesplätze/Freizeitparks<br />-<br />----------------------------------------------------------------<br />Kameras                      :<br /><br />Onrides: <br />GoPro Hero 7 Black Edition<br /><br />Offrides/Bilder :<br />Sony FDR-AX33<br />Nikon D5300', 'https://yt3.ggpht.com/a/AATXAJwsYdy2FHLXPOVioIJrxdzIeeXr1YWlM_N37GnZGg=s88-c-k-c0xffffffff-no-rj-mo', '', '', '', '', '', 'kirmesfan_schweiz', '-7-', '20.11.2013', '201017-11', '201017-11', 0, 652, 1199, 2291, 5880, 8140, NULL, 0, 374701, 862252, 1372073, 3571172, 5127592, NULL, 2215, NULL, 'Discovery - Rodel (Offride 2) Lunapark Wetzikon 2020', 'GnHMaWUhJos', '<td class=\"yt-lastvideo\" data-sort=\"201003234409\" data-utime=\"201017-11\"><a href=\"https://youtu.be/GnHMaWUhJos\" title=\"Discovery - Rodel (Offride 2) Lunapark Wetzikon 2020\" target=\"_blank\">Sa. 03.10.20</a><div class=\"info\"><div class=\"close\"></div><div class=\"circle\" style=\"background-image:url(https://i4.ytimg.com/vi/GnHMaWUhJos/hqdefault.jpg)\"></div><p>Discovery - Rodel (Offride 2) Lunapark Wetzikon 2020<br><br>Views: 318 &nbsp; Ø/Video: 2315<br>Veröffentlicht am: Sa. 03.10.20 um 23:44 Uhr</p><div class=\"abobar\"><a href=\"https://youtu.be/GnHMaWUhJos\" target=\"_blank\" class=\"red\">zum Video</a></div></div></td>', 318, '2020-10-03T21:44:09+00:00', '201003234409', 'ch');
INSERT INTO `channels` VALUES (289, 0, 'UCwOZ-UZDXNydwULvnffMacA', 'Swisscom', 'Auf dem Swisscom YouTube Kanal findest du unterhaltsame Serien rund um digitale Themen. Die Swisscom Originals Rocco, Hamster, XGENCY, Takeover und CLASH warten darauf, von dir entdeckt zu werden.<br />Zudem kannst du in diversen Swisscom Tech Videos neue Gadgets und nützliche Produkte kennenlernen und dich von Trainer Marcel inspirieren lassen.<br />Wenn du Fragen zu Swisscom Produkten hast, hilft dir die Swisscom Help Videoserie weiter. <br />Abonniere den Kanal um kein Update zu verpassen. Viel Spass :)', 'https://yt3.ggpht.com/a/AATXAJwMHGdssheqJJ4skRhOANGAmL4-HurXV7Rryb9-0g=s88-c-k-c0xffffffff-no-rj-mo', '', 'https://www.youtube.com/swisscom', 'https://www.swisscom.ch', '', '', 'swisscom', '-9-13-', '11.04.2006', '201017-11', '201017-11', 0, 12484, 14335, 15260, 16500, 17200, NULL, 0, 7973549, 14084833, 22458408, 28169603, 32376958, NULL, 342, NULL, 'How to watch Hero League - League of Legends', 'eeuiKMb06Lg', '<td class=\"yt-lastvideo\" data-sort=\"201010143258\" data-utime=\"201017-11\"><a href=\"https://youtu.be/eeuiKMb06Lg\" title=\"How to watch Hero League - League of Legends\" target=\"_blank\">Sa. 10.10.20</a><div class=\"info\"><div class=\"close\"></div><div class=\"circle\" style=\"background-image:url(https://i2.ytimg.com/vi/eeuiKMb06Lg/hqdefault.jpg)\"></div><p>How to watch Hero League - League of Legends<br><br>Views: 191 &nbsp; Ø/Video: 94669<br>Veröffentlicht am: Sa. 10.10.20 um 14:32 Uhr</p><div class=\"abobar\"><a href=\"https://youtu.be/eeuiKMb06Lg\" target=\"_blank\" class=\"red\">zum Video</a></div></div></td>', 191, '2020-10-10T12:32:58+00:00', '201010143258', 'ch');
INSERT INTO `channels` VALUES (290, 0, 'UCknxAEil_PISwwVbOKCsXYA', 'Team Freerunning', 'Hallo zusammen✌ wir wissen nicht was wir schreiben sollen. Darum: viel spas auf unserem Kanal, von den Salamandrossos🐾', 'https://yt3.ggpht.com/a/AATXAJzW22nw4Fr2RBlzSkbMxKguBVlU7xfIAgzP_ZAqxQ=s88-c-k-c0xffffffff-no-rj-mo', '', 'https://www.youtube.com/teamfreerunning', '', '', '', 'official_teamfreerunning', '-5-6-', '04.02.2017', '201017-11', '201017-11', 0, 0, 0, 2012, 302, 405, NULL, 0, 0, 0, 7640, 16301, 31892, NULL, 110, NULL, 'Die Beerie verändered din gschmack🍓🤯 (Miricle Beeries) | Vlog #57', 'l9_nGsvj0ao', '<td class=\"yt-lastvideo\" data-sort=\"200919120012\" data-utime=\"201017-11\"><a href=\"https://youtu.be/l9_nGsvj0ao\" title=\"Die Beerie verändered din gschmack🍓🤯 (Miricle Beeries) | Vlog #57\" target=\"_blank\">Sa. 19.09.20</a><div class=\"info\"><div class=\"close\"></div><div class=\"circle\" style=\"background-image:url(https://i1.ytimg.com/vi/l9_nGsvj0ao/hqdefault.jpg)\"></div><p>Die Beerie verändered din gschmack🍓🤯 (Miricle Beeries) | Vlog #57<br><br>Views: 81 &nbsp; Ø/Video: 290<br>Veröffentlicht am: Sa. 19.09.20 um 12:00 Uhr</p><div class=\"abobar\"><a href=\"https://youtu.be/l9_nGsvj0ao\" target=\"_blank\" class=\"red\">zum Video</a></div></div></td>', 81, '2020-09-19T10:00:12+00:00', '200919120012', 'ch');
INSERT INTO `channels` VALUES (291, 0, 'UC2rSoiwCtjlaTQ0ugzW3rMw', 'Peter Schurte', 'TV & Videoproduktionen', 'https://yt3.ggpht.com/a/AATXAJwwDn7wCkUnTjxslNdqisixuiYymOVdxCd_K0-c=s88-c-k-c0xffffffff-no-rj-mo', '', 'https://www.youtube.com/videobilderschweiz', 'http://www.videobilder.ch', '', '', '', '-3-22-', '14.08.2011', '201017-11', '201017-11', 0, 0, 150, 251, 360, 474, NULL, 0, 0, 132853, 222689, 263573, 333626, NULL, 253, NULL, 'Baukran Helikopter Montage - Best of / Stirnimann Potain - Oberstdorf 2020', 'qVBPEGi9fcg', '<td class=\"yt-lastvideo\" data-sort=\"201016113332\" data-utime=\"201017-11\"><a href=\"https://youtu.be/qVBPEGi9fcg\" title=\"Baukran Helikopter Montage - Best of / Stirnimann Potain - Oberstdorf 2020\" target=\"_blank\">Fr. 16.10.20</a><div class=\"info\"><div class=\"close\"></div><div class=\"circle\" style=\"background-image:url(https://i2.ytimg.com/vi/qVBPEGi9fcg/hqdefault.jpg)\"></div><p>Baukran Helikopter Montage - Best of / Stirnimann Potain - Oberstdorf 2020<br><br>Views: 25 &nbsp; Ø/Video: 1319<br>Veröffentlicht am: Fr. 16.10.20 um 11:33 Uhr</p><div class=\"abobar\"><a href=\"https://youtu.be/qVBPEGi9fcg\" target=\"_blank\" class=\"red\">zum Video</a></div></div></td>', 25, '2020-10-16T09:33:32+00:00', '201016113332', 'ch');
INSERT INTO `channels` VALUES (292, 1, 'UC9yUcYTT-bpvSrGKntLox-g', 'BalinFilms', 'Sali Dui,<br />Ich heissä Balin, bi 17ni und chumä usem schenä Kanton Obwaldä. Ich unterhaltä dich generell mit Vlogs.<br />Warum schrib ich so viel?<br />Liog dich eifach sälber dir mi Kanal :D', 'https://yt3.ggpht.com/a/AATXAJyg9kXITtkgxHK_RbY04OTXVh4199HsMrz1QBB9aA=s88-c-k-c0xffffffff-no-rj-mo', '', 'https://www.youtube.com/balinfilms', '', '', '', 'balinfilms', '-3-6-30-', '04.04.2015', '201016-20', '201017-11', 0, 142, 453, 705, 763, 795, NULL, 0, 18504, 30057, 46129, 56501, 63335, NULL, 49, NULL, 'Seenachtsfest Lungern', 'BlitrRLZBzU', '<td class=\"yt-lastvideo\" data-sort=\"190521193000\" data-utime=\"201017-11\"><a href=\"https://youtu.be/BlitrRLZBzU\" title=\"Seenachtsfest Lungern\" target=\"_blank\">Di. 21.05.19</a><div class=\"info\"><div class=\"close\"></div><div class=\"circle\" style=\"background-image:url(https://i3.ytimg.com/vi/BlitrRLZBzU/hqdefault.jpg)\"></div><p>Seenachtsfest Lungern<br><br>Views: 2637 &nbsp; Ø/Video: 1293<br>Veröffentlicht am: Di. 21.05.19 um 19:30 Uhr</p><div class=\"abobar\"><a href=\"https://youtu.be/BlitrRLZBzU\" target=\"_blank\" class=\"red\">zum Video</a></div></div></td>', 2637, '2019-05-21T17:30:00+00:00', '190521193000', 'ch');
INSERT INTO `channels` VALUES (293, 0, 'UCHw-vGQ4oT23dZshrOdOz1Q', 'Migo & Buzz', '', 'https://yt3.ggpht.com/a/AATXAJx58Fk-LOESpIljNvXpCkhNOjKsn_5j4TW4I8HP=s88-c-k-c0xffffffff-no-rj-mo', '', 'https://www.youtube.com/MIGOBUZZ', '', '', '', '', '-8-', '25.01.2011', '201017-11', '201017-11', 0, 982, 1481, 1980, 2300, 2520, NULL, 0, 402153, 652030, 897578, 116101, 1292644, NULL, 29, NULL, 'Migo & Iroas bei RaBe 14.8.2020', 'YvP41g8BXtI', '<td class=\"yt-lastvideo\" data-sort=\"200818161123\" data-utime=\"201017-11\"><a href=\"https://youtu.be/YvP41g8BXtI\" title=\"Migo & Iroas bei RaBe 14.8.2020\" target=\"_blank\">Di. 18.08.20</a><div class=\"info\"><div class=\"close\"></div><div class=\"circle\" style=\"background-image:url(https://i2.ytimg.com/vi/YvP41g8BXtI/hqdefault.jpg)\"></div><p>Migo & Iroas bei RaBe 14.8.2020<br><br>Views: 2980 &nbsp; Ø/Video: 44574<br>Veröffentlicht am: Di. 18.08.20 um 16:11 Uhr</p><div class=\"abobar\"><a href=\"https://youtu.be/YvP41g8BXtI\" target=\"_blank\" class=\"red\">zum Video</a></div></div></td>', 2980, '2020-08-18T14:11:23+00:00', '200818161123', 'ch');
INSERT INTO `channels` VALUES (294, 0, 'UCdK9GXeJZ2wiW4QWnWKNQFQ', 'Islandart GmbH', 'Du bist hier auf dem Kanal von Islandart gelandet. Wir sind eine Winterthurer Agentur für Film, Foto, Web und Grafik. Zu sehen gibts hier unsere Kundenarbeiten, Trailer für lange Filme und die Serie „Kurzgeschichten aus Winterthur“. Viel Spass beim Ansehen unserer Filme!<br /><br /><br />This is the channel from Islandart. We are a design agency for film, photo, web and graphic design from Winterthur in Switzerland. Here you can watch projects for customers, trailers for our longer movies and the series „Short Stories from Winterthur“. Have fun!', 'https://yt3.ggpht.com/a/AATXAJyQzkNSLPrBWwJv_LhfmBamgFtZbdFeZnHoXo5T=s88-c-k-c0xffffffff-no-rj-mo', 'Lukas Schwarzenbacher', '', 'https://islandart.ch', '', '', 'islandartgmbh', '-13-20-', '14.06.2013', '201017-11', '201017-11', 0, 0, 0, 0, 13, 25, NULL, 0, 0, 0, 0, 5758, 8926, NULL, 13, NULL, 'Die Mutter - Kurzgeschichte aus Winterthur', 'H1hRiKgYKH4', '<td class=\"yt-lastvideo\" data-sort=\"201016110336\" data-utime=\"201017-11\"><a href=\"https://youtu.be/H1hRiKgYKH4\" title=\"Die Mutter - Kurzgeschichte aus Winterthur\" target=\"_blank\">Fr. 16.10.20</a><div class=\"info\"><div class=\"close\"></div><div class=\"circle\" style=\"background-image:url(https://i1.ytimg.com/vi/H1hRiKgYKH4/hqdefault.jpg)\"></div><p>Die Mutter - Kurzgeschichte aus Winterthur<br><br>Views: 139 &nbsp; Ø/Video: 687<br>Veröffentlicht am: Fr. 16.10.20 um 11:03 Uhr</p><div class=\"abobar\"><a href=\"https://youtu.be/H1hRiKgYKH4\" target=\"_blank\" class=\"red\">zum Video</a></div></div></td>', 139, '2020-10-16T09:03:36+00:00', '201016110336', 'ch');
INSERT INTO `channels` VALUES (295, 0, 'UCEFj7im8lKkGQBS5KVBvTRw', 'Alli Eis TV', 'OFFIZIELLER YOUTUBE-KANAL<br />© ALLI EIS | USTER, SCHWEIZ', 'https://yt3.ggpht.com/a/AATXAJzhGi-LPLMM11Myt-jdf4fLPfrLNEq5ERVV_tdZ=s88-c-k-c0xffffffff-no-rj-mo', '', '', 'https://www.allieis-music.ch', '', '', '', '-8-20-', '13.12.2014', '201017-11', '201017-11', 0, 203, 386, 540, 755, 895, NULL, 0, 45124, 88918, 119281, 181274, 205051, NULL, 27, NULL, 'Ruff x John Darra - \"Sangue per Sangue\" - prod. by Chekaa', 'j0IZTqtVdxg', '<td class=\"yt-lastvideo\" data-sort=\"200904000012\" data-utime=\"201017-11\"><a href=\"https://youtu.be/j0IZTqtVdxg\" title=\"Ruff x John Darra - \"Sangue per Sangue\" - prod. by Chekaa\" target=\"_blank\">Fr. 04.09.20</a><div class=\"info\"><div class=\"close\"></div><div class=\"circle\" style=\"background-image:url(https://i3.ytimg.com/vi/j0IZTqtVdxg/hqdefault.jpg)\"></div><p>Ruff x John Darra - \"Sangue per Sangue\" - prod. by Chekaa<br><br>Views: 962 &nbsp; Ø/Video: 7594<br>Veröffentlicht am: Fr. 04.09.20 um 00:00 Uhr</p><div class=\"abobar\"><a href=\"https://youtu.be/j0IZTqtVdxg\" target=\"_blank\" class=\"red\">zum Video</a></div></div></td>', 962, '2020-09-03T22:00:12+00:00', '200904000012', 'ch');
INSERT INTO `channels` VALUES (296, 0, 'UCPYLj6rKd-gZfnu8-rlX5xg', 'Boris Baldinger', '', 'https://yt3.ggpht.com/a/AATXAJwMHWAAhpiLOpa6m6TUN7iqYToZQOHiqBP3qVlRwg=s88-c-k-c0xffffffff-no-rj-mo', '', 'https://www.youtube.com/borisbaldinger', 'https://www.boris-baldinger.com', 'https://www.youtube.com/playlist?list=PLyfCkCKabBTX10Qto4BRRCxGB-KWhsYvQ', '', 'borisbaldinger', '-3-12-18-20-', '30.01.2007', '201017-11', '201017-11', 29, 47, 84, 225, 262, 383, NULL, 419, 7572, 19469, 40159, 58061, 74682, NULL, 67, NULL, 'Personal Branding Fotografie - Boris Baldinger', '4f1uA0rpClE', '<td class=\"yt-lastvideo\" data-sort=\"201001123724\" data-utime=\"201017-11\"><a href=\"https://youtu.be/4f1uA0rpClE\" title=\"Personal Branding Fotografie - Boris Baldinger\" target=\"_blank\">Do. 01.10.20</a><div class=\"info\"><div class=\"close\"></div><div class=\"circle\" style=\"background-image:url(https://i1.ytimg.com/vi/4f1uA0rpClE/hqdefault.jpg)\"></div><p>Personal Branding Fotografie - Boris Baldinger<br><br>Views: 40 &nbsp; Ø/Video: 1115<br>Veröffentlicht am: Do. 01.10.20 um 12:37 Uhr</p><div class=\"abobar\"><a href=\"https://youtu.be/4f1uA0rpClE\" target=\"_blank\" class=\"red\">zum Video</a></div></div></td>', 40, '2020-10-01T10:37:24+00:00', '201001123724', 'ch');
INSERT INTO `channels` VALUES (297, 0, 'UC9XWvADkT-cfYsZROM43ZQQ', 'danis888', '', 'https://yt3.ggpht.com/a/AATXAJwaLMwOUNHFYZfJlEGAb_7xXOSA2IG_uAIt1Cvq=s88-c-k-c0xffffffff-no-rj-mo', 'Daniel Schnyder', '', '', '', '', '', '-7-', '06.04.2008', '201017-11', '201017-11', 0, 0, 0, 0, 10100, 11000, NULL, 0, 0, 0, 0, 5681033, 6811375, NULL, 114, NULL, 'Dani\'s 50er im M-113 am 08.08.2020', 'LcNuIf--78Y', '<td class=\"yt-lastvideo\" data-sort=\"200809234702\" data-utime=\"201017-11\"><a href=\"https://youtu.be/LcNuIf--78Y\" title=\"Dani\'s 50er im M-113 am 08.08.2020\" target=\"_blank\">So. 09.08.20</a><div class=\"info\"><div class=\"close\"></div><div class=\"circle\" style=\"background-image:url(https://i1.ytimg.com/vi/LcNuIf--78Y/hqdefault.jpg)\"></div><p>Dani\'s 50er im M-113 am 08.08.2020<br><br>Views: 1068 &nbsp; Ø/Video: 59749<br>Veröffentlicht am: So. 09.08.20 um 23:47 Uhr</p><div class=\"abobar\"><a href=\"https://youtu.be/LcNuIf--78Y\" target=\"_blank\" class=\"red\">zum Video</a></div></div></td>', 1068, '2020-08-09T21:47:02+00:00', '200809234702', 'ch');
INSERT INTO `channels` VALUES (298, 0, 'UCtyYIFbQxQscwUdTZDSDWUA', 'TROIS-SEPT MUSIC', '', 'https://yt3.ggpht.com/a/AATXAJx5IbP-8lkRiI2bgnzqb6ttV2-kORBbq4frsaID7g=s88-c-k-c0xffffffff-no-rj-mo', '', '', '', '', '', '', '-8-', '03.10.2016', '201017-11', '201017-11', 0, 0, 0, 0, 454, 480, NULL, 0, 0, 0, 0, 31110, 53030, NULL, 8, NULL, 'DJAMAL - 🕰 ROLEX 🕰 (Official Video) - prod. by Beataura | AllColours Everything', '8E1XuX8oiOg', '<td class=\"yt-lastvideo\" data-sort=\"200903180028\" data-utime=\"201017-11\"><a href=\"https://youtu.be/8E1XuX8oiOg\" title=\"DJAMAL - 🕰 ROLEX 🕰 (Official Video) - prod. by Beataura | AllColours Everything\" target=\"_blank\">Do. 03.09.20</a><div class=\"info\"><div class=\"close\"></div><div class=\"circle\" style=\"background-image:url(https://i1.ytimg.com/vi/8E1XuX8oiOg/hqdefault.jpg)\"></div><p>DJAMAL - 🕰 ROLEX 🕰 (Official Video) - prod. by Beataura | AllColours Everything<br><br>Views: 2155 &nbsp; Ø/Video: 6629<br>Veröffentlicht am: Do. 03.09.20 um 18:00 Uhr</p><div class=\"abobar\"><a href=\"https://youtu.be/8E1XuX8oiOg\" target=\"_blank\" class=\"red\">zum Video</a></div></div></td>', 2155, '2020-09-03T16:00:28+00:00', '200903180028', 'ch');
INSERT INTO `channels` VALUES (299, 0, 'UC0o_VNVChHiHsAuttYLyRug', 'Çay & Ziggis', 'Video go brrrrrrrrr.', 'https://yt3.ggpht.com/a/AATXAJxk6lp9jwARrUqpwaTphoVk42qVkmajeeG_ZZtqDQ=s88-c-k-c0xffffffff-no-rj-mo', '', '', 'https://cayundziggis.com', 'https://open.spotify.com/show/08RVzgBonecqyzcTacnWLY?si=hLhGhPzxQ1GHnKoVhxeLTw', '', 'cayundziggis', '-8-12-', '29.08.2019', '201017-11', '201017-11', 0, 0, 0, 0, 0, 384, NULL, 0, 0, 0, 0, 0, 19788, NULL, 153, NULL, 'würsch? // RAMO & JOKER BRA - FRANK LUCAS // reaction & review', 'QT-ATSsFE4w', '<td class=\"yt-lastvideo\" data-sort=\"201016143952\" data-utime=\"201017-11\"><a href=\"https://youtu.be/QT-ATSsFE4w\" title=\"würsch? // RAMO & JOKER BRA - FRANK LUCAS // reaction & review\" target=\"_blank\">Fr. 16.10.20</a><div class=\"info\"><div class=\"close\"></div><div class=\"circle\" style=\"background-image:url(https://i2.ytimg.com/vi/QT-ATSsFE4w/hqdefault.jpg)\"></div><p>würsch? // RAMO & JOKER BRA - FRANK LUCAS // reaction & review<br><br>Views: 47 &nbsp; Ø/Video: 129<br>Veröffentlicht am: Fr. 16.10.20 um 14:39 Uhr</p><div class=\"abobar\"><a href=\"https://youtu.be/QT-ATSsFE4w\" target=\"_blank\" class=\"red\">zum Video</a></div></div></td>', 47, '2020-10-16T12:39:52+00:00', '201016143952', 'ch');
INSERT INTO `channels` VALUES (300, 0, 'UCdFkj0fA6VYJaty-v8_avvg', 'SRF DOK', 'SRF DOK erzählt Geschichten, so einzigartig wie das Leben. Wir zeigen hochwertige Dokumentationen und Reportagen aus der Schweiz.<br /><br />► Dokumentarfilme aus der Schweiz: Themen aus Gesellschaft, Wirtschaft, Politik, Natur, Abenteuer, Zeitgeschichte.<br />► Doku-Serien von «SRF DOK» tauchen in die vielfältigsten Lebenswelten ein – wie in die Abenteuer der wagemutigen Schweizer Auswanderer in «Auf und davon».<br />► Reportagen von «SRF Reporter» rücken Menschen und ihre berührenden Schicksale ins Zentrum – in der Schweiz und weltweit.<br /><br /><br />----------<br />Bitte beachte, dass auch für Kommentare auf dem YouTube-Kanal von SRF DOK unsere Social Media Netiquette gilt 👉 srf.ch/social-netiquette. Ehrverletzende Beiträge oder solche mit rassistischen, diskriminierenden, sexistischen oder gewaltverherrlichenden Inhalten werden nicht geduldet. Wir behalten uns das Recht vor, regelwidrige Beiträge vollständig und ohne Rückfrage zu entfernen.', 'https://yt3.ggpht.com/a/AATXAJyjyLp-oiXy6ZRtijLzjK5zOxUINcoN-6QmdBLMug=s88-c-k-c0xffffffff-no-rj-mo', '', 'https://www.youtube.com/SRFDOK', '', '', '', '', '-9-', '15.09.2011', '201017-11', '201017-11', 9825, 15000, 21960, 43452, 92600, 141000, NULL, 5572389, 9788892, 14770851, 23324604, 49773353, 76565059, NULL, 1038, NULL, 'Schweizer Grossbanken und die Klimakrise | CS und UBS finanzieren schmutzige Energie | SRF DOK', 'qoYlTviRbKs', '<td class=\"yt-lastvideo\" data-sort=\"201015170012\" data-utime=\"201017-11\"><a href=\"https://youtu.be/qoYlTviRbKs\" title=\"Schweizer Grossbanken und die Klimakrise | CS und UBS finanzieren schmutzige Energie | SRF DOK\" target=\"_blank\">Do. 15.10.20</a><div class=\"info\"><div class=\"close\"></div><div class=\"circle\" style=\"background-image:url(https://i2.ytimg.com/vi/qoYlTviRbKs/hqdefault.jpg)\"></div><p>Schweizer Grossbanken und die Klimakrise | CS und UBS finanzieren schmutzige Energie | SRF DOK<br><br>Views: 8695 &nbsp; Ø/Video: 73762<br>Veröffentlicht am: Do. 15.10.20 um 17:00 Uhr</p><div class=\"abobar\"><a href=\"https://youtu.be/qoYlTviRbKs\" target=\"_blank\" class=\"red\">zum Video</a></div></div></td>', 8695, '2020-10-15T15:00:12+00:00', '201015170012', 'ch');
INSERT INTO `channels` VALUES (301, 0, 'UCcpH6cLpZNdYkCv_jiaWIIA', 'Trummer', 'Clips & Souvenirs des Berndeutsch-SingerSongwriter Trummer<br /><br /><br /><br />Musik hören und kaufen:<br /><br />trummeronline.ch<br /><br />trummer.bandcamp.com', 'https://yt3.ggpht.com/a/AATXAJwctPLT6K5pqW0J-8OglSlc-PqjpOnvBFD3qbQ0ng=s88-c-k-c0xffffffff-no-rj-mo', '', '', 'http://trummeronline.ch', '', '', 'trummeronline', '-8-25-', '20.02.2007', '201017-11', '201017-11', 0, 0, 102, 133, 152, 161, NULL, 0, 0, 109502, 125334, 132353, 137478, NULL, 41, NULL, 'Trummer - Liebi (wasoimmerdasheisst) feat. Valeska Steiner - Familienalbum - ArtworkVideo', 'YKPIG_Fczhg', '<td class=\"yt-lastvideo\" data-sort=\"201016070006\" data-utime=\"201017-11\"><a href=\"https://youtu.be/YKPIG_Fczhg\" title=\"Trummer - Liebi (wasoimmerdasheisst) feat. Valeska Steiner - Familienalbum - ArtworkVideo\" target=\"_blank\">Fr. 16.10.20</a><div class=\"info\"><div class=\"close\"></div><div class=\"circle\" style=\"background-image:url(https://i2.ytimg.com/vi/YKPIG_Fczhg/hqdefault.jpg)\"></div><p>Trummer - Liebi (wasoimmerdasheisst) feat. Valeska Steiner - Familienalbum - ArtworkVideo<br><br>Views: 23 &nbsp; Ø/Video: 3353<br>Veröffentlicht am: Fr. 16.10.20 um 07:00 Uhr</p><div class=\"abobar\"><a href=\"https://youtu.be/YKPIG_Fczhg\" target=\"_blank\" class=\"red\">zum Video</a></div></div></td>', 23, '2020-10-16T05:00:06+00:00', '201016070006', 'ch');
INSERT INTO `channels` VALUES (302, 1, 'UCzvENPzB8p0T7y749Y-wHcA', 'Creaperbox', 'Ja ne', 'https://yt3.ggpht.com/a/AATXAJxpdVeikMTR1rvRBhDfUobTgLrF174Ffeea7HrY=s88-c-k-c0xffffffff-no-rj-mo', '', '', '', '', '', '', '-4-', '08.12.2016', '201016-20', '201017-11', 0, 0, 0, 0, 13, 13, NULL, 0, 0, 0, 0, 3810, 3900, NULL, 32, NULL, 'Mordhau | Boa kills | CH', '7ZG0g4hwT_c', '<td class=\"yt-lastvideo\" data-sort=\"191225234527\" data-utime=\"201017-11\"><a href=\"https://youtu.be/7ZG0g4hwT_c\" title=\"Mordhau | Boa kills | CH\" target=\"_blank\">Mi. 25.12.19</a><div class=\"info\"><div class=\"close\"></div><div class=\"circle\" style=\"background-image:url(https://i4.ytimg.com/vi/7ZG0g4hwT_c/hqdefault.jpg)\"></div><p>Mordhau | Boa kills | CH<br><br>Views: 19 &nbsp; Ø/Video: 122<br>Veröffentlicht am: Mi. 25.12.19 um 23:45 Uhr</p><div class=\"abobar\"><a href=\"https://youtu.be/7ZG0g4hwT_c\" target=\"_blank\" class=\"red\">zum Video</a></div></div></td>', 19, '2019-12-25T22:45:27+00:00', '191225234527', 'ch');
INSERT INTO `channels` VALUES (303, 0, 'UCdUoRcflFJllYd8a9OTQCjw', 'Maelos Fanbase', 'Säli zäme<br /><br />Willkomme bim Youtube-Fan-Kanal vom Maelo! Bim erste Youtube-Fan-Kanal vomena Swisstuber überhoupt (gloubi)!<br /><br />Hinder däm Züg stecke i, Alexandra. O bekannt aus Alexandras Skyline uf Insta & Youtube oder uf Insta o @maeloromani_fan<br /><br />Dä Kanau gübts nume wegem u für de Maelo! Kuss geht raus😘', 'https://yt3.ggpht.com/a/AATXAJzVeZHbetaBrhoOe51_ch2GFg8t_q9MWKEIpt5u=s88-c-k-c0xffffffff-no-rj-mo', 'Alexandra', '', '', '', '', 'maeloromani_fan', '-6-', '28.07.2019', '201017-11', '201017-11', 0, 0, 0, 0, 0, 20, NULL, 0, 0, 0, 0, 0, 100, NULL, 4, NULL, 'Maelos Tanzkünst - Stream vom 11.5. - Maelos Fanbase', '_IqXH_AHUgk', '<td class=\"yt-lastvideo\" data-sort=\"200520234400\" data-utime=\"201017-11\"><a href=\"https://youtu.be/_IqXH_AHUgk\" title=\"Maelos Tanzkünst - Stream vom 11.5. - Maelos Fanbase\" target=\"_blank\">Mi. 20.05.20</a><div class=\"info\"><div class=\"close\"></div><div class=\"circle\" style=\"background-image:url(https://i4.ytimg.com/vi/_IqXH_AHUgk/hqdefault.jpg)\"></div><p>Maelos Tanzkünst - Stream vom 11.5. - Maelos Fanbase<br><br>Views: 16 &nbsp; Ø/Video: 25<br>Veröffentlicht am: Mi. 20.05.20 um 23:44 Uhr</p><div class=\"abobar\"><a href=\"https://youtu.be/_IqXH_AHUgk\" target=\"_blank\" class=\"red\">zum Video</a></div></div></td>', 16, '2020-05-20T21:44:00+00:00', '200520234400', 'ch');
INSERT INTO `channels` VALUES (304, 0, 'UCG-6WW9xu4wOKGRILxK-dfQ', 'Planet Vibe', 'Das Team Planet Vibe (ACYM&SAZAR) heisst dich Herzlich Willkommen auf unserem Youtube Kanal. <br />Wir sind zwei Schweizer Künstler die schon sehr lange befreundet sind und auch lange zusammen Musik machen. Abgesehen von der Musik, findest du auf diesem Kanal verschiedenste Challenges, Quiz Battles und vieles mehr. <br />Unser Ziel: Die Unterhaltsamste Plattform der Schweiz zu werden! <br />Sei dabei und begleite uns:)<br /><br />Instagram: instagram.com/planetvibe_/', 'https://yt3.ggpht.com/a/AATXAJzf2ZmCkl1KeNfn-MOnLZqdz9-2xjoXoxsM968=s88-c-k-c0xffffffff-no-rj-mo', 'ACYM & SAZAR', '', '', '', '', 'planetvibe_', '-6-8-', '10.06.2019', '201017-11', '201017-11', 0, 0, 0, 0, 0, 559, NULL, 0, 0, 0, 0, 0, 51315, NULL, 55, NULL, 'Q&A mit Danfuture, M2k und Acym', '5XRTBw3H-4Y', '<td class=\"yt-lastvideo\" data-sort=\"200820190014\" data-utime=\"201017-11\"><a href=\"https://youtu.be/5XRTBw3H-4Y\" title=\"Q&A mit Danfuture, M2k und Acym\" target=\"_blank\">Do. 20.08.20</a><div class=\"info\"><div class=\"close\"></div><div class=\"circle\" style=\"background-image:url(https://i2.ytimg.com/vi/5XRTBw3H-4Y/hqdefault.jpg)\"></div><p>Q&A mit Danfuture, M2k und Acym<br><br>Views: 189 &nbsp; Ø/Video: 933<br>Veröffentlicht am: Do. 20.08.20 um 19:00 Uhr</p><div class=\"abobar\"><a href=\"https://youtu.be/5XRTBw3H-4Y\" target=\"_blank\" class=\"red\">zum Video</a></div></div></td>', 189, '2020-08-20T17:00:14+00:00', '200820190014', 'ch');
INSERT INTO `channels` VALUES (305, 0, 'UCZv9s7jo0m1yMkbCW6ORNzA', 'Prhyme Tyme Music', '▼Website<br />prhymetyme.ch<br /><br />▼Artists<br />- KomA<br />- Bobby Brookz<br />- Freezy<br />- Fakt E1z<br />- FAMA<br />- Benzo<br /><br />▼Sound Engineering/Photgraphy/Videography<br />- FAMA<br /><br />▼Beats<br />- Bobby Brookz<br />- FAMA<br /><br />▼Graphics<br />- komartworx<br /><br />▼Facebook<br />Prhyme Tyme Muzik: goo.gl/yYB5X6<br />KomA aka Jona$ty: facebook.com/komabwoy<br />Bobby Brookz: goo.gl/tvkDcS<br />J&B: facebook.com/justerinibrookzmusic/<br />FAMA: goo.gl/FI3tVW', 'https://yt3.ggpht.com/a/AATXAJz8I8kGJdJ1H0Ta-jtWmC5PQsAqnVSxNJAFvJLe=s88-c-k-c0xffffffff-no-rj-mo', '', 'https://www.youtube.com/prhymetymemusic', 'http://www.prhymetyme.ch', '', '', 'prhymetyme', '-8-', '07.05.2015', '201017-11', '201017-11', 0, 0, 149, 267, 415, 498, NULL, 0, 0, 49881, 73271, 114076, 139245, NULL, 41, NULL, 'KomA & Bobby Brookz - Sternzeiche O.G.', '0q3hrYwcltw', '<td class=\"yt-lastvideo\" data-sort=\"201016120000\" data-utime=\"201017-11\"><a href=\"https://youtu.be/0q3hrYwcltw\" title=\"KomA & Bobby Brookz - Sternzeiche O.G.\" target=\"_blank\">Fr. 16.10.20</a><div class=\"info\"><div class=\"close\"></div><div class=\"circle\" style=\"background-image:url(https://i1.ytimg.com/vi/0q3hrYwcltw/hqdefault.jpg)\"></div><p>KomA & Bobby Brookz - Sternzeiche O.G.<br><br>Views: 807 &nbsp; Ø/Video: 3396<br>Veröffentlicht am: Fr. 16.10.20 um 12:00 Uhr</p><div class=\"abobar\"><a href=\"https://youtu.be/0q3hrYwcltw\" target=\"_blank\" class=\"red\">zum Video</a></div></div></td>', 807, '2020-10-16T10:00:00+00:00', '201016120000', 'ch');
INSERT INTO `channels` VALUES (306, 0, 'UCAMy1rHhrQFxISsl-HQowLw', 'MutzeMischt', 'Alles nur noch Live. <br /><br />Zur Zeit seht Ihr hier hauptsächlich Twitch-Streams<br />twitch.tv/mutzemischt<br /><br />Spontane Uploads sind die Regel.<br /><br />Meine Spiel-Genres:<br />• Aufbau, Strategie und Wirtschaft<br />• Open World<br />• Rennsport<br />• Simulation<br />• Rollenspiele<br />• Sport<br />• Shooter <br />• verschiedene Demos<br />• und alles was mir so in die Hände fällt ;)<br /><br />Mein PC:<br />► Corsair Obsidian 450D (Midi Tower)<br />► Asus ROG Strix Z370-F Gaming<br />► Intel Core i7-8700K<br />► ASUS ROG STRIX GeForce GTX 1080 Ti 11G GAMING (11GB)<br />► Alphacool Eisbear 280 (14.40cm)<br />► HyperX Fury (1x, 16GB, DDR4-3200, DIMM 288)<br />► be quiet! SilentWings 3 High-Speed (140mm, 1x)<br />► be quiet! Power Zone (650W)<br />► Sandisk Ultra 3D (500GB, 2.5\")<br />► Seagate BarraCuda (4TB, 3.5\")<br />► Tastatur G810 ORION SPECTRUM<br />► G502 HERO HIGH-PERFORMANCE-GAMING-MAUS<br /><br />Konsolen: <br />PS4 Pro <br /><br />Lenkrad:<br />Thrustmaster T150 Force Feedback und TH8A Shifter auf Wheel Stand Pro montiert.<br /><br /><br />Viel Spass auf meinem Kanal und bis zum nächsten Klick. :)', 'https://yt3.ggpht.com/a/AATXAJzQ2eQ2ZxD_6aanFKwlvQII40akRt-VcYetKcYXgg=s88-c-k-c0xffffffff-no-rj-mo', '', 'https://www.youtube.com/mutzemischt', '', '', 'mutzemischt', 'mutzemischt', '-4-11-', '31.03.2016', '201017-11', '201017-11', 0, 51, 203, 279, 305, 299, NULL, 0, 4558, 24455, 50379, 67249, 35732, NULL, 103, NULL, 'LS19 Hof Bergmann ►Multiplayer◄ #swisstubers', 'aNbpULRGIvg', '<td class=\"yt-lastvideo\" data-sort=\"201016080000\" data-utime=\"201017-11\"><a href=\"https://youtu.be/aNbpULRGIvg\" title=\"LS19 Hof Bergmann ►Multiplayer◄ #swisstubers\" target=\"_blank\">Fr. 16.10.20</a><div class=\"info\"><div class=\"close\"></div><div class=\"circle\" style=\"background-image:url(https://i2.ytimg.com/vi/aNbpULRGIvg/hqdefault.jpg)\"></div><p>LS19 Hof Bergmann ►Multiplayer◄ #swisstubers<br><br>Views: 6 &nbsp; Ø/Video: 347<br>Veröffentlicht am: Fr. 16.10.20 um 08:00 Uhr</p><div class=\"abobar\"><a href=\"https://youtu.be/aNbpULRGIvg\" target=\"_blank\" class=\"red\">zum Video</a></div></div></td>', 6, '2020-10-16T06:00:00+00:00', '201016080000', 'ch');
INSERT INTO `channels` VALUES (307, 1, 'UCgTwdkG7FyvQbHEsy0z7psg', 'Jasgaba', 'Game Let\'s Plays auf Schweizerdeutsch, Tutorials auf Deutsch', 'https://yt3.ggpht.com/a/AATXAJzeSX7jsMndcS1X6-OtikUAgdyn-QCfSvQHA2-UIA=s88-c-k-c0xffffffff-no-rj-mo', 'Jasmin Gander', 'https://www.youtube.com/jasgaba', '', '', '', '', '-4-14-', '28.08.2013', '201016-20', '201017-11', 0, 0, 47, 111, 198, 290, NULL, 0, 0, 3433, 18078, 48161, 97371, NULL, 113, NULL, 'Die Sims 4 PS4 runde Theken, Fliesen teilen, Objekte rauf/runter (& XBOX)', 'txx31-7zdv0', '<td class=\"yt-lastvideo\" data-sort=\"190915174446\" data-utime=\"201017-11\"><a href=\"https://youtu.be/txx31-7zdv0\" title=\"Die Sims 4 PS4 runde Theken, Fliesen teilen, Objekte rauf/runter (& XBOX)\" target=\"_blank\">So. 15.09.19</a><div class=\"info\"><div class=\"close\"></div><div class=\"circle\" style=\"background-image:url(https://i1.ytimg.com/vi/txx31-7zdv0/hqdefault.jpg)\"></div><p>Die Sims 4 PS4 runde Theken, Fliesen teilen, Objekte rauf/runter (& XBOX)<br><br>Views: 2188 &nbsp; Ø/Video: 862<br>Veröffentlicht am: So. 15.09.19 um 17:44 Uhr</p><div class=\"abobar\"><a href=\"https://youtu.be/txx31-7zdv0\" target=\"_blank\" class=\"red\">zum Video</a></div></div></td>', 2188, '2019-09-15T15:44:46+00:00', '190915174446', 'ch');
INSERT INTO `channels` VALUES (308, 0, 'UC9TzD1vSXf-FmdmRgTkwNcw', 'BEARSnGAMES', 'Wir sind zwei Bros aus der schönen Schweiz und Gamen was das Zeug hält<br />BnG ist die Abkürzung von BEARS\'n\'GAMES: Bears für (Bros Esports and Random Stuff)<br /><br />Unsere \"Main\" Games: <br />Dungeons & Dragons<br />League Of Legends <br />Legends of Runeterra<br />Monster Hunter World<br />Anthem<br />Magic The Gathering: Arena<br /><br />Wir freuen uns darauf, dich im Chat unseres Livestreams oder auf unserem Discord Server kennen zu lernen.<br /><br />--------------------------------------------------------------------------------<br />schribed üs uf Discord: <br />► discord.gg/KbEUSrD<br /><br />verFolged üs uf Twitter:<br />► twitter.com/bearsngames<br /><br />lueged üs uf Twitch:<br />►twitch.tv/bearsngames', 'https://yt3.ggpht.com/a/AATXAJz9qB2wqkkPmuymV2V3N1C0tjsaFmQo2-7i5U-8=s88-c-k-c0xffffffff-no-rj-mo', '', '', '', '', 'bearsngames', 'bearsngames', '-4-11-', '29.08.2018', '201017-11', '201017-11', 0, 0, 0, 0, 10, 25, NULL, 0, 0, 0, 0, 63, 297, NULL, 12, NULL, 'BEARS\'n\'Dragons | Episode 9: Willkommen in Saltmarsh [CH/DE]|', 'pRR2bFyo6nQ', '<td class=\"yt-lastvideo\" data-sort=\"200504183004\" data-utime=\"201017-11\"><a href=\"https://youtu.be/pRR2bFyo6nQ\" title=\"BEARS\'n\'Dragons | Episode 9: Willkommen in Saltmarsh [CH/DE]|\" target=\"_blank\">Mo. 04.05.20</a><div class=\"info\"><div class=\"close\"></div><div class=\"circle\" style=\"background-image:url(https://i1.ytimg.com/vi/pRR2bFyo6nQ/hqdefault.jpg)\"></div><p>BEARS\'n\'Dragons | Episode 9: Willkommen in Saltmarsh [CH/DE]|<br><br>Views: 9 &nbsp; Ø/Video: 25<br>Veröffentlicht am: Mo. 04.05.20 um 18:30 Uhr</p><div class=\"abobar\"><a href=\"https://youtu.be/pRR2bFyo6nQ\" target=\"_blank\" class=\"red\">zum Video</a></div></div></td>', 9, '2020-05-04T16:30:04+00:00', '200504183004', 'ch');
INSERT INTO `channels` VALUES (309, 0, 'UCgUaI1NBgLxZ6R0a9R29FUA', 'Wasem - KDG', 'Offizieller YouTube Kanal von Wasem und der KDG Crew.', 'https://yt3.ggpht.com/a/AATXAJy2W1UsnHI7YpXSrBr0IAJpVR8hJFCtRZn5vgrIQQ=s88-c-k-c0xffffffff-no-rj-mo', '', '', '', '', '', 'wasem.bassem', '-8-', '09.09.2013', '201017-11', '201017-11', 0, 0, 0, 0, 66, 98, NULL, 0, 0, 0, 0, 3784, 6864, NULL, 7, NULL, 'WASEM - KIMBO SLICE (Official Video 2020)', 'dnkK15TwOTU', '<td class=\"yt-lastvideo\" data-sort=\"200823000005\" data-utime=\"201017-11\"><a href=\"https://youtu.be/dnkK15TwOTU\" title=\"WASEM - KIMBO SLICE (Official Video 2020)\" target=\"_blank\">So. 23.08.20</a><div class=\"info\"><div class=\"close\"></div><div class=\"circle\" style=\"background-image:url(https://i1.ytimg.com/vi/dnkK15TwOTU/hqdefault.jpg)\"></div><p>WASEM - KIMBO SLICE (Official Video 2020)<br><br>Views: 612 &nbsp; Ø/Video: 981<br>Veröffentlicht am: So. 23.08.20 um 00:00 Uhr</p><div class=\"abobar\"><a href=\"https://youtu.be/dnkK15TwOTU\" target=\"_blank\" class=\"red\">zum Video</a></div></div></td>', 612, '2020-08-22T22:00:05+00:00', '200823000005', 'ch');
INSERT INTO `channels` VALUES (310, 1, 'UCwUnokbfG43RJFpNosEPEPg', 'Lura', 'Hallo All Zäme<br /><br />Ich bin Lura und zur Zeit mache ich \"Nur\" Gaming auf dem Kanal.<br />Ich habe vor einiger Zeit festgestellt, dass das Gaming Hobby überhand genommen hat und andere Hobbys wie z.B Editing zu kurz kommen. Youtube gibt mir die Möglichkeit die beiden Dinge und später vielleicht mehr miteinander zu verbinden.<br /><br />Ich wünsche mir für meinen Kanal das sich hier eine Offene, Kommunikationsfreudige und Lustige Community entwickelt die Miteinander diskutieren und debattieren kann und Freude am Gamen und am Leben zeigt :-).<br />Wenn ihr also Ideen habt, dann nur Raus damit ich kuck mir alles an :-).', 'https://yt3.ggpht.com/a/AATXAJytWi_GIe3CNty6OmabqFcH-isL-Urwbkb2pP7Ztw=s88-c-k-c0xffffffff-no-rj-mo', '', '', '', '', '', '', '-4-14-', '03.09.2011', '201016-20', '201017-11', 0, 0, 0, 0, 20, 22, NULL, 0, 0, 0, 0, 789, 830, NULL, 35, NULL, 'Life is Strange 2 ♥ 020: Ausgleichende Ungerechtigkeit...?', 'M4Uf3oeGEsE', '<td class=\"yt-lastvideo\" data-sort=\"191216113159\" data-utime=\"201017-11\"><a href=\"https://youtu.be/M4Uf3oeGEsE\" title=\"Life is Strange 2 ♥ 020: Ausgleichende Ungerechtigkeit...?\" target=\"_blank\">Mo. 16.12.19</a><div class=\"info\"><div class=\"close\"></div><div class=\"circle\" style=\"background-image:url(https://i2.ytimg.com/vi/M4Uf3oeGEsE/hqdefault.jpg)\"></div><p>Life is Strange 2 ♥ 020: Ausgleichende Ungerechtigkeit...?<br><br>Views: 27 &nbsp; Ø/Video: 24<br>Veröffentlicht am: Mo. 16.12.19 um 11:31 Uhr</p><div class=\"abobar\"><a href=\"https://youtu.be/M4Uf3oeGEsE\" target=\"_blank\" class=\"red\">zum Video</a></div></div></td>', 27, '2019-12-16T10:31:59+00:00', '191216113159', 'ch');
INSERT INTO `channels` VALUES (311, 0, 'UCghVVLU_hOTbCIYaKQk8hTw', 'Datenschutzbeauftragte Kanton Zürich', 'Offizieller YouTube-Kanal des Datenschutzbeauftragten des Kantons Zürich (DSB).<br /><br />Der Youtube-Kanal des DSB dient der Veröffentlichung von Videos zu den Themenbereichen Datenschutz, Informationssicherheit, Privacy sowie Security und ist Teil der allgemeinen Informationstätigkeit des DSB.', 'https://yt3.ggpht.com/a/AATXAJxp2srDDqMxMkITfVrwB_kBqUjqnqo8f2H-_SRbIA=s88-c-k-c0xffffffff-no-rj-mo', '', '', 'https://dsb.zh.ch/internet/datenschutzbeauftragter/', '', '', '', '-7-10-20-', '07.12.2015', '201017-11', '201017-11', 0, 0, 0, 0, 92, 120, NULL, 0, 0, 0, 0, 22623, 24490, NULL, 30, NULL, 'Ich sehe was, was du nicht siehst | 1. Preis Datenschutz-Video-Wettbewerb 2020', 'ecD26hXqZu4', '<td class=\"yt-lastvideo\" data-sort=\"200918200006\" data-utime=\"201017-11\"><a href=\"https://youtu.be/ecD26hXqZu4\" title=\"Ich sehe was, was du nicht siehst | 1. Preis Datenschutz-Video-Wettbewerb 2020\" target=\"_blank\">Fr. 18.09.20</a><div class=\"info\"><div class=\"close\"></div><div class=\"circle\" style=\"background-image:url(https://i2.ytimg.com/vi/ecD26hXqZu4/hqdefault.jpg)\"></div><p>Ich sehe was, was du nicht siehst | 1. Preis Datenschutz-Video-Wettbewerb 2020<br><br>Views: 443 &nbsp; Ø/Video: 816<br>Veröffentlicht am: Fr. 18.09.20 um 20:00 Uhr</p><div class=\"abobar\"><a href=\"https://youtu.be/ecD26hXqZu4\" target=\"_blank\" class=\"red\">zum Video</a></div></div></td>', 443, '2020-09-18T18:00:06+00:00', '200918200006', 'ch');
INSERT INTO `channels` VALUES (312, 1, 'UCxmjdO_pdzqXVO-cKYdWo-A', 'Werthiplay', 'Hertzlich Willkommen auf meinem Kanal. Ich bin euer Werti und mache Let\'s plays<br />auf der PS4 und dem PC.', 'https://yt3.ggpht.com/a/AATXAJxhVwWCgn1IJjTD-bJf1bH9O2YRjKHBx-EqSSql=s88-c-k-c0xffffffff-no-rj-mo', '', '', '', '', 'werthiplay', '', '-4-11-', '05.04.2018', '201016-20', '201017-11', 0, 0, 0, 0, 3, 3, NULL, 0, 0, 0, 0, 106, 116, NULL, 34, NULL, 'Far Cry: New Dawn #04 Rush\'s Befreiung', '2h4CSni1sDE', '<td class=\"yt-lastvideo\" data-sort=\"190309000203\" data-utime=\"201017-11\"><a href=\"https://youtu.be/2h4CSni1sDE\" title=\"Far Cry: New Dawn #04 Rush\'s Befreiung\" target=\"_blank\">Sa. 09.03.19</a><div class=\"info\"><div class=\"close\"></div><div class=\"circle\" style=\"background-image:url(https://i3.ytimg.com/vi/2h4CSni1sDE/hqdefault.jpg)\"></div><p>Far Cry: New Dawn #04 Rush\'s Befreiung<br><br>Views: 1 &nbsp; Ø/Video: 3<br>Veröffentlicht am: Sa. 09.03.19 um 00:02 Uhr</p><div class=\"abobar\"><a href=\"https://youtu.be/2h4CSni1sDE\" target=\"_blank\" class=\"red\">zum Video</a></div></div></td>', 1, '2019-03-08T23:02:03+00:00', '190309000203', 'ch');
INSERT INTO `channels` VALUES (313, 0, 'UCWfA8w5ZuzdjZs_3SZY9h6Q', 'Change Moments', 'Hallo Schweiz!<br /><br />Wir sind «Change Moments» und lieben es, Menschen auf kreative Art zu überraschen und zu beschenken. Wir möchten Alltagsmomente kreativ verändern und halten diese mit versteckter Kamera fest. Falls du unsere Vision teilst und uns unterstützen willst, dann erzähle deinen Freunden davon, teile unsere Videos und besuche unsere Website: changemoments.ch<br /><br />Für Anregungen und fragen: info@changemoments.ch<br />Für Unterstützung: changemoments.ch/unterstuetze-uns<br /><br />Bis zum nächsten Video,<br />Stefan, Gründer Change Moments', 'https://yt3.ggpht.com/a/AATXAJylXjCtocSBUd9HDaY1tbRdko8mHQFJf8JvyTvNdA=s88-c-k-c0xffffffff-no-rj-mo', '', 'https://www.youtube.com/changemoments', 'https://www.changemoments.ch', '', '', 'change_moments', '-7-', '12.12.2016', '201017-11', '201017-11', 0, 0, 1602, 2391, 2370, 3000, NULL, 0, 0, 230695, 502172, 526853, 850714, NULL, 10, NULL, 'Versteckte Kamera: Liebe Mamis - Wir sagen DANKE', 'n-66Ua5TGIE', '<td class=\"yt-lastvideo\" data-sort=\"201013175712\" data-utime=\"201017-11\"><a href=\"https://youtu.be/n-66Ua5TGIE\" title=\"Versteckte Kamera: Liebe Mamis - Wir sagen DANKE\" target=\"_blank\">Di. 13.10.20</a><div class=\"info\"><div class=\"close\"></div><div class=\"circle\" style=\"background-image:url(https://i3.ytimg.com/vi/n-66Ua5TGIE/hqdefault.jpg)\"></div><p>Versteckte Kamera: Liebe Mamis - Wir sagen DANKE<br><br>Views: 40653 &nbsp; Ø/Video: 85071<br>Veröffentlicht am: Di. 13.10.20 um 17:57 Uhr</p><div class=\"abobar\"><a href=\"https://youtu.be/n-66Ua5TGIE\" target=\"_blank\" class=\"red\">zum Video</a></div></div></td>', 40653, '2020-10-13T15:57:12+00:00', '201013175712', 'ch');
INSERT INTO `channels` VALUES (314, 1, 'UCJzKFKXHbGerDy1MsMsGCAA', 'JaenuK', '-', 'https://yt3.ggpht.com/a/AATXAJzRL-W1fU2IwOoe1re-qHYLMZSpojsHrlEZ_Kiatg=s88-c-k-c0xffffffff-no-rj-mo', 'Jan Kröcher', 'https://www.youtube.com/jaenuk', '', '', '', 'jaenuk', '-2-', '31.01.2017', '201016-20', '201017-11', 0, 0, 42, 145, 155, 161, NULL, 0, 0, 1094, 9761, 14173, 6315, NULL, 14, NULL, 'Barcelona VLOG | JaenuK', 'vYb0D8X5ba0', '<td class=\"yt-lastvideo\" data-sort=\"191231185923\" data-utime=\"201017-11\"><a href=\"https://youtu.be/vYb0D8X5ba0\" title=\"Barcelona VLOG | JaenuK\" target=\"_blank\">Di. 31.12.19</a><div class=\"info\"><div class=\"close\"></div><div class=\"circle\" style=\"background-image:url(https://i3.ytimg.com/vi/vYb0D8X5ba0/hqdefault.jpg)\"></div><p>Barcelona VLOG | JaenuK<br><br>Views: 159 &nbsp; Ø/Video: 451<br>Veröffentlicht am: Di. 31.12.19 um 18:59 Uhr</p><div class=\"abobar\"><a href=\"https://youtu.be/vYb0D8X5ba0\" target=\"_blank\" class=\"red\">zum Video</a></div></div></td>', 159, '2019-12-31T17:59:23+00:00', '191231185923', 'ch');
INSERT INTO `channels` VALUES (315, 0, 'UCwDGZz0CT9wyC14kRJ7Nxhg', 'TeleBlocher', 'Willkommen bei Teleblocher, der wöchentlichen Sendung des Schaffhauser Fernsehens mit Alt-Bundesrat Christoph Blocher im Gespräch mit Dr. Matthias Ackeret, Journalist und Autor des Buchs »Das Blocher-Prinzip«', 'https://yt3.ggpht.com/a/AATXAJyFn5uvQ9GXsntHpbQtFnNxX2fSsX_Nr-Q61FLv=s88-c-k-c0xffffffff-no-rj-mo', 'Christoph Blocher', '', '', '', '', '', '-10-', '06.01.2015', '201017-11', '201017-11', 0, 0, 0, 0, 0, 0, NULL, 0, 0, 0, 0, 1652850, 2132890, NULL, 303, NULL, 'Folge 685: Jean Ziegler, Adolf Muschg und Corona', 'TjWfLELCxf0', '<td class=\"yt-lastvideo\" data-sort=\"201016114500\" data-utime=\"201017-11\"><a href=\"https://youtu.be/TjWfLELCxf0\" title=\"Folge 685: Jean Ziegler, Adolf Muschg und Corona\" target=\"_blank\">Fr. 16.10.20</a><div class=\"info\"><div class=\"close\"></div><div class=\"circle\" style=\"background-image:url(https://i1.ytimg.com/vi/TjWfLELCxf0/hqdefault.jpg)\"></div><p>Folge 685: Jean Ziegler, Adolf Muschg und Corona<br><br>Views: 3856 &nbsp; Ø/Video: 7039<br>Veröffentlicht am: Fr. 16.10.20 um 11:45 Uhr</p><div class=\"abobar\"><a href=\"https://youtu.be/TjWfLELCxf0\" target=\"_blank\" class=\"red\">zum Video</a></div></div></td>', 3856, '2020-10-16T09:45:00+00:00', '201016114500', 'ch');
INSERT INTO `channels` VALUES (316, 1, 'UCCnx9LJflGPYVfHIxpO2iKg', 'Ropick', '', 'https://yt3.ggpht.com/a/AATXAJw9N3VaBMcGajRCPqHqOiuCMR1GskoloHYdzZW_5A=s88-c-k-c0xffffffff-no-rj-mo', 'Robin Pickis', '', '', '', '', 'ropick', '-6-', '06.09.2013', '201016-20', '201017-11', 0, 0, 0, 0, 49, 84, NULL, 0, 0, 0, 0, 2024, 2587, NULL, 4, NULL, 'Nemo - 5i uf de Uhr (Ropick Remix)', 'r3RYpYEW-oo', '<td class=\"yt-lastvideo\" data-sort=\"190213214805\" data-utime=\"201017-11\"><a href=\"https://youtu.be/r3RYpYEW-oo\" title=\"Nemo - 5i uf de Uhr (Ropick Remix)\" target=\"_blank\">Mi. 13.02.19</a><div class=\"info\"><div class=\"close\"></div><div class=\"circle\" style=\"background-image:url(https://i3.ytimg.com/vi/r3RYpYEW-oo/hqdefault.jpg)\"></div><p>Nemo - 5i uf de Uhr (Ropick Remix)<br><br>Views: 295 &nbsp; Ø/Video: 647<br>Veröffentlicht am: Mi. 13.02.19 um 21:48 Uhr</p><div class=\"abobar\"><a href=\"https://youtu.be/r3RYpYEW-oo\" target=\"_blank\" class=\"red\">zum Video</a></div></div></td>', 295, '2019-02-13T20:48:05+00:00', '190213214805', 'ch');
INSERT INTO `channels` VALUES (317, 0, 'UCu85c-H8poaZiNwdL4jEz-w', 'Kolap Podcast', 'Der Kolap Podcast befasst sich mit aktuellen Themen aus der Schweizer Musikindustrie und zeigt alle Facetten des Künstler-Geschäfts auf.<br />Es soll ein Ort sein wo hilfreiche Informationen geteilt und Diskussionen zum Thema Musik x Business in der Schweiz geführt werden.<br /><br />Für persönliches Feedback oder Business Anfragen: kolappodcast@gmail.com<br /><br />Host & Produktion: Alex Kolovelonis', 'https://yt3.ggpht.com/a/AATXAJzFyYcZRMB_5EYU8ye2zc2EQxkhJAhMWddBjDAChg=s88-c-k-c0xffffffff-no-rj-mo', 'Alex Kolovelonis', '', '', 'https://www.youtube.com/channel/UCu85c-H8poaZiNwdL4jEz-w/playlists', '', 'kolappodcast', '-7-8-12-', '19.02.2019', '201017-11', '201017-11', 0, 0, 0, 0, 0, 73, NULL, 0, 0, 0, 0, 0, 3575, NULL, 83, NULL, 'Musighörer-Analyse: \"Ähnlichi Songs\" nach Mood Kontext sueche | Kolap Podcast (Clips)', 'ksyeCw7c_Rk', '<td class=\"yt-lastvideo\" data-sort=\"201015183002\" data-utime=\"201017-11\"><a href=\"https://youtu.be/ksyeCw7c_Rk\" title=\"Musighörer-Analyse: \"Ähnlichi Songs\" nach Mood Kontext sueche | Kolap Podcast (Clips)\" target=\"_blank\">Do. 15.10.20</a><div class=\"info\"><div class=\"close\"></div><div class=\"circle\" style=\"background-image:url(https://i4.ytimg.com/vi/ksyeCw7c_Rk/hqdefault.jpg)\"></div><p>Musighörer-Analyse: \"Ähnlichi Songs\" nach Mood Kontext sueche | Kolap Podcast (Clips)<br><br>Views: 12 &nbsp; Ø/Video: 43<br>Veröffentlicht am: Do. 15.10.20 um 18:30 Uhr</p><div class=\"abobar\"><a href=\"https://youtu.be/ksyeCw7c_Rk\" target=\"_blank\" class=\"red\">zum Video</a></div></div></td>', 12, '2020-10-15T16:30:02+00:00', '201015183002', 'ch');
INSERT INTO `channels` VALUES (318, 0, 'UCzntZPXRAODxDriw8Jwz_jQ', 'Dezhign', 'Dezhign Filmzh ist ein Filmunternehmen aus Zürich welches sich auf Music Clips, Streetvideos und Präsentationen spezialisiert hat. Vom Einfachen Shooting bis zur grossen Filmproduktion setzt Dezhign Filmzh jeden Kundenwunsch professionell um. Infos: info@dezhign.com', 'https://yt3.ggpht.com/a/AATXAJwXkTmWrOlfNDnvWFwJFSstyJMqYHzcHISjnl20=s88-c-k-c0xffffffff-no-rj-mo', '', 'https://www.youtube.com/dezhignfilmzh', '', '', '', 'dezhign', '-8-20-', '17.05.2011', '201017-11', '201017-11', 0, 1714, 2674, 3393, 4320, 5220, NULL, 0, 1138262, 1592192, 2116208, 2971939, 3532041, NULL, 184, NULL, 'GSEZHLOS - Mazhke - Feat. Blokkmonsta , Terra Nova', 'iK6LjtLmbrA', '<td class=\"yt-lastvideo\" data-sort=\"201016000011\" data-utime=\"201017-11\"><a href=\"https://youtu.be/iK6LjtLmbrA\" title=\"GSEZHLOS - Mazhke - Feat. Blokkmonsta , Terra Nova\" target=\"_blank\">Fr. 16.10.20</a><div class=\"info\"><div class=\"close\"></div><div class=\"circle\" style=\"background-image:url(https://i2.ytimg.com/vi/iK6LjtLmbrA/hqdefault.jpg)\"></div><p>GSEZHLOS - Mazhke - Feat. Blokkmonsta , Terra Nova<br><br>Views: 14663 &nbsp; Ø/Video: 19196<br>Veröffentlicht am: Fr. 16.10.20 um 00:00 Uhr</p><div class=\"abobar\"><a href=\"https://youtu.be/iK6LjtLmbrA\" target=\"_blank\" class=\"red\">zum Video</a></div></div></td>', 14663, '2020-10-15T22:00:11+00:00', '201016000011', 'ch');
INSERT INTO `channels` VALUES (319, 0, 'UCJLxuelj84_DW1K3aHEcAtw', 'RICH VO INNE', '', 'https://yt3.ggpht.com/a/AATXAJwxC8Ezu0Fi5c5marf0Mh-TcaBH3d-r0U68fooQsQ=s88-c-k-c0xffffffff-no-rj-mo', '', 'https://www.youtube.com/roniloud', '', '', '', '', '-8-', '26.04.2018', '201017-11', '201017-11', 0, 0, 0, 0, 579, 676, NULL, 0, 0, 0, 0, 59165, 86043, NULL, 7, NULL, 'Roni Loud - 50k', 'RteihqkkWc8', '<td class=\"yt-lastvideo\" data-sort=\"200403000010\" data-utime=\"201017-11\"><a href=\"https://youtu.be/RteihqkkWc8\" title=\"Roni Loud - 50k\" target=\"_blank\">Fr. 03.04.20</a><div class=\"info\"><div class=\"close\"></div><div class=\"circle\" style=\"background-image:url(https://i3.ytimg.com/vi/RteihqkkWc8/hqdefault.jpg)\"></div><p>Roni Loud - 50k<br><br>Views: 3348 &nbsp; Ø/Video: 12292<br>Veröffentlicht am: Fr. 03.04.20 um 00:00 Uhr</p><div class=\"abobar\"><a href=\"https://youtu.be/RteihqkkWc8\" target=\"_blank\" class=\"red\">zum Video</a></div></div></td>', 3348, '2020-04-02T22:00:10+00:00', '200403000010', 'ch');
INSERT INTO `channels` VALUES (320, 0, 'UCQNjowQrznb6sronvuEzELA', 'Just Gerry_', 'Hallo Leute komme aus der Schweiz und bin ein Streamer.', 'https://yt3.ggpht.com/a/AATXAJx_etbsHgHUFArzNljePGkqaMxcDx1bdZA7l6sf=s88-c-k-c0xffffffff-no-rj-mo', '', '', '', '', 'justgerry_', 'justgerry_', '-4-11-27-', '07.02.2014', '201017-11', '201017-11', 0, 0, 0, 0, 46, 67, NULL, 0, 0, 0, 0, 1807, 2312, NULL, 27, NULL, 'Unboxing Logitech Headset G Pro X', 'yJ2fTsUvfm0', '<td class=\"yt-lastvideo\" data-sort=\"200629123342\" data-utime=\"201017-11\"><a href=\"https://youtu.be/yJ2fTsUvfm0\" title=\"Unboxing Logitech Headset G Pro X\" target=\"_blank\">Mo. 29.06.20</a><div class=\"info\"><div class=\"close\"></div><div class=\"circle\" style=\"background-image:url(https://i2.ytimg.com/vi/yJ2fTsUvfm0/hqdefault.jpg)\"></div><p>Unboxing Logitech Headset G Pro X<br><br>Views: 149 &nbsp; Ø/Video: 86<br>Veröffentlicht am: Mo. 29.06.20 um 12:33 Uhr</p><div class=\"abobar\"><a href=\"https://youtu.be/yJ2fTsUvfm0\" target=\"_blank\" class=\"red\">zum Video</a></div></div></td>', 149, '2020-06-29T10:33:42+00:00', '200629123342', 'ch');
INSERT INTO `channels` VALUES (321, 0, 'UCZbrILUUCFHhW0ea_JPYZLw', 'Swiss Filmmaker', 'Schwizer Youtuber wo Filmnews & Kritike macht. <br />Zudem gibi dir Tipps & Tricks ds o du ä Schwizer Youtuber chasch wärde.<br /><br />Möchtisch du ä kurzä Film realisierä odr äs Video mit mir zämä machä? <br />Hesch du äs Produkt odr ä Film wo du vorstelle möchtsch?<br />De mäld di sehr gärn per Mail bi mir: lenny.knobel@gmail.com', 'https://yt3.ggpht.com/a/AATXAJz39XFChdrnhla49QhB73tRRewORJjLSI_VX6_58w=s88-c-k-c0xffffffff-no-rj-mo', 'Lenny Knobel', '', 'https://shop.spreadshirt.ch/swissfilmmaker', '', '', 'lennyknobel', '-3-6-', '31.01.2019', '201017-11', '201017-11', 0, 0, 0, 0, 29, 93, NULL, 0, 0, 0, 0, 2279, 6273, NULL, 22, NULL, 'SCHWEIZER YOUTUBE-KANAL | Erstellen & Einrichten', 'qY2xCYvrA4U', '<td class=\"yt-lastvideo\" data-sort=\"200528193647\" data-utime=\"201017-11\"><a href=\"https://youtu.be/qY2xCYvrA4U\" title=\"SCHWEIZER YOUTUBE-KANAL | Erstellen & Einrichten\" target=\"_blank\">Do. 28.05.20</a><div class=\"info\"><div class=\"close\"></div><div class=\"circle\" style=\"background-image:url(https://i2.ytimg.com/vi/qY2xCYvrA4U/hqdefault.jpg)\"></div><p>SCHWEIZER YOUTUBE-KANAL | Erstellen & Einrichten<br><br>Views: 68 &nbsp; Ø/Video: 285<br>Veröffentlicht am: Do. 28.05.20 um 19:36 Uhr</p><div class=\"abobar\"><a href=\"https://youtu.be/qY2xCYvrA4U\" target=\"_blank\" class=\"red\">zum Video</a></div></div></td>', 68, '2020-05-28T17:36:47+00:00', '200528193647', 'ch');
INSERT INTO `channels` VALUES (322, 0, 'UCJQDfq4TBApJeblCpi06hZw', 'Verreis', 'Willkommen auf unserem YouTube Kanal<br /><br />Schön, dass du hier bist 😊 <br />Job gekündigt, Wohnung abgegeben, Rucksack gepackt und los gehts... 🎒✈️ 🌍<br /><br />Seit dem 06.07.2017 sind wir auf Weltreise und möchten unsere Erlebnisse und Abenteuer gerne mit euch in unseren Videos teilen. <br /><br />Und seit dem 06.04.2018 bereisen wir die Welt per Anhalter.<br /><br />Wir sind:<br /><br />✦ Fabienne & Adriano 👫<br />    Wir lieben das Reisen und das Abenteuer. <br />    Sind stets auf der Suche nach neuen Erfahrungen, Abenteuer und Kulturen<br /><br />✦ Ach ja, unsere Videos sind auf Schweizerdeutsch 🇨🇭<br /><br />★ Abonniere unseren Kanal ★<br />     Falls dir unsere Videos gefallen, würden wir uns riesig über ein Abo freuen 🎉<br /><br /> ( Detailliertere Informationen findest du auf unserer Webseite: verreis.com )<br /><br />Hier findest du uns noch:<br /><br />Instagram ● instagram.com/verreis_travel/<br />Facebook ● facebook.com/verreiscom/<br />Twitter ● twitter.com/verreis_com', 'https://yt3.ggpht.com/a/AATXAJwHUrzRdTP8vYFjAR1ZR0ZafCajgyHKqUQ0xrKtVg=s88-c-k-c0xffffffff-no-rj-mo', 'Fabienne Rohr & Adriano Wasescha', 'https://www.youtube.com/verreisreisevlogs', 'https://www.verreis.com', '', '', '_verreis_', '-1-', '30.08.2017', '201017-11', '201017-11', 0, 0, 0, 0, 733, 1150, NULL, 0, 0, 0, 0, 159405, 336009, NULL, 86, NULL, 'Manaslu Circuit - Trekking in Nepal ⎜ Vlog #81', 'pOrAa6CL5Ik', '<td class=\"yt-lastvideo\" data-sort=\"200830121436\" data-utime=\"201017-11\"><a href=\"https://youtu.be/pOrAa6CL5Ik\" title=\"Manaslu Circuit - Trekking in Nepal ⎜ Vlog #81\" target=\"_blank\">So. 30.08.20</a><div class=\"info\"><div class=\"close\"></div><div class=\"circle\" style=\"background-image:url(https://i1.ytimg.com/vi/pOrAa6CL5Ik/hqdefault.jpg)\"></div><p>Manaslu Circuit - Trekking in Nepal ⎜ Vlog #81<br><br>Views: 426 &nbsp; Ø/Video: 3907<br>Veröffentlicht am: So. 30.08.20 um 12:14 Uhr</p><div class=\"abobar\"><a href=\"https://youtu.be/pOrAa6CL5Ik\" target=\"_blank\" class=\"red\">zum Video</a></div></div></td>', 426, '2020-08-30T10:14:36+00:00', '200830121436', 'ch');
INSERT INTO `channels` VALUES (323, 0, 'UCBgh81kt3WwT1WFM8nBUUtQ', 'EWZ', 'Willkommen auf dem offiziellen youtube-Kanal von ewz. Hier geben wir dir mit unseren Mitarbeitenden-Vlogs einen Einblick in unsere Arbeitswelt, erklären dir einfach diverse Themen rund um die Energie, geben dir einen Einblick in unsere Events und Sponsorings und portraitieren innovative und nachhaltige Zürcher Startups. <br /><br />Abonniere uns, um mittels einfachen Erklär-Videos die Welt der Energie zu verstehen, dich bei energieeffizienten Kochvideos zu inspirieren und in unsere Arbeitswelt einzutauchen. Viel Spass!<br /><br />Weitere Infos auch unter: <br />ewz.ch, <br />Facebook.com/ewz.energie, <br />Twitter.com/ewz_energie<br />Instagram.com/ewz.energie<br />Das Magazin für Nachhaltigkeit, powered by ewz: powernewz.ch', 'https://yt3.ggpht.com/a/AATXAJxhBUu1l-TY5S_zA_btV6B9IKy2U5z81BgfgdeY=s88-c-k-c0xffffffff-no-rj-mo', '', 'https://www.youtube.com/ewzdieenergie', 'https://www.ewz.ch', '', '', 'ewz.energie', '-13-', '19.12.2013', '201017-11', '201017-11', 0, 0, 0, 0, 759, 798, NULL, 0, 0, 0, 0, 695823, 1344049, NULL, 83, NULL, 'In 10 Schritten zum neuen ewz-Teammitglied | ewz.energie', 'dOmse7TdkvU', '<td class=\"yt-lastvideo\" data-sort=\"200925143403\" data-utime=\"201017-11\"><a href=\"https://youtu.be/dOmse7TdkvU\" title=\"In 10 Schritten zum neuen ewz-Teammitglied | ewz.energie\" target=\"_blank\">Fr. 25.09.20</a><div class=\"info\"><div class=\"close\"></div><div class=\"circle\" style=\"background-image:url(https://i1.ytimg.com/vi/dOmse7TdkvU/hqdefault.jpg)\"></div><p>In 10 Schritten zum neuen ewz-Teammitglied | ewz.energie<br><br>Views: 61 &nbsp; Ø/Video: 16193<br>Veröffentlicht am: Fr. 25.09.20 um 14:34 Uhr</p><div class=\"abobar\"><a href=\"https://youtu.be/dOmse7TdkvU\" target=\"_blank\" class=\"red\">zum Video</a></div></div></td>', 61, '2020-09-25T12:34:03+00:00', '200925143403', 'ch');
INSERT INTO `channels` VALUES (324, 0, 'UCqSgwXQrRSWLdjuQCg844Pg', 'Sektion Züri', 'Offizielle Kanal vo Sektion Züri<br /><br />Züri Musik usem 3/4<br /><br />Instagram <br /><br />@Sektionzh<br /><br />@llokoluna<br /><br />@Drinero34<br /><br />@jordanparatofficial<br /><br />@hero_official04<br /><br />SC:Sektionzh', 'https://yt3.ggpht.com/a/AATXAJzjRsxFcUFijFw5OaB9VfUmzqTrL0gO06wsZInpkA=s88-c-k-c0xffffffff-no-rj-mo', '', 'https://www.youtube.com/BadBoysZH', '', '', '', 'sektionzh', '-8-20-', '01.04.2013', '201017-11', '201017-11', 0, 0, 3975, 5096, 5620, 6420, NULL, 0, 0, 1081792, 1503673, 1789181, 2108139, NULL, 29, NULL, 'L Loko x Drini - 5K (Official Video) prod. by yngscorpio', 'XS-6LjxNftM', '<td class=\"yt-lastvideo\" data-sort=\"200722120010\" data-utime=\"201017-11\"><a href=\"https://youtu.be/XS-6LjxNftM\" title=\"L Loko x Drini - 5K (Official Video) prod. by yngscorpio\" target=\"_blank\">Mi. 22.07.20</a><div class=\"info\"><div class=\"close\"></div><div class=\"circle\" style=\"background-image:url(https://i1.ytimg.com/vi/XS-6LjxNftM/hqdefault.jpg)\"></div><p>L Loko x Drini - 5K (Official Video) prod. by yngscorpio<br><br>Views: 26643 &nbsp; Ø/Video: 72694<br>Veröffentlicht am: Mi. 22.07.20 um 12:00 Uhr</p><div class=\"abobar\"><a href=\"https://youtu.be/XS-6LjxNftM\" target=\"_blank\" class=\"red\">zum Video</a></div></div></td>', 26643, '2020-07-22T10:00:10+00:00', '200722120010', 'ch');
INSERT INTO `channels` VALUES (325, 0, 'UCqUfbNA6TeyA3AtMlXdsUuw', 'Royal C Gang', 'Royal C ist die Gang<br />Label aus Basel<br /><br />Fan Shop Adresse<br />royalcmanagement@gmx.ch', 'https://yt3.ggpht.com/a/AATXAJwWr-EnI1489HrKl1rZOV5yfXL9UvuuLlvOma9uDg=s88-c-k-c0xffffffff-no-rj-mo', '', '', '', '', '', 'managment.royal', '-8-21-', '12.11.2018', '201017-11', '201017-11', 0, 0, 0, 0, 191, 304, NULL, 0, 0, 0, 0, 21444, 48003, NULL, 28, NULL, 'Royal C mini Frau Teaser', 'bXf93pCIT4I', '<td class=\"yt-lastvideo\" data-sort=\"201014195247\" data-utime=\"201017-11\"><a href=\"https://youtu.be/bXf93pCIT4I\" title=\"Royal C mini Frau Teaser\" target=\"_blank\">Mi. 14.10.20</a><div class=\"info\"><div class=\"close\"></div><div class=\"circle\" style=\"background-image:url(https://i3.ytimg.com/vi/bXf93pCIT4I/hqdefault.jpg)\"></div><p>Royal C mini Frau Teaser<br><br>Views: 148 &nbsp; Ø/Video: 1714<br>Veröffentlicht am: Mi. 14.10.20 um 19:52 Uhr</p><div class=\"abobar\"><a href=\"https://youtu.be/bXf93pCIT4I\" target=\"_blank\" class=\"red\">zum Video</a></div></div></td>', 148, '2020-10-14T17:52:47+00:00', '201014195247', 'ch');
INSERT INTO `channels` VALUES (326, 0, 'UCPpQKCMOCwoQ-rw1lqE9wMA', 'Lino Cappuccino', 'Ich mache mengmol Youtubevideos.... <br /><br />R.I.P 2019 TOP TEN Erich', 'https://yt3.ggpht.com/a/AATXAJwKxbDn4zUA9izLsxFz8Rd86xA2Awbf10NyHQGNHQ=s88-c-k-c0xffffffff-no-rj-mo', 'Lino Haltinner', '', 'https://www.linocappuccino.com', '', 'toptenerich', 'linocappuccinox', '-6-11-15-28-', '03.11.2017', '201017-11', '201017-11', 0, 0, 0, 317, 605, 663, NULL, 0, 0, 0, 20065, 43930, 53851, NULL, 235, NULL, 'OSTSCHWEIZER in STEFAN BÜSSERS BAR / #18 ZDEL', 'A_fgZDvAZnw', '<td class=\"yt-lastvideo\" data-sort=\"201015180002\" data-utime=\"201017-11\"><a href=\"https://youtu.be/A_fgZDvAZnw\" title=\"OSTSCHWEIZER in STEFAN BÜSSERS BAR / #18 ZDEL\" target=\"_blank\">Do. 15.10.20</a><div class=\"info\"><div class=\"close\"></div><div class=\"circle\" style=\"background-image:url(https://i2.ytimg.com/vi/A_fgZDvAZnw/hqdefault.jpg)\"></div><p>OSTSCHWEIZER in STEFAN BÜSSERS BAR / #18 ZDEL<br><br>Views: 133 &nbsp; Ø/Video: 229<br>Veröffentlicht am: Do. 15.10.20 um 18:00 Uhr</p><div class=\"abobar\"><a href=\"https://youtu.be/A_fgZDvAZnw\" target=\"_blank\" class=\"red\">zum Video</a></div></div></td>', 133, '2020-10-15T16:00:02+00:00', '201015180002', 'ch');
INSERT INTO `channels` VALUES (327, 0, 'UCX0OdLuEQ3ccSCq-Z7iMoiw', 'Deville', '«Deville» ist die Late-Night Sendung auf SRF. Eloquent, pointiert und charmant ironisch. So präsentiert Dominic Deville, Tausendsassa und Ententrainer, das Format. Unterhaltung, aber mit Haltung. Schwachsinn, aber mit Stil. Dominic Devilles amüsant-provokanter Blick auf das aktuelle Geschehen, und seine humorvolle Aufbereitung gesellschaftlicher Themen, prägen den Charakter der Sendung.<br /><br />Du möchtest «Deville» einmal live miterleben?<br />Die neue Staffel startet am 27. September 2020 und läuft jeweils um 21.40 Uhr auf SRF 1.<br /><br />Hier Tickets reservieren:<br />filmgerberei-deville.ch', 'https://yt3.ggpht.com/a/AATXAJzkSK3Z8Nv2VUEqTassc35z2wnh1TIiE7SxpuwR=s88-c-k-c0xffffffff-no-rj-mo', '', 'https://www.youtube.com/srfdeville', 'https://srf.ch', '', '', 'srfdeville', '-6-9-', '26.03.2019', '201017-11', '201017-11', 0, 0, 0, 0, 3640, 6770, NULL, 0, 0, 0, 0, 15043906, 16582099, NULL, 696, NULL, 'Hygiene-Regeln | Deville', 'DFU9m3IQh6Y', '<td class=\"yt-lastvideo\" data-sort=\"201012145743\" data-utime=\"201017-11\"><a href=\"https://youtu.be/DFU9m3IQh6Y\" title=\"Hygiene-Regeln | Deville\" target=\"_blank\">Mo. 12.10.20</a><div class=\"info\"><div class=\"close\"></div><div class=\"circle\" style=\"background-image:url(https://i1.ytimg.com/vi/DFU9m3IQh6Y/hqdefault.jpg)\"></div><p>Hygiene-Regeln | Deville<br><br>Views: 1707 &nbsp; Ø/Video: 23825<br>Veröffentlicht am: Mo. 12.10.20 um 14:57 Uhr</p><div class=\"abobar\"><a href=\"https://youtu.be/DFU9m3IQh6Y\" target=\"_blank\" class=\"red\">zum Video</a></div></div></td>', 1707, '2020-10-12T12:57:43+00:00', '201012145743', 'ch');
INSERT INTO `channels` VALUES (328, 0, 'UC-zQNulCOpRGVxkKmV-08UQ', 'Megawatt', '', 'https://yt3.ggpht.com/a/AATXAJxV5OOv8JZslEhAm5k1p8OYiYYIyl4m5SrE9XCO=s88-c-k-c0xffffffff-no-rj-mo', '', '', 'https://www.megawattmusig.ch', '', '', 'megawattmusig', '-8-', '27.11.2019', '201017-11', '201017-11', 0, 0, 0, 0, 0, 511, NULL, 0, 0, 0, 0, 0, 92109, NULL, 7, NULL, 'Megawatt - Heimatgfühl (Offiziells Musigvideo)', 'GoY4dkOD2iE', '<td class=\"yt-lastvideo\" data-sort=\"200821060025\" data-utime=\"201017-11\"><a href=\"https://youtu.be/GoY4dkOD2iE\" title=\"Megawatt - Heimatgfühl (Offiziells Musigvideo)\" target=\"_blank\">Fr. 21.08.20</a><div class=\"info\"><div class=\"close\"></div><div class=\"circle\" style=\"background-image:url(https://i4.ytimg.com/vi/GoY4dkOD2iE/hqdefault.jpg)\"></div><p>Megawatt - Heimatgfühl (Offiziells Musigvideo)<br><br>Views: 28727 &nbsp; Ø/Video: 13158<br>Veröffentlicht am: Fr. 21.08.20 um 06:00 Uhr</p><div class=\"abobar\"><a href=\"https://youtu.be/GoY4dkOD2iE\" target=\"_blank\" class=\"red\">zum Video</a></div></div></td>', 28727, '2020-08-21T04:00:25+00:00', '200821060025', 'ch');
INSERT INTO `channels` VALUES (329, 0, 'UCy33T2BHQUa3veat8ExJqFw', 'STARTER GANG', 'Starter Gang<br /><br /><br />startergang.com/', 'https://yt3.ggpht.com/a/AATXAJxIpOy6lEnAqBu0XzKLjuMGoXeQANG3PIvWigl5Jw=s88-c-k-c0xffffffff-no-rj-mo', '', '', 'https://www.startergang.com', '', '', 'startergangofficial', '-8-', '29.01.2012', '201017-11', '201017-11', 0, 0, 707, 981, 1130, 1240, NULL, 0, 0, 297038, 412202, 475192, 528452, NULL, 79, NULL, 'JAS CRW - REPORT (Prod. by Jamie Rodigan)', 'hAfqMMyuiFM', '<td class=\"yt-lastvideo\" data-sort=\"200828000026\" data-utime=\"201017-11\"><a href=\"https://youtu.be/hAfqMMyuiFM\" title=\"JAS CRW - REPORT (Prod. by Jamie Rodigan)\" target=\"_blank\">Fr. 28.08.20</a><div class=\"info\"><div class=\"close\"></div><div class=\"circle\" style=\"background-image:url(https://i1.ytimg.com/vi/hAfqMMyuiFM/hqdefault.jpg)\"></div><p>JAS CRW - REPORT (Prod. by Jamie Rodigan)<br><br>Views: 11365 &nbsp; Ø/Video: 6689<br>Veröffentlicht am: Fr. 28.08.20 um 00:00 Uhr</p><div class=\"abobar\"><a href=\"https://youtu.be/hAfqMMyuiFM\" target=\"_blank\" class=\"red\">zum Video</a></div></div></td>', 11365, '2020-08-27T22:00:26+00:00', '200828000026', 'ch');
INSERT INTO `channels` VALUES (330, 0, 'UCwk1_C0u7_dIwEp1erRdzMw', 'King NB', '', 'https://yt3.ggpht.com/a/AATXAJyWEeOyWSfv03fAEsrYuTK4y_ltJP7Uiu_RZ5Gnjw=s88-c-k-c0xffffffff-no-rj-mo', '', '', '', '', '', 'king_nb', '-8-', '29.11.2017', '201017-11', '201017-11', 0, 0, 0, 0, 867, 1030, NULL, 0, 0, 0, 0, 70264, 105385, NULL, 10, NULL, 'King NB - BO$$ [Official Video] prod. by Saucelikedonx', 'lNCwI2itJbA', '<td class=\"yt-lastvideo\" data-sort=\"200918190012\" data-utime=\"201017-11\"><a href=\"https://youtu.be/lNCwI2itJbA\" title=\"King NB - BO$$ [Official Video] prod. by Saucelikedonx\" target=\"_blank\">Fr. 18.09.20</a><div class=\"info\"><div class=\"close\"></div><div class=\"circle\" style=\"background-image:url(https://i1.ytimg.com/vi/lNCwI2itJbA/hqdefault.jpg)\"></div><p>King NB - BO$$ [Official Video] prod. by Saucelikedonx<br><br>Views: 2728 &nbsp; Ø/Video: 10539<br>Veröffentlicht am: Fr. 18.09.20 um 19:00 Uhr</p><div class=\"abobar\"><a href=\"https://youtu.be/lNCwI2itJbA\" target=\"_blank\" class=\"red\">zum Video</a></div></div></td>', 2728, '2020-09-18T17:00:12+00:00', '200918190012', 'ch');
INSERT INTO `channels` VALUES (331, 0, 'UCsdYbDenEXVloUc6mYfDStw', 'Sara machts', 'Ich bin en Macherin vor de Kamera, wo ned alles uf Goldwaag leid.<br /><br />...........................................................................................................................................................................................................................<br /><br />Über mich:<br />sarabachmann.ch<br /><br />Über mini Firma:<br />saramachts.ch<br /><br />Ich machs au do:<br />INSTAGRAM: @saramachts<br />FACEBOOK: facebook.com/sarabachmannofficial<br />SNAPCHAT: @saramachts<br />MUSICAL.LY: @saramachts', 'https://yt3.ggpht.com/a/AATXAJxoVwwiw0zNny_O6BMNc0A9Ea_NTGaSpf_iWPIGvw=s88-c-k-c0xffffffff-no-rj-mo', 'Sara Bachmann', '', 'https://www.sarabachmann.ch', '', '', 'saramachts', '-6-9-14-18-29-', '27.10.2009', '201017-11', '201017-11', 3109, 4556, 5899, 7146, 7900, 8450, NULL, 2683008, 3907409, 5138042, 6056305, 6614904, 7088942, NULL, 453, NULL, 'Colour Stay Shampoo | Style like a host', 'W_qCcCnRgKI', '<td class=\"yt-lastvideo\" data-sort=\"200622152758\" data-utime=\"201017-11\"><a href=\"https://youtu.be/W_qCcCnRgKI\" title=\"Colour Stay Shampoo | Style like a host\" target=\"_blank\">Mo. 22.06.20</a><div class=\"info\"><div class=\"close\"></div><div class=\"circle\" style=\"background-image:url(https://i4.ytimg.com/vi/W_qCcCnRgKI/hqdefault.jpg)\"></div><p>Colour Stay Shampoo | Style like a host<br><br>Views: 392 &nbsp; Ø/Video: 15649<br>Veröffentlicht am: Mo. 22.06.20 um 15:27 Uhr</p><div class=\"abobar\"><a href=\"https://youtu.be/W_qCcCnRgKI\" target=\"_blank\" class=\"red\">zum Video</a></div></div></td>', 392, '2020-06-22T13:27:58+00:00', '200622152758', 'ch');
INSERT INTO `channels` VALUES (332, 0, 'UCRavEtOkesgfuXol-ElvVyw', 'MaeLOL', 'Livestream Usschnitte & Highlights und komplett gechillti Atmosphäre vom Maelo.<br /><br />- Hauptkanal: Maelo<br />- Twitch: maeloromani<br />- Instagram: @maeloromani<br />- Podcast: Privatchat Podcast<br /><br />gönnt öch dii beschti Unterhaltig, lul!', 'https://yt3.ggpht.com/a/AATXAJzEytmUa66_kqusPj6_yM86nnIWrjpjjd6OBrSI9g=s88-c-k-c0xffffffff-no-rj-mo', '', 'https://www.youtube.com/maelol', '', '', '', 'maeloromani', '-6-15-24-', '19.07.2014', '201017-11', '201017-11', 0, 0, 0, 0, 745, 5410, NULL, 0, 0, 0, 0, 18785, 402750, NULL, 230, NULL, 'ORTE in LUZERN erraten 🇨🇭 GEOGUESSR SCHWEIZ 🤔 Maelo Livestream Highlights', 'ysj36X7P7SI', '<td class=\"yt-lastvideo\" data-sort=\"201017110009\" data-utime=\"201017-11\"><a href=\"https://youtu.be/ysj36X7P7SI\" title=\"ORTE in LUZERN erraten 🇨🇭 GEOGUESSR SCHWEIZ 🤔 Maelo Livestream Highlights\" target=\"_blank\">Sa. 17.10.20</a><div class=\"info\"><div class=\"close\"></div><div class=\"circle\" style=\"background-image:url(https://i2.ytimg.com/vi/ysj36X7P7SI/hqdefault.jpg)\"></div><p>ORTE in LUZERN erraten 🇨🇭 GEOGUESSR SCHWEIZ 🤔 Maelo Livestream Highlights<br><br>Views: 54 &nbsp; Ø/Video: 1751<br>Veröffentlicht am: Sa. 17.10.20 um 11:00 Uhr</p><div class=\"abobar\"><a href=\"https://youtu.be/ysj36X7P7SI\" target=\"_blank\" class=\"red\">zum Video</a></div></div></td>', 54, '2020-10-17T09:00:09+00:00', '201017110009', 'ch');
INSERT INTO `channels` VALUES (333, 1, 'UCxy0ues-Qgrs871Cz_m72ZA', 'LYRICS TV', '', 'https://yt3.ggpht.com/a/AATXAJx3kn1eB2KSKEpVnP51jms7vmBOqd5UrpKx202j=s88-c-k-c0xffffffff-no-rj-mo', '', 'https://www.youtube.com/lyricsmagazinch', 'https://lyricsmagazin.ch', '', '', 'lyricsmagazin', '-8-9-', '25.03.2015', '201016-20', '201017-11', 0, 411, 1259, 2078, 2520, 2660, NULL, 0, 48902, 233920, 439493, 608951, 698914, NULL, 82, NULL, 'YBN Cordae performs his hit «bad idea» on Swiss German - Openair Frauenfeld', 'bLrfoMG81hA', '<td class=\"yt-lastvideo\" data-sort=\"190806001119\" data-utime=\"201017-11\"><a href=\"https://youtu.be/bLrfoMG81hA\" title=\"YBN Cordae performs his hit «bad idea» on Swiss German - Openair Frauenfeld\" target=\"_blank\">Di. 06.08.19</a><div class=\"info\"><div class=\"close\"></div><div class=\"circle\" style=\"background-image:url(https://i3.ytimg.com/vi/bLrfoMG81hA/hqdefault.jpg)\"></div><p>YBN Cordae performs his hit «bad idea» on Swiss German - Openair Frauenfeld<br><br>Views: 617 &nbsp; Ø/Video: 8523<br>Veröffentlicht am: Di. 06.08.19 um 00:11 Uhr</p><div class=\"abobar\"><a href=\"https://youtu.be/bLrfoMG81hA\" target=\"_blank\" class=\"red\">zum Video</a></div></div></td>', 617, '2019-08-05T22:11:19+00:00', '190806001119', 'ch');
INSERT INTO `channels` VALUES (334, 0, 'UC1O5__Uj3u4nIHHUAWvyBIg', 'The Nerds', 'Unnötiges Wissen für Jedermann.<br /><br />Mir sind 2 Brüedere, wo eifach Lust uf en Podcast händ und eu unnötigs Wüsse wänd vermittle. Jedi Wuche hämer es Thema und zu dem Thema gits spannendi, kuriosi Fakte. Usserdem machemer immer am Endi vom Podcast es Quiz mit dem Wüsse. Am beste losed er eifach dri. Und wen er vo afang ah wend lose, losed doch am Folg 13. Dete hämmer di Finali Form vom Podcast erreicht.', 'https://yt3.ggpht.com/a/AATXAJzCVG3ymZ-oDH6JSVq5enPvZdU7gl233ULDBXoR=s88-c-k-c0xffffffff-no-rj-mo', '', '', '', 'https://anchor.fm/thenerds-podcast', '', 'thenerds_podcast', '-12-', '29.12.2019', '201017-11', '201017-11', 0, 0, 0, 0, 0, 15, NULL, 0, 0, 0, 0, 0, 317, NULL, 30, NULL, 'The Nerds Folge 28 - In den Weiten des Weltraums', 'jhlYiLPteGI', '<td class=\"yt-lastvideo\" data-sort=\"200713091409\" data-utime=\"201017-11\"><a href=\"https://youtu.be/jhlYiLPteGI\" title=\"The Nerds Folge 28 - In den Weiten des Weltraums\" target=\"_blank\">Mo. 13.07.20</a><div class=\"info\"><div class=\"close\"></div><div class=\"circle\" style=\"background-image:url(https://i3.ytimg.com/vi/jhlYiLPteGI/hqdefault.jpg)\"></div><p>The Nerds Folge 28 - In den Weiten des Weltraums<br><br>Views: 14 &nbsp; Ø/Video: 11<br>Veröffentlicht am: Mo. 13.07.20 um 09:14 Uhr</p><div class=\"abobar\"><a href=\"https://youtu.be/jhlYiLPteGI\" target=\"_blank\" class=\"red\">zum Video</a></div></div></td>', 14, '2020-07-13T07:14:09+00:00', '200713091409', 'ch');
INSERT INTO `channels` VALUES (335, 0, 'UCXlgNLBjG0bzWNa3qXJJ20g', 'Fotoremo', '', 'https://yt3.ggpht.com/a/AATXAJzzI33FslGCtrTqoSOrRDh7IrEc6-XQZuGXD0pY=s88-c-k-c0xffffffff-no-rj-mo', 'Remo Peer', '', 'https://www.fotoremo.ch', '', '', 'fotoremo.ch', '-3-31-', '28.11.2015', '201017-11', '201017-11', 0, 0, 24, 53, 100, 116, NULL, 0, 0, 6049, 14141, 30726, 45588, NULL, 11, NULL, 'Südafrika - Auf der Garden Route von Port Elizabeth nach Kapstadt', 'U_xnhNrqRyA', '<td class=\"yt-lastvideo\" data-sort=\"200118183909\" data-utime=\"201017-11\"><a href=\"https://youtu.be/U_xnhNrqRyA\" title=\"Südafrika - Auf der Garden Route von Port Elizabeth nach Kapstadt\" target=\"_blank\">Sa. 18.01.20</a><div class=\"info\"><div class=\"close\"></div><div class=\"circle\" style=\"background-image:url(https://i2.ytimg.com/vi/U_xnhNrqRyA/hqdefault.jpg)\"></div><p>Südafrika - Auf der Garden Route von Port Elizabeth nach Kapstadt<br><br>Views: 3698 &nbsp; Ø/Video: 4144<br>Veröffentlicht am: Sa. 18.01.20 um 18:39 Uhr</p><div class=\"abobar\"><a href=\"https://youtu.be/U_xnhNrqRyA\" target=\"_blank\" class=\"red\">zum Video</a></div></div></td>', 3698, '2020-01-18T17:39:09+00:00', '200118183909', 'ch');
INSERT INTO `channels` VALUES (336, 0, 'UCb1UQ-uUy4aN8OeUA9OIicA', 'MA GamesTV', 'Hallo und herzlich willkommen auf unserem Kanal.<br /><br />Wir sind Michael und Alessio<br /><br /><br />Wir zeigen euch hier Einblicke in verschiedene Games, testen sie für euch machen Reviews, unboxings und streamen Live auf Twitch. <br /><br />Jeden Freitag laufen die MANews, Infos zu aktuellen Videogames, Filmen und weitere News der Woche.<br /><br /><br /><br />Unsere T-Shirt  und Hoodi Kollektion Season 1 ist gestartet falls ihr an einem interessiert seid schreibt uns gerne per Mail.<br /><br />Verschiedene Projekte sind im Aufbau und News werden diesbezüglich noch folgen seid gespannt.<br /><br />Bei Fragen oder sonstigem könnt Ihr uns gerne per Mail anschreiben.-.:::: magamestv88@gmail.com<br /><br />Euer MA Games Team', 'https://yt3.ggpht.com/a/AATXAJxjvOC0QqNW81tmmqPqeCysZ86adZRzuVj6IspHXQ=s88-c-k-c0xffffffff-no-rj-mo', '', '', '', '', 'magamestv', 'MAGamesTV', '-4-11-27-', '08.03.2019', '201017-11', '201017-11', 0, 0, 0, 0, 98, 138, NULL, 0, 0, 0, 0, 5849, 10211, NULL, 148, NULL, 'Baldurs Gate 3 TOP | Crucible eingestellt | MANews', 'O9yl94TvJW4', '<td class=\"yt-lastvideo\" data-sort=\"201016120006\" data-utime=\"201017-11\"><a href=\"https://youtu.be/O9yl94TvJW4\" title=\"Baldurs Gate 3 TOP | Crucible eingestellt | MANews\" target=\"_blank\">Fr. 16.10.20</a><div class=\"info\"><div class=\"close\"></div><div class=\"circle\" style=\"background-image:url(https://i4.ytimg.com/vi/O9yl94TvJW4/hqdefault.jpg)\"></div><p>Baldurs Gate 3 TOP | Crucible eingestellt | MANews<br><br>Views: 19 &nbsp; Ø/Video: 69<br>Veröffentlicht am: Fr. 16.10.20 um 12:00 Uhr</p><div class=\"abobar\"><a href=\"https://youtu.be/O9yl94TvJW4\" target=\"_blank\" class=\"red\">zum Video</a></div></div></td>', 19, '2020-10-16T10:00:06+00:00', '201016120006', 'ch');
INSERT INTO `channels` VALUES (337, 0, 'UCOBV9Eix-pcTaJw5qUJSw6w', 'Patti Basler', '', 'https://yt3.ggpht.com/a/AATXAJy4szSSShVjOBmT6IqwFXsr3Ng0R4QjuTD5YS2Ysg=s88-c-k-c0xffffffff-no-rj-mo', '', '', 'http://www.pattibasler.ch', '', '', 'pattibasler', '-6-14-22-', '15.06.2009', '201017-11', '201017-11', 0, 0, 0, 0, 0, 408, NULL, 0, 0, 0, 0, 0, 48673, NULL, 30, NULL, 'ApocalypsoTV PATTI BASLER & PHILIPPE KUHN Lieber Ignazio Cassis', 'J8BbyVHpu0M', '<td class=\"yt-lastvideo\" data-sort=\"200613152011\" data-utime=\"201017-11\"><a href=\"https://youtu.be/J8BbyVHpu0M\" title=\"ApocalypsoTV PATTI BASLER & PHILIPPE KUHN Lieber Ignazio Cassis\" target=\"_blank\">Sa. 13.06.20</a><div class=\"info\"><div class=\"close\"></div><div class=\"circle\" style=\"background-image:url(https://i3.ytimg.com/vi/J8BbyVHpu0M/hqdefault.jpg)\"></div><p>ApocalypsoTV PATTI BASLER & PHILIPPE KUHN Lieber Ignazio Cassis<br><br>Views: 256 &nbsp; Ø/Video: 1622<br>Veröffentlicht am: Sa. 13.06.20 um 15:20 Uhr</p><div class=\"abobar\"><a href=\"https://youtu.be/J8BbyVHpu0M\" target=\"_blank\" class=\"red\">zum Video</a></div></div></td>', 256, '2020-06-13T13:20:11+00:00', '200613152011', 'ch');
INSERT INTO `channels` VALUES (338, 0, 'UCuYkkkrnjQSepXv5LJBWW6A', 'Gwünnermusic Zürich', 'GWÜNNERMUSIC ZÜRICH', 'https://yt3.ggpht.com/a/AATXAJzFQuIgrls1iCDzpOGCeIaEBBaJUhsJiitevhJ-Tw=s88-c-k-c0xffffffff-no-rj-mo', '', '', '', '', '', 'onkel_ari', '-8-20-', '21.09.2016', '201017-11', '201017-11', 0, 0, 1020, 2144, 2640, 3050, NULL, 0, 0, 161350, 312625, 509023, 628582, NULL, 4, NULL, 'Onkel Ari - Down (Official Video) Prod. by L8V8L', 'w0htYZ6-kZM', '<td class=\"yt-lastvideo\" data-sort=\"200305200007\" data-utime=\"201017-11\"><a href=\"https://youtu.be/w0htYZ6-kZM\" title=\"Onkel Ari - Down (Official Video) Prod. by L8V8L\" target=\"_blank\">Do. 05.03.20</a><div class=\"info\"><div class=\"close\"></div><div class=\"circle\" style=\"background-image:url(https://i4.ytimg.com/vi/w0htYZ6-kZM/hqdefault.jpg)\"></div><p>Onkel Ari - Down (Official Video) Prod. by L8V8L<br><br>Views: 90759 &nbsp; Ø/Video: 157146<br>Veröffentlicht am: Do. 05.03.20 um 20:00 Uhr</p><div class=\"abobar\"><a href=\"https://youtu.be/w0htYZ6-kZM\" target=\"_blank\" class=\"red\">zum Video</a></div></div></td>', 90759, '2020-03-05T19:00:07+00:00', '200305200007', 'ch');
INSERT INTO `channels` VALUES (339, 0, 'UCVotk52nRcP2l0UHYMtodyw', 'Jordan Parat', 'ZÜRICH FINEST', 'https://yt3.ggpht.com/a/AATXAJygQG0RdQa8iGdPsbhMBeV_wasf3V2DnDXlOnIb=s88-c-k-c0xffffffff-no-rj-mo', '', '', '', '', '', '', '-8-20-', '25.01.2017', '201017-11', '201017-11', 0, 0, 165, 2019, 3890, 5200, NULL, 0, 0, 36228, 367416, 810232, 1089659, NULL, 8, NULL, 'Jordan Parat feat. EAZ - So eifach', 'yES1B6QJuls', '<td class=\"yt-lastvideo\" data-sort=\"200812120239\" data-utime=\"201017-11\"><a href=\"https://youtu.be/yES1B6QJuls\" title=\"Jordan Parat feat. EAZ - So eifach\" target=\"_blank\">Mi. 12.08.20</a><div class=\"info\"><div class=\"close\"></div><div class=\"circle\" style=\"background-image:url(https://i2.ytimg.com/vi/yES1B6QJuls/hqdefault.jpg)\"></div><p>Jordan Parat feat. EAZ - So eifach<br><br>Views: 38267 &nbsp; Ø/Video: 136207<br>Veröffentlicht am: Mi. 12.08.20 um 12:02 Uhr</p><div class=\"abobar\"><a href=\"https://youtu.be/yES1B6QJuls\" target=\"_blank\" class=\"red\">zum Video</a></div></div></td>', 38267, '2020-08-12T10:02:39+00:00', '200812120239', 'ch');
INSERT INTO `channels` VALUES (340, 0, 'UC97FMdlARgF_LHwbe2jqfMg', 'SwissLPGamers', 'Willkommen auf dem Kanal von SwissLPGamers!<br /><br />Wir sind zwei Schweizer die seit ein paar Jahren Videos für die Schweizer Community produzieren.<br />Auf unserem Kanal findest du hauptsächlich Let`s Plays.<br />Manchmal gibt es aber auch Reviews, Gewinnspiele oder Streams.<br /><br />Wir wollen dir eine grosse und vielfältige Platte an Let`s Plays bieten, darum kannst du uns deine Wünsche immer in die Kommentare oder als PN schreiben.<br /><br />Unser Team besteht aus:<br />-Hurni97<br /><br />Hast du lust mit uns zu reden oder einfach mit deinen Kollegen zocken?<br />Dann joine noch heute auf unseren SwissLPGamers TS3 Server!<br />IP: SwissLPGamers.nitrado.net<br /><br />Besuch uns doch auf den unten verlinkten Plattformen, es würde uns freuen dich wieder zu sehen.<br />Liebe Grüsse, Euer SwissLPGamers-Crew', 'https://yt3.ggpht.com/a/AATXAJzHQ-dy6mFcTY642n_frroBBQrm2YnFwXEdxycDUA=s88-c-k-c0xffffffff-no-rj-mo', '', 'https://www.youtube.com/swisslpgamers', 'https://swisslpgamers.ch', '', 'swisslpgamers', 'swisslpgamers', '-4-11-15-25-', '05.06.2012', '201017-11', '201017-11', 388, 493, 563, 627, 660, 683, NULL, 68794, 94305, 110112, 121920, 129935, 139036, NULL, 1337, NULL, 'Hurni kocht 👨‍🍳 | Beeren-Streuselkuchen 🍰 | #01 | Schweizerdeutsch', 'Gr7kjI3D0H4', '<td class=\"yt-lastvideo\" data-sort=\"200809204139\" data-utime=\"201017-11\"><a href=\"https://youtu.be/Gr7kjI3D0H4\" title=\"Hurni kocht 👨‍🍳 | Beeren-Streuselkuchen 🍰 | #01 | Schweizerdeutsch\" target=\"_blank\">So. 09.08.20</a><div class=\"info\"><div class=\"close\"></div><div class=\"circle\" style=\"background-image:url(https://i4.ytimg.com/vi/Gr7kjI3D0H4/hqdefault.jpg)\"></div><p>Hurni kocht 👨‍🍳 | Beeren-Streuselkuchen 🍰 | #01 | Schweizerdeutsch<br><br>Views: 64 &nbsp; Ø/Video: 104<br>Veröffentlicht am: So. 09.08.20 um 20:41 Uhr</p><div class=\"abobar\"><a href=\"https://youtu.be/Gr7kjI3D0H4\" target=\"_blank\" class=\"red\">zum Video</a></div></div></td>', 64, '2020-08-09T18:41:39+00:00', '200809204139', 'ch');
INSERT INTO `channels` VALUES (341, 0, 'UCsInF5d9_xkivttxhG2kPuA', 'N1njaBoy', 'Schwiizer wo Spass am Zocke het 🤪 #swisstubers', 'https://yt3.ggpht.com/a/AATXAJyJ9XqRQo98tVIel3RNlX-Ps6gQZnUiDmCi6dmxvw=s88-c-k-c0xffffffff-no-rj-mo', '', '', '', '', 'n1njaboy', 'n1njaboy_twitch', '-4-11-', '15.06.2010', '201017-11', '201017-11', 0, 0, 0, 0, 0, 165, NULL, 0, 0, 0, 0, 0, 5917, NULL, 202, NULL, 'Kabooom - Dying light - Part 5', '8t8iQu7Y4W0', '<td class=\"yt-lastvideo\" data-sort=\"200727210418\" data-utime=\"201017-11\"><a href=\"https://youtu.be/8t8iQu7Y4W0\" title=\"Kabooom - Dying light - Part 5\" target=\"_blank\">Mo. 27.07.20</a><div class=\"info\"><div class=\"close\"></div><div class=\"circle\" style=\"background-image:url(https://i1.ytimg.com/vi/8t8iQu7Y4W0/hqdefault.jpg)\"></div><p>Kabooom - Dying light - Part 5<br><br>Views: 6 &nbsp; Ø/Video: 29<br>Veröffentlicht am: Mo. 27.07.20 um 21:04 Uhr</p><div class=\"abobar\"><a href=\"https://youtu.be/8t8iQu7Y4W0\" target=\"_blank\" class=\"red\">zum Video</a></div></div></td>', 6, '2020-07-27T19:04:18+00:00', '200727210418', 'ch');
INSERT INTO `channels` VALUES (342, 0, 'UC-8opPZu9x2sLvV6Feh-uDA', 'KING JOKER', '', 'https://yt3.ggpht.com/a/AATXAJxjdzr3l5c5SDqEadFttE6L3UeubiM0moYMHLpPLQ=s88-c-k-c0xffffffff-no-rj-mo', '', '', '', '', 'klng_joker', '', '-4-11-', '11.06.2013', '201017-11', '201017-11', 0, 7, 8, 12, 12, 28, NULL, 0, 611, 1002, 1199, 1374, 3496, NULL, 92, NULL, '[CH] I HA BLUET GLECKT IN AMONG US - KING JOKER', '_WGTjjW64y8', '<td class=\"yt-lastvideo\" data-sort=\"201010215021\" data-utime=\"201017-11\"><a href=\"https://youtu.be/_WGTjjW64y8\" title=\"[CH] I HA BLUET GLECKT IN AMONG US - KING JOKER\" target=\"_blank\">Sa. 10.10.20</a><div class=\"info\"><div class=\"close\"></div><div class=\"circle\" style=\"background-image:url(https://i4.ytimg.com/vi/_WGTjjW64y8/hqdefault.jpg)\"></div><p>[CH] I HA BLUET GLECKT IN AMONG US - KING JOKER<br><br>Views: 38 &nbsp; Ø/Video: 38<br>Veröffentlicht am: Sa. 10.10.20 um 21:50 Uhr</p><div class=\"abobar\"><a href=\"https://youtu.be/_WGTjjW64y8\" target=\"_blank\" class=\"red\">zum Video</a></div></div></td>', 38, '2020-10-10T19:50:21+00:00', '201010215021', 'ch');
INSERT INTO `channels` VALUES (343, 1, 'UCEyBnGXgfEHC5Oc9jquY5sA', 'Tize.ch', 'Tize.ch: Das Magazin von & für die junge Generation. #Jung, #frech, #dynamisch.', 'https://yt3.ggpht.com/a/AATXAJzUblbWDcumj8DGCgfLnF1Cyot3zgTrH1htvWNC=s88-c-k-c0xffffffff-no-rj-mo', '', '', '', '', '', 'tize.ch', '-6-', '18.04.2018', '201016-20', '201017-11', 0, 0, 0, 0, 49, 52, NULL, 0, 0, 0, 0, 2721, 2963, NULL, 10, NULL, 'Tize.ch an den Swiss Music Awards 2019', 'kj8Ad3Tc_IM', '<td class=\"yt-lastvideo\" data-sort=\"190217232038\" data-utime=\"201017-11\"><a href=\"https://youtu.be/kj8Ad3Tc_IM\" title=\"Tize.ch an den Swiss Music Awards 2019\" target=\"_blank\">So. 17.02.19</a><div class=\"info\"><div class=\"close\"></div><div class=\"circle\" style=\"background-image:url(https://i4.ytimg.com/vi/kj8Ad3Tc_IM/hqdefault.jpg)\"></div><p>Tize.ch an den Swiss Music Awards 2019<br><br>Views: 217 &nbsp; Ø/Video: 296<br>Veröffentlicht am: So. 17.02.19 um 23:20 Uhr</p><div class=\"abobar\"><a href=\"https://youtu.be/kj8Ad3Tc_IM\" target=\"_blank\" class=\"red\">zum Video</a></div></div></td>', 217, '2019-02-17T22:20:38+00:00', '190217232038', 'ch');
INSERT INTO `channels` VALUES (344, 0, 'UCnj4x0rS44EnWi2jUyEsyMQ', 'Noa Goldstein', 'Mein Name ist Noa Goldstein - vor 11 Jahren begann ich zu fotografieren und heute bin ich <br />professioneller People- und Werbefotograf.<br />Auf meinem Kanal erfährst du alles rund um das Thema Fotografie und Bildbearbeitung. Das ganze nicht auf <br />Hochdeutsch, Englisch oder Französisch - sonder auf Schweizerdeutsch. Wenn auch du dich für die Fotografie und <br />Bildbearbeitung interessierst, abonniere mein Kanal und lerne gemeinsam mit mir das Fotografieren<br /><br />▶️ Web: nogoldstein.com<br /><br />▶️ Facebook: @Noa Goldstein Photography<br /><br />▶️ Instagram @noa.goldstein_photography', 'https://yt3.ggpht.com/a/AATXAJxnGWe_ytabtNBYmGDhGPXX7iU3U0g0vmljHxUaPg=s88-c-k-c0xffffffff-no-rj-mo', '', '', 'https://www.noagoldstein.com', '', '', 'noa.goldstein_photography', '-3-18-', '31.08.2020', '201017-11', '201017-11', 0, 0, 0, 0, 0, 18, NULL, 0, 0, 0, 0, 0, 709, NULL, 23, NULL, '▶️ Real Talk Freitag #4 I Mit Daniel Salzmann ⚽️', 'VKc4VZ8sMTg', '<td class=\"yt-lastvideo\" data-sort=\"201009173003\" data-utime=\"201017-11\"><a href=\"https://youtu.be/VKc4VZ8sMTg\" title=\"▶️ Real Talk Freitag #4 I Mit Daniel Salzmann ⚽️\" target=\"_blank\">Fr. 09.10.20</a><div class=\"info\"><div class=\"close\"></div><div class=\"circle\" style=\"background-image:url(https://i3.ytimg.com/vi/VKc4VZ8sMTg/hqdefault.jpg)\"></div><p>▶️ Real Talk Freitag #4 I Mit Daniel Salzmann ⚽️<br><br>Views: 36 &nbsp; Ø/Video: 31<br>Veröffentlicht am: Fr. 09.10.20 um 17:30 Uhr</p><div class=\"abobar\"><a href=\"https://youtu.be/VKc4VZ8sMTg\" target=\"_blank\" class=\"red\">zum Video</a></div></div></td>', 36, '2020-10-09T15:30:03+00:00', '201009173003', 'ch');
INSERT INTO `channels` VALUES (345, 0, 'UC_AURBE754hG41nUDvl7LHA', 'Wariashi', 'De einzig Wari.', 'https://yt3.ggpht.com/a/AATXAJzOiVSycoERmbb75ITmrl_03-rBDLVfG4Pv2nBB=s88-c-k-c0xffffffff-no-rj-mo', '', 'https://www.youtube.com/Wariashi', '', 'https://open.spotify.com/show/6SV8sYZTbG6E9ewjcptPQi', '', '', '-6-12-', '06.02.2014', '201017-11', '201017-11', 0, 0, 0, 0, 0, 58, NULL, 0, 0, 0, 0, 0, 290, NULL, 2, NULL, 'Supportcast Outtakes', '6BaKaygvhac', '<td class=\"yt-lastvideo\" data-sort=\"200429180010\" data-utime=\"201017-11\"><a href=\"https://youtu.be/6BaKaygvhac\" title=\"Supportcast Outtakes\" target=\"_blank\">Mi. 29.04.20</a><div class=\"info\"><div class=\"close\"></div><div class=\"circle\" style=\"background-image:url(https://i3.ytimg.com/vi/6BaKaygvhac/hqdefault.jpg)\"></div><p>Supportcast Outtakes<br><br>Views: 104 &nbsp; Ø/Video: 145<br>Veröffentlicht am: Mi. 29.04.20 um 18:00 Uhr</p><div class=\"abobar\"><a href=\"https://youtu.be/6BaKaygvhac\" target=\"_blank\" class=\"red\">zum Video</a></div></div></td>', 104, '2020-04-29T16:00:10+00:00', '200429180010', 'ch');
INSERT INTO `channels` VALUES (346, 0, 'UCnrizBjYthFlj_spTBu_XDA', 'Gucci Gubi', '', 'https://yt3.ggpht.com/a/AATXAJyBNpv9BmUiNV9_vjksRbO0tlccAeHVoFdIvRBviQ=s88-c-k-c0xffffffff-no-rj-mo', '', '', '', '', '', 'guccigubi', '-6-8-', '20.04.2015', '201017-11', '201017-11', 0, 0, 36, 63, 85, 97, NULL, 0, 0, 13330, 21520, 10847, 14485, NULL, 14, NULL, 'GUBI - Über Nacht', 'XeII4ZZVo-o', '<td class=\"yt-lastvideo\" data-sort=\"201013170013\" data-utime=\"201017-11\"><a href=\"https://youtu.be/XeII4ZZVo-o\" title=\"GUBI - Über Nacht\" target=\"_blank\">Di. 13.10.20</a><div class=\"info\"><div class=\"close\"></div><div class=\"circle\" style=\"background-image:url(https://i1.ytimg.com/vi/XeII4ZZVo-o/hqdefault.jpg)\"></div><p>GUBI - Über Nacht<br><br>Views: 173 &nbsp; Ø/Video: 1035<br>Veröffentlicht am: Di. 13.10.20 um 17:00 Uhr</p><div class=\"abobar\"><a href=\"https://youtu.be/XeII4ZZVo-o\" target=\"_blank\" class=\"red\">zum Video</a></div></div></td>', 173, '2020-10-13T15:00:13+00:00', '201013170013', 'ch');
INSERT INTO `channels` VALUES (347, 0, 'UCqjzVEpePv6aZzL27YuOp2Q', 'Fearless Generation', '', 'https://yt3.ggpht.com/a/AATXAJxcGZSD5xi9JVwB3kqF2yXsJmrJ2K8Gooo5LOxyww=s88-c-k-c0xffffffff-no-rj-mo', '', 'https://www.youtube.com/fearlessgeneration', '', '', '', 'message_fg', '-8-', '14.07.2017', '201017-11', '201017-11', 0, 0, 0, 128, 269, 336, NULL, 0, 0, 0, 5342, 28312, 42850, NULL, 43, NULL, 'Message - Narbe [Audio] prod. by Beats a la Casa', 'i9_9XQfLVqQ', '<td class=\"yt-lastvideo\" data-sort=\"200221000015\" data-utime=\"201017-11\"><a href=\"https://youtu.be/i9_9XQfLVqQ\" title=\"Message - Narbe [Audio] prod. by Beats a la Casa\" target=\"_blank\">Fr. 21.02.20</a><div class=\"info\"><div class=\"close\"></div><div class=\"circle\" style=\"background-image:url(https://i2.ytimg.com/vi/i9_9XQfLVqQ/hqdefault.jpg)\"></div><p>Message - Narbe [Audio] prod. by Beats a la Casa<br><br>Views: 312 &nbsp; Ø/Video: 997<br>Veröffentlicht am: Fr. 21.02.20 um 00:00 Uhr</p><div class=\"abobar\"><a href=\"https://youtu.be/i9_9XQfLVqQ\" target=\"_blank\" class=\"red\">zum Video</a></div></div></td>', 312, '2020-02-20T23:00:15+00:00', '200221000015', 'ch');
INSERT INTO `channels` VALUES (348, 0, 'UC-4iBCMmz3sJ2cNjIxh4p8g', 'Likurso CH', 'Ab sofort kommt hier auf dem kanal nur noch musik videos', 'https://yt3.ggpht.com/a/AATXAJxGDCvz-jL-yGui-JPgUOacWz2aHSNo9yNOc8Ox3A=s88-c-k-c0xffffffff-no-rj-mo', '', '', '', '', '', '', '-8-12-', '14.09.2017', '201017-11', '201017-11', 0, 0, 0, 0, 0, 42, NULL, 0, 0, 0, 0, 0, 1252, NULL, 17, NULL, 'Likurso Pottcast #5 Politischs Thema', '7Vi3vKIJRZ4', '<td class=\"yt-lastvideo\" data-sort=\"200219160948\" data-utime=\"201017-11\"><a href=\"https://youtu.be/7Vi3vKIJRZ4\" title=\"Likurso Pottcast #5 Politischs Thema\" target=\"_blank\">Mi. 19.02.20</a><div class=\"info\"><div class=\"close\"></div><div class=\"circle\" style=\"background-image:url(https://i4.ytimg.com/vi/7Vi3vKIJRZ4/hqdefault.jpg)\"></div><p>Likurso Pottcast #5 Politischs Thema<br><br>Views: 56 &nbsp; Ø/Video: 74<br>Veröffentlicht am: Mi. 19.02.20 um 16:09 Uhr</p><div class=\"abobar\"><a href=\"https://youtu.be/7Vi3vKIJRZ4\" target=\"_blank\" class=\"red\">zum Video</a></div></div></td>', 56, '2020-02-19T15:09:48+00:00', '200219160948', 'ch');
INSERT INTO `channels` VALUES (349, 1, 'UCmG5pmhiYWdS7HkPKNQFhCw', 'RuehSäubst', 'Zwöi Giele wo zGfüeu hei si sige lustig :D', 'https://yt3.ggpht.com/a/AATXAJzt_ND6hzM3v8dOfOQSHHZfCmAbekYDaYo4eHTG=s88-c-k-c0xffffffff-no-rj-mo', '', 'https://www.youtube.com/ruehsaubst', '', '', '', 'ruehsaubst', '-6-', '17.10.2017', '201016-20', '201017-11', 0, 0, 103, 135, 145, 140, NULL, 0, 0, 1510, 2615, 3079, 3152, NULL, 4, NULL, 'Summerferie? (mit Cyru)', 'HuAk7vbJP1U', '<td class=\"yt-lastvideo\" data-sort=\"190110091509\" data-utime=\"201017-11\"><a href=\"https://youtu.be/HuAk7vbJP1U\" title=\"Summerferie? (mit Cyru)\" target=\"_blank\">Do. 10.01.19</a><div class=\"info\"><div class=\"close\"></div><div class=\"circle\" style=\"background-image:url(https://i1.ytimg.com/vi/HuAk7vbJP1U/hqdefault.jpg)\"></div><p>Summerferie? (mit Cyru)<br><br>Views: 333 &nbsp; Ø/Video: 788<br>Veröffentlicht am: Do. 10.01.19 um 09:15 Uhr</p><div class=\"abobar\"><a href=\"https://youtu.be/HuAk7vbJP1U\" target=\"_blank\" class=\"red\">zum Video</a></div></div></td>', 333, '2019-01-10T08:15:09+00:00', '190110091509', 'ch');
INSERT INTO `channels` VALUES (350, 0, 'UCf_VdXkhQccpigg5FbLYpEA', 'King Pepe', '', 'https://yt3.ggpht.com/a/AATXAJw8bU3FR5MJT2hkfEs8Kr_43zOM0vwlStyUuOS7=s88-c-k-c0xffffffff-no-rj-mo', '', 'https://www.youtube.com/pepeisfree', 'https://kingpepe.ch', '', '', 'kingpepe.ch', '-8-', '04.06.2007', '201017-11', '201017-11', 0, 0, 0, 0, 371, 414, NULL, 0, 0, 0, 0, 413936, 438819, NULL, 35, NULL, 'King Pepe :.:.: Öppis Schöns kaputt mache :.:.: Official Music Video', 'i6TUgjbVvMw', '<td class=\"yt-lastvideo\" data-sort=\"200124104517\" data-utime=\"201017-11\"><a href=\"https://youtu.be/i6TUgjbVvMw\" title=\"King Pepe :.:.: Öppis Schöns kaputt mache :.:.: Official Music Video\" target=\"_blank\">Fr. 24.01.20</a><div class=\"info\"><div class=\"close\"></div><div class=\"circle\" style=\"background-image:url(https://i2.ytimg.com/vi/i6TUgjbVvMw/hqdefault.jpg)\"></div><p>King Pepe :.:.: Öppis Schöns kaputt mache :.:.: Official Music Video<br><br>Views: 864 &nbsp; Ø/Video: 12538<br>Veröffentlicht am: Fr. 24.01.20 um 10:45 Uhr</p><div class=\"abobar\"><a href=\"https://youtu.be/i6TUgjbVvMw\" target=\"_blank\" class=\"red\">zum Video</a></div></div></td>', 864, '2020-01-24T09:45:17+00:00', '200124104517', 'ch');
INSERT INTO `channels` VALUES (351, 0, 'UCxqPGnbRq2TCnXxT4ZuhCLw', 'Nico Luethi', 'Filmmaker, Musician and Composer', 'https://yt3.ggpht.com/a/AATXAJw3mOZTpARRHc1-iOuzVBHklu-z6FpXCKuLY5Mc8A=s88-c-k-c0xffffffff-no-rj-mo', '', '', '', '', '', 'luethi.music', '-8-', '06.03.2016', '201017-11', '201017-11', 0, 0, 0, 0, 0, 44, NULL, 0, 0, 0, 0, 0, 1250, NULL, 9, NULL, 'Nico.Lino - Movies Official Video) ft. Prod.Lois', '45UTzvmmT9w', '<td class=\"yt-lastvideo\" data-sort=\"201003210000\" data-utime=\"201017-11\"><a href=\"https://youtu.be/45UTzvmmT9w\" title=\"Nico.Lino - Movies Official Video) ft. Prod.Lois\" target=\"_blank\">Sa. 03.10.20</a><div class=\"info\"><div class=\"close\"></div><div class=\"circle\" style=\"background-image:url(https://i1.ytimg.com/vi/45UTzvmmT9w/hqdefault.jpg)\"></div><p>Nico.Lino - Movies Official Video) ft. Prod.Lois<br><br>Views: 102 &nbsp; Ø/Video: 139<br>Veröffentlicht am: Sa. 03.10.20 um 21:00 Uhr</p><div class=\"abobar\"><a href=\"https://youtu.be/45UTzvmmT9w\" target=\"_blank\" class=\"red\">zum Video</a></div></div></td>', 102, '2020-10-03T19:00:00+00:00', '201003210000', 'ch');
